文山區,建物,臺北市文山區興隆路三段１１２巷３號二樓,0.0,住,,,1110829,土地0建物1車位0,二層,5,公寓(5樓含以下無電梯),住家用,鋼筋混凝土造,0730130,81.34,2,2,1,有,有,有,25000,307,,0.0,0,國家住宅及都市更新中心辦理社會住宅包租代管計畫。水電費、瓦斯費及每月管理費500元皆由承租人負擔。,RPSNMLLJRHHGFAA47CC
文山區,建物,臺北市文山區辛亥路四段１６６巷２０號四樓,0.0,住,,,1110824,土地0建物1車位0,四層,4,公寓(5樓含以下無電梯),住家用,鋼筋混凝土造,,82.0,3,2,1,有,無,有,20000,244,,0.0,0,,RPVNMLLJRHHGFAA77CC
文山區,建物,臺北市文山區羅斯福路五段１０１號七樓之２,0.0,商,,,1110820,土地0建物1車位0,七層,12,住宅大樓(11層含以上有電梯),住家用,鋼筋混凝土造,0970618,69.0,2,1,1,有,有,有,23000,333,,0.0,0,國家住宅及都市更新中心社會住宅包租代管計畫。每月水電費由承租人負擔。,RPUOMLLJRHHGFAA77CC
士林區,建物,臺北市士林區後街２１巷３４號,0.0,住,,,1110828,土地0建物1車位0,一層,4,公寓(5樓含以下無電梯),住家用,鋼筋混凝土造,0680418,122.43,4,2,1,有,無,有,15000,123,,0.0,0,國家住宅及都市更新中心辦理社會住宅包租代管計畫。水電費、瓦斯費由承租人負擔。,RPSNMLLJRHHGFEA87CC
士林區,建物,臺北市士林區芝玉路二段２０巷７號４樓,0.0,住,,,1110827,土地0建物1車位0,四層,5,公寓(5樓含以下無電梯),住家用,鋼筋混凝土造,0740621,115.86,3,2,2,有,無,有,35000,302,,0.0,0,,RPQOMLLJRHHGFEA77CC
北投區,建物,臺北市北投區崇仁路一段１３１巷２弄１０號４樓,0.0,住,,,1110826,土地0建物1車位0,四層,5,公寓(5樓含以下無電梯),住家用,鋼筋混凝土造,0751016,116.00999999999999,4,2,2,有,有,有,28000,241,,0.0,0,,RPROMLLJRHHGFEA87CC
士林區,建物,臺北市士林區基河路４０號５樓之７,0.0,商,,,1110721,土地0建物1車位0,五層,13,套房(1房1廳1衛),住家用,鋼筋混凝土造,0871211,25.330000000000002,1,1,1,有,有,有,13000,513,,0.0,0,,RPUOMLLJRHHGFEA18CC
士林區,建物,臺北市士林區延平北路五段５號４F,0.0,住,,,1110725,土地0建物1車位0,四層,5,公寓(5樓含以下無電梯),住家用,鋼筋混凝土造,0710930,85.26,0,0,0,無,無,有,15000,176,,0.0,0,,RPVOMLLJRHHGFEA28CC
士林區,建物,臺北市士林區中山北路五段４０巷４號,0.0,其他,,,1110725,土地0建物0車位0,全,2,透天厝,住家用,磚造,02809,14.21,1,0,1,有,無,有,11000,774,,0.0,0,,RPXOMLLJRHHGFEA48CC
士林區,房地(土地+建物)+車位,臺北市士林區中山北路七段１２４巷３-１號２樓,209.27,住,,,1110705,土地1建物1車位3,二層,12,住宅大樓(11層含以上有電梯),住家用,鋼筋混凝土造,1030805,434.40999999999997,3,2,3,有,無,有,177000,407,坡道平面,0.0,0,,RPVPMLLJRHHGFEA38CC
士林區,建物,臺北市士林區承德路四段３３２號５樓,0.0,住,,,1110819,土地0建物0車位0,五層,5,套房(1房1廳1衛),住家用,鋼筋混凝土造,0700820,19.650000000000002,1,0,1,有,無,有,10700,545,,0.0,0,此為分租套房，第五層共分成5間，一間平均面積約為19.65平方公尺，電費及每月垃圾收取費600元、水費200元皆為承租人負擔。,RPXPMLLJRHHGFEA58CC
萬華區,建物,臺北市萬華區西園路一段１６８號九樓之２,0.0,商,,,1110826,土地0建物1車位0,九層,12,套房(1房1廳1衛),住家用,鋼筋混凝土造,0780503,29.02,1,0,1,有,有,有,12000,414,,0.0,0,國家住宅及都市更新中心辦理社會住宅包租代管計畫。水電費、瓦斯費及每月管理費400元皆由承租人負擔。,RPSNMLLJRHHGFBA57CC
中正區,建物,臺北市中正區漢口街一段１１０號４樓之１６,0.0,商,,,1110810,土地0建物1車位0,九層,9,辦公商業大樓,商業用,鋼筋混凝土造,0661110,70.99000000000001,0,1,1,有,有,有,24000,338,,0.0,0,有附冷氣,RPROMLLJRHHGFBA57CC
大同區,建物,臺北市大同區重慶北路二段２０７號十樓,0.0,商,,,1110830,土地0建物2車位0,十層,12,辦公商業大樓,商業用,鋼筋混凝土造,0830108,261.34000000000003,0,0,0,無,有,無,100000,383,,0.0,0,承租本號及之12戶打通出租。,RPTOMLLJRHHGFBA77CC
中山區,建物,臺北市中山區民生東路一段２５號八樓之３８,0.0,商,,,1110826,土地0建物1車位0,八層,12,套房(1房1廳1衛),住家用,鋼筋混凝土造,0690815,56.11,1,1,1,有,有,有,23000,410,,0.0,0,國家住宅及都市更新中心辦理社會住宅包租代管計畫。水電費、瓦斯費及每月管理費1040元皆由承租人負擔。,RPPNMLLJRHHGFCA37CC
中山區,建物,臺北市中山區長春路２４７號六樓之５,0.0,商,,,1110826,土地0建物1車位0,六層,12,套房(1房1廳1衛),住家用,鋼筋混凝土造,0970104,39.87,1,0,1,有,有,有,20000,502,,0.0,0,國家住宅及都市更新中心辦理社會住宅包租代管計畫。水電費、瓦斯費及每月管理費1688元皆由承租人負擔。,RPRNMLLJRHHGFCA57CC
內湖區,建物,臺北市內湖區內湖路二段４２８號８樓之１,0.0,住,,,1110806,土地0建物1車位0,八層,15,公寓(5樓含以下無電梯),住家用,鋼筋混凝土造,1070327,80.14,2,2,1,有,有,有,37000,462,,0.0,0,,RPSNMLLJRHHGFCA67CC
中山區,建物,臺北市中山區新生北路三段６１號二樓之１６,0.0,住,,,1110825,土地0建物1車位0,二層,9,套房(1房1廳1衛),住家用,鋼筋混凝土造,0650907,45.82,1,0,1,有,有,有,16500,360,,0.0,0,國家住宅及都市更新中心辦理社會住宅包租代管計畫。水電費、瓦斯費及每月管理費700元皆由承租人負擔。,RPVNMLLJRHHGFCA97CC
內湖區,建物,臺北市內湖區東湖路１１３巷４８之１號１樓,68.49,商,,,1110831,土地0建物1車位0,一層,10,店面(店鋪),商業用,鋼筋混凝土造,0850308,137.29,0,0,0,無,無,無,50000,364,,0.0,0,,RPPOMLLJRHHGFCA47CC
中山區,房地(土地+建物)+車位,臺北市中山區松江路１３９號１２樓,33.7,商,,,1110712,土地1建物1車位2,十二層,12,辦公商業大樓,商業用,鋼筋混凝土造,0831014,352.46999999999997,0,0,0,無,有,有,200000,567,坡道機械,0.0,0,,RPOPMLLJRHHGFCA47CC
中山區,建物,臺北市中山區林森北路４０９號九樓之２３,0.0,商,,,1110829,土地0建物1車位0,九層,12,套房(1房1廳1衛),住家用,鋼筋混凝土造,0710531,30.57,1,1,1,有,有,有,13000,425,,0.0,0,國家住宅及都市更新中心辦理社會住宅包租代管計畫。水電費及每月管理費850元皆由承租人負擔。,RPQQMLLJRHHGFCA77CC
大安區,建物,臺北市大安區安和路一段４９巷２６號５樓之３,0.0,其他,,,1110816,土地0建物1車位0,五層,7,華廈(10層含以下有電梯),住家用,鋼筋混凝土造,0670421,116.2,3,2,2,有,無,有,60000,516,,0.0,0,,RPXNMLLJRHHGFFA58DC
中山區,房地(土地+建物),臺北市中山區林森北路５７４號,93.0,商,,,1110829,土地1建物1車位0,全,4,透天厝,,加強磚造,,338.64,0,0,0,無,無,無,170000,502,,0.0,0,,RPVNMLMJRHHGFCA08CC
內湖區,建物,臺北市內湖區陽光街９２巷１４弄４號五樓,0.0,住,,,1110824,土地0建物0車位0,五層,5,套房(1房1廳1衛),住家用,鋼筋混凝土造,0711224,15.8,1,0,1,有,無,有,8300,525,,0.0,0,此為分租套房，第五層共分成5間，一間平均面積約為15.80平方公尺，電費及每月管理維護費200元、水費200元、公共清潔費200元皆為承租人負擔。,RPQOMLMJRHHGFCA67CC
內湖區,建物,臺北市內湖區文德路６號二樓,0.0,住,,,1110823,土地0建物1車位0,二層,7,辦公商業大樓,住家用,鋼筋混凝土造,0731129,123.53,3,2,1,有,有,有,28000,227,,0.0,0,,RPUOMLMJRHHGFCA08CC
中山區,建物,臺北市中山區樂群三路７５號,0.0,商,,,1110815,土地0建物1車位0,一層,9,店面(店鋪),商業用,鋼筋混凝土造,0970201,167.73,0,1,2,有,有,無,95000,566,,0.0,0,租賃期間含免租金裝潢期。租金調整:111年9月15日至113年9月14日每月租金為＄95000；113年9月15日至115年9月14日每月租金為＄100000；115年9月15日至118年9月14日每月租金為＄105000；118年9月15日至121年9月14日每月租金為＄110000。,RPOPMLMJRHHGFCA57CC
中山區,建物,臺北市中山區長春路２２０號十一樓之５,0.0,商,,,1110823,土地0建物1車位0,十一層,12,套房(1房1廳1衛),住家用,鋼筋混凝土造,0830812,27.950000000000003,1,1,1,有,有,有,12500,447,,0.0,0,水電費及每月管理費676元由承租人另外負擔。,RPPPMLMJRHHGFCA67CC
中山區,建物,臺北市中山區南京東路一段１７號１５樓之１,0.0,商,,,1110823,土地0建物1車位2,十五層,23,住宅大樓(11層含以上有電梯),（Ｈ－２）集合住宅,鋼骨造,1100823,436.89,3,2,3,有,無,有,240000,549,坡道平面,71.0,0,,RPRPMLMJRHHGFCA87CC
中山區,建物,臺北市中山區長安東路一段３０巷８弄３號１樓,0.0,商,,,1110821,土地0建物1車位0,一層,6,住宅大樓(11層含以上有電梯),住家用,鋼筋混凝土造,1030106,40.53,1,1,1,有,無,有,40000,987,,0.0,0,,RPSPMLMJRHHGFCA97CC
中山區,建物,臺北市中山區新生北路二段３８號十一樓之５,0.0,商,,,1110821,土地0建物1車位1,十一層,17,套房(1房1廳1衛),住家用,鋼筋混凝土造,0850718,119.76,1,1,1,有,有,有,33000,276,坡道平面,40.87,0,,RPUPMLMJRHHGFCA18CC
中山區,建物,臺北市中山區南京東路二段１０１號７樓,0.0,商,,,1110822,土地0建物1車位0,七層,12,辦公商業大樓,商業用,鋼筋混凝土造,0800222,304.63,6,0,0,有,有,有,200000,657,,0.0,0,此為分割物件，承租坪數為92.15坪,RPVPMLMJRHHGFCA28CC
內湖區,建物,臺北市內湖區內湖路三段２４２號９樓,0.0,住,,,1110822,土地0建物1車位2,九層,14,住宅大樓(11層含以上有電梯),住家用,鋼筋混凝土造,1020731,267.41999999999996,2,2,2,有,無,有,100000,374,坡道平面,30.02,0,,RPOQMLMJRHHGFCA67CC
中山區,建物,臺北市中山區中山北路一段１３６號,0.0,商,,,1110818,土地0建物1車位0,全,4,透天厝,住商用,加強磚造,0570507,85.48,0,1,1,有,無,有,95000,1111,,0.0,0,僅承租該透天厝的一樓及騎樓,RPPQMLMJRHHGFCA77CC
中山區,建物,臺北市中山區八德路二段６６號七樓之６,0.0,住,,,1110802,土地0建物1車位0,七層,11,套房(1房1廳1衛),商業用,鋼筋混凝土造,0950323,35.629999999999995,1,1,1,有,有,有,18400,516,,0.0,0,,RPRQMLMJRHHGFCA97CC
中山區,建物,臺北市中山區八德路二段３１９號８樓,0.0,商,,,1110820,土地0建物1車位1,八層,13,住宅大樓(11層含以上有電梯),住家用,鋼筋混凝土造,1071129,219.41000000000003,3,2,2,有,無,有,74000,337,坡道平面,40.89,0,,RPSQMLMJRHHGFCA08CC
中山區,建物,臺北市中山區民生東路三段８８巷４號４樓之２,0.0,其他,,,1110826,土地0建物1車位0,四層,15,住宅大樓(11層含以上有電梯),集合住宅,鋼筋混凝土造,0750314,109.6,3,2,2,有,無,有,46000,420,,0.0,0,,RPTQMLMJRHHGFCA18CC
中山區,建物,臺北市中山區中山北路三段５３之１號三樓,0.0,商,,,1110826,土地0建物1車位0,三層,5,公寓(5樓含以下無電梯),住家用,鋼筋混凝土造,0660413,76.55,3,1,1,有,無,有,22000,287,,0.0,0,國家住宅及都市更新中心社會住宅包租代管計畫。每月水電瓦斯費由承租人負擔。,RPWQMLMJRHHGFCA48CC
大同區,建物,臺北市大同區南京西路８０號３樓之１,0.0,商,,,1110825,土地0建物1車位0,三層,15,住宅大樓(11層含以上有電梯),住家用,鋼筋混凝土造,0970205,128.28,3,2,2,有,有,有,62578,488,,0.0,0,,RPPNMLMJRHHGFBA37CC
大同區,建物,臺北市大同區庫倫街２１號,0.0,住,,,1110809,土地0建物0車位0,一層,2,店面(店鋪),,加強磚造,,79.75,0,0,0,無,無,無,40000,502,,0.0,0,,RPWNMLMJRHHGFBA08CC
中正區,建物,臺北市中正區忠孝東路一段８４巷２號９樓之２,0.0,商,,,1110823,土地0建物1車位0,九層,12,住宅大樓(11層含以上有電梯),多戶住宅（Ｈ２）（２組）,鋼筋混凝土造,1110111,58.25,1,1,1,有,有,有,50000,858,,0.0,0,,RPOOMLMJRHHGFBA37CC
中正區,建物,臺北市中正區博愛路１３０號二樓之２,0.0,商,,,1110802,土地0建物1車位0,二層,13,套房(1房1廳1衛),商業用,鋼筋混凝土造,0800510,54.39,1,1,1,有,有,有,15000,276,,0.0,0,,RPROMLMJRHHGFBA67CC
大同區,建物,臺北市大同區承德路三段６９號４樓之３,0.0,商,,,1110828,土地0建物1車位0,四層,14,住宅大樓(11層含以上有電梯),第二組多戶住宅（二）集合住宅,鋼筋混凝土造,1070723,70.51,2,1,1,有,無,有,41000,581,,0.0,0,,RPSOMLMJRHHGFBA77CC
大同區,建物,臺北市大同區承德路三段２４７巷１６號四樓,0.0,商,,,1110828,土地0建物1車位0,四層,5,公寓(5樓含以下無電梯),住家用,鋼筋混凝土造,0650702,104.03,3,2,2,有,無,有,26000,250,,0.0,0,國家住宅及都市更新中心社會住宅包租代管計畫。每月水電瓦斯費由承租人負擔。,RPTOMLMJRHHGFBA87CC
士林區,建物,臺北市士林區福國路９５號七樓之２１,0.0,商,,,1110822,土地0建物1車位0,七層,8,套房(1房1廳1衛),住家用,,0660811,36.66,1,1,1,有,有,有,19000,518,,0.0,0,,RPUNMLMJRHHGFEA18CC
士林區,建物,臺北市士林區大南路２６４號,0.0,住,,,1110826,土地0建物1車位0,一層,2,店面(店鋪),,加強磚造,0560715,96.5,2,1,1,有,無,無,45000,466,,0.0,0,部分承租。,RPVNMLMJRHHGFEA28CC
北投區,建物,臺北市北投區大業路２８０巷２３號,0.0,住,,,1110822,土地0建物1車位0,一層,4,公寓(5樓含以下無電梯),見使用執照,鋼筋混凝土造,0671013,89.26,3,2,1,有,無,無,25000,280,,0.0,0,,RPXNMLMJRHHGFEA48CC
士林區,建物,臺北市士林區延平北路五段２２８號,0.0,商,,,1110819,土地0建物0車位0,二層,3,套房(1房1廳1衛),住商用,加強磚造,0520612,23.0,1,0,1,有,無,有,10800,470,,0.0,0,此為分租套房，第二層共分成2間，一間平均面積約為23平方公尺，每月電費為承租人負擔。,RPQOMLMJRHHGFEA87CC
北投區,建物,臺北市北投區裕民六路５號十四樓,0.0,商,,,1110821,土地0建物1車位1,十四層,18,住宅大樓(11層含以上有電梯),自由職業事務所,鋼筋混凝土造,0970930,135.71,2,1,1,有,有,有,49500,365,坡道平面,47.05,0,租金含管理費。承租車位為同社區他戶產權之車位，面積依謄本持分比例63/10000面積登錄。,RPSOMLMJRHHGFEA08CC
士林區,建物,臺北市士林區幸福街１６巷２號,0.0,住,,,1110805,土地0建物1車位0,全,2,透天厝,住家用,加強磚造,0540803,84.56,3,2,2,有,無,有,48500,574,,0.0,0,,RPUOMLMJRHHGFEA28CC
士林區,建物,臺北市士林區倫等街５４巷２３號２樓,0.0,住,,,1110821,土地0建物1車位0,二層,4,公寓(5樓含以下無電梯),住家用,鋼筋混凝土造,0660907,77.72,3,2,1,有,無,有,21000,270,,0.0,0,,RPVOMLMJRHHGFEA38CC
士林區,建物,臺北市士林區中山北路五段８２９巷４５號８樓,0.0,住,,,1110811,土地0建物1車位3,八層,12,住宅大樓(11層含以上有電梯),住家用,鋼筋混凝土造,0980116,403.63,4,2,3,有,無,有,180000,446,坡道平面,112.86,0,,RPWOMLMJRHHGFEA48CC
北投區,建物,臺北市北投區公館路１６１巷３１號２樓,0.0,住,,,1110810,土地0建物1車位2,二層,5,住宅大樓(11層含以上有電梯),住家用,鋼筋混凝土造,1041119,250.94,3,2,2,有,無,有,70000,279,坡道平面,0.0,0,,RPOPMLMJRHHGFEA77CC
北投區,建物,臺北市北投區新民路６２巷１５弄１號４樓之１,0.0,其他,,,1110824,土地0建物1車位1,四層,5,華廈(10層含以下有電梯),住家用,鋼筋混凝土造,1051019,98.09,1,1,1,有,無,有,29000,296,升降平面,33.53,0,,RPRPMLMJRHHGFEA08CC
中正區,建物,臺北市中正區和平西路一段１７號六樓之１,0.0,商,,,1110829,土地0建物1車位0,六層,14,住宅大樓(11層含以上有電梯),集合住宅,鋼骨造,1080425,60.65,1,1,1,有,有,有,36000,594,,0.0,0,,RPRNMLMJRHHGFAA47CC
文山區,建物,臺北市文山區興隆路三段８２號,0.0,商,,,1110901,土地0建物1車位0,一層,5,店面(店鋪),見使用執照,鋼筋混凝土造,0690201,108.33,0,0,0,無,無,無,160000,1477,,0.0,0,,RPWNMLMJRHHGFAA97CC
中正區,建物,臺北市中正區南昌路二段８９號１１樓,0.0,商,,,1110825,土地0建物1車位0,十一層,14,住宅大樓(11層含以上有電梯),集合住宅,鋼骨造,1080124,58.72,2,1,1,有,無,有,45000,766,,0.0,0,,RPXOMLMJRHHGFAA18CC
文山區,建物,臺北市文山區辛亥路五段５５巷２號五樓,0.0,住,,,1110826,土地0建物1車位0,五層,5,公寓(5樓含以下無電梯),住家用,鋼筋混凝土造,0710907,101.25,3,2,1,有,無,有,27000,267,,0.0,0,國家住宅及都市更新中心社會住宅包租代管計畫。每月水電瓦斯費由承租人負擔。,RPPPMLMJRHHGFAA47CC
文山區,建物,臺北市文山區指南路三段７１號四樓之２,0.0,住,,,1110826,土地0建物1車位0,四層,8,華廈(10層含以下有電梯),住家用,鋼筋混凝土造,0840509,85.89,2,2,1,有,有,有,23000,268,,0.0,0,國家住宅及都市更新中心社會住宅包租代管計畫。水電瓦斯費及每月管理費909元由承租人負擔。,RPQPMLMJRHHGFAA57CC
大安區,建物,臺北市大安區泰順街４０巷１號３樓,0.0,住,,,1110821,土地0建物1車位0,三層,7,華廈(10層含以下有電梯),住家用,鋼筋混凝土造,0700713,139.41,3,2,2,有,無,有,69000,495,,0.0,0,,RPQOMLMJRHHGFFA97CC
大安區,建物,臺北市大安區大安路二段８８號４樓,0.0,住,,,1110823,土地0建物1車位0,四層,7,華廈(10層含以下有電梯),住家用,鋼筋混凝土造,0730814,159.27,4,2,2,有,無,有,72000,452,,0.0,0,,RPROMLMJRHHGFFA08CC
大安區,建物,臺北市大安區新生南路一段１６５巷２１號３樓之１,0.0,住,,,1110825,土地0建物1車位0,三層,6,華廈(10層含以下有電梯),住家用,鋼筋混凝土造,0970123,72.03999999999999,1,1,1,有,無,有,38000,527,,0.0,0,與台北市大安區新生南路一段165巷21號3樓之2共同承租,RPTOMLMJRHHGFFA28CC
松山區,建物,臺北市松山區南京東路五段４０號十三樓之２,0.0,其他,,,1110823,土地0建物1車位0,十三層,19,辦公商業大樓,住家用,鋼筋混凝土造,0790216,70.47,0,2,1,有,有,有,26000,369,,0.0,0,,RPSOMLMJRHHGFDA97CC
松山區,建物,臺北市松山區民生東路五段１９０號七樓之２,0.0,商,,,1110816,土地0建物1車位0,七層,16,套房(1房1廳1衛),商業用,鋼筋混凝土造,0721229,38.79,1,0,1,有,有,有,18000,464,,0.0,0,水電費及每月管理費1200元由承租人另外負擔。,RPTOMLMJRHHGFDA08CC
信義區,建物,臺北市信義區東興路５７號９樓,0.0,工,,,1110819,土地0建物1車位0,九層,11,辦公商業大樓,工業用,鋼筋混凝土造,0820205,437.24,7,1,2,有,無,有,175000,400,,0.0,0,,RPUOMLMJRHHGFDA18CC
南港區,建物,臺北市南港區南港路二段１５６號１０樓,0.0,住,,,1110723,土地0建物1車位0,十層,19,住宅大樓(11層含以上有電梯),住家用,鋼筋混凝土造,0851022,136.12,4,2,2,有,有,有,35000,257,,0.0,0,,RPVOMLMJRHHGFDA28CC
信義區,建物,臺北市信義區松勤街９號八樓之５,0.0,其他,,,1110813,土地0建物1車位0,八層,19,住宅大樓(11層含以上有電梯),住家用,鋼骨造,0961225,100.32,2,2,1,有,有,有,70000,698,,0.0,0,租金含管理費。,RPWOMLMJRHHGFDA38CC
南港區,建物,臺北市南港區經貿二路１５７巷３６弄１１１號三樓,0.0,住,,,1110826,土地0建物1車位1,三層,11,住宅大樓(11層含以上有電梯),住家用,鋼筋混凝土造,0991202,236.99,2,2,2,有,有,有,72000,304,坡道平面,46.53,0,,RPXOMLMJRHHGFDA48CC
信義區,建物,臺北市信義區信義路五段１２１號７樓,0.0,其他,,,1110822,土地0建物1車位0,七層,19,住宅大樓(11層含以上有電梯),住家用,鋼筋混凝土造,0980702,112.6,2,1,1,有,無,有,69977,621,,0.0,0,,RPOPMLMJRHHGFDA67CC
信義區,建物,臺北市信義區忠孝東路五段４８５號１５樓之２,0.0,住,,,1110824,土地0建物1車位0,十五層,17,辦公商業大樓,商業用,鋼骨鋼筋混凝土造,0820514,179.24,0,0,2,有,無,有,65800,367,,0.0,0,,RPPPMLMJRHHGFDA77CC
松山區,建物,臺北市松山區八德路四段７５８號４樓,0.0,商,,,1110815,土地0建物1車位0,四層,14,辦公商業大樓,娛樂服務業,鋼骨造,0930330,645.5,0,0,0,有,無,有,283127,439,,0.0,0,前三年租金283127114年10月起租金調整為292890,RPQPMLMJRHHGFDA87CC
南港區,建物,臺北市南港區興華路１４６號６樓之３,0.0,住,,,1110824,土地0建物1車位1,六層,12,住宅大樓(11層含以上有電梯),住家用,鋼筋混凝土造,0980325,79.35,2,1,1,有,無,有,36000,454,升降機械,0.0,0,,RPRPMLMJRHHGFDA97CC
松山區,建物,臺北市松山區光復北路２３０巷２７號三樓,0.0,住,,,1110817,土地0建物1車位0,三層,18,住宅大樓(11層含以上有電梯),集合住宅,鋼筋混凝土造,0910514,128.99,3,2,1,有,有,有,42000,326,,0.0,0,租金含管理費。,RPSPMLMJRHHGFDA08CC
內湖區,房地(土地+建物)+車位,臺北市內湖區成功路四段１５５號４樓,58.87,其他,,,1110811,土地4建物1車位1,見其他登記事項,7,華廈(10層含以下有電梯),住家用,鋼筋混凝土造,0780214,243.95,4,3,3,有,有,無,45000,184,坡道平面,0.0,0,承租人為包租業，租金不含管理費，由承租人支付代扣之租賃所得稅及健保補充保費。,RPQNMLOJRHHGFCA77CC
中山區,建物,臺北市中山區長安東路二段１０８號１１樓之５、１１樓之６、１１樓之７,0.0,商,,,1110901,土地0建物3車位0,十一層,11,辦公商業大樓,住商用,鋼筋混凝土造,0611109,243.78,4,2,0,有,有,無,92400,379,,0.0,0,,RPRNMLOJRHHGFCA87CC
中山區,建物,臺北市中山區四平街６６號,0.0,住,,,1110824,土地0建物1車位0,一層,3,公寓(5樓含以下無電梯),,加強磚造,,70.95,0,1,1,有,無,有,50000,705,,0.0,0,房屋用途做辦公室使用。,RPPNMLPJRHHGFCA77CC
中山區,建物,臺北市中山區新生北路二段６０巷２號九樓,0.0,商,,,1110827,土地0建物1車位0,九層,12,套房(1房1廳1衛),住家用,鋼筋混凝土造,0701228,49.54,1,0,1,有,有,有,15000,303,,0.0,0,國家住宅及都市更新中心辦理社會住宅包租代管計畫。水電費、瓦斯費及每月管理費1100元皆由承租人負擔。,RPQNMLPJRHHGFCA87CC
內湖區,建物,臺北市內湖區文德路２１０巷３０弄９號五樓,0.0,住,,,1110826,土地0建物0車位0,五層,5,套房(1房1廳1衛),住家用,鋼筋混凝土造,0700626,43.17,1,0,1,有,無,有,15000,347,,0.0,0,部分承租。租金含水費及電費。,RPSNMLPJRHHGFCA08CC
內湖區,建物,臺北市內湖區康樂街１１６號二樓、１１６之１號二樓、１１６之２號二樓,0.0,住,,,1110901,土地0建物3車位2,二層,8,店面(店鋪),商業用,鋼筋混凝土造,0830510,356.72,0,0,1,有,有,無,120000,336,坡道平面,68.4,0,民國113年12月1日起租金調整為123600元/月民國115年12月1日起租金調整為127308元/月,RPQOMLPJRHHGFCA97CC
內湖區,建物,臺北市內湖區民權東路六段４８９號六樓,0.0,住,,,1110828,土地0建物1車位1,六層,10,華廈(10層含以下有電梯),住家用,鋼筋混凝土造,0941228,190.38,4,2,2,有,有,有,42000,221,坡道平面,38.02,0,,RPSOMLPJRHHGFCA18CC
中山區,建物,臺北市中山區林森北路４１６巷１號２樓之４,0.0,商,,,1110830,土地0建物1車位0,二層,11,住宅大樓(11層含以上有電梯),住家用,鋼筋混凝土造,0650909,26.68,0,0,0,無,有,有,17000,637,,0.0,0,,RPOPMLPJRHHGFCA87CC
中山區,建物,臺北市中山區基湖路１５２號,0.0,住,,,1110823,土地0建物1車位2,全,4,透天厝,見使用執照,鋼筋混凝土造,0891230,346.58,4,2,4,有,有,有,133000,384,坡道平面,0.0,0,租金含管理費。車位面積無法分算。,RPPPMLPJRHHGFCA97CC
中山區,建物,臺北市中山區中山北路二段６２巷３號７樓、７樓之１,0.0,其他,,,1110815,土地0建物1車位0,七層,7,華廈(10層含以下有電梯),住家用,鋼筋混凝土造,0960711,81.46,2,1,1,有,有,有,33000,405,,0.0,0,,RPUPMLPJRHHGFCA48CC
萬華區,建物,臺北市萬華區昆明街４６號八樓之６,0.0,商,,,1110826,土地0建物1車位0,八層,8,華廈(10層含以下有電梯),住家用,鋼筋混凝土造,0761221,88.41,2,2,1,有,有,有,26000,294,,0.0,0,,RPQNMLPJRHHGFBA77CC
中正區,建物,臺北市中正區博愛路２５號四樓之１７,0.0,商,,,1110823,土地0建物1車位0,四層,10,套房(1房1廳1衛),商業用,鋼筋混凝土造,0661230,52.15,1,1,1,有,有,有,18000,345,,0.0,0,國家住宅及都市更新中心社會住宅包租代管計畫。水電瓦斯費及每月管理費1200元由承租人負擔。,RPSNMLPJRHHGFBA97CC
中正區,建物,臺北市中正區南陽街３號五樓之７,0.0,商,,,1110826,土地0建物1車位0,五層,7,套房(1房1廳1衛),商業用,鋼筋混凝土造,0690812,37.54,1,0,1,有,有,有,14000,373,,0.0,0,國家住宅及都市更新中心社會住宅包租代管計畫。水電費及每月管理費680元由承租人負擔。,RPUNMLPJRHHGFBA18CC
中正區,建物,臺北市中正區忠孝東路一段７６號７樓之１,0.0,商,,,1110902,土地0建物1車位0,七層,12,辦公商業大樓,商業用,鋼筋混凝土造,0711116,506.34000000000003,0,0,0,無,有,有,300000,592,,0.0,0,五室合併出租 之1+之2+之3+之4+之5,RPVNMLPJRHHGFBA28CC
大同區,建物,臺北市大同區民權西路３００號１０樓之７,0.0,其他,,,1110829,土地0建物1車位0,十層,13,住宅大樓(11層含以上有電梯),住家用,鋼筋混凝土造,1060314,98.83,2,2,1,有,有,有,36000,364,,0.0,0,租金含稅價,RPWNMLPJRHHGFBA38CC
萬華區,建物,臺北市萬華區昆明街４６號五樓之７,0.0,商,,,1110824,土地0建物1車位0,五層,8,套房(1房1廳1衛),住家用,鋼筋混凝土造,0761221,51.07000000000001,1,1,1,有,有,有,18000,352,,0.0,0,,RPOOMLPJRHHGFBA67CC
