松山區,建物,臺北市松山區南京東路五段５９巷２７之２３號,0.0,住,,,1110928,土地0建物1車位0,四層,4,公寓(5樓含以下無電梯),住家用,鋼筋混凝土造,0610331,105.8,3,2,1,有,無,有,33000,312,,0.0,0,加入臺北市社會住宅包租代管第3期計畫,RPOPMLSKIIHGFDA57CC
信義區,建物,臺北市信義區松山路２８７巷３弄７號四樓,0.0,商,,,1111015,土地0建物1車位0,四層,4,公寓(5樓含以下無電梯),住家用,鋼筋混凝土造,0661228,101.14,1,1,1,有,有,有,15000,148,,0.0,0,,RPPPMLSKIIHGFDA67CC
信義區,建物,臺北市信義區崇德街５２號１+２樓,0.0,住,,,1111018,土地0建物1車位0,見其他登記事項,7,店面(店鋪),住商用,鋼筋混凝土造,0820724,152.49,3,2,2,有,有,有,50000,328,,0.0,0,,RPQPMLSKIIHGFDA77CC
中正區,建物,臺北市中正區汀洲路二段１２３號３樓,0.0,住,,,1111004,土地0建物1車位0,三層,4,公寓(5樓含以下無電梯),住家用,木造,0581222,81.45,3,1,1,有,無,有,18000,221,,0.0,0,台北市社會住宅包租代管計畫。水電瓦斯費由承租人負擔。,RPQNMLSKIIHGFAA27CC
中正區,建物,臺北市中正區水源路１２７號６樓之１,0.0,商,,,1111006,土地0建物1車位0,六層,10,套房(1房1廳1衛),見使用執照,鋼筋混凝土造,0680309,46.59,1,1,1,有,有,有,13000,279,,0.0,0,臺北市社會住宅包租代管計畫。水電瓦斯費及每月管理費900元由承租人負擔。,RPSNMLSKIIHGFAA47CC
文山區,建物,臺北市文山區興隆路三段１００號２樓,0.0,商,,,1111006,土地0建物1車位0,二層,5,公寓(5樓含以下無電梯),住家用,鋼筋混凝土造,0690201,108.33,0,0,0,無,有,無,53000,489,,0.0,0,,RPPOMLSKIIHGFAA27CC
中正區,建物,臺北市中正區水源路４７號十二樓,0.0,住,,,1110925,土地0建物1車位0,十二層,13,住宅大樓(11層含以上有電梯),住家用,鋼筋混凝土造,0911202,165.98000000000002,1,1,1,有,無,有,30000,181,,0.0,0,,RPROMLSKIIHGFAA47CC
中正區,建物,臺北市中正區詔安街２６巷１０弄１號２樓,0.0,住,,,1111012,土地0建物1車位0,二層,5,公寓(5樓含以下無電梯),住家用,鋼筋混凝土造,0700420,75.67999999999999,3,2,2,有,無,有,28500,377,,0.0,0,國家住宅及都市更新中心社會住宅包租代管計畫。每月水電瓦斯費由承租人負擔。,RPVOMLSKIIHGFAA87CC
中正區,建物,臺北市中正區水源路３９號十樓之１,0.0,住,,,1111010,土地0建物1車位0,十層,13,住宅大樓(11層含以上有電梯),住家用,鋼筋混凝土造,0911202,78.73,1,1,1,有,有,有,25000,318,,0.0,0,,RPXNMLTKIIHGFAA08CC
信義區,建物,臺北市信義區基隆路一段１０１巷１１之１號,0.0,住,,,1111013,土地0建物1車位0,二層,4,公寓(5樓含以下無電梯),住家用,鋼筋混凝土造,0601203,67.77,2,1,1,有,無,有,28000,413,,0.0,0,國家住宅及都市更新中心辦理社會住宅包租代管計畫。水電費、瓦斯費由承租人負擔。,RPOOMLTKIIHGFDA57CC
信義區,建物,臺北市信義區基隆路二段１５１號五樓之１,0.0,住,,,1111012,土地0建物0車位0,五層,12,套房(1房1廳1衛),商業用,鋼筋混凝土造,0701117,28.69,1,0,1,有,無,有,14000,488,,0.0,0,此為分租套房，第五層共分成5間，一間平均面積約為28.69平方公尺。水電費及每月管理維護費200元皆為承租人負擔。,RPROMLTKIIHGFDA87CC
信義區,建物,臺北市信義區松高路１號２０之３,0.0,商,,,1110929,土地0建物1車位0,二十層,32,辦公商業大樓,一般事務所,鋼骨造,1011126,525.0,0,0,0,無,有,有,654297,1246,,0.0,0,,RPSOMLTKIIHGFDA97CC
松山區,房地(土地+建物),臺北市松山區復興北路２０１號３樓之２、之３,59.85,其他,,,1111014,土地1建物2車位0,三層,12,辦公商業大樓,商業用,鋼筋混凝土造,0730718,224.66000000000003,0,1,0,有,無,有,110000,490,,0.0,0,,RPTOMLTKIIHGFDA08CC
松山區,建物,臺北市松山區敦化北路１００號,0.0,其他,,,1111004,土地0建物0車位0,十層,15,套房(1房1廳1衛),商業用,鋼骨鋼筋混凝土造,0721005,30.73,1,0,1,有,無,有,15900,517,,0.0,0,此為分租套房，租賃面積約為30.73平方公尺，每月電費1500元、管理費930元、水費300元、瓦斯費300元皆為承租人負擔。本租賃標的未計入共有部分之分算面積。,RPUOMLTKIIHGFDA18CC
松山區,房地(土地+建物),臺北市松山區八德路三段７４巷３５弄３號,44.7,住,,,1110907,土地1建物1車位0,一層,4,公寓(5樓含以下無電梯),住家用,鋼筋混凝土造,0640317,124.02,2,3,2,有,無,有,73500,593,,0.0,0,,RPWOMLTKIIHGFDA38CC
信義區,建物,臺北市信義區松高路１號２０樓、２０樓之１、２０樓之２,0.0,商,,,1110929,土地0建物3車位0,二十層,32,辦公商業大樓,一般事務所,鋼骨造,1011126,1578.22,0,0,0,無,有,有,1966929,1246,,0.0,0,,RPXOMLTKIIHGFDA48CC
松山區,建物,臺北市松山區敦化北路１００號,0.0,其他,,,1111005,土地0建物0車位0,九層,15,套房(1房1廳1衛),商業用,鋼骨鋼筋混凝土造,0721005,30.73,1,0,1,有,無,有,15858,516,,0.0,0,此為分租套房，租賃面積約為30.73平方公尺，每月電費1500元、管理費930元、水費300元、瓦斯費300元皆為承租人負擔。本租賃標的未計入共有部分之分算面積。,RPPPMLTKIIHGFDA77CC
松山區,建物,臺北市松山區敦化北路１００號,0.0,其他,,,1111005,土地0建物0車位0,十層,15,套房(1房1廳1衛),商業用,鋼骨鋼筋混凝土造,0721005,30.73,1,0,1,有,無,有,15858,516,,0.0,0,此為分租套房，租賃面積約為30.73平方公尺，每月電費1500元、管理費930元、水費300元、瓦斯費300元皆為承租人負擔。本租賃標的未計入共有部分之分算面積。,RPQPMLTKIIHGFDA87CC
大安區,建物,臺北市大安區復興南路二段５５號９樓,0.0,商,,,1110926,土地0建物1車位0,九層,15,住宅大樓(11層含以上有電梯),住家用,鋼骨鋼筋混凝土造,1090803,71.78999999999999,2,2,1,有,有,有,60000,836,,0.0,0,,RPQNMLTKIIHGFFA87CC
大安區,建物,臺北市大安區建國南路二段１８１之１號５樓,0.0,住,,,1111014,土地0建物1車位0,五層,12,住宅大樓(11層含以上有電梯),住家用,鋼筋混凝土造,0730308,96.98,2,2,2,有,有,有,35000,361,,0.0,0,,RPXNMLTKIIHGFFA58CC
大安區,建物,臺北市大安區四維路１２４巷２２號,0.0,住,,,1111001,土地0建物0車位0,一層,2,套房(1房1廳1衛),,加強磚造,,14.43,1,0,1,有,無,有,7700,534,,0.0,0,此為分租套房，第一層共分成4間，一間平均面積約為14.43平方公尺，電費及每月垃圾收取費600元、水雜費200元皆為承租人負擔。,RPVOMLTKIIHGFFA48CC
北投區,建物,臺北市北投區溫泉路９９之４號４樓,0.0,其他,,,1111006,土地0建物1車位0,四層,5,公寓(5樓含以下無電梯),住家用,鋼筋混凝土造,0740926,49.07,1,0,1,有,有,有,16000,326,,0.0,0,,RPUNMLTKIIHGFEA18CC
士林區,建物,臺北市士林區承德路四段４０巷４９號五樓,0.0,住,,,1111014,土地0建物1車位0,五層,5,套房(1房1廳1衛),住家用,鋼筋混凝土造,0610812,30.7,1,0,1,有,無,有,13000,423,,0.0,0,國家住宅及都市更新中心辦理社會住宅包租代管計畫。電費由承租人負擔。,RPWNMLTKIIHGFEA38CC
北投區,建物,臺北市北投區中央北路一段１７７號４樓,0.0,商,,,1111013,土地0建物1車位0,四層,10,華廈(10層含以下有電梯),商業用,鋼筋混凝土造,0860120,160.51,3,1,2,有,有,有,30000,187,,0.0,0,國家住宅及都市更新中心社會住宅包租代管計畫。水電瓦斯費及每月管理費2123元由承租人負擔。,RPOOMLTKIIHGFEA67CC
北投區,建物,臺北市北投區北投路二段１１號８樓６,0.0,住,,,1110922,土地0建物1車位0,八層,13,住宅大樓(11層含以上有電梯),住家用,鋼筋混凝土造,0831019,179.58,0,1,1,有,有,無,37000,206,,0.0,0,,RPQOMLTKIIHGFEA87CC
士林區,建物,臺北市士林區士東路４０號５樓,0.0,住,,,1111015,土地0建物1車位0,五層,5,公寓(5樓含以下無電梯),住家用,鋼筋混凝土造,0720512,117.3,3,2,2,有,無,有,36500,311,,0.0,0,,RPTOMLTKIIHGFEA18CC
中山區,建物,臺北市中山區林森北路５８７號５樓之２,0.0,商,,,1110923,土地0建物1車位0,五層,13,住宅大樓(11層含以上有電梯),住家用,鋼筋混凝土造,1000726,89.94,1,2,1,有,有,有,58000,645,,0.0,0,,RPQNMLTKIIHGFCA57CC
中山區,建物,臺北市中山區南京東路二段１０８號１１樓,0.0,其他,,,1110926,土地0建物1車位0,十一層,18,套房(1房1廳1衛),住家用,鋼骨造,0990917,61.65,1,1,1,有,有,有,40000,649,,0.0,0,,RPUNMLTKIIHGFCA97CC
內湖區,房地(土地+建物),臺北市內湖區文湖街２-１號９樓B,84.75,工,,,1111018,土地1建物0車位0,九層,9,廠辦,工業用,鋼筋混凝土造,0900501,138.67,0,0,0,無,有,有,36000,260,,0.0,0,一層隔兩間A、B辦公室。無法計算坪數。土地坪數未分割，無法計算。,RPVNMLTKIIHGFCA08CC
中山區,建物,臺北市中山區松江路１５６巷３３號４樓,0.0,商,,,1110928,土地0建物1車位0,四層,5,公寓(5樓含以下無電梯),住家用,鋼筋混凝土造,0750807,130.81,4,2,2,有,無,有,45000,344,,0.0,0,,RPWNMLTKIIHGFCA18CC
中山區,建物,臺北市中山區松江路１９０號７樓之１,0.0,商,,,1111017,土地0建物1車位0,七層,12,辦公商業大樓,商業用,鋼筋混凝土造,0710308,131.85999999999999,2,1,2,有,有,有,64000,485,,0.0,0,,RPQOMLTKIIHGFCA67CC
中山區,建物,臺北市中山區龍江路３７０巷１號２樓,0.0,住,,,1111010,土地0建物1車位0,二層,5,公寓(5樓含以下無電梯),住家用,鋼筋混凝土造,0680910,116.3,3,2,2,有,無,有,21000,181,,0.0,0,,RPROMLTKIIHGFCA77CC
內湖區,建物,臺北市內湖區文德路１７１巷９弄１０號５樓,0.0,住,,,1111008,土地0建物1車位0,五層,5,公寓(5樓含以下無電梯),住家用,鋼筋混凝土造,0740410,112.47,2,2,2,有,有,有,35000,311,,0.0,0,,RPTOMLTKIIHGFCA97CC
中山區,建物,臺北市中山區明水路３９７巷１８弄２２號七樓,0.0,住,,,1110927,土地0建物1車位1,七層,15,住宅大樓(11層含以上有電梯),住家用,鋼筋混凝土造,0960919,241.97,4,2,3,有,有,有,125000,517,坡道平面,32.03,0,租金含管理費。,RPRPMLTKIIHGFCA87CC
中山區,建物,臺北市中山區新生北路二段６８巷９號１１樓,0.0,商,,,1110929,土地0建物1車位0,十一層,13,住宅大樓(11層含以上有電梯),住家用,鋼筋混凝土造,0971229,52.71,1,1,1,有,有,有,36000,683,,0.0,0,,RPUPMLTKIIHGFCA18CC
內湖區,建物,臺北市內湖區內湖路一段４９號５樓之１、內湖路一段４９號５樓之２,0.0,住,,,1111005,土地0建物0車位0,五層,5,套房(1房1廳1衛),住家用,鋼筋混凝土造,0780920,30.79,1,0,1,有,無,有,20000,650,,0.0,0,第五層共分成19間，套房面積約為30.79平方公尺，每月垃圾收取費600元、水費200元、管理費550元皆為承租人負擔。,RPSQMLTKIIHGFCA08CC
南港區,房地(土地+建物),臺北市南港區富康街１巷１６弄３２號,100.0,商,,,1111010,土地1建物1車位0,一層,5,公寓(5樓含以下無電梯),住家用,鋼筋混凝土造,0640823,68.61,0,0,0,無,無,有,28000,408,,0.0,0,,RPPOMLTKIIHGFDA77DC
大同區,建物,臺北市大同區南京西路２５巷３２號７樓之１,0.0,商,,,1110930,土地0建物1車位0,七層,7,華廈(10層含以下有電梯),住家用,鋼筋混凝土造,0970626,99.72999999999999,2,2,1,有,有,有,48000,481,,0.0,0,,RPXNMLTKIIHGFBA18CC
萬華區,建物,臺北市萬華區環河南路二段１３０巷２弄１１號,0.0,住,,,1111003,土地0建物1車位0,全,2,透天厝,,加強磚造,,74.66,3,1,1,有,無,有,21000,281,,0.0,0,國家住宅及都市更新中心辦理社會住宅包租代管計畫。水電費、瓦斯費由承租人負擔。,RPOOMLTKIIHGFBA37CC
萬華區,建物,臺北市萬華區雙和街８２號三樓,0.0,商,,,1111005,土地0建物1車位0,三層,5,公寓(5樓含以下無電梯),住家用,鋼筋混凝土造,0640508,48.19,1,1,1,有,有,有,10000,208,,0.0,0,,RPSOMLTKIIHGFBA77CC
萬華區,建物,臺北市萬華區貴陽街二段５號,0.0,商,,,1111008,土地0建物1車位0,一層,13,店面(店鋪),一般零售業（甲組）（不含日用百貨業）,鋼筋混凝土造,1080222,91.89,0,1,1,有,無,無,28000,305,,0.0,0,免租裝修期:111.10.8-111.10.31；每月水電瓦斯費由承租人另外負擔。,RPTOMLTKIIHGFBA87CC
萬華區,建物,臺北市萬華區長沙街二段７１之１號,0.0,商,,,1111007,土地0建物0車位0,全,5,透天厝,,加強磚造,,9.12,1,0,0,有,無,有,4000,439,,0.0,0,此為雅房，面積約為9.12平方公尺，電費及每月垃圾收取費600元、水費200元皆為承租人負擔。,RPOPMLTKIIHGFBA47CC
萬華區,建物,臺北市萬華區長沙街二段７１之１號,0.0,商,,,1111010,土地0建物0車位0,全,5,透天厝,,加強磚造,,10.23,1,0,0,有,無,有,5000,489,,0.0,0,此為雅房，面積約為10.23平方公尺，電費及每月垃圾收取費600元、水費200元皆為承租人負擔。,RPPPMLTKIIHGFBA57CC
萬華區,建物,臺北市萬華區西園路二段２４１號二樓,0.0,住,,,1111015,土地0建物0車位0,二層,4,套房(1房1廳1衛),住家用,鋼筋混凝土造,0600804,23.14,1,0,1,有,無,有,12300,532,,0.0,0,此為分租套房，第二層共分成4間，一間平均面積約為23.14平方公尺。電費及每月垃圾收取費600元、水費200元皆為承租人負擔。,RPUNMLKLIIHGFBA07CC
萬華區,建物,臺北市萬華區和平西路三段６４號,0.0,商,,,1111012,土地0建物0車位0,五層,5,套房(1房1廳1衛),住商用,鋼筋混凝土造,,21.89,1,0,1,有,無,有,9700,443,,0.0,0,此為分租套房，第五層共分成5間，一間平均面積約為21.89平方公尺。電費及每月垃圾收取費600元、水費200元、公區使用費1500元皆為承租人負擔。,RPOOMLKLIIHGFBA56CC
大同區,建物,臺北市大同區華陰街９１號６樓之５,0.0,商,,,1111004,土地0建物1車位0,六層,15,住宅大樓(11層含以上有電梯),一般事務所,鋼筋混凝土造,1001205,89.66,1,1,1,有,無,有,40000,446,,0.0,0,,RPSOMLKLIIHGFBA96CC
大同區,建物,臺北市大同區甘州街４２巷９號三樓,0.0,商,,,1111017,土地0建物0車位0,三層,4,公寓(5樓含以下無電梯),住家用,鋼筋混凝土造,0620426,81.89,3,1,1,有,無,有,22500,275,,0.0,0,此為3房，第三層共分成2間，一間平均面積約為81.89平方公尺。電費及每月垃圾收取費1100元、水費200元皆為承租人負擔。最後一個月為免租期間。,RPUOMLKLIIHGFBA17CC
大同區,車位,臺北市大同區承德路一段１號等公有部分,0.0,其他,,,1110826,土地0建物0車位1,,,其他,,,,15.51,0,0,0,有,有,無,4500,,坡道平面,15.51,4500,原申報書序號C1AB11108310016市民大道一段京站廣場地下六層編號244之停車位,RPXOMLKLIIHGFBA47CC
大同區,車位,臺北市大同區承德路一段１號等共有部分,0.0,其他,,,1110927,土地0建物0車位1,,,其他,,,,13.47,0,0,0,有,有,無,4500,,坡道平面,13.47,4500,市民大道一段京站廣場地下六層編號188號之停車位,RPQPMLKLIIHGFBA86CC
大同區,車位,臺北市大同區承德路一段１號等共有部分,0.0,其他,,,1110930,土地0建物0車位1,,,其他,,,,13.47,0,0,0,有,有,無,4000,,坡道平面,13.47,4000,市民大道一段京站廣場地下六層編號239號之停車位,RPRPMLKLIIHGFBA96CC
中山區,建物,臺北市中山區龍江路２８６巷４號四樓,0.0,住,,,1111006,土地0建物1車位0,四層,4,公寓(5樓含以下無電梯),住家用,加強磚造,0580314,103.87,3,1,2,有,無,有,27000,260,,0.0,0,國家住宅及都市更新中心辦理社會住宅包租代管計畫。水電費、瓦斯費由承租人負擔。,RPOOMLKLIIHGFCA66CC
中山區,建物,臺北市中山區農安街１６６巷６號１樓,0.0,住,,,1110929,土地0建物1車位0,一層,7,華廈(10層含以下有電梯),住家用,鋼筋混凝土造,0681229,159.82,0,0,0,無,無,有,90000,563,,0.0,0,,RPSOMLKLIIHGFCA07CC
中山區,建物,臺北市中山區中山北路一段８２號九樓,0.0,商,,,1111011,土地0建物0車位0,九層,11,辦公商業大樓,商業用,鋼筋混凝土造,0601201,231.38,5,0,0,有,有,無,75000,324,,0.0,0,承租部份面積含公設約70坪。,RPXOMLKLIIHGFCA57CC
中山區,建物,臺北市中山區農安街２４號二樓,0.0,商,,,1111006,土地0建物0車位0,二層,4,套房(1房1廳1衛),住家用,鋼筋混凝土造,0621012,23.33,1,0,1,有,無,有,13000,557,,0.0,0,此為分租套房，第二層隔為4間，一間面積約為23.33平方公尺，電費及每月垃圾收取費600元、水費200元皆為承租人負擔。,RPUPMLKLIIHGFCA37CC
中山區,建物,臺北市中山區民權西路７９號１０樓之１,122.56,商,,,1111007,土地0建物1車位0,十層,10,華廈(10層含以下有電梯),商業用,鋼筋混凝土造,0670622,127.71,0,0,0,無,有,有,39000,305,,0.0,0,,RPPQMLKLIIHGFCA96CC
北投區,建物,臺北市北投區崇仁路一段１３１巷１６號二樓,0.0,住,,,1111017,土地0建物1車位0,二層,5,公寓(5樓含以下無電梯),住家用,鋼筋混凝土造,0751016,112.03,3,2,2,有,無,有,22500,201,,0.0,0,國家住宅及都市更新中心辦理社會住宅包租代管計畫。水電費、瓦斯費由承租人負擔。,RPPOMLKLIIHGFEA96CC
北投區,建物,臺北市北投區溫泉路７１號六樓之２５,0.0,其他,,,1111019,土地0建物1車位0,六層,7,套房(1房1廳1衛),住家用,鋼筋混凝土造,0700218,30.03,1,0,1,有,有,有,13000,433,,0.0,0,國家住宅及都市更新中心辦理社會住宅包租代管計畫。水電費、瓦斯費及每月管理費460元皆由承租人負擔。,RPQOMLKLIIHGFEA07CC
大安區,建物,臺北市大安區建國南路一段２７９巷１４號八樓,0.0,其他,,,1111015,土地0建物1車位0,八層,14,住宅大樓(11層含以上有電梯),住家用,鋼筋混凝土造,0760216,82.36,3,2,1,有,有,有,30000,364,,0.0,0,,RPSNMLKLIIHGFFA27CC
大安區,建物,臺北市大安區仁愛路四段４０８巷２１號七樓,0.0,商,,,1111004,土地0建物1車位0,七層,9,華廈(10層含以下有電梯),住家用,鋼筋混凝土造,0970701,73.48,1,2,1,有,有,有,40565,552,,0.0,0,租金含稅及二代健保補充保費及租賃所得稅,RPPOMLKLIIHGFFA07CC
信義區,建物,臺北市信義區基隆路二段１８９號２樓之１,0.0,商,,,1111014,土地0建物1車位0,二層,21,辦公商業大樓,見使用執照,鋼筋混凝土造,0860221,113.28,2,1,1,有,無,有,48000,424,,0.0,0,,RPSOMLKLIIHGFDA17CC
信義區,建物,臺北市信義區松德路１７１號６樓之５,0.0,住,,,1110921,土地0建物1車位0,六層,21,辦公商業大樓,見使用執照,鋼骨混凝土造,0841212,220.22,4,1,0,有,無,無,89000,404,,0.0,0,,RPUOMLKLIIHGFDA37CC
信義區,建物,臺北市信義區松德路１６７號,0.0,住,,,1111018,土地0建物1車位0,一層,30,辦公商業大樓,商業用,鋼骨混凝土造,0820524,65.15,0,1,1,有,無,有,43800,672,,0.0,0,,RPVOMLKLIIHGFDA47CC
松山區,建物,臺北市松山區南京東路五段１５之９號,0.0,商,,,1110926,土地0建物0車位0,十層,11,辦公商業大樓,住家用,鋼筋混凝土造,0600302,115.7,2,1,2,有,有,有,53476,462,,0.0,0,分租約35坪,RPPPMLKLIIHGFDA96CC
松山區,建物,臺北市松山區敦化北路１００號,0.0,其他,,,1111006,土地0建物0車位0,九層,15,套房(1房1廳1衛),商業用,鋼骨鋼筋混凝土造,0721005,30.73,1,0,1,有,無,有,15900,517,,0.0,0,此為分租套房，租賃面積約為30.73平方公尺，每月電費1500元、管理費930元、水費300元、瓦斯費300元皆為承租人負擔。本租賃標的未計入共有部分之分算面積。,RPSPMLKLIIHGFDA27CC
松山區,建物,臺北市松山區敦化北路１００號,0.0,其他,,,1111007,土地0建物0車位0,十層,15,套房(1房1廳1衛),商業用,鋼骨鋼筋混凝土造,0721005,30.73,1,0,1,有,無,有,15900,517,,0.0,0,此為分租套房，租賃面積約為30.73平方公尺，每月電費1500元、管理費930元、水費300元、瓦斯費300元皆為承租人負擔。本租賃標的未計入共有部分之分算面積。,RPTPMLKLIIHGFDA37CC
松山區,建物,臺北市松山區敦化北路１００號,0.0,其他,,,1111011,土地0建物0車位0,十層,15,套房(1房1廳1衛),商業用,鋼骨鋼筋混凝土造,0721005,30.73,1,0,1,有,無,有,15900,517,,0.0,0,此為分租套房，租賃面積約為30.73平方公尺，每月電費1500元、管理費930元、水費300元、瓦斯費300元皆為承租人負擔。本租賃標的未計入共有部分之分算面積。,RPUPMLKLIIHGFDA47CC
松山區,建物,臺北市松山區敦化北路１００號,0.0,其他,,,1111006,土地0建物0車位0,十層,15,套房(1房1廳1衛),商業用,鋼骨鋼筋混凝土造,0721005,30.73,1,0,1,有,無,有,15900,517,,0.0,0,此為分租套房，租賃面積約為30.73平方公尺，每月電費1500元、管理費930元、水費300元、瓦斯費300元皆為承租人負擔。本租賃標的未計入共有部分之分算面積。,RPVPMLKLIIHGFDA57CC
松山區,建物,臺北市松山區敦化北路１００號,0.0,其他,,,1111011,土地0建物0車位0,十層,15,套房(1房1廳1衛),商業用,鋼骨鋼筋混凝土造,0721005,30.73,1,0,1,有,無,有,15900,517,,0.0,0,此為分租套房，租賃面積約為30.73平方公尺，每月電費1500元、管理費930元、水費300元、瓦斯費300元皆為承租人負擔。本租賃標的未計入共有部分之分算面積。,RPWPMLKLIIHGFDA67CC
松山區,建物,臺北市松山區敦化北路１００號,0.0,其他,,,1111011,土地0建物0車位0,十層,15,套房(1房1廳1衛),商業用,鋼骨鋼筋混凝土造,0721005,30.73,1,0,1,有,無,有,15900,517,,0.0,0,此為分租套房，租賃面積約為30.73平方公尺，每月電費1500元、管理費920元、水費300元、瓦斯費300元皆為承租人負擔。本租賃標的未計入共有部分之分算面積。,RPXPMLKLIIHGFDA77CC
松山區,建物,臺北市松山區敦化北路１００號,0.0,其他,,,1111010,土地0建物0車位0,十層,15,套房(1房1廳1衛),商業用,鋼骨鋼筋混凝土造,0721005,30.73,1,0,1,有,無,有,16990,553,,0.0,0,此為分租套房，租賃面積約為30.73平方公尺，每月電費1500元、管理費910元、水費300元、瓦斯費300元皆為承租人負擔。本租賃標的未計入共有部分之分算面積。,RPOQMLKLIIHGFDA96CC
松山區,建物,臺北市松山區敦化北路１００號,0.0,其他,,,1111011,土地0建物0車位0,十層,15,套房(1房1廳1衛),商業用,鋼骨鋼筋混凝土造,0721005,30.73,1,0,1,有,無,有,16590,540,,0.0,0,此為分租套房，租賃面積約為30.73平方公尺，每月電費1500元、管理費910元、水費300元、瓦斯費300元皆為承租人負擔。本租賃標的未計入共有部分之分算面積。租期第13個月免租金。,RPPQMLKLIIHGFDA07CC
松山區,建物,臺北市松山區敦化北路１００號,0.0,其他,,,1111010,土地0建物0車位0,十層,15,套房(1房1廳1衛),商業用,鋼骨鋼筋混凝土造,0721005,30.73,1,0,1,有,無,有,16630,541,,0.0,0,此為分租套房，租賃面積約為30.73平方公尺，每月電費1500元、管理費870元、水費300元、瓦斯費300元皆為承租人負擔。本租賃標的未計入共有部分之分算面積。,RPQQMLKLIIHGFDA17CC
中正區,建物,臺北市中正區金門街２４巷２４之８號五樓,0.0,住,,,1111014,土地0建物1車位0,五層,10,華廈(10層含以下有電梯),住家用,鋼筋混凝土造,1020207,82.35,2,1,1,有,有,有,35000,425,,0.0,0,租金含管理費。,RPRNMLKLIIHGFAA66CC
中正區,建物,臺北市中正區師大路１９４號２樓,0.0,住,,,1110905,土地0建物1車位0,二層,4,套房(1房1廳1衛),,加強磚造,,19.83,1,0,1,有,無,有,8500,429,,0.0,0,,RPSNMLKLIIHGFAA76CC
文山區,建物,臺北市文山區辛亥路七段５巷５號八樓,0.0,住,,,1110918,土地0建物1車位1,八層,12,住宅大樓(11層含以上有電梯),住家用,鋼筋混凝土造,1021025,193.39999999999998,3,2,2,有,有,有,39000,202,坡道平面,28.56,0,,RPVNMLKLIIHGFAA07CC
文山區,房地(土地+建物),臺北市文山區景興路４２巷２弄５號,0.0,住,,,1111020,土地0建物1車位0,一層,4,公寓(5樓含以下無電梯),住家用,鋼筋混凝土造,0630920,94.68,3,2,2,有,無,無,42000,444,,0.0,0,,RPTOMLLLIIHGFAA07CC
文山區,建物,臺北市文山區景興路３００號六樓之１０,0.0,商,,,1111013,土地0建物1車位0,六層,27,住宅大樓(11層含以上有電梯),集合住宅,鋼骨鋼筋混凝土造,1090110,83.12,2,2,1,有,有,有,30000,361,,0.0,0,租賃範圍不含車位，已扣除車位面積。,RPWOMLLLIIHGFAA37CC
松山區,建物,臺北市松山區復興北路３６７號１０樓,0.0,商,,,1110923,土地0建物1車位1,十層,12,辦公商業大樓,住家用,鋼筋混凝土造,0721118,360.42,0,0,0,無,有,無,196200,544,升降平面,0.0,0,,RPPNMLLLIIHGFDA86CC
松山區,建物,臺北市松山區市民大道四段１３７號,0.0,住,,,1111020,土地0建物1車位0,一層,5,店面(店鋪),見使用執照,鋼筋混凝土造,0710818,131.68,1,1,1,有,有,有,98000,744,,0.0,0,,RPWNMLLLIIHGFDA57CC
信義區,建物,臺北市信義區信義路五段１２８號１２樓,0.0,其他,,,1110908,土地0建物1車位0,十二層,25,住宅大樓(11層含以上有電梯),住家用,鋼骨造、鋼骨鋼筋混凝土造,0931130,231.5,3,2,2,有,有,有,150000,648,,0.0,0,,RPPOMLLLIIHGFDA96CC
信義區,建物,臺北市信義區吳興街２８４巷１３弄５號四樓之１,0.0,住,,,1111018,土地0建物1車位0,四層,7,套房(1房1廳1衛),住家用,鋼筋混凝土造,0821123,46.410000000000004,1,1,1,有,有,有,19900,429,,0.0,0,國家住宅及都市更新中心社會住宅包租代管計畫。水電瓦斯費及每月管理費1100元由承租人負擔。,RPSOMLLLIIHGFDA27CC
