中山區,建物,臺北市中山區林森北路３６３號１７樓之６,0.0,商,,,1110912,土地0建物1車位0,十七層,18,住宅大樓(11層含以上有電梯),商業用,鋼筋混凝土造,0980916,66.62,1,1,1,有,有,有,45000,675,,0.0,0,,RPPOMLMLRHHGFCA77CC
中山區,建物,臺北市中山區新生北路二段６８巷９號７樓之１０,0.0,商,,,1110912,土地0建物1車位0,七層,13,住宅大樓(11層含以上有電梯),住家用,鋼筋混凝土造,0971229,73.84,2,1,1,有,有,有,45000,609,,0.0,0,,RPROMLMLRHHGFCA97CC
中山區,建物,臺北市中山區雙城街２５巷５號九樓,0.0,商,,,1110901,土地0建物1車位0,九層,13,住宅大樓(11層含以上有電梯),住家用,鋼筋混凝土造,1041221,131.81,2,1,2,有,有,有,80000,607,,0.0,0,,RPTOMLMLRHHGFCA18CC
中山區,建物,臺北市中山區松江路２２３號１１樓,0.0,其他,,,1110803,土地0建物0車位0,十一層,18,辦公商業大樓,一般事務所,鋼骨鋼筋混凝土造,1030703,541.88,0,0,0,無,有,無,457828,845,,0.0,0,租金含稅，部分租賃。,RPOPMLMLRHHGFCA77CC
中山區,建物,臺北市中山區林森北路３７２號５樓,0.0,商,,,1110919,土地0建物1車位0,五層,11,辦公商業大樓,商業用,鋼骨鋼筋混凝土造,0610613,109.09,0,0,0,無,無,無,42900,393,,0.0,0,承租部分面積,RPQPMLMLRHHGFCA97CC
大同區,建物,臺北市大同區市民大道一段２０５號十一樓之８,0.0,其他,,,1110830,土地0建物1車位0,十一層,18,住宅大樓(11層含以上有電梯),住家用,鋼骨造,0980724,84.62,2,1,1,有,有,有,56000,662,,0.0,0,,RPRNMLMLRHHGFBA77CC
大同區,建物,臺北市大同區市民大道一段２０１號九樓之７,0.0,其他,,,1110831,土地0建物1車位0,九層,18,住宅大樓(11層含以上有電梯),住家用,鋼骨造,0980724,118.12,3,2,2,有,有,有,55000,466,,0.0,0,,RPTNMLMLRHHGFBA97CC
大同區,建物,臺北市大同區市民大道一段２０７號十樓,0.0,其他,,,1110831,土地0建物1車位0,十層,18,住宅大樓(11層含以上有電梯),住家用,鋼骨造,0980724,80.4,2,1,1,有,有,有,50000,622,,0.0,0,,RPUNMLMLRHHGFBA08CC
大同區,建物,臺北市大同區市民大道一段２０７號十六樓之３,0.0,其他,,,1110831,土地0建物1車位0,十六層,18,住宅大樓(11層含以上有電梯),住家用,鋼骨造,0980724,77.10000000000001,2,1,1,有,有,有,55000,713,,0.0,0,,RPVNMLMLRHHGFBA18CC
中正區,建物,臺北市中正區漢口街一段６８巷１０號,0.0,商,,,1110917,土地0建物0車位0,一層,4,套房(1房1廳1衛),,加強磚造,,30.74,1,0,1,有,無,有,12000,390,,0.0,0,此為分租套房，第一層分成2間，一間平均面積約為30.74平方公尺。電費及每月管理維護費200元、垃圾收取費600元，皆為承租人負擔。,RPWOMLMLRHHGFBA38CC
士林區,建物,臺北市士林區中山北路六段２１２之１號十二樓,0.0,住,,,1110824,土地0建物1車位0,十二層,14,住宅大樓(11層含以上有電梯),住家用,鋼骨鋼筋混凝土造,0930518,166.37,3,2,2,有,有,有,110000,661,,0.0,0,,RPTNMLMLRHHGFEA28CC
士林區,建物,臺北市士林區天母東路３６之５號四樓,0.0,商,,,1110831,土地0建物1車位0,四層,12,住宅大樓(11層含以上有電梯),商業用,鋼筋混凝土造,0751017,190.86999999999998,3,2,2,有,有,有,70000,367,,0.0,0,,RPUNMLMLRHHGFEA38CC
北投區,房地(土地+建物)+車位,臺北市北投區民族街１５號２樓,877.0,住,,,1110810,土地1建物1車位1,二層,9,華廈(10層含以下有電梯),住家用,鋼筋混凝土造,0961121,207.0,4,2,2,有,有,有,50000,242,坡道平面,4.4,0,原申報書號:C1AE11108100004,RPVNMLMLRHHGFEA48CC
士林區,建物,臺北市士林區芝玉路一段２２２號８樓之２,0.0,住,,,1110908,土地0建物1車位1,八層,18,住宅大樓(11層含以上有電梯),住家用,鋼骨鋼筋混凝土造,0971112,164.87,3,1,2,有,有,有,105000,637,坡道平面,30.59,0,,RPXNMLMLRHHGFEA68CC
北投區,建物,臺北市北投區裕民二路６３號十樓,0.0,商,,,1110907,土地0建物1車位0,十層,19,住宅大樓(11層含以上有電梯),自由業事務所,鋼筋混凝土造,1021108,112.81,2,1,1,有,有,有,64000,567,,0.0,0,,RPWOMLMLRHHGFEA68CC
北投區,建物,臺北市北投區中央北路三段４０巷３４弄１８號１８樓,0.0,住,,,1110917,土地0建物1車位1,十八層,21,住宅大樓(11層含以上有電梯),住家用,鋼筋混凝土造,1010731,148.2,2,2,2,有,有,有,45000,304,坡道平面,0.0,0,,RPPPMLMLRHHGFEA08CC
文山區,建物,臺北市文山區興隆路三段２２號,0.0,商,,,1110831,土地0建物1車位0,一層,3,店面(店鋪),住商用,鋼筋混凝土造,,102.25,0,1,1,有,無,無,102401,1001,,0.0,0,部分承租。,RPRNMLMLRHHGFAA67CC
中正區,建物,臺北市中正區和平西路一段１１號十樓,0.0,商,,,1110917,土地0建物0車位0,十層,11,套房(1房1廳1衛),商業用,鋼筋混凝土造,,42.6,1,0,1,有,無,有,8500,200,,0.0,0,此為分租套房，第十層共分成21間，一間平均面積約為42.60平方公尺。電費及每月垃圾收取費600元、水費200元、鍋爐費300元皆為承租人負擔。,RPQOMLMLRHHGFAA67CC
中正區,建物,臺北市中正區和平西路一段１１號十一樓,0.0,商,,,1110917,土地0建物0車位0,十一層,11,套房(1房1廳1衛),商業用,鋼筋混凝土造,,40.66,1,0,1,有,無,有,11000,271,,0.0,0,此為分租套房，第十一層共分成22間，一間平均面積約為40.66平方公尺。電費及每月垃圾收取費600元、水費200元、鍋爐費300元皆為承租人負擔。,RPUOMLMLRHHGFAA08CC
中正區,建物,臺北市中正區和平西路一段１１號六樓,0.0,商,,,1110917,土地0建物0車位0,六層,11,住宅大樓(11層含以上有電梯),商業用,鋼筋混凝土造,,17.84,1,0,0,有,無,有,6600,370,,0.0,0,此為雅房，面積約為17.84平方公尺。電費及每月垃圾收取費600元、水費200元、鍋爐費300元皆為承租人負擔。,RPWOMLMLRHHGFAA28CC
文山區,建物,臺北市文山區興隆路四段１４５巷５３號四樓,0.0,住,,,1110920,土地0建物0車位0,四層,4,套房(1房1廳1衛),住家用,鋼筋混凝土造,0711018,26.75,1,0,1,有,無,有,7000,262,,0.0,0,此為分租套房，第四層共分成6間，一間平均面積約為26.75平方公尺。每月電費由承租人負擔。,RPXOMLMLRHHGFAA38CC
中正區,建物,臺北市中正區和平西路一段１１號七樓,0.0,商,,,1110917,土地0建物0車位0,七層,11,套房(1房1廳1衛),商業用,鋼筋混凝土造,,38.89,1,0,1,有,無,有,12500,321,,0.0,0,此為分租套房，第七層共分成23間，一間平均面積約為38.89平方公尺。電費及每月垃圾收取費600元、水費200元、鍋爐費300元皆為承租人負擔。,RPOPMLMLRHHGFAA57CC
文山區,建物,臺北市文山區三福街６９之２號四樓,0.0,住,,,1110916,土地0建物1車位0,四層,4,公寓(5樓含以下無電梯),集合住宅,鋼筋混凝土造,0640219,89.55,3,2,1,有,無,有,22000,246,,0.0,0,,RPRPMLMLRHHGFAA87CC
大安區,房地(土地+建物),臺北市大安區金山南路２段６號１樓,6.14,住,,,1110809,土地1建物1車位0,一層,12,辦公商業大樓,商業用,鋼筋混凝土造,0700619,70.11,0,0,0,無,有,有,95000,1355,,0.0,0,,RPSNMLMLRHHGFFA28CC
大安區,建物,臺北市大安區大安路二段６６號９樓之７,0.0,住,,,1110815,土地0建物1車位0,九層,12,住宅大樓(11層含以上有電梯),住家用,鋼筋混凝土造,0981113,83.13,1,1,1,有,有,有,40000,481,,0.0,0,,RPUNMLMLRHHGFFA48CC
大安區,建物,臺北市大安區復興南路１段１０７巷５弄７號５樓,0.0,商,,,1110922,土地0建物1車位0,五層,15,住宅大樓(11層含以上有電梯),住家用,鋼骨鋼筋混凝土造,1051014,241.28,4,2,2,有,有,有,90000,373,,0.0,0,,RPXNMLMLRHHGFFA78CC
大安區,建物,臺北市大安區大安路二段６６號五樓之９,0.0,住,,,1110901,土地0建物1車位0,五層,12,住宅大樓(11層含以上有電梯),住家用,鋼筋混凝土造,0981113,42.87,1,1,1,有,有,有,33000,770,,0.0,0,,RPPOMLMLRHHGFFA08CC
大安區,建物,臺北市大安區光復南路６９２巷３３號四樓,0.0,商,,,1110915,土地0建物0車位0,四層,5,套房(1房1廳1衛),住家用,鋼筋混凝土造,0620109,19.83,1,0,1,有,無,有,9800,494,,0.0,0,此為分租套房，第四層共分成5間，一間面積約為19.83平方公尺，每月電費及管理維護費200元、垃圾收取費600元，皆為承租人負擔。,RPUOMLMLRHHGFFA58CC
南港區,建物,臺北市南港區忠孝東路六段２７１號,0.0,工,,,1110829,土地0建物1車位0,一層,4,店面(店鋪),工業用,鋼筋混凝土造,0631212,95.13,0,1,1,有,無,無,35000,368,,0.0,0,租賃期間含免租金裝潢期。,RPQNMLMLRHHGFDA87CC
信義區,房地(土地+建物),臺北市信義區忠孝東路五段４２３巷５０號２樓２０１房,14.0,住,,,1110922,土地1建物1車位0,二層,3,公寓(5樓含以下無電梯),住家用,加強磚造,0510201,16.52,0,0,0,無,無,有,11500,696,,0.0,0,此為分租套房面積為16.52㎡,RPUOMLMLRHHGFDA38CC
信義區,建物,臺北市信義區松山路１３０號１２樓,0.0,商,,,1110916,土地0建物1車位0,十二層,12,辦公商業大樓,見使用執照,鋼筋混凝土造,0900627,842.73,0,0,0,無,有,有,315000,374,,0.0,0,12樓三室合併出租 本室+之1+之2，三室地號皆相同。,RPVOMLMLRHHGFDA48CC
松山區,建物,臺北市松山區南京東路五段１４３號四樓,0.0,商,,,1110916,土地0建物0車位0,四層,4,套房(1房1廳1衛),住家用,鋼筋混凝土造,0610915,37.1,1,0,1,有,無,有,15900,429,,0.0,0,此為分租套房，第四層共分成3間，一間平均面積約為37.10平方公尺。電費及每月垃圾收取費600元、水費200元皆為承租人負擔。,RPWOMLMLRHHGFDA58CC
松山區,建物,臺北市松山區南京東路五段１４３號四樓,0.0,商,,,1110915,土地0建物0車位0,四層,4,套房(1房1廳1衛),住家用,鋼筋混凝土造,0610915,37.1,1,0,1,有,無,有,14500,391,,0.0,0,此為分租套房，第四層共分成3間，一間平均面積約為37.10平方公尺。電費及每月垃圾收取費600元、水費200元皆為承租人負擔。,RPXOMLMLRHHGFDA68CC
信義區,建物,臺北市信義區崇德街１０５號３樓,0.0,住,,,1090901,土地0建物1車位0,三層,7,華廈(10層含以下有電梯),住家用,鋼筋混凝土造,0770627,78.33,3,2,2,有,無,有,28000,357,,0.0,0,,RPOPMLMLRHHGFDA87CC
信義區,建物,臺北市信義區松勤街８６號９樓,0.0,住,,,1110915,土地0建物1車位1,九層,10,辦公商業大樓,集合住宅,鋼骨造,1081107,335.86,0,0,0,無,無,有,334000,1046,塔式車位,22.29,6000,租金328000，車位另租6000。四室合併出租 本室+之1+之2+之3，只租一個車位，故9樓之1的02301-000建號車位扣除。,RPPPMLMLRHHGFDA97CC
信義區,建物,臺北市信義區忠孝東路五段６８９號８樓,0.0,住,,,1110913,土地0建物1車位2,八層,9,辦公商業大樓,一般事務所,鋼筋混凝土造,0911023,287.65,4,1,1,有,有,有,126000,438,升降機械,0.0,0,租金含2機械車位B2,RPQPMLMLRHHGFDA08CC
信義區,建物,臺北市信義區基隆路二段５１號５樓之６,0.0,商,,,1110912,土地0建物1車位0,五層,17,辦公商業大樓,商業用,鋼骨混凝土造,0820519,216.55,0,0,0,無,無,無,129000,596,,0.0,0,,RPRPMLMLRHHGFDA18CC
信義區,建物,臺北市信義區永吉路２２５巷２７號６樓,0.0,住,,,1110922,土地0建物1車位1,六層,12,住宅大樓(11層含以上有電梯),住家用,鋼筋混凝土造,0990510,104.76,3,2,2,有,有,有,50000,477,塔式車位,0.0,0,,RPSPMLMLRHHGFDA28CC
信義區,建物,臺北市信義區基隆路一段３５巷７弄１之２號,0.0,住,,,1110916,土地0建物0車位0,全,4,透天厝,防空避難室、會客室、宿舍,鋼筋混凝土造,0641016,15.71,1,0,0,有,無,有,6000,382,,0.0,0,此為雅房，面積約為15.71平方公尺。每月垃圾收取費600元、水費200元、公區使用費200元皆為承租人負擔。,RPUPMLMLRHHGFDA48CC
信義區,建物,臺北市信義區信義路五段１０９號九樓之７,0.0,其他,,,1110912,土地0建物1車位0,九層,12,住宅大樓(11層含以上有電梯),住家用,鋼筋混凝土造,0860926,100.28,3,2,2,有,有,有,55000,548,,0.0,0,租金含管理費。,RPRNMLNLRHHGFDA08CC
信義區,建物,臺北市信義區永吉路１２７巷２５號四樓,0.0,住,,,1110915,土地0建物0車位0,四層,4,套房(1房1廳1衛),住家用,鋼筋混凝土造,0630722,21.07,1,0,1,有,無,有,11500,546,,0.0,0,此為分租套房，第四層共分成5間，一間平均面積約為21.07平方公尺。每月電費及管理維護費200元、垃圾收取費600元皆為承租人負擔。,RPUNMLNLRHHGFDA38CC
南港區,建物,臺北市南港區忠孝東路７段５１８號,0.0,商,,,1110901,土地0建物1車位0,一層,10,辦公商業大樓,一般零售業甲組,鋼筋混凝土造,1040409,170.32,0,0,0,無,有,無,54038,317,坡道平面,41.19,0,,RPXNMLNLRHHGFDA68CC
松山區,建物,臺北市松山區八德路四段１９７號三樓,0.0,住,,,1110908,土地0建物1車位0,三層,4,公寓(5樓含以下無電梯),住家用,加強磚造,,85.84,2,1,1,有,無,有,23000,268,,0.0,0,租賃期間含免租金裝潢期。,RPSOMLNLRHHGFDA28CC
信義區,建物,臺北市信義區基隆路一段３５巷７弄１之２號,0.0,住,,,1110919,土地0建物0車位0,全,4,透天厝,防空避難室、會客室、宿舍,鋼筋混凝土造,0641016,17.12,1,0,0,有,無,有,6000,350,,0.0,0,此為雅房，面積約為17.12平方公尺。每月垃圾收取費600元、水費200元、公區使用費200元皆為承租人負擔。,RPTOMLNLRHHGFDA38CC
松山區,房地(土地+建物),臺北市松山區新東街２６巷６號２樓,36.5,住,,,1110920,土地1建物1車位0,二層,4,公寓(5樓含以下無電梯),住家用,鋼筋混凝土造,0610629,87.63,3,2,1,有,無,有,35000,399,,0.0,0,,RPVOMLNLRHHGFDA58CC
松山區,建物,臺北市松山區八德路四段１７７號,0.0,住,,,1110919,土地0建物0車位0,二層,4,套房(1房1廳1衛),,加強磚造,,22.75,1,0,1,有,無,有,11000,484,,0.0,0,此為分租套房，第二層共分成4間，一間平均面積約為22.75平方公尺。電費及每月垃圾收取費600元、水費200元皆為承租人負擔。,RPWOMLNLRHHGFDA68CC
信義區,建物,臺北市信義區基隆路一段３５巷７弄１之２號,0.0,住,,,1110920,土地0建物0車位0,全,4,透天厝,防空避難室、會客室、宿舍,鋼筋混凝土造,0641016,16.46,1,0,0,有,無,有,6000,365,,0.0,0,此為雅房，面積約為16.46平方公尺。每月垃圾收取費600元、水費200元、公共使用費200元皆為承租人負擔。,RPXOMLNLRHHGFDA78CC
南港區,建物,臺北市南港區興中路１２巷１９號六樓,0.0,商,,,1110913,土地0建物2車位2,六層,10,華廈(10層含以下有電梯),商業用,鋼筋混凝土造,0810811,261.6,0,0,0,無,有,有,73000,279,升降平面,0.0,0,同時租賃台北市南港區興中路１２巷２１號六樓及車位二個，車位面積共70.34平方公尺無法拆分。,RPPPMLNLRHHGFDA08CC
信義區,建物,臺北市信義區忠孝東路四段５０４號,0.0,住,,,1110830,土地0建物1車位0,一層,10,華廈(10層含以下有電梯),商業用,鋼筋混凝土造,0660324,359.38,2,2,2,有,有,有,430000,1197,,0.0,0,,RPSPMLNLRHHGFDA38CC
大安區,建物,臺北市大安區敦化南路二段２７３號８樓之１號,0.0,其他,,,1110902,土地0建物1車位0,八層,12,住宅大樓(11層含以上有電梯),住家用,鋼筋混凝土造,0750207,123.53999999999999,3,2,2,有,有,有,45000,364,,0.0,0,,RPPNMLNLRHHGFFA08CC
大安區,建物,臺北市大安區信義路３段２３之１號２樓,0.0,商,,,1110923,土地0建物1車位0,二層,4,公寓(5樓含以下無電梯),住家用,加強磚造,0580710,75.61,1,1,1,有,無,無,35000,463,,0.0,0,,RPUNMLNLRHHGFFA58CC
大安區,建物,臺北市大安區忠孝東路四段７６號十一樓,0.0,商,,,1110912,土地0建物1車位0,十一層,12,住宅大樓(11層含以上有電梯),住家用,鋼筋混凝土造,0660118,66.3,3,1,1,有,有,有,35000,528,,0.0,0,,RPWNMLNLRHHGFFA78CC
大安區,建物,臺北市大安區忠孝東路四段６０號４樓之２,0.0,商,,,1110828,土地0建物1車位0,四層,12,住宅大樓(11層含以上有電梯),住家用,鋼筋混凝土造,0640424,137.35,5,2,2,有,有,有,64000,466,,0.0,0,,RPXNMLNLRHHGFFA88CC
文山區,建物,臺北市文山區興隆路二段１３０巷３０號二樓,0.0,住,,,1110914,土地0建物1車位0,二層,4,公寓(5樓含以下無電梯),住家用,鋼筋混凝土造,0630219,85.45,3,2,1,有,無,有,25000,293,,0.0,0,,RPPNMLNLRHHGFAA57CC
中正區,建物,臺北市中正區和平西路一段１１號十樓,0.0,商,,,1110921,土地0建物0車位0,十層,11,套房(1房1廳1衛),商業用,鋼筋混凝土造,,42.6,1,0,1,有,無,有,14200,333,,0.0,0,此為分租套房，第十層共分成21間，一間平均面積約為42.60平方公尺。電費及每月垃圾收取費600元、水費200元、鍋爐費300元皆為承租人負擔。,RPVNMLNLRHHGFAA18CC
中正區,建物,臺北市中正區和平西路一段１１號六樓,0.0,商,,,1110921,土地0建物0車位0,六層,11,套房(1房1廳1衛),商業用,鋼筋混凝土造,,22.9,1,0,1,有,無,有,13000,568,,0.0,0,此為分租套房，第六層共分成21間，一間平均面積約為22.90平方公尺。電費及每月垃圾收取費600元、水費200元、鍋爐費300元皆為承租人負擔。,RPXNMLNLRHHGFAA38CC
北投區,建物,臺北市北投區石牌路二段３１５巷２３號三樓,0.0,住,,,1110912,土地0建物1車位1,三層,11,住宅大樓(11層含以上有電梯),住家用,鋼筋混凝土造,0980622,201.0,4,2,2,有,有,有,60000,299,坡道平面,28.98,0,租金含管理費。,RPQNMLNLRHHGFEA08CC
北投區,建物,臺北市北投區石牌路二段５２號,0.0,商,,,1110923,土地0建物1車位0,全,3,透天厝,住商用,加強磚造,0581005,197.58,0,0,3,有,無,有,265000,1341,,0.0,0,,RPVNMLNLRHHGFEA58CC
北投區,建物,臺北市北投區溫泉路１３２之１３號三樓,0.0,其他,,,1110916,土地0建物1車位0,三層,5,套房(1房1廳1衛),住家用,鋼筋混凝土造,0721116,46.0,1,1,1,有,無,有,9000,196,,0.0,0,,RPOOMLNLRHHGFEA97CC
北投區,建物,臺北市北投區三合街二段４４０號六樓,0.0,住,,,1110918,土地0建物1車位1,見其他登記事項,18,住宅大樓(11層含以上有電梯),住家用,鋼筋混凝土造,0870714,126.14,3,1,1,有,有,有,36000,285,坡道平面,0.0,0,車位面積無法分算。,RPQOMLNLRHHGFEA18CC
北投區,建物,臺北市北投區新民路６２巷１５弄１號三樓之１,0.0,其他,,,1110914,土地0建物1車位1,三層,5,華廈(10層含以下有電梯),住家用,鋼筋混凝土造,1051019,98.09,2,1,1,有,有,有,28000,285,升降平面,33.53,0,,RPROMLNLRHHGFEA28CC
士林區,建物,臺北市士林區天母東路４３巷４弄９號７樓,0.0,商,,,1110830,土地0建物1車位0,七層,7,華廈(10層含以下有電梯),住家用,鋼筋混凝土造,0690325,126.52,4,2,3,有,有,有,80000,632,,0.0,0,,RPWOMLNLRHHGFEA78CC
士林區,建物,臺北市士林區社中街１５２巷３０號三樓之１,0.0,住,,,1110921,土地0建物1車位0,三層,7,華廈(10層含以下有電梯),住家用,鋼筋混凝土造,0840414,120.82,2,1,2,有,有,有,24000,199,,0.0,0,國家住宅及都市更新中心社會住宅包租代管計畫。每月水電瓦斯費由承租人負擔。,RPXOMLNLRHHGFEA88CC
萬華區,建物,臺北市萬華區富民路１４５巷３５弄２２號二樓,0.0,住,,,1110916,土地0建物1車位0,二層,4,公寓(5樓含以下無電梯),住家用,加強磚造,,68.36,3,1,1,有,無,有,13000,190,,0.0,0,,RPPNMLNLRHHGFBA67CC
大同區,建物,臺北市大同區民權西路２２８號,0.0,商,,,1110912,土地0建物2車位0,一層,12,店面(店鋪),商業用,鋼筋混凝土造,0770623,76.69,0,2,1,有,有,無,40000,522,,0.0,0,兩個門牌。,RPRNMLNLRHHGFBA87CC
萬華區,建物,臺北市萬華區西園路二段２６１巷４６弄２號,0.0,住,,,1110922,土地0建物1車位0,一層,3,公寓(5樓含以下無電梯),工業用,加強磚造,,72.12,3,1,1,有,無,無,17000,236,,0.0,0,,RPUNMLNLRHHGFBA18CC
中正區,建物,臺北市中正區重慶南路１段６２號３樓,0.0,商,,,1110902,土地0建物1車位0,三層,7,華廈(10層含以下有電梯),,鋼筋混凝土造,,172.48,5,2,2,有,無,有,50000,290,,0.0,0,,RPROMLNLRHHGFBA97CC
中正區,車位,臺北市中正區重慶南路一段１２１號地下,0.0,商,,,1110829,土地0建物0車位1,,8,其他,店舖、停車場兼防空避難室,鋼筋混凝土造,0711016,50.62,0,0,0,有,有,無,7000,,坡道平面,50.62,7000,,RPSOMLNLRHHGFBA08CC
中正區,建物,臺北市中正區衡陽路７６號,0.0,商,,,1110917,土地0建物0車位0,五層,7,套房(1房1廳1衛),,加強磚造,,26.3,1,0,1,有,無,有,12500,475,,0.0,0,此為分租套房，第五層共分成5間，一間平均面積約為26.30平方公尺，電費及每月垃圾收取費600元、水費200元皆為承租人負擔。,RPUOMLNLRHHGFBA28CC
萬華區,建物,臺北市萬華區西寧南路２１４號四樓,0.0,商,,,1110915,土地0建物0車位0,四層,4,套房(1房1廳1衛),住家用,鋼筋混凝土造,0620528,23.4,1,0,1,有,無,有,12300,526,,0.0,0,此為分租套房，第4層隔為3間，一間面積約為23.40平方公尺，電費及每月垃圾收取費600元、水費200元皆為承租人負擔。,RPVOMLNLRHHGFBA38CC
中山區,房地(土地+建物)+車位,臺北市中山區明水路５７５號１３樓,0.0,住,,,1110922,土地0建物1車位1,十三層,16,住宅大樓(11層含以上有電梯),住家用,鋼筋混凝土造,0840223,248.76,4,2,2,有,有,有,70000,281,坡道平面,38.58,0,,RPRNMLNLRHHGFCA97CC
內湖區,建物,臺北市內湖區行善路３５３號９樓B,0.0,工,,,1110901,土地0建物1車位0,九層,12,辦公商業大樓,一般事務所，一般辦公室,鋼骨造,1040526,438.07,4,0,0,有,有,有,169758,388,,0.0,0,,RPXNMLNLRHHGFCA58CC
中山區,建物,臺北市中山區新生北路３段７４號８樓,0.0,商,,,1110916,土地0建物1車位0,八層,11,住宅大樓(11層含以上有電梯),住家用,鋼筋混凝土造,0710227,91.31,2,1,2,有,有,有,28900,317,,0.0,0,水電瓦斯、網路費及每月管理費2100元由承租人負擔。,RPPOMLNLRHHGFCA87CC
中山區,建物,臺北市中山區復興北路２３２號五樓之２,0.0,住,,,1110919,土地0建物1車位0,五層,14,住宅大樓(11層含以上有電梯),集合住宅,鋼筋混凝土造,0750314,114.62,2,2,2,有,有,有,43000,375,,0.0,0,租金含管理費。,RPPQMLNLRHHGFCA08CC
中山區,建物,臺北市中山區南京東路二段７號,0.0,商,,,1110917,土地0建物0車位0,八層,8,套房(1房1廳1衛),住商用,鋼筋混凝土造,0580616,24.78,1,0,1,有,無,有,11700,472,,0.0,0,此為分租套房，第八層共分成5間，一間平均面積約為24.78平方公尺，電費及每月垃圾收取費600元、水費200元皆為承租人負擔。,RPUQMLNLRHHGFCA58CC
中山區,建物,臺北市中山區遼寧街７６巷２號,0.0,住,,,1110920,土地0建物0車位0,一層,5,店面(店鋪),住家用,鋼筋混凝土造,0730502,66.12,1,1,1,有,無,有,50000,756,,0.0,0,部分承租。租賃期間含免租金裝潢期。租金調漲：第四年至第五年每月租金新台幣伍萬參仟元。,RPVQMLNLRHHGFCA68CC
中山區,建物,臺北市中山區民權東路二段３８號６樓,0.0,商,,,1110902,土地0建物1車位0,六層,12,住宅大樓(11層含以上有電梯),住家用,鋼筋混凝土造,1020206,164.10000000000002,4,2,2,有,有,有,72040,439,,0.0,0,,RPORMLNLRHHGFCA08CC
中山區,建物,臺北市中山區中山北路一段１０５巷２號二樓,0.0,商,,,1110919,土地0建物0車位0,四層,4,套房(1房1廳1衛),住家用,加強磚造,0550518,24.87,1,0,1,有,無,有,13000,523,,0.0,0,此為分租套房，第四層共分成4間，一間平均面積約為24.87平方公尺。電費及每月垃圾收取費600元、水費200元皆為承租人負擔。,RPSRMLNLRHHGFCA48CC
中山區,建物,臺北市中山區中山北路二段１２９號三樓,0.0,商,,,1110902,土地0建物1車位0,三層,14,辦公商業大樓,商業用,鋼骨鋼筋混凝土造,0930319,217.74,0,0,0,無,有,無,110000,505,,0.0,0,,RPPNMLOLRHHGFCA87CC
中山區,建物,臺北市中山區建國北路二段９之２號九樓,0.0,住,,,1110908,土地0建物1車位0,九層,14,辦公商業大樓,商業用,鋼筋混凝土造,0950713,60.0,1,1,1,有,有,有,35000,583,,0.0,0,,RPQNMLOLRHHGFCA97CC
中山區,建物,臺北市中山區林森北路３６３號十五樓之６,0.0,商,,,1110912,土地0建物1車位0,十五層,18,辦公商業大樓,商業用,鋼筋混凝土造,0980916,66.62,1,1,1,有,有,有,50000,751,,0.0,0,,RPRNMLOLRHHGFCA08CC
大同區,建物,臺北市大同區太原路８０號六樓之２,0.0,商,,,1110905,土地0建物1車位0,六層,14,住宅大樓(11層含以上有電梯),住家用,鋼筋混凝土造,0971211,37.36,1,1,1,有,有,有,18000,482,,0.0,0,,RPPNMLOLRHHGFBA77CC
大同區,建物,臺北市大同區市民大道一段２０７號十五樓之１４,0.0,其他,,,1110907,土地0建物1車位0,十五層,18,住宅大樓(11層含以上有電梯),住家用,鋼骨造,0980724,47.21,1,1,1,有,有,有,30000,635,,0.0,0,,RPRNMLOLRHHGFBA97CC
北投區,建物,臺北市北投區明德路２７９號５樓,0.0,住,,,1110831,土地0建物1車位0,五層,5,公寓(5樓含以下無電梯),住家用,鋼筋混凝土造,0650922,114.49,3,2,2,有,無,有,26000,227,,0.0,0,,RPPNMLOLRHHGFEA08CC
北投區,建物,臺北市北投區石牌路二段３１５巷２３號二樓,0.0,住,,,1110916,土地0建物1車位0,二層,11,住宅大樓(11層含以上有電梯),住家用,鋼筋混凝土造,0980622,172.01999999999998,3,2,2,有,有,有,54146,315,,0.0,0,,RPQNMLOLRHHGFEA18CC
士林區,建物,臺北市士林區中山北路六段１９５巷６號八樓之２,0.0,住,,,1110916,土地0建物1車位0,八層,14,住宅大樓(11層含以上有電梯),住家用,鋼筋混凝土造,0970506,147.5,3,1,2,有,有,有,70000,475,,0.0,0,,RPRNMLOLRHHGFEA28CC
