內湖區,房地(土地+建物),臺北市內湖區陽光街３２１巷６０號５樓,0.0,其他,,,1101203,土地1建物1車位0,五層,6,廠辦,工商用,鋼筋混凝土造,0881029,1193.38,0,0,0,無,有,無,492245,412,,0.0,0,部分面積承租,RPUNMLRLKIGGFCA97CC
內湖區,房地(土地+建物),臺北市內湖區瑞光路４０８號３樓之５,0.0,工,,,1101215,土地1建物1車位0,三層,12,廠辦,工業用,鋼骨造,0951128,510.75,0,0,0,無,有,無,239000,468,,0.0,0,,RPWNMLRLKIGGFCA18CC
內湖區,建物,臺北市內湖區康寧路三段２１９巷９號四樓,0.0,商,,,1101129,土地0建物1車位0,四層,5,公寓(5樓含以下無電梯),住家用,鋼筋混凝土造,0740921,113.96000000000001,3,2,2,有,無,有,34000,298,,0.0,0,,RPTOMLRLKIGGFCA97CC
中山區,建物,臺北市中山區伊通街５２巷１號６樓,0.0,商,,,1101213,土地0建物1車位0,六層,6,華廈(10層含以下有電梯),住家用,鋼筋混凝土造,0950918,79.36,2,2,2,有,無,有,38000,479,,0.0,0,,RPWOMLRLKIGGFCA28CC
中山區,建物,臺北市中山區中山北路二段１３８號６樓,0.0,商,,,1101029,土地0建物1車位1,六層,14,辦公商業大樓,商業用,鋼筋混凝土造,0970611,175.93,3,2,2,有,有,有,69000,392,坡道平面,23.66,0,,RPVPMLRLKIGGFCA28CC
中山區,建物,臺北市中山區新生北路一段５９號１１樓,0.0,商,,,1101111,土地0建物2車位0,十一層,12,住宅大樓(11層含以上有電梯),住家用,鋼筋混凝土造,0680515,168.67000000000002,1,1,2,有,無,有,58000,344,,0.0,0,建號01651-0僅承租部份約12.75坪,RPXPMLRLKIGGFCA48CC
中山區,建物,臺北市中山區新生北路２段３８號１４樓之２,0.0,商,,,1101202,土地0建物1車位0,十四層,17,住宅大樓(11層含以上有電梯),住家用,鋼筋混凝土造,0850718,78.9,2,1,1,有,有,有,25000,317,,0.0,0,,RPWQMLRLKIGGFCA48CC
南港區,建物,臺北市南港區富康街５７號,0.0,住,,,1101214,土地0建物1車位0,一層,4,店面(店鋪),住家用,鋼筋混凝土造,0630118,45.49,0,1,1,有,無,有,27000,594,,0.0,0,水電費瓦斯費網路費由承租人負擔,RPQPMLRLKIGGFDA87CC
松山區,建物,臺北市松山區敦化南路１段５７號１１樓之７,0.0,其他,,,1101207,土地0建物1車位0,十一層,12,住宅大樓(11層含以上有電梯),住家用,鋼筋混凝土造,,95.16,3,2,2,有,有,有,45000,473,,0.0,0,,RPPNMLSLKIGGFDA67CC
南港區,建物,臺北市南港區興中路６８巷１６號１１樓,0.0,商,,,1101207,土地0建物1車位0,十一層,17,住宅大樓(11層含以上有電梯),商業用,鋼筋混凝土造,0831216,82.37,2,2,1,有,有,有,30000,364,,0.0,0,,RPQNMLSLKIGGFDA77CC
信義區,建物,臺北市信義區光復南路４１５巷１８０號４樓,0.0,住,,,1101203,土地0建物1車位0,四層,7,華廈(10層含以下有電梯),住家用,鋼筋混凝土造,0721117,119.62,0,0,0,無,無,無,34000,284,,0.0,0,,RPWNMLSLKIGGFDA38CC
信義區,建物,臺北市信義區基隆路一段１４３號７樓,0.0,商,,,1101224,土地0建物1車位0,七層,13,辦公商業大樓,一般事務所,鋼骨造,0950126,187.70999999999998,0,0,0,無,無,有,90000,479,,0.0,0,,RPUOMLSLKIGGFDA28CC
信義區,建物,臺北市信義區林口街３３號二樓,0.0,住,,,1101214,土地0建物0車位0,二層,4,套房(1房1廳1衛),住家用,鋼筋混凝土造,0590920,18.53,1,0,1,有,無,有,9600,518,,0.0,0,此為分租套房，第二層共分成4間，一間平均面積約為18.53平方公尺。管理維護費＄200、垃圾費＄600，由承租人負擔,RPOPMLSLKIGGFDA77CC
大同區,建物,臺北市大同區承德路二段８１號四樓之３,0.0,商,,,1101227,土地0建物1車位0,四層,16,辦公商業大樓,商業用,鋼筋混凝土造,0820914,213.18,4,0,2,有,有,無,86500,406,,0.0,0,,RPSOMLSLKIGGFBA97DC
中山區,建物,臺北市中山區德惠街３４號十一樓之２５,0.0,商,,,1101113,土地0建物1車位0,十一層,11,住宅大樓(11層含以上有電梯),住家用,鋼筋混凝土造,0681219,22.81,1,1,1,有,有,有,9100,399,,0.0,0,,RPRNMLSLKIGGFCA77CC
中山區,建物,臺北市中山區松江路１０８巷４號,0.0,住,,,1101216,土地0建物1車位0,一層,6,店面(店鋪),商業用,鋼筋混凝土造,0660416,387.08,6,2,2,有,無,有,150000,388,,0.0,0,租賃期間含免租金裝潢期。,RPSNMLSLKIGGFCA87CC
中山區,建物,臺北市中山區林森北路３０６號十樓之８,0.0,商,,,1101224,土地0建物1車位0,十層,14,住宅大樓(11層含以上有電梯),住家用,鋼筋混凝土造,0920213,30.25,1,0,1,有,有,有,12500,413,,0.0,0,國家住宅及都市更新中心110年社會住宅包租代管第三期計畫,RPWNMLSLKIGGFCA28CC
中山區,建物,臺北市中山區林森北路５３６號七樓之７,0.0,商,,,1101130,土地0建物1車位0,七層,14,住宅大樓(11層含以上有電梯),商業用,鋼筋混凝土造,0940826,45.0,2,1,1,有,無,有,23000,511,,0.0,0,,RPQPMLSLKIGGFCA87CC
中山區,建物,臺北市中山區農安街６號九樓之９,0.0,商,,,1101216,土地0建物1車位0,九層,14,住宅大樓(11層含以上有電梯),商業用,鋼筋混凝土造,0980622,60.18,2,1,1,有,有,有,36000,598,,0.0,0,租金含管理費。,RPRPMLSLKIGGFCA97CC
中山區,建物,臺北市中山區雙城街５０號六樓之２,0.0,商,,,1101205,土地0建物1車位0,七層,6,套房(1房1廳1衛),住家用,鋼筋混凝土造,0700526,33.72,1,0,1,有,有,有,13000,386,,0.0,0,水費、電費、管理費由承租人負擔,RPSPMLSLKIGGFCA08CC
士林區,建物,臺北市士林區中山北路７段１１４巷３３弄４號２樓,0.0,住,,,1101208,土地0建物1車位0,二層,6,華廈(10層含以下有電梯),住家用,鋼筋混凝土造,0761117,141.03,3,2,2,有,有,有,42000,298,,0.0,0,,RPPNMLSLKIGGFEA77CC
北投區,建物,臺北市北投區中央北路３段４０巷３４弄１８號１８樓之１,0.0,住,,,1101214,土地0建物1車位1,十八層,21,住宅大樓(11層含以上有電梯),住家用,鋼筋混凝土造,1010731,154.71,3,2,2,有,有,有,42000,271,坡道平面,0.0,0,,RPQNMLSLKIGGFEA87CC
士林區,建物,臺北市士林區天母東路２２號６樓,0.0,商,,,1101226,土地0建物1車位0,六層,20,住宅大樓(11層含以上有電梯),見使用執照,鋼筋混凝土造,0740515,102.78999999999999,2,2,1,有,有,有,40000,389,,0.0,0,,RPRNMLSLKIGGFEA97CC
士林區,建物,臺北市士林區承德路四段７９號九樓,0.0,商,,,1101215,土地0建物1車位1,九層,14,住宅大樓(11層含以上有電梯),住家用,鋼筋混凝土造,0960621,250.51999999999998,4,2,2,有,有,有,70000,279,坡道平面,12.97,0,,RPOOMLSLKIGGFEA77CC
大同區,建物,臺北市大同區寧夏路２０號３樓之３,0.0,商,,,1101224,土地0建物1車位0,三層,13,住宅大樓(11層含以上有電梯),住家用,鋼筋混凝土造,1001130,46.36,2,1,1,有,有,有,24000,518,,0.0,0,,RPPNMLSLKIGGFBA47CC
大同區,建物,臺北市大同區延平北路一段９２號１０樓之３,0.0,商,,,1101222,土地0建物1車位1,十層,10,華廈(10層含以下有電梯),住家用,鋼筋混凝土造,0770924,170.46,3,2,2,有,有,有,53500,314,升降機械,0.0,4500,租金49000 車位4500,RPXNMLSLKIGGFBA28CC
大同區,建物,臺北市大同區延平北路三段１７巷１７號１樓及地下層,0.0,住,,,1101227,土地0建物1車位0,一層,5,公寓(5樓含以下無電梯),商業用,鋼筋混凝土造,0770308,159.23,0,0,0,無,無,有,56000,352,,0.0,0,,RPXOMLSLKIGGFBA38CC
大安區,建物,臺北市大安區敦化南路二段１６４號５樓之３,0.0,其他,,,1101119,土地0建物1車位0,五層,12,辦公商業大樓,商業用,鋼筋混凝土造,0750825,129.75,0,0,0,無,無,有,50000,385,,0.0,0,,RPPPMLSLKIGGFFA08CC
大安區,房地(土地+建物),臺北市大安區信義路二段７４號４樓,0.0,商,,,1101116,土地1建物1車位0,四層,4,華廈(10層含以下有電梯),住家用,鋼筋混凝土造,,242.4,0,0,0,無,無,有,98000,404,,0.0,0,,RPQPMLSLKIGGFFA18CC
大安區,建物,臺北市大安區羅斯福路３段３７號６樓,0.0,商,,,1101119,土地0建物0車位0,六層,15,辦公商業大樓,一般事務所,鋼筋混凝土造,0961012,145.79,0,0,0,無,有,有,65000,446,,0.0,0,,RPQOMLTLKIGGFFA18CC
信義區,建物,臺北市信義區永吉路６號１１樓,0.0,商,,,1101229,土地0建物1車位0,十一層,12,住宅大樓(11層含以上有電梯),住家用,鋼筋混凝土造,0961106,126.48,3,2,2,有,無,有,57000,451,,0.0,0,,RPWOMLTLKIGGFDA68DC
萬華區,建物,臺北市萬華區長沙街二段１１號六樓之２８,0.0,商,,,1101210,土地0建物1車位0,六層,11,住宅大樓(11層含以上有電梯),見使用執照,鋼筋混凝土造,0691113,30.4,1,0,1,有,有,有,10000,329,,0.0,0,台北市都發局社會住宅包租代管第3期計畫,RPWNMLTLKIGGFBA28CC
中正區,建物,臺北市中正區延平南路１６０之２號,0.0,商,,,1101207,土地0建物0車位0,四層,4,套房(1房1廳1衛),,鋼筋混凝土造,,26.24,1,0,1,有,無,有,12200,465,,0.0,0,此為分租套房，第4層共分成3間，一間平均面積約為26.24平方公尺。每月水雜費＄200，垃圾費＄600，由承租人負擔,RPUOMLTLKIGGFBA18CC
大同區,建物,臺北市大同區重慶北路三段１６６號,0.0,商,,,1101208,土地0建物0車位0,二層,2,套房(1房1廳1衛),,加強磚造,,29.39,1,0,1,有,無,有,13500,459,,0.0,0,此為分租套房，第2層共分成5間，一間平均面積約為29.39平方公尺。每月水雜費＄200，垃圾費＄600，由承租人負擔,RPVOMLTLKIGGFBA28CC
萬華區,建物,臺北市萬華區康定路１０３號１１樓之５,0.0,商,,,1101207,土地0建物1車位0,十一層,26,住宅大樓(11層含以上有電梯),住家用,鋼骨造,1050331,108.72999999999999,2,1,1,有,有,有,34000,313,,0.0,0,,RPXOMLTLKIGGFBA48CC
大同區,建物,臺北市大同區華陰街９１號３樓之３,0.0,商,,,1101221,土地0建物1車位0,三層,15,住宅大樓(11層含以上有電梯),一般事務所,鋼筋混凝土造,1001205,57.730000000000004,0,0,0,無,有,有,28000,485,,0.0,0,,RPWPMLTLKIGGFBA48CC
大同區,建物,臺北市大同區迪化街二段２８號,0.0,住,,,1101228,土地0建物1車位0,一層,4,公寓(5樓含以下無電梯),住家用,鋼筋混凝土造,0720423,79.8,3,1,1,有,無,有,26000,326,,0.0,0,國家住宅及都市更新中心 110 年社會住宅包租代管第 三 期計畫 水費電費瓦斯費由承租人負擔,RPXPMLTLKIGGFBA58CC
萬華區,建物,臺北市萬華區西寧南路２１９號８樓,0.0,其他,,,1101202,土地0建物0車位0,八層,10,套房(1房1廳1衛),住家用,鋼筋混凝土造,0620303,26.26,1,0,1,有,無,有,9000,343,,0.0,0,此為分租套房，第八層共分成8間，一間平均面積約為26.26平方公尺，垃圾收取費600元、水雜費200元，皆為承租人負擔。,RPPQMLTLKIGGFBA87CC
中正區,建物,臺北市中正區衡陽路７６號,0.0,商,,,1101203,土地0建物0車位0,二層,7,套房(1房1廳1衛),,加強磚造,,32.87,1,0,1,有,無,有,14400,438,,0.0,0,此為分租套房，第五層共分成4間，一間平均面積約為32.87平方公尺，垃圾收取費600元、水雜費200元。,RPQQMLTLKIGGFBA97CC
北投區,建物,臺北市北投區大度路三段２９９號九樓之２,0.0,住,,,1101219,土地0建物1車位0,九層,14,套房(1房1廳1衛),住家用,鋼筋混凝土造,0971013,57.84,1,1,1,有,有,有,22000,380,,0.0,0,租金含管理費。,RPPNMLTLKIGGFEA87CC
北投區,建物,臺北市北投區溫泉路７１號六樓之１３,0.0,其他,,,1101225,土地0建物1車位0,六層,7,華廈(10層含以下有電梯),住家用,鋼筋混凝土造,0700218,27.240000000000002,1,0,1,有,有,有,10000,367,,0.0,0,台北市都發局社會住宅包租代管第2期計畫,RPWNMLTLKIGGFEA58CC
士林區,建物,臺北市士林區通河街３２３巷７３號,0.0,住,,,1101217,土地0建物1車位0,地下層,5,公寓(5樓含以下無電梯),住家用,鋼筋混凝土造,0591210,27.63,1,1,1,有,無,有,6000,217,,0.0,0,台北市都發局社會住宅包租代管第3期計畫,RPSOMLTLKIGGFEA28CC
北投區,建物,臺北市北投區東華街一段４９２號９樓,0.0,住,,,1101203,土地0建物1車位1,九層,14,住宅大樓(11層含以上有電梯),住家用,鋼筋混凝土造,0950720,164.45,3,2,2,有,有,有,75000,456,坡道平面,43.69,0,,RPVOMLTLKIGGFEA58CC
文山區,建物,臺北市文山區木柵路二段７巷４號２樓,0.0,商,,,1101222,土地0建物1車位0,二層,3,公寓(5樓含以下無電梯),住家用,加強磚造,0571120,94.3,3,2,1,有,無,有,18000,191,,0.0,0,台北市都發局社會住宅包租代管第3期計畫,RPTNMLTLKIGGFAA87CC
文山區,建物,臺北市文山區木柵路一段８９巷１７號二樓,0.0,住,,,1101224,土地0建物1車位0,二層,4,公寓(5樓含以下無電梯),集合住宅,鋼筋混凝土造,0630710,110.22,3,2,3,有,無,有,25000,227,,0.0,0,國家住宅及都市更新中心 110 年社會住宅包租代管第 三 期計畫 水費電費瓦斯費由承租人負擔,RPRPMLTLKIGGFAA87CC
中正區,建物,臺北市中正區和平西路一段１１號八樓,0.0,商,,,1101203,土地0建物0車位0,八層,11,套房(1房1廳1衛),商業用,鋼筋混凝土造,,44.730000000000004,1,0,1,有,無,有,13400,300,,0.0,0,此為分租套房，第八層共分成20間，一間平均面積約為44.73平方公尺，垃圾收取費600元、水雜費200元，鍋爐費300元皆為承租人負擔。,RPWPMLTLKIGGFAA38CC
中正區,建物,臺北市中正區和平西路一段１１號七樓,0.0,商,,,1101201,土地0建物0車位0,七層,11,套房(1房1廳1衛),商業用,鋼筋混凝土造,,38.89,1,0,1,有,無,有,12900,332,,0.0,0,此為分租套房，第7層共分成23間，一間平均面積約為38.89平方公尺，垃圾收取費600元、水雜費200元、鍋爐費300元，皆為承租人負擔,RPXPMLTLKIGGFAA48CC
中正區,建物,臺北市中正區和平西路一段１１號七樓,0.0,商,,,1101201,土地0建物0車位0,七層,11,套房(1房1廳1衛),商業用,鋼筋混凝土造,,38.89,1,0,1,有,無,有,12900,332,,0.0,0,此為分租套房，第7層共分成23間，一間平均面積約為38.89平方公尺，垃圾收取費600元、水雜費200元、鍋爐費300元，皆為承租人負擔,RPOQMLTLKIGGFAA67CC
中山區,建物,臺北市中山區敬業三路１７１號１樓,0.0,住,,,1101202,土地0建物1車位1,一層,7,華廈(10層含以下有電梯),住家用,鋼筋混凝土造,0980910,139.51,2,2,2,有,有,有,93000,667,坡道平面,24.79,0,,RPRNMLTLKIGGFCA87CC
內湖區,建物,臺北市內湖區東湖路１１３巷５９號４樓,0.0,住,,,1101227,土地0建物1車位0,四層,5,公寓(5樓含以下無電梯),住家用,鋼筋混凝土造,0730413,115.14,3,2,2,有,無,有,22000,191,,0.0,0,租金含稅價,RPVNMLTLKIGGFCA28CC
中山區,建物,臺北市中山區龍江路４５巷３８號４樓,0.0,住,,,1101213,土地0建物1車位0,四層,4,公寓(5樓含以下無電梯),住家用,鋼筋混凝土造,0650505,105.32,3,2,1,有,無,有,22000,209,,0.0,0,台北市都發局社會住宅包租代管第3期計畫,RPOOMLTLKIGGFCA67CC
內湖區,建物,臺北市內湖區成功路三段１８７巷３５弄１９號四樓,0.0,住,,,1101221,土地0建物1車位0,四層,5,公寓(5樓含以下無電梯),住家用,鋼筋混凝土造,0690331,91.34,3,2,2,有,無,有,18000,197,,0.0,0,台北市都發局社會住宅包租代管第3期計畫,RPROMLTLKIGGFCA97CC
中山區,建物,臺北市中山區南京東路７號,0.0,商,,,1101208,土地0建物0車位0,八層,8,套房(1房1廳1衛),住商用,鋼筋混凝土造,0580616,24.78,1,1,1,有,無,有,16000,646,,0.0,0,此為分租套房，第8層共分成5間，一間平均面積約為24.78平方公尺。每月水雜費＄200，垃圾費＄600，承租人負擔,RPWOMLTLKIGGFCA48CC
中山區,建物,臺北市中山區新生北路二段４９號４樓,0.0,住,,,1101203,土地0建物1車位0,四層,19,住宅大樓(11層含以上有電梯),住家用,鋼骨鋼筋混凝土造,0980916,208.51,4,2,2,有,無,有,55000,264,,0.0,0,,RPXOMLTLKIGGFCA58CC
中山區,建物,臺北市中山區新生北路二段６２巷１６號１６樓之２,0.0,商,,,1101205,土地0建物1車位0,十六層,19,住宅大樓(11層含以上有電梯),住家用,鋼骨鋼筋混凝土造,1050322,77.96000000000001,2,1,2,有,有,有,52886,678,,0.0,0,,RPOPMLTLKIGGFCA77CC
內湖區,建物,臺北市內湖區瑞光路２５８巷５２號２樓,0.0,工,,,1101227,土地0建物1車位1,二層,7,辦公商業大樓,工業用,鋼筋混凝土造,0870812,306.6,2,1,0,有,有,有,72000,235,坡道平面,0.0,0,,RPQPMLTLKIGGFCA97CC
中山區,建物,臺北市中山區新生北路一段３１號,0.0,住,,,1101209,土地0建物0車位0,四層,4,套房(1房1廳1衛),,加強磚造,,34.99,1,0,1,有,無,有,12200,349,,0.0,0,此為分租套房，第4層共分成2間，一間平均面積約為34.99平方公尺。水雜費＄200，垃圾費＄600，由承租人負擔,RPXPMLTLKIGGFCA68CC
中山區,房地(土地+建物),臺北市中山區中山北路二段３３號１１樓,28.47,商,,,1101215,土地1建物1車位0,十一層,12,辦公商業大樓,住家用,鋼筋混凝土造,0740705,235.86999999999998,0,0,0,無,有,無,87000,369,,0.0,0,,RPOQMLTLKIGGFCA87CC
內湖區,建物,臺北市內湖區康樂街６１巷１２弄３號四樓,0.0,住,,,1101224,土地0建物1車位0,四層,5,公寓(5樓含以下無電梯),住家用,鋼筋混凝土造,0741230,87.64,3,2,1,有,無,有,23000,262,,0.0,0,國家住宅及都市更新中心 110 年社會住宅包租代管第 三 期計畫 水費電費瓦斯費網路費第四台由承租人負擔,RPVRMLTLKIGGFCA68CC
中山區,建物,臺北市中山區民權東路二段９２巷１弄２４號,0.0,住,,,1101204,土地0建物0車位0,一層,6,套房(1房1廳1衛),住商用,鋼筋混凝土造,0711130,30.22,1,0,1,有,無,有,13800,457,,0.0,0,此為分租套房，第一層共分成6間，一間平均面積約為30.22平方公尺，垃圾收取費600元、水雜費200元，皆為承租人負擔。,RPPSMLTLKIGGFCA18CC
中山區,建物,臺北市中山區南京東路二段５０號十二樓,0.0,商,,,1101216,土地0建物1車位0,十二層,12,辦公商業大樓,住家用,鋼筋混凝土造,0770607,124.86999999999999,3,0,0,有,有,無,60000,480,,0.0,0,租金未稅。,RPTSMLTLKIGGFCA58CC
信義區,建物,臺北市信義區忠孝東路５段４１２號９樓,0.0,商,,,1101210,土地0建物1車位0,九層,18,住宅大樓(11層含以上有電梯),見使用執照,鋼筋混凝土造,0860121,164.48,2,1,2,有,有,有,73956,450,,0.0,0,,RPROMLTLKIGGFDA08CC
松山區,建物,臺北市松山區南京東路５段３４３號３樓之２,0.0,商,,,1101130,土地0建物1車位0,三層,11,辦公商業大樓,見使用執照,鋼筋混凝土造,0910612,170.17000000000002,0,0,0,無,有,無,66668,392,,0.0,0,租金支付以一周為一期,RPOPMLTLKIGGFDA87CC
南港區,建物,臺北市南港區忠孝東路六段４８１號二樓,0.0,工,,,1101203,土地0建物0車位0,二層,4,公寓(5樓含以下無電梯),工業用,鋼筋混凝土造,0670120,13.22,1,0,0,有,無,有,5200,393,,0.0,0,此為雅房，一間面積約為13.22平方公尺，垃圾收取費600元、水雜費200元，皆為承租人負擔。,RPPPMLTLKIGGFDA97CC
信義區,房地(土地+建物),臺北市信義區吳興街６００巷９８弄１之１號六樓,23.68,住,,,1101225,土地1建物1車位0,六層,6,華廈(10層含以下有電梯),住家用,鋼筋混凝土造,0850606,79.86,2,1,1,有,無,有,20000,250,,0.0,0,,RPTNMLKMKIGGFDA37CC
松山區,建物,臺北市松山區光復南路４５巷１６號２樓,0.0,住,,,1101213,土地0建物1車位0,二層,6,華廈(10層含以下有電梯),住家用,鋼筋混凝土造,0760425,150.84,4,2,1,有,無,有,50000,331,,0.0,0,,RPWNMLKMKIGGFDA67CC
松山區,建物,臺北市松山區敦化北路１９９巷８之３號,0.0,住,,,1101220,土地0建物1車位0,一層,12,華廈(10層含以下有電梯),住家用,鋼筋混凝土造,0830716,188.43,2,2,2,有,無,有,81000,430,,0.0,0,,RPXNMLKMKIGGFDA77CC
信義區,建物,臺北市信義區忠孝東路五段１０１號１１樓,0.0,住,,,1101220,土地0建物1車位0,十一層,13,住宅大樓(11層含以上有電梯),多戶住宅,鋼筋混凝土造,1030829,100.94,1,2,2,有,無,有,95000,941,,0.0,0,,RPOOMLKMKIGGFDA96CC
信義區,建物,臺北市信義區松山路１１９巷１弄１９號４樓,0.0,商,,,1101228,土地0建物1車位0,四層,5,公寓(5樓含以下無電梯),住家用,鋼筋混凝土造,0731127,106.59,3,2,2,有,無,有,29000,272,,0.0,0,,RPPOMLKMKIGGFDA07CC
信義區,建物,臺北市信義區忠孝東路五段４６９號四樓之１,0.0,商,,,1101222,土地0建物1車位0,四層,21,住宅大樓(11層含以上有電梯),集合住宅,鋼骨造,1100119,64.97,2,1,1,有,有,有,43000,662,,0.0,0,租金含管理費。租賃範圍不含車位，已扣除車位面積。,RPSOMLKMKIGGFDA37CC
南港區,房地(土地+建物)+車位,臺北市南港區經貿二路２３５巷３７號２０F,103.77,住,,,1100929,土地1建物1車位4,二十層,21,住宅大樓(11層含以上有電梯),住家用,鋼骨鋼筋混凝土造,1031204,627.89,4,2,5,有,有,無,290000,462,坡道平面,110.28,0,,RPTOMLKMKIGGFDA47CC
松山區,建物,臺北市松山區南京東路五段３２８號六樓之２,0.0,商,,,1101205,土地0建物1車位0,六層,10,華廈(10層含以下有電梯),住家用,鋼骨鋼筋混凝土造,0930907,61.43,1,1,1,有,有,有,23000,374,,0.0,0,國家住宅及都市更新中心108年社會住宅包租代管第二期計畫,RPVOMLKMKIGGFDA67CC
松山區,建物,臺北市松山區復興北路１７９號１２樓之５,0.0,商,,,1101117,土地0建物1車位0,十二層,12,住宅大樓(11層含以上有電梯),住家用,鋼筋混凝土造,,47.82,1,1,1,有,有,無,24000,502,,0.0,0,,RPRPMLKMKIGGFDA37CC
南港區,建物,臺北市南港區興南街６４巷２號５樓,0.0,住,,,1101228,土地0建物1車位0,五層,5,公寓(5樓含以下無電梯),住家用,鋼筋混凝土造,0900803,49.489999999999995,1,0,1,有,無,有,14000,283,,0.0,0,國家住宅及都市更新中心110年社會住宅包租代管第三期計畫,RPWPMLKMKIGGFDA87CC
松山區,建物,臺北市松山區延吉街２８號３樓,0.0,住,,,1101229,土地0建物1車位0,三層,4,公寓(5樓含以下無電梯),住家用,鋼筋混凝土造,,144.91,4,2,2,有,無,有,41000,283,,0.0,0,,RPOQMLKMKIGGFDA17CC
松山區,建物,臺北市松山區南京東路４段２３號１２樓之５,0.0,商,,,1101227,土地0建物1車位0,十二層,15,住宅大樓(11層含以上有電梯),住家用,鋼筋混凝土造,0971205,55.85,1,1,1,有,有,有,30000,537,,0.0,0,,RPSQMLKMKIGGFDA57CC
中山區,建物,臺北市中山區新生北路二段１３７巷８號２樓,0.0,住,,,1101220,土地0建物1車位0,二層,7,華廈(10層含以下有電梯),住家用,鋼筋混凝土造,0950102,61.709999999999994,0,0,0,無,有,有,25000,405,,0.0,0,,RPQOMLKMKIGGFCA07CC
中山區,建物,臺北市中山區農安街２７號二樓,0.0,商,,,1101228,土地0建物1車位0,二層,8,華廈(10層含以下有電梯),住家用,鋼筋混凝土造,0660514,160.86,3,2,1,有,有,有,24000,149,,0.0,0,國家住宅及都市更新中心110年社會住宅包租代管第三期計畫,RPUOMLKMKIGGFCA47CC
內湖區,建物,臺北市內湖區行善路２９７號十一樓,0.0,住,,,1101223,土地0建物1車位1,十一層,14,住宅大樓(11層含以上有電梯),住家用,鋼筋混凝土造,1070711,166.05,3,1,2,有,有,有,55000,331,坡道平面,42.04,0,租金含管理費。,RPVOMLKMKIGGFCA57CC
中山區,建物,臺北市中山區松江路９３巷３號６樓之１,0.0,住,,,1101206,土地0建物1車位0,六層,6,華廈(10層含以下有電梯),住家用,鋼筋混凝土造,0860417,194.72,3,2,2,有,有,有,82500,424,,0.0,0,,RPWOMLKMKIGGFCA67CC
中山區,建物,臺北市中山區龍江路３９５號三樓,0.0,住,,,1101227,土地0建物1車位0,三層,5,公寓(5樓含以下無電梯),住家用,鋼筋混凝土造,0731214,118.02000000000001,4,1,2,有,無,有,23000,195,,0.0,0,國家住宅及都市更新中心110年社會住宅包租代管第三期計畫,RPXOMLKMKIGGFCA77CC
內湖區,建物,臺北市內湖區康寧路一段２１４巷２０號五樓,0.0,其他,,,1101223,土地0建物1車位0,五層,5,公寓(5樓含以下無電梯),住家用,鋼筋混凝土造,0691220,94.44,4,2,2,有,無,有,22000,233,,0.0,0,,RPOPMLKMKIGGFCA96CC
內湖區,車位,臺北市內湖區文湖街２１巷６８弄１３號等,0.0,住,,,1101207,土地0建物0車位1,,,其他,,,,57.89,0,0,0,有,有,無,3000,,升降平面,0.0,3000,,RPVPMLKMKIGGFCA67CC
內湖區,建物,臺北市內湖區瑞光路２２３號３樓,0.0,住,,,1101220,土地0建物1車位0,三層,8,華廈(10層含以下有電梯),住家用,鋼筋混凝土造,0831108,153.92,3,2,2,有,有,無,35000,227,,0.0,0,,RPXPMLKMKIGGFCA87CC
中山區,建物,臺北市中山區新生北路二段６６號６樓之１９,0.0,商,,,1101224,土地0建物1車位0,十二層,12,住宅大樓(11層含以上有電梯),商業用,鋼筋混凝土造,0690721,24.599999999999998,1,1,1,有,有,有,13000,528,,0.0,0,含管理費,RPVQMLKMKIGGFCA77CC
中山區,建物,臺北市中山區中山北路１段１０５巷１２號４樓之１,0.0,商,,,1101220,土地0建物1車位0,四層,10,華廈(10層含以下有電梯),一般事務所,鋼筋混凝土造,1060110,115.58000000000001,2,2,2,有,有,有,74800,647,,0.0,0,,RPWQMLKMKIGGFCA87CC
中山區,房地(土地+建物),臺北市中山區明水路６３６號九樓,11.4,商,,,1101230,土地1建物1車位0,九層,9,華廈(10層含以下有電梯),商業用,鋼筋混凝土造,0960503,47.85,1,1,1,有,無,有,27500,575,,0.0,0,,RPXQMLKMKIGGFCA97CC
中山區,建物,臺北市中山區農安街８號６樓之８,0.0,商,,,1101213,土地0建物1車位0,六層,14,住宅大樓(11層含以上有電梯),商業用,鋼筋混凝土造,0980622,43.769999999999996,2,1,1,有,有,有,50000,1142,,0.0,0,,RPORMLKMKIGGFCA17CC
