汐止區,建物,新北市汐止區祥雲街２１號３樓,0.0,,鄉村區,乙種建築用地,1110324,土地0建物1車位0,三層,4,公寓(5樓含以下無電梯),住家用,鋼筋混凝土造,0700506,70.82,2,1,1,有,無,有,12000,169,,0.0,0,此為新北市社會住宅包租代管計劃之物件，評定市價租金為17300，因新北市計劃租金上限為35000，選擇代租方案須打九折且簽約租金無條件捨去至百分位，房東願以較低的金額出租，故實際租賃契約金額為12000。,RPSPMLSLLHHGFDF78CC
汐止區,建物,新北市汐止區新臺五路一段１５９號１４樓-１０,0.0,商,,,1110325,土地0建物1車位0,十四層,14,辦公商業大樓,商業用,鋼筋混凝土造,0880706,48.01,0,0,0,無,有,有,17500,365,,0.0,0,,RPQOMLTLLHHGFDF58CC
汐止區,建物,新北市汐止區新興路１２１號八樓,0.0,住,,,1110317,土地0建物1車位1,八層,21,住宅大樓(11層含以上有電梯),集合住宅,鋼筋混凝土構造,1070213,170.97,3,2,2,有,有,有,36300,212,坡道平面,30.31,0,租金含管理費。,RPUOMLTLLHHGFDF98CC
汐止區,房地(土地+建物),新北市汐止區新臺五路一段７９號８樓之１２,20.46,工,,,1110303,土地3建物1車位0,八層,20,廠辦,工商用,鋼造,0830330,91.31,0,0,0,無,有,無,22000,241,,0.0,0,此為分租戶租金含管理費及公用水電,RPQPMLTLLHHGFDF68CC
汐止區,建物,新北市汐止區中興路３１號６樓之２,0.0,工,,,1110308,土地0建物1車位0,六層,8,廠辦,工業用,鋼筋混凝土造,0780606,433.65,0,1,1,有,有,無,65000,150,,0.0,0,租金內含租賃稅及健保補充保費，不含管理費，含社區提供的1個使用權車位。,RPTPMLTLLHHGFDF98CC
汐止區,建物,新北市汐止區水源路一段２７號１樓,0.0,住,,,1110220,土地0建物1車位0,一層,5,店面(店鋪),住家用,鋼筋混凝土造,0711221,95.68,0,0,0,無,無,無,27000,282,,0.0,0,,RPWPMLTLLHHGFDF66CC
汐止區,建物,新北市汐止區民族二街１３號二樓,0.0,住,,,1110306,土地0建物1車位0,二層,6,華廈(10層含以下有電梯),住家用,鋼筋混凝土造,1051219,103.78999999999999,2,1,1,有,無,有,16000,154,,0.0,0,,RPXPMLTLLHHGFDF76CC
新莊區,建物,新北市新莊區中原路８１號十二樓,0.0,住,,,1110313,土地0建物1車位0,十二層,14,住宅大樓(11層含以上有電梯),住家用,鋼筋混凝土造,0891108,131.5,4,2,2,有,有,有,35000,266,,0.0,0,租金含管理費。,RPRRMLTLLHHGFBF78CC
新莊區,建物,新北市新莊區福美街１２８巷４１號,0.0,住,,,1110317,土地0建物1車位1,一層,13,店面(店鋪),店舖,鋼筋混凝土造,1010926,151.67000000000002,0,1,1,有,有,無,45000,297,坡道平面,26.98,0,,RPXRMLTLLHHGFBF76CC
新莊區,房地(土地+建物),新北市新莊區雙鳳路７４號,38.54,住,,,1110317,土地1建物1車位0,一層,4,店面(店鋪),住家用,鋼筋混凝土造,0681226,99.23,1,1,1,有,無,無,37547,378,,0.0,0,,RPPTMLTLLHHGFBF78CC
五股區,建物,新北市五股區五福路１２２號二樓,0.0,住,,,1110216,土地0建物1車位0,二層,11,住宅大樓(11層含以上有電梯),住家用,鋼筋混凝土造,0850521,118.63,2,2,1,有,有,有,15000,126,,0.0,0,本案屬國家住宅及都市更新中心辦理社會住宅包租代管第3期計劃,RPVTMLTLLHHGFBF76CC
五股區,建物,新北市五股區成泰路一段３２巷５８號六樓,0.0,住,,,1110212,土地0建物1車位0,六層,11,住宅大樓(11層含以上有電梯),住家用,鋼筋混凝土造,0860306,103.34,3,2,2,有,有,有,17000,165,,0.0,0,本案屬國家住宅及都市更新中心辦理社會住宅包租代管第3期計劃,RPOUMLTLLHHGFBF78CC
新莊區,建物,新北市新莊區西盛街１５３巷１號十五樓,0.0,住,,,1110305,土地0建物1車位0,十五層,16,住宅大樓(11層含以上有電梯),住家用,鋼筋混凝土造,0810914,56.68000000000001,2,1,1,有,無,有,12600,222,,0.0,0,,RPQUMLTLLHHGFBF98CC
五股區,建物,新北市五股區成泰路一段３２巷３２號二樓,0.0,住,,,1110302,土地0建物1車位0,二層,10,華廈(10層含以下有電梯),住家用,鋼筋混凝土造,0860306,101.41,4,2,2,有,有,有,19000,187,,0.0,0,本案屬國家住宅及都市更新中心辦理社會住宅包租代管第3期計劃,RPTUMLTLLHHGFBF66CC
新莊區,建物,新北市新莊區幸福路９０號２樓,0.0,住,,,1110317,土地0建物1車位0,二層,5,公寓(5樓含以下無電梯),住家用,鋼筋混凝土造,0721210,91.8,3,2,1,有,無,有,24000,261,,0.0,0,此為新北市公會版社會住宅包租代管計畫之物件評定市價租金為26667，選擇代租方案須打九折實際租賃契約金額為24000，水電費由承租人負擔。,RPUUMLTLLHHGFBF76CC
新莊區,建物,新北市新莊區福壽街４３號３樓,0.0,住,,,1110316,土地0建物1車位0,見其他登記事項,4,公寓(5樓含以下無電梯),住家用,加強磚造,0660209,74.74,3,2,1,有,無,有,22000,294,,0.0,0,此為新北市公會版社會住宅包租代管計畫之物件評定市價租金為24445選擇代租方案須打九折實際租賃契約金額為22000，水電瓦斯費由承租人負擔。,RPOVMLTLLHHGFBF88CC
林口區,建物,新北市林口區新寮１之５９號７樓,0.0,商,,,1110316,土地0建物1車位0,七層,7,華廈(10層含以下有電梯),住家用,鋼筋混凝土造,0820809,126.88000000000001,4,2,2,有,無,有,22000,173,,0.0,0,此為新北市公會版社會住宅包租代管計畫之物件評定市價租金為24445選擇代租方案須打九折實際租賃契約金額為22000，水電瓦斯費由承租人負擔。,RPPVMLTLLHHGFBF98CC
五股區,建物,新北市五股區新城八路３６號十六樓,0.0,商,,,1110309,土地0建物1車位1,十六層,19,住宅大樓(11層含以上有電梯),集合住宅,鋼筋混凝土造,1060104,119.71000000000001,2,1,1,有,有,有,18000,173,坡道平面,33.06,3000,本案僅建物部份屬國家住宅及都市更新中心辦理社會住宅包租代管第2期計劃,RPVVMLTLLHHGFBF96CC
淡水區,房地(土地+建物)+車位,新北市淡水區淡金路二段１６３號２樓,19.46,住,,,1110326,土地1建物1車位1,二層,15,住宅大樓(11層含以上有電梯),住家用,鋼筋混凝土造,1010731,112.1,3,2,2,有,有,有,21000,187,坡道平面,31.45,0,租金含管理費,RPSNMLTLLHHGFEF78CC
淡水區,房地(土地+建物)+車位,新北市淡水區北新路１９２之１１號,32.33,住,,,1110316,土地1建物1車位1,一層,7,華廈(10層含以下有電梯),住家用,鋼筋混凝土造,0981008,90.01,2,2,2,有,有,有,19000,211,坡道平面,32.26,0,租金含管理費,RPUNMLTLLHHGFEF98CC
淡水區,房地(土地+建物)+車位,新北市淡水區新市三路二段２５７號１０樓,8.72,商,,,1110326,土地1建物1車位1,十層,29,住宅大樓(11層含以上有電梯),住家用,鋼筋混凝土造,1070525,129.15,2,1,1,有,有,有,16000,124,坡道平面,30.47,0,,RPPOMLTLLHHGFEF58CC
淡水區,房地(土地+建物),新北市淡水區八勢一街５３之３號３樓,19.97,住,,,1110325,土地1建物1車位0,三層,11,住宅大樓(11層含以上有電梯),住家用,鋼筋混凝土造,0930603,116.02000000000001,2,2,1,有,有,有,17718,153,,0.0,0,,RPUOMLTLLHHGFEF09CC
八里區,建物,新北市八里區中華路二段３７６號一樓,0.0,商,,,1110324,土地0建物1車位0,一層,15,店面(店鋪),商業用,鋼筋混凝土造,0841013,285.4,0,0,0,無,無,有,47787,167,,0.0,0,,RPPPMLTLLHHGFEF68CC
八里區,建物,新北市八里區義民街４７號１０樓,0.0,住,,,1110317,土地0建物1車位0,十層,12,住宅大樓(11層含以上有電梯),集合住宅,鋼筋混凝土造,1090818,82.49,2,1,1,有,有,有,17500,212,,0.0,0,此為新北市公會版社會住宅包租代管計畫之物件評定市價租金為19445元選擇代租方案須打九折實際租賃契約金額為17500元，水電瓦斯及每月管理費1900元由承租人負擔。,RPPQMLTLLHHGFEF78CC
淡水區,建物,新北市淡水區沙崙路一段１號八樓,0.0,住,,,1110320,土地0建物1車位1,八層,23,住宅大樓(11層含以上有電梯),住家用,鋼筋混凝土造,1080306,170.06,3,2,2,有,有,有,25000,147,坡道平面,26.13,0,租金含管理費。,RPVQMLTLLHHGFEF76CC
淡水區,房地(土地+建物)+車位,新北市淡水區沙崙路一段１２６巷６０號１１樓,18.17,住,,,1110327,土地1建物1車位1,十一層,14,住宅大樓(11層含以上有電梯),住家用,鋼筋混凝土造,1050816,112.07,2,2,1,有,有,有,20000,178,坡道平面,36.52,0,,RPPRMLTLLHHGFEF88CC
新店區,建物,新北市新店區自立街１３０巷２號四樓,0.0,住,,,1110314,土地0建物1車位0,四層,5,公寓(5樓含以下無電梯),住家用,鋼筋混凝土造,0720506,105.94,3,2,2,有,有,有,24000,227,,0.0,0,租金含管理費。,RPRNMLTLLHHGFCF48CC
新店區,建物,新北市新店區中興路一段２６６之１號十七樓之四,0.0,住,,,1110313,土地0建物1車位0,十七層,22,套房(1房1廳1衛),住家用,鋼筋混凝土造,0861029,40.16,1,0,1,有,有,有,15000,374,,0.0,0,,RPSNMLTLLHHGFCF58CC
新店區,建物,新北市新店區吉安街４７號二樓,0.0,住,,,1110305,土地0建物1車位0,二層,7,華廈(10層含以下有電梯),住家用,鋼筋混凝土造,0840415,96.81,3,2,2,有,無,有,25500,263,,0.0,0,,RPOOMLTLLHHGFCF28CC
新店區,建物,新北市新店區北宜路二段４２１巷２弄１１號六樓,0.0,住,,,1110323,土地0建物1車位0,六層,10,華廈(10層含以下有電梯),住家用,鋼筋混凝土造,1000524,69.41,2,1,1,有,有,有,17500,252,,0.0,0,租金含管理費。,RPQOMLTLLHHGFCF48CC
板橋區,建物,新北市板橋區中正路２５０巷１２４號,0.0,住,,,1110317,土地0建物1車位0,一層,5,店面(店鋪),商業用,鋼筋混凝土造,0690723,64.52,2,3,1,有,無,有,34134,529,,0.0,0,,RPRPMLTLLHHGFAF48CC
板橋區,建物,新北市板橋區南雅東路１之１號,0.0,住,,,1110320,土地0建物1車位0,見其他登記事項,15,店面(店鋪),店舖,鋼筋混凝土造,0960809,88.51,0,0,0,無,有,無,75000,847,,0.0,0,租金含管理費。,RPXPMLTLLHHGFAF09CC
板橋區,建物,新北市板橋區倉後街１之８號五樓,0.0,商,,,1110323,土地0建物1車位0,五層,10,套房(1房1廳1衛),住家用,鋼筋混凝土造,0720929,54.760000000000005,1,1,1,有,有,有,8000,146,,0.0,0,此為新北市社會住宅包租代管計畫之物件評定市價租金為8889元選擇代管方案須打9折實際租賃契約金額為8000元。水電費、瓦斯費以及每月管理費1010元皆由承租人負擔。,RPTQMLTLLHHGFAF78CC
土城區,房地(土地+建物),新北市土城區青雲路１６５號１樓+２樓,7.87,商,,,1110325,土地1建物2車位0,見其他登記事項,12,店面(店鋪),住家用,鋼筋混凝土造,0870626,206.03,0,0,0,無,有,無,80000,388,,0.0,0,,RPVQMLTLLHHGFAF98CC
板橋區,建物,新北市板橋區中山路一段１６０之８號十樓,6.67,其他,,,1110328,土地0建物1車位0,十層,13,住宅大樓(11層含以上有電梯),住家用,鋼筋混凝土造,0980427,43.72,0,0,0,無,有,有,26562,608,,0.0,0,,RPORMLTLLHHGFAF38CC
永和區,建物,新北市永和區永平路３０２巷３２弄８號二十樓,0.0,住,,,1110317,土地0建物1車位0,二十層,20,住宅大樓(11層含以上有電梯),集合住宅,鋼筋混凝土構造,1080522,83.93,2,2,1,有,有,有,28000,334,,0.0,0,租金含管理費。,RPWOMLTLLHHGFHF96CC
中和區,建物,新北市中和區中山路３段２號４樓,0.0,住,,,1110324,土地0建物1車位0,四層,4,公寓(5樓含以下無電梯),住家用,加強磚造,0820920,130.43,2,2,2,有,無,有,21000,161,,0.0,0,此為新北市社會住宅包租代管計劃之物件，評定市價租金為35000，因新北市計劃租金上限為35000，選擇代租方案須打九折且簽約租金無條件捨去至百分位，房東願以較低的金額出租，故實際租賃契約金額為21000。,RPXOMLTLLHHGFHF07CC
永和區,建物,新北市永和區永和路二段１７５號２樓,0.0,商,,,1110128,土地0建物1車位0,二層,4,公寓(5樓含以下無電梯),住家用,鋼筋混凝土造,0611128,258.14,0,0,0,無,無,無,113779,441,,0.0,0,,RPTPMLTLLHHGFHF76CC
中和區,建物,新北市中和區水源路８９號三樓,0.0,住,,,1110319,土地0建物1車位0,見其他登記事項,5,公寓(5樓含以下無電梯),住家用,鋼筋混凝土造,0680412,83.75,3,2,1,有,無,無,22000,263,,0.0,0,,RPUPMLTLLHHGFHF86CC
中和區,建物,新北市中和區大仁街１０巷８號四樓,0.0,住,,,1110320,土地0建物1車位0,四層,4,公寓(5樓含以下無電梯),住家用,加強磚造,0650111,80.44,2,2,2,有,無,有,17000,211,,0.0,0,,RPQQMLTLLHHGFHF56CC
中和區,建物,新北市中和區圓通路３６７巷３３弄６之３號５樓,0.0,其他,,,1110321,土地0建物1車位1,五層,6,華廈(10層含以下有電梯),住家用,鋼筋混凝土造,0860630,182.03,3,1,2,有,無,有,30000,165,坡道平面,0.0,0,,RPXQMLTLLHHGFHF27CC
三峽區,建物,新北市三峽區大學路３９之３號六樓,0.0,住,,,1110318,土地0建物1車位0,六層,13,住宅大樓(11層含以上有電梯),住家用,鋼筋混凝土造,0941017,71.78,2,2,1,有,有,有,16000,223,,0.0,0,租金含管理費。租賃範圍不含車位，已扣除車位面積。,RPPNMLTLLHHGFIF88CC
三峽區,建物,新北市三峽區中正路一段１７４巷４弄３４號,0.0,其他,,,1110315,土地0建物1車位0,一層,6,店面(店鋪),商業用,鋼筋混凝土造,0820626,83.69,2,1,1,有,有,有,18000,215,,0.0,0,,RPRNMLTLLHHGFIF09CC
樹林區,建物,新北市樹林區龍興街３１巷１７號四樓,0.0,住,,,1110305,土地0建物1車位0,四層,4,公寓(5樓含以下無電梯),住家用,鋼筋混凝土造,0640124,90.0,2,2,1,有,無,有,10000,111,,0.0,0,,RPSNMLTLLHHGFIF56CC
鶯歌區,房地(土地+建物)+車位,新北市鶯歌區尖山路２１７-１號三樓,43.35,住,,,1110301,土地1建物1車位1,三層,13,住宅大樓(11層含以上有電梯),集合住宅,鋼筋混凝土造,1081007,219.0,3,2,3,有,有,有,29000,132,坡道平面,36.37,0,含管理費,RPTNMLTLLHHGFIF66CC
樹林區,建物,新北市樹林區大雅路３７５號二樓,0.0,住,,,1110315,土地0建物1車位1,二層,15,住宅大樓(11層含以上有電梯),住家用,鋼筋混凝土造,0960629,118.87,3,2,2,有,有,有,28000,236,坡道機械,16.02,0,,RPUNMLTLLHHGFIF76CC
樹林區,建物,新北市樹林區太平路１５０巷４８號三樓,0.0,住,,,1110313,土地0建物1車位0,三層,8,華廈(10層含以下有電梯),住家用,鋼筋混凝土造,0890519,118.80000000000001,3,2,2,有,有,有,22000,185,,0.0,0,,RPVNMLTLLHHGFIF86CC
三峽區,建物,新北市三峽區愛國路１６８號１０樓之９,0.0,商,,,1110327,土地0建物1車位0,十層,14,住宅大樓(11層含以上有電梯),集合住宅,鋼筋混凝土造,1100719,92.04,3,1,2,有,有,有,18000,196,,0.0,0,此為新北市社會住宅包租代管計劃之物件，評定市價租金為20400，因新北市計劃租金上限為35000，選擇代租方案須打九折且簽約租金無條件捨去至百分位，房東願以較低的金額出租，故實際租賃契約金額為18000。,RPOOMLTLLHHGFIF88CC
樹林區,建物,新北市樹林區保安街二段１６７巷１８號,0.0,其他,,,1110315,土地0建物1車位0,一層,3,公寓(5樓含以下無電梯),住家用,鋼筋混凝土造,0660212,75.7,0,2,1,有,無,有,25000,330,,0.0,0,房屋用途做辦公室使用。,RPWOMLTLLHHGFIF07CC
鶯歌區,建物,新北市鶯歌區國中街１２１之３號６樓,0.0,住,,,1110328,土地0建物1車位0,六層,11,住宅大樓(11層含以上有電梯),集合住宅,鋼筋混凝土造,1061212,129.66,2,1,1,有,有,有,17300,133,,0.0,0,此為新北市社會住宅包租代管計劃之物件，評定市價租金為21000，因新北市計劃租金上限為35000，選擇代租方案須打九折且簽約租金無條件捨去至百分位，房東願以較低的金額出租，故實際租賃契約金額為17300。管理費另收2149元汽車車位1個，租賃期間無償使用,RPOPMLTLLHHGFIF98CC
樹林區,建物,新北市樹林區柑園街二段１４３號,0.0,,一般農業區,甲種建築用地,1110319,土地0建物1車位0,一層,7,華廈(10層含以下有電梯),住家用,鋼筋混凝土造,0971218,189.55,4,2,2,有,有,有,28000,148,,0.0,0,租金含管理費。,RPPPMLTLLHHGFIF09CC
三峽區,建物,新北市三峽區大學路８５號四樓之十七,0.0,住,,,1110320,土地0建物1車位0,四層,15,套房(1房1廳1衛),集合住宅,鋼筋混凝土造,1010608,36.370000000000005,1,0,1,有,有,有,11000,302,,0.0,0,租金含管理費。,RPQPMLTLLHHGFIF56CC
鶯歌區,建物,新北市鶯歌區龍三路５７號六樓,0.0,住,,,1110320,土地0建物1車位1,六層,11,住宅大樓(11層含以上有電梯),集合住宅,鋼筋混凝土造,1081014,147.76,3,2,2,有,有,有,28315,192,坡道平面,28.09,0,租金含管理費。,RPUPMLTLLHHGFIF96CC
三重區,建物,新北市三重區新興路１０號十三樓,0.0,住,,,1110312,土地0建物1車位1,十三層,15,住宅大樓(11層含以上有電梯),集合住宅,鋼筋混凝土造,1100503,130.94,2,2,1,有,有,有,31000,237,坡道平面,36.63,0,租金含管理費。,RPOPMLTLLHHGFGF78CC
蘆洲區,建物,新北市蘆洲區民族路４６６巷６號二樓,0.0,住,,,1110309,土地0建物1車位1,二層,7,華廈(10層含以下有電梯),住家用,鋼筋混凝土造,0860910,145.87,4,2,2,有,有,有,23000,151,其他,13.22,3000,本案僅建物部份屬國家住宅及都市更新中心辦理社會住宅包租代管第3期計劃,RPQPMLTLLHHGFGF98CC
三重區,建物,新北市三重區重新路五段６０９巷１６號６樓之１,0.0,工,,,1110307,土地0建物1車位1,六層,10,廠辦,工商用,鋼筋混凝土造,0810521,169.33,1,1,0,有,無,有,43500,257,坡道平面,0.0,0,,RPVPMLTLLHHGFGF86CC
三重區,建物,新北市三重區正義北路３３巷４號,0.0,住,,,1110301,土地0建物1車位0,二層,4,公寓(5樓含以下無電梯),住家用,加強磚造,0620209,79.0,2,2,1,有,無,有,21000,266,,0.0,0,,RPQPMLKMLHHGFGF18CC
三重區,建物,新北市三重區重新路一段１４２號十九樓,0.0,其他,,,1110324,土地0建物1車位0,十九層,27,住宅大樓(11層含以上有電梯),住家用,鋼骨鋼筋混凝土造,1011220,98.31,2,1,1,有,有,有,36000,366,,0.0,0,水電費 、瓦斯費依帳單及每月管理費2974元皆由承租人負擔。,RPUPMLKMLHHGFGF58CC
三重區,建物,新北市三重區集美街２４７巷３１弄８號五樓,0.0,住,,,1110310,土地0建物1車位0,五層,6,華廈(10層含以下有電梯),住家用,鋼筋混凝土造,0880309,75.56,2,1,1,有,無,有,20000,265,,0.0,0,,RPOQMLKMLHHGFGF08CC
三重區,建物,新北市三重區集智街１０號４樓,0.0,住,,,1110319,土地0建物1車位1,四層,11,住宅大樓(11層含以上有電梯),住家用,鋼筋混凝土造,1040114,222.31,3,2,2,有,無,有,55000,247,坡道平面,34.74,0,,RPPQMLKMLHHGFGF18CC
三重區,建物,新北市三重區信義西街４９號１樓,0.0,其他,,,1101202,土地0建物1車位0,一層,4,店面(店鋪),商業用,加強磚造,0601212,62.0,0,0,0,無,無,有,40000,645,,0.0,0,雙方合意此租賃合約自民國112年12月2日起，租金金額調升為四萬三千元整。,RPSQMLKMLHHGFGF48CC
三重區,房地(土地+建物),新北市三重區自強路一段１９０號１樓,17.26,住,,,1110325,土地1建物1車位0,一層,4,公寓(5樓含以下無電梯),商業用,鋼筋混凝土造,0661110,55.28,0,0,1,有,無,無,62578,1132,,0.0,0,,RPVQMLKMLHHGFGF78CC
蘆洲區,建物,新北市蘆洲區九芎街１６７巷５２號六樓,0.0,住,,,1110316,土地0建物1車位0,六層,7,華廈(10層含以下有電梯),住家用,鋼筋混凝土造,0890703,90.75999999999999,3,1,2,有,有,有,18500,204,,0.0,0,,RPWQMLKMLHHGFGF88CC
三重區,建物,新北市三重區力行路一段１７８巷３號二樓,0.0,住,,,1110312,土地0建物1車位0,二層,5,公寓(5樓含以下無電梯),住家用,鋼筋混凝土造,0720129,85.71,3,1,1,有,無,有,19000,222,,0.0,0,,RPPRMLKMLHHGFGF28CC
鶯歌區,建物,新北市鶯歌區西湖街２之８號二樓,0.0,住,,,1110325,土地0建物1車位0,二層,12,住宅大樓(11層含以上有電梯),住家用,鋼筋混凝土造,0841027,113.39,3,2,2,有,有,有,18500,163,,0.0,0,此為新北市社會住宅包租代管計畫之物件評定市價租金為20556元選擇代管方案須打9折實際租賃契約金額為18500元；水電瓦斯費皆由承租人負擔。,RPTNMLKMLHHGFIF48CC
永和區,建物,新北市永和區永貞路６６號,0.0,其他,,,1110322,土地0建物1車位0,一層,4,店面(店鋪),商業用,鋼筋混凝土造,0660922,46.02,0,1,1,有,無,無,28000,608,,0.0,0,租賃期間含免租金裝潢期。租金調漲：112年4月1日起租金調整為30000元/月。,RPVOMLKMLHHGFHF68CC
中和區,建物,新北市中和區南山路２３６巷３４之５號四樓,0.0,住,,,1110325,土地0建物1車位0,四層,5,公寓(5樓含以下無電梯),住家用,鋼筋混凝土造,0721012,78.11,3,2,1,有,無,有,20000,256,,0.0,0,此為新北市社會住宅包租代管計畫之物件，評定市價租金22223元，選擇代租方案須打九折，實際租賃契約金額為20000元；水電瓦斯費由承租人負擔。,RPWOMLKMLHHGFHF78CC
中和區,房地(土地+建物),新北市中和區中正路２７６號５樓,0.0,住,,,1110318,土地0建物1車位0,五層,12,住宅大樓(11層含以上有電梯),住家用,鋼筋混凝土造,0830203,126.69,3,2,2,有,有,有,25000,197,,0.0,0,,RPPPMLKMLHHGFHF18CC
永和區,建物,新北市永和區永利路３０號三樓,0.0,住,,,1110307,土地0建物1車位0,三層,7,華廈(10層含以下有電梯),住家用,鋼筋混凝土造,0820520,147.5,3,2,2,有,無,有,20000,136,,0.0,0,,RPSPMLKMLHHGFHF48CC
中和區,房地(土地+建物),新北市中和區連城路９９巷７號４樓之３,11.66,住,,,1110330,土地1建物1車位0,四層,18,住宅大樓(11層含以上有電梯),住家用,鋼筋混凝土造,0880114,90.7,3,2,2,有,無,有,21000,232,,0.0,0,社宅3期,RPUPMLKMLHHGFHF68CC
中和區,建物,新北市中和區建八路１２８號,0.0,工,,,1110318,土地0建物0車位1,見其他登記事項,4,店面(店鋪),辦公室、室內停車位、單身宿舍、廠房、地下防空避難室。,鋼筋混凝土造,0780607,243.94,0,3,1,有,無,無,75000,307,一樓平面,15.0,0,部分承租。門牌整編，依現場門牌申報。,RPSQMLKMLHHGFHF58CC
中和區,房地(土地+建物)+車位,新北市中和區中原三街９號九樓,26.3,住,,,1110312,土地1建物1車位1,九層,23,住宅大樓(11層含以上有電梯),集合住宅,鋼筋混凝土構造,1091202,157.06,3,1,2,有,有,無,38000,242,坡道平面,31.63,0,,RPSRMLKMLHHGFHF68CC
永和區,房地(土地+建物),新北市永和區博愛街４５巷３號,27.4,住,,,1110324,土地2建物1車位0,一層,5,公寓(5樓含以下無電梯),住家用,鋼筋混凝土造,0671003,81.64,2,2,1,有,無,有,25000,306,,0.0,0,,RPTRMLKMLHHGFHF78CC
板橋區,建物,新北市板橋區長江路二段２號二十樓之５,0.0,住,,,1110320,土地0建物1車位0,二十層,26,套房(1房1廳1衛),住家用,鋼筋混凝土造,0850120,40.7,0,0,0,無,有,有,14000,344,,0.0,0,,RPROMLKMLHHGFAF57CC
板橋區,房地(土地+建物),新北市板橋區中山路二段３６７之１號９樓,0.0,商,,,1110311,土地0建物1車位0,九層,12,住宅大樓(11層含以上有電梯),住家用,鋼筋混凝土造,0860205,30.11,1,0,1,有,有,有,12500,415,,0.0,0,,RPOPMLKMLHHGFAF37CC
土城區,房地(土地+建物),新北市土城區金安街５３號８樓之１,0.0,住,,,1110312,土地0建物1車位0,八層,13,住宅大樓(11層含以上有電梯),住家用,鋼筋混凝土造,0830201,30.08,1,1,1,有,無,有,9000,299,,0.0,0,,RPTPMLKMLHHGFAF87CC
板橋區,建物,新北市板橋區民生路三段６８號十樓,0.0,住,,,1110318,土地0建物1車位0,十層,31,住宅大樓(11層含以上有電梯),住家用,鋼骨鋼筋混凝土造,0891009,86.46,2,2,1,有,有,有,27000,312,,0.0,0,租金含管理費。,RPQQMLKMLHHGFAF67CC
土城區,建物,新北市土城區中央路三段２８１巷１１弄１０號十二樓,0.0,住,,,1110310,土地0建物1車位0,十二層,12,住宅大樓(11層含以上有電梯),住家用,鋼筋混凝土造,0860813,122.88,3,2,2,有,有,有,12000,98,,0.0,0,,RPSQMLKMLHHGFAF87CC
新店區,房地(土地+建物),新北市新店區中正路１０２巷８弄１號４樓,48.64,住,,,1110324,土地1建物1車位0,四層,4,公寓(5樓含以下無電梯),住家用,鋼筋混凝土造,0620619,123.34,3,2,2,有,無,有,25000,203,,0.0,0,,RPPPMLKMLHHGFCF67CC
新店區,房地(土地+建物),新北市新店區碧安街４號３樓,52.98,住,,,1110329,土地1建物1車位0,三層,4,公寓(5樓含以下無電梯),住家用,鋼筋混凝土造,0680720,87.86,3,1,1,有,無,有,21400,244,,0.0,0,,RPQPMLKMLHHGFCF77CC
淡水區,建物,新北市淡水區新興街３６號七樓,0.0,住,,,1110325,土地0建物0車位0,七層,16,套房(1房1廳1衛),住家用,鋼筋混凝土造,0811221,29.82,1,0,1,有,有,有,6000,201,,0.0,0,此為分租套房，第7層共分為5間，一間平均面積約為29.82平方公尺；水電瓦斯費由承租人負擔。,RPPNMLKMLHHGFEF67CC
淡水區,建物,新北市淡水區新民街１２０巷３９號八樓,0.0,住,,,1110328,土地0建物1車位0,八層,16,套房(1房1廳1衛),住家用,鋼筋混凝土造,0810508,44.38,1,0,1,有,有,有,7000,158,,0.0,0,此為新北市社會住宅包租代管計畫之物件，評定市價租金為7778，選擇代租方案須打九折，實際租賃契約金額為7000；水電費及管理費1032元由承租人負擔。,RPSNMLKMLHHGFEF97CC
淡水區,建物,新北市淡水區中正東路二段１１９號三樓,0.0,住,,,1110322,土地0建物1車位0,三層,21,住宅大樓(11層含以上有電梯),住家用,鋼筋混凝土造,0900302,120.89000000000001,3,2,2,有,有,有,23000,190,,0.0,0,租金含管理費。,RPVNMLKMLHHGFEF28CC
