淡水區,房地(土地+建物),新北市淡水區新春街９１巷１７號六樓,8.47,住,,,1110408,土地1建物1車位0,六層,18,住宅大樓(11層含以上有電梯),住家用,鋼筋混凝土造,0860514,48.879999999999995,1,0,1,有,有,有,10000,205,,0.0,0,含管理費,RPVOMLTKMHHGFEF56CC
淡水區,房地(土地+建物)+車位,新北市淡水區濱海路二段２０２巷２８號七樓,18.46,其他,,,1110413,土地1建物1車位1,七層,14,住宅大樓(11層含以上有電梯),住家用,鋼筋混凝土造,1060817,98.07,2,2,1,有,無,有,23000,235,坡道平面,33.07,0,含管理費,RPXOMLTKMHHGFEF76CC
淡水區,建物,新北市淡水區淡金路５５號九樓,0.0,住,,,1110413,土地0建物1車位0,九層,12,住宅大樓(11層含以上有電梯),住家用,鋼筋混凝土造,0850605,100.36,2,1,1,有,有,有,15000,149,,0.0,0,此為新北市社會住宅包租代管計畫之物件，評定市價租金為16667元，選擇代租方案須打九折，實際租賃契約金額為15000元。水電費由承租人負擔。,RPQPMLTKMHHGFEF78CC
淡水區,建物,新北市淡水區濱海路二段２１６號八樓,0.0,住,,,1110414,土地0建物1車位0,八層,14,住宅大樓(11層含以上有電梯),住家用,鋼筋混凝土造,1060216,81.22,2,1,1,有,有,有,18500,228,,0.0,0,此為新北市社會住宅包租代管計畫之物件，評定市價租金為20556元，選擇代租方案須打九折，實際租賃契約金額為18500元。水電費、瓦斯費由承租人負擔。,RPSPMLTKMHHGFEF98CC
八里區,建物,新北市八里區龍米路一段４５２號二十樓,0.0,住,,,1110330,土地0建物1車位0,二十層,29,住宅大樓(11層含以上有電梯),住家用,鋼骨混凝土造,0850923,171.45999999999998,4,2,2,有,有,有,31000,181,,0.0,0,,RPOQMLTKMHHGFEF68CC
三峽區,建物,新北市三峽區中山路３０１號１０樓,0.0,住,,,1110415,土地0建物1車位0,十層,15,套房(1房1廳1衛),住家用,鋼筋混凝土造,0950123,44.120000000000005,1,0,1,有,有,有,10000,227,,0.0,0,此為新北市社會住宅包租代管計劃之物件，評定市價租金為12900，因新北市計劃租金上限為35000，選擇代租方案須打九折且簽約租金無條件捨去至百分位，房東願以較低的金額出租，故實際租賃契約金額為10000。,RPSNMLTKMHHGFIF56CC
樹林區,建物,新北市樹林區鎮前街３２７之２號５樓,0.0,住,,,1110418,土地0建物1車位0,五層,5,公寓(5樓含以下無電梯),住家用,鋼筋混凝土造,0690610,91.92,3,1,2,有,無,有,17000,185,,0.0,0,此為新北市社會住宅包租代管計劃之物件，評定市價租金為18900，因新北市計劃租金上限為35000，選擇代租方案須打九折且簽約租金無條件捨去至百分位，實際租賃契約金額17000。,RPWNMLTKMHHGFIF96CC
鶯歌區,房地(土地+建物),新北市鶯歌區鶯歌路１５８號,28.95,住,,,1110406,土地1建物1車位0,一層,8,店面(店鋪),店鋪,鋼筋混凝土造,1100914,176.0,0,0,1,有,無,無,43500,247,,0.0,0,管委會目前尚未成立,RPSOMLTKMHHGFIF66CC
樹林區,建物,新北市樹林區保安街二段３０１號五樓,0.0,住,,,1110401,土地0建物1車位0,五層,12,住宅大樓(11層含以上有電梯),住家用,鋼筋混凝土造,0830108,135.09,4,1,2,有,有,有,19000,141,,0.0,0,此物件加入新北市社會住宅包租代管計畫，評定市價租金為21112元，代租代管方案打九折為19000元，以19000元為簽訂租賃契約租金。,RPTOMLTKMHHGFIF76CC
鶯歌區,建物,新北市鶯歌區文化路１３６巷１之１號１樓,0.0,住,,,1110405,土地0建物1車位0,一層,4,店面(店鋪),住家用,鋼筋混凝土造,0750508,106.0,1,1,2,有,無,有,18000,170,,0.0,0,,RPXOMLTKMHHGFIF17CC
三峽區,建物,新北市三峽區和平街３６巷７弄５號五樓,0.0,住,,,1110415,土地0建物1車位0,五層,9,華廈(10層含以下有電梯),集合住宅,鋼筋混凝土造,0990126,145.9,3,2,2,有,有,有,21000,144,,0.0,0,,RPVPMLTKMHHGFIF07CC
汐止區,房地(土地+建物),新北市汐止區大同路三段６１５號３１樓之３,7.55,住,,,1110327,土地1建物1車位0,三十一層,32,住宅大樓(11層含以上有電梯),住家用,鋼筋混凝土造,0880203,78.57,2,1,1,有,有,有,15000,191,,0.0,0,含管理費,RPPNMLTKMHHGFDF38CC
汐止區,車位,新北市汐止區大同路三段６１５號地下一樓等公共設施,12.64,住,,,1110401,土地0建物0車位1,,,其他,,,,42.69,0,0,0,有,有,無,3000,,坡道平面,42.69,3000,含管理費每個450元,RPQNMLTKMHHGFDF48CC
汐止區,車位,新北市汐止區大同路三段６１５號地下１樓等公共設施,8.6,住,,,1110401,土地0建物0車位1,,,其他,,,,42.69,0,0,0,有,有,無,3000,,坡道平面,42.69,3000,含管理費每個450元,RPRNMLTKMHHGFDF58CC
汐止區,車位,新北市汐止區大同路三段６０９號地下１樓等公共設施,5.54,住,,,1110401,土地0建物0車位1,,,其他,,,,69.34,0,0,0,有,有,無,3000,,坡道平面,69.34,3000,含管理費每個450元,RPSNMLTKMHHGFDF68CC
汐止區,建物,新北市汐止區樟樹二路４６６號二樓,0.0,住,,,1110406,土地0建物1車位0,二層,15,住宅大樓(11層含以上有電梯),住家用,鋼筋混凝土造,1060518,98.03,2,2,1,有,有,有,25000,255,,0.0,0,租金含管理費。,RPXNMLTKMHHGFDF56CC
汐止區,建物,新北市汐止區勤進路８３巷３號三樓之２６,0.0,,山坡地保育區,丙種建築用地,1110325,土地0建物1車位0,三層,7,套房(1房1廳1衛),住家用,鋼筋混凝土造,0710824,33.24,1,0,1,有,有,有,9500,286,,0.0,0,,RPQPMLTKMHHGFDF68CC
瑞芳區,建物,新北市瑞芳區逢甲路３４３號之２,0.0,住,,,1110415,土地0建物1車位0,一層,5,套房(1房1廳1衛),住家用,鋼筋混凝土造,0840705,86.87,1,0,1,有,無,有,11000,127,,0.0,0,此為新北市社會住宅包租代管計畫之物件，評定市價租金12223元，選擇代租方案須打九折，實際租賃契約金額為11000元；水電瓦斯費、網路費由承租人負擔。,RPSNMLTKMHHGFFF88CC
汐止區,房地(土地+建物)+車位,新北市汐止區福德二路６３號１３樓,12.64,住,,,1110411,土地1建物1車位1,十三層,15,住宅大樓(11層含以上有電梯),住家用,鋼筋混凝土構造,1060725,117.52,2,2,1,有,有,有,28000,238,坡道平面,36.27,0,,RPPQMLKLMHHGFDF87CC
汐止區,房地(土地+建物),新北市汐止區南昌街１８號４樓,22.75,住,,,1110410,土地1建物1車位0,四層,4,公寓(5樓含以下無電梯),住家用,加強磚造,0650817,69.9,3,2,1,有,無,有,16000,229,,0.0,0,,RPWQMLKLMHHGFDF58CC
汐止區,房地(土地+建物)+車位,新北市汐止區新臺五路一段９３號２９樓之３、２９樓之５,48.36,其他,,,1110324,土地2建物2車位1,二十九層,35,廠辦,廠房,鋼骨構造,1080123,645.48,0,0,0,無,有,有,150000,232,坡道平面,37.1,0,,RPVRMLKLMHHGFDF58CC
三峽區,建物,新北市三峽區民生街２７巷１６號十三樓之４,0.0,住,,,1110415,土地0建物1車位0,十三層,16,套房(1房1廳1衛),住家用,鋼筋混凝土造,0850401,28.37,1,0,1,有,有,有,7000,247,,0.0,0,,RPPOMLKLMHHGFIF18CC
三峽區,建物,新北市三峽區大同路９８之８號九樓之三,0.0,住,,,1110415,土地0建物1車位0,九層,13,住宅大樓(11層含以上有電梯),住家用,鋼筋混凝土造,0850215,129.4,3,2,2,有,有,有,13800,107,,0.0,0,此為新北市社會住宅包租代管計畫之物件，評定市價租金為15334元，選擇代管方案須打9折，實際租賃契約金額為13800元；水電費及每月管理費1200元由承租人負擔。,RPUOMLKLMHHGFIF68CC
三峽區,建物,新北市三峽區大同路８８巷１號六樓之二,0.0,住,,,1110415,土地0建物1車位0,六層,14,住宅大樓(11層含以上有電梯),住家用,鋼筋混凝土造,0850215,138.01,3,2,2,有,有,有,14700,107,,0.0,0,此為新北市社會住宅包租代管計畫之物件，評定市價租金為16334元，選擇代管方案須打9折，實際租賃契約金額為14700元；水電費及每月管理費1300元由承租人負擔。,RPVOMLKLMHHGFIF78CC
樹林區,建物,新北市樹林區文德街３巷３０號三樓,0.0,住,,,1110415,土地0建物1車位0,三層,5,公寓(5樓含以下無電梯),住家用,鋼筋混凝土造,0780811,125.45,3,2,2,有,無,有,22000,175,,0.0,0,此為新北市社會住宅包租代管計畫之物件評定市價租金為24445選擇代管方案須打9折實際租賃契約金額為22000；水電瓦斯費由承租人負擔。,RPWOMLKLMHHGFIF88CC
三峽區,建物,新北市三峽區學成路９９號１５樓,0.0,住,,,1110401,土地0建物1車位1,十五層,15,住宅大樓(11層含以上有電梯),住家用,鋼筋混凝土造,0960409,172.43,3,2,2,有,有,有,22200,145,坡道平面,32.82,2000,此為新北市社會住宅包租代管計劃之物件，評定市價租金為24446，因新北市計劃租金上限為22500，選擇代租方案須打九折且簽約租金無條件捨去至百分位，實際租賃契約金額20200。管理費每月2300元另計機車車位一位，租賃期間無償使用,RPSPMLKLMHHGFIF58CC
淡水區,房地(土地+建物)+車位,新北市淡水區後洲路一段５８號１６樓,31.53,住,,,1110417,土地1建物1車位1,十六層,23,住宅大樓(11層含以上有電梯),住家用,鋼筋混凝土造,1021203,233.05,4,2,2,有,無,有,30000,129,坡道平面,28.28,0,含管理費,RPWOMLKLMHHGFEF48CC
淡水區,房地(土地+建物)+車位,新北市淡水區新市三路二段１８１號１５樓,9.93,商,,,1110413,土地1建物1車位1,十五層,29,住宅大樓(11層含以上有電梯),住家用,鋼筋混凝土造,1070525,152.47,3,2,2,有,有,有,20000,131,坡道平面,30.47,0,,RPTPMLKLMHHGFEF28CC
淡水區,房地(土地+建物),新北市淡水區水碓２５巷２０-１號９樓,20.28,,山坡地保育區,丙種建築用地,1110414,土地1建物1車位0,九層,12,住宅大樓(11層含以上有電梯),住家用,鋼筋混凝土造,0840117,49.97,1,1,1,有,有,有,10000,200,,0.0,0,,RPTQMLKLMHHGFEF38CC
淡水區,建物,新北市淡水區新春街１２６巷９號十三樓之５,0.0,住,,,1110415,土地0建物1車位0,十三層,17,住宅大樓(11層含以上有電梯),住家用,鋼筋混凝土造,0851116,106.03999999999999,3,2,2,有,有,有,16500,156,,0.0,0,此為新北市社會住宅包租代管計畫之物件，評定市價租金為18334元，選擇代租方案須打九折，實際租賃契約金額為16500元；水電瓦斯費及每月管理費1600元由承租人負擔。,RPWQMLKLMHHGFEF68CC
淡水區,建物,新北市淡水區學府路５１巷５弄３號四樓,0.0,住,,,1110415,土地0建物1車位0,四層,5,公寓(5樓含以下無電梯),住家用,鋼筋混凝土造,0730824,112.52,3,2,1,有,無,有,15000,133,,0.0,0,此為新北市社會住宅包租代管計畫之物件，評定市價租金為16667元，選擇代租方案須打九折，實際租賃契約金額為15000元；水電瓦斯費由承租人負擔。,RPSRMLKLMHHGFEF38CC
淡水區,房地(土地+建物),新北市淡水區新生街９０巷１２號３樓,29.7,住,,,1110406,土地1建物1車位0,三層,4,公寓(5樓含以下無電梯),住家用,鋼筋混凝土造,0661215,86.83,3,2,1,有,無,有,15000,173,,0.0,0,,RPTRMLKLMHHGFEF48CC
淡水區,房地(土地+建物),新北市淡水區學府路３２巷２７號２樓,0.0,住,,,1110417,土地1建物1車位0,二層,14,住宅大樓(11層含以上有電梯),住家用,鋼筋混凝土造,0891107,115.8,3,2,2,有,無,有,24000,207,,0.0,0,,RPPSMLKLMHHGFEF18CC
淡水區,建物,新北市淡水區英專路６５巷３號十四樓之１,0.0,住,,,1110418,土地0建物1車位0,十四層,14,套房(1房1廳1衛),住家用,鋼筋混凝土造,0961026,46.29,1,0,1,有,有,有,17300,374,,0.0,0,此為新北市社會住宅包租代管計畫之物件評定市價租金為19223元，選擇代管方案須打9折實際租賃契約金額為17300元；水電費皆由承租人負擔。,RPRSMLKLMHHGFEF38CC
淡水區,房地(土地+建物)+車位,新北市淡水區濱海路一段３０６巷６０弄４６號十一樓,23.98,住,,,1110409,土地1建物1車位1,十一層,15,住宅大樓(11層含以上有電梯),住家用,鋼筋混凝土造,1021021,137.07,3,2,2,有,有,有,24000,175,坡道平面,32.41,0,,RPSSMLKLMHHGFEF48CC
淡水區,房地(土地+建物)+車位,新北市淡水區濱海路一段１５１號二樓,42.91,住,,,1110419,土地1建物1車位1,二層,14,住宅大樓(11層含以上有電梯),住家用,鋼筋混凝土造,1011101,223.09000000000003,4,2,2,有,有,有,30000,134,坡道平面,29.92,0,含管理費,RPPTMLKLMHHGFEF28CC
淡水區,房地(土地+建物)+車位,新北市淡水區新市二路二段２號十三樓之１,19.64,住,,,1110420,土地1建物1車位1,十三層,13,住宅大樓(11層含以上有電梯),住家用,鋼筋混凝土造,1040907,129.57999999999998,4,2,2,有,有,有,36000,278,坡道平面,29.46,0,租金含管含車,RPQTMLKLMHHGFEF38CC
淡水區,房地(土地+建物),新北市淡水區大忠街１１７號四樓之５,9.99,住,,,1110415,土地1建物1車位0,四層,18,住宅大樓(11層含以上有電梯),住家用,鋼筋混凝土造,0830629,60.730000000000004,1,1,1,有,有,有,7500,123,,0.0,0,寵物條款:1.退租時會收取消毒費1000元2.清潔若有清潔乾淨則不收費3.家具若有毀損則另計若買相同商品補,RPVTMLKLMHHGFEF88CC
林口區,建物,新北市林口區忠孝路３００號１８樓,0.0,商,,,1110324,土地0建物1車位0,十八層,24,住宅大樓(11層含以上有電梯),集合住宅,鋼筋混凝土造,1070919,96.89,2,1,1,有,有,有,29000,299,,0.0,0,,RPQOMLKLMHHGFBF57CC
新莊區,建物,新北市新莊區榮華路二段１０號８樓之８,0.0,住,,,1110407,土地0建物1車位0,八層,19,住宅大樓(11層含以上有電梯),集合住宅,鋼筋混凝土造,1060109,73.51,2,2,1,有,有,有,20700,282,,0.0,0,,RPTOMLKLMHHGFBF87CC
林口區,房地(土地+建物),新北市林口區文化三路一段３９巷７號,14.6,住,,,1110324,土地1建物1車位0,一層,33,店面(店鋪),一般零售業,鋼骨構造,1061130,119.48,0,0,0,無,有,無,55000,460,,0.0,0,不含管不含稅,RPPPMLKLMHHGFBF57CC
新莊區,建物,新北市新莊區民安西路８１巷７號四樓,0.0,住,,,1110416,土地0建物1車位0,四層,5,公寓(5樓含以下無電梯),住家用,鋼筋混凝土造,0720330,81.59,3,2,1,有,無,有,15000,184,,0.0,0,此為新北市社會住宅包租代管計畫之物件，評定市價租金為16667元，選擇代管方案須打9折，實際租賃契約金額為15000元；水電費由承租人負擔。,RPRSMLKLMHHGFBF08CC
林口區,房地(土地+建物),新北市林口區文化一路二段１８６號,58.25,住,,,1101231,土地1建物2車位0,一層,6,華廈(10層含以下有電梯),日常用品零售業,鋼筋混凝土造,0970609,175.70999999999998,1,1,1,有,有,無,52000,296,,0.0,0,,RPUSMLKLMHHGFBF38CC
五股區,建物,新北市五股區中興路四段３８巷５號之３,0.0,商,,,1110414,土地0建物0車位0,四層,4,套房(1房1廳1衛),住家用,加強磚造,0660115,23.01,1,0,1,有,無,有,7500,326,,0.0,0,此為分租套房，第四層共分成4間，一間平均面積約為23.01平方公尺。每月管理維護費200元由承租人負擔。,RPPTMLKLMHHGFBF97CC
汐止區,房地(土地+建物),新北市汐止區中興路２３６號８樓,81.86,住,,,1110330,土地1建物1車位0,八層,12,辦公商業大樓,商業用,鋼筋混凝土造,0891108,147.32,0,1,1,有,有,有,21000,143,,0.0,0,外牆作為廣告使用,RPORMLKLMHHGFDF97DC
汐止區,房地(土地+建物)+車位,新北市汐止區大同路三段１９６之６號６樓,30.19,工,,,1110408,土地1建物1車位2,六層,10,廠辦,工業用,鋼筋混凝土造,0810629,318.32,2,1,1,有,有,有,30000,94,坡道平面,0.0,0,,RPPRMLKLMHHGFDF08DC
三重區,建物,新北市三重區電信街９３號１樓,0.0,住,,,1110315,土地0建物1車位0,一層,7,店面(店鋪),商業用,鋼筋混凝土造,0831024,143.5,0,0,0,無,無,有,50000,348,,0.0,0,,RPUOMLKLMHHGFGF48CC
三重區,建物,新北市三重區文化北路７巷４號三樓,0.0,住,,,1110414,土地0建物1車位0,三層,4,公寓(5樓含以下無電梯),住家用,加強磚造,0640908,37.0,2,2,1,有,無,有,15000,405,,0.0,0,此為新北市社會住宅包租代管計畫之物件評定市價租金為16667元，選擇代租方案須打9折實際租賃契約金額為15000元。水電費、瓦斯費由承租人負擔。,RPWOMLKLMHHGFGF68CC
三重區,建物,新北市三重區重新路一段１６０號１４樓,0.0,其他,,,1110401,土地0建物1車位0,十四層,27,套房(1房1廳1衛),住家用,鋼骨鋼筋混凝土造,1011220,46.209999999999994,1,0,1,有,有,有,20602,446,,0.0,0,水電瓦斯費及每月管理費1398元由承租人負擔。,RPQPMLKLMHHGFGF18CC
三重區,建物,新北市三重區三民街１５３號三樓,0.0,住,,,1110416,土地0建物0車位0,三層,4,套房(1房1廳1衛),住家用,加強磚造,0641029,21.2,1,0,1,有,無,有,10500,495,,0.0,0,此為分租套房，第三層共分成4間，一間平均面積約為21.20平方公尺。每月垃圾費600元、管理維護費200元皆由承租人負擔。,RPOQMLKLMHHGFGF08CC
新店區,房地(土地+建物),新北市新店區安忠路５７巷２６弄２９號４樓,0.0,住,,,1110331,土地0建物1車位0,四層,6,華廈(10層含以下有電梯),住家用,鋼筋混凝土造,0840708,56.080000000000005,1,1,1,有,無,有,13000,232,,0.0,0,,RPVNMLKLMHHGFCF08CC
新店區,房地(土地+建物),新北市新店區新店路２６２之７號９樓,0.0,其他,,,1110401,土地0建物1車位0,九層,19,住宅大樓(11層含以上有電梯),住家用,鋼筋混凝土造,0980409,44.55,1,1,1,有,有,有,17500,393,,0.0,0,,RPXNMLKLMHHGFCF28CC
新店區,房地(土地+建物)+車位,新北市新店區寶橋路２３５巷６弄４號６樓,248.62,工,,,1110325,土地1建物1車位1,六層,8,廠辦,工業用,鋼筋混凝土造,0771104,364.65000000000003,0,0,0,無,無,無,80000,219,坡道平面,0.0,0,,RPXOMLKLMHHGFCF38CC
深坑區,房地(土地+建物),新北市深坑區北深路三段１８９巷２號,9.45,住,,,1110228,土地1建物1車位0,一層,7,店面(店鋪),商業用,鋼筋混凝土造,0840126,53.55,0,0,0,無,無,無,19900,372,,0.0,0,,RPTPMLKLMHHGFCF08CC
土城區,房地(土地+建物),新北市土城區金城路三段１９３號１０樓,0.0,其他,,,1110331,土地0建物1車位0,十層,22,住宅大樓(11層含以上有電梯),住家用,鋼筋混凝土造,0851116,91.02000000000001,2,2,1,有,有,有,19400,213,,0.0,0,,RPXNMLKLMHHGFAF08CC
土城區,建物,新北市土城區永豐路１４３號,0.0,商,,,1110418,土地0建物1車位0,一層,8,店面(店鋪),見使用執照,鋼筋混凝土造,0830117,269.87,0,2,1,有,無,無,68260,253,,0.0,0,※租金每個月新台幣陸萬捌仟貳佰陸拾元整含租賃所得稅及二代健保補充保費。※本房屋係供營業之用。,RPPPMLKLMHHGFAF47CC
中和區,建物,新北市中和區莒光路１７５之１號一樓,0.0,住,,,1110330,土地0建物2車位0,一層,5,店面(店鋪),住商用,鋼筋混凝土造,0720526,190.54,0,0,0,無,無,無,79644,418,,0.0,0,此物件與莒光路１７５之２號一樓共同出租2位所有權人各收取一半租金，111/3/30-111/5/31，為免租裝修期於111/6/1-115/5/31，租金為79644、115/6/1-121/5/31，租金為86472,RPTPMLKLMHHGFHF58CC
中和區,建物,新北市中和區中山路二段３０３號三樓之六,0.0,工,,,1110403,土地0建物1車位0,三層,12,辦公商業大樓,一般商業設施〈一般事務所〉,鋼筋混凝土造,0970114,83.32,0,0,0,無,有,無,27260,327,,0.0,0,,RPPQMLKLMHHGFHF28CC
中和區,建物,新北市中和區建康路１９８之１號四樓,0.0,住,,,1110413,土地0建物1車位0,四層,27,住宅大樓(11層含以上有電梯),集合住宅,鋼骨構造,1080225,94.08,2,2,1,有,有,無,24000,255,,0.0,0,,RPSQMLKLMHHGFHF58CC
中和區,房地(土地+建物),新北市中和區成功路１２７巷９號２樓,0.0,住,,,1110408,土地0建物1車位0,見其他登記事項,4,公寓(5樓含以下無電梯),住家用,鋼筋混凝土造,0691202,95.23,3,2,2,有,無,有,23500,247,,0.0,0,,RPTQMLKLMHHGFHF68CC
中和區,建物,新北市中和區景平路４７５之３號,0.0,住,,,1110411,土地0建物1車位0,見其他登記事項,4,套房(1房1廳1衛),住家用,鋼筋混凝土造,0671129,65.85,1,0,1,有,無,有,15000,228,,0.0,0,此為新北市社會住宅包租代管計畫之物件，評定市價租金16667元，選擇代租方案須打九折，實際租賃契約金額為15000元；水電瓦斯費、網路費由承租人負擔。,RPUQMLKLMHHGFHF78CC
永和區,建物,新北市永和區永和路二段３１２號,0.0,商,,,1110418,土地0建物1車位0,一層,4,店面(店鋪),住家用,加強磚造,0410101,76.19,0,0,0,無,無,無,35000,459,,0.0,0,僅出租1樓,RPVQMLKLMHHGFHF88CC
永和區,房地(土地+建物),新北市永和區秀朗路二段４８之１號２樓,0.0,住,,,1110324,土地0建物1車位0,二層,5,公寓(5樓含以下無電梯),住家用,鋼筋混凝土造,0751001,93.68,3,2,2,有,無,有,25000,267,,0.0,0,,RPWQMLKLMHHGFHF98CC
中和區,房地(土地+建物),新北市中和區景平路４９３巷２弄６號三樓,23.93,住,,,1110407,土地1建物1車位0,三層,4,公寓(5樓含以下無電梯),住家用,鋼筋混凝土造,0670218,72.16,3,2,1,有,無,有,29582,410,,0.0,0,,RPTRMLKLMHHGFHF78CC
永和區,房地(土地+建物),新北市永和區中正路９５之１號５樓,0.0,住,,,1110405,土地0建物1車位0,五層,19,住宅大樓(11層含以上有電梯),住家用,鋼筋混凝土造,0900411,94.9,3,1,2,有,有,有,24000,253,,0.0,0,,RPUSMLKLMHHGFHF98CC
永和區,房地(土地+建物),新北市永和區自由街１８號二樓,6.84,商,,,1110416,土地1建物1車位0,二層,11,其他,店舖,鋼筋混凝土造,0880119,70.69,2,2,1,有,有,有,23000,325,,0.0,0,,RPVSMLKLMHHGFHF09CC
中和區,建物,新北市中和區福祥路６８號５樓之８,0.0,其他,,,1110401,土地0建物1車位0,五層,21,套房(1房1廳1衛),住家用,鋼筋混凝土造,0960828,55.33,1,1,1,有,有,有,17500,316,,0.0,0,此為新北市社會住宅包租代管計劃之物件，評定市價租金為19452，因新北市計劃租金上限為22500，選擇代租方案須打九折且簽約租金無條件捨去至百分位，實際租賃契約金額17500。租賃期間111.4.30-112.1.26，未滿9個月管理費每月1700元另計,RPOUMLKLMHHGFHF58CC
中和區,建物,新北市中和區華新街１２７之３號,0.0,住,,,1110401,土地0建物1車位0,四層,4,公寓(5樓含以下無電梯),住家用,加強磚造,0580618,47.09,2,1,1,有,無,有,13000,276,,0.0,0,此為新北市社會住宅包租代管計劃之物件，評定市價租金為17772，因新北市計劃租金上限為22500，選擇代租方案須打九折且簽約租金無條件捨去至百分位，房東願以較低的金額出租，故實際租賃契約金額為13000。,RPPUMLKLMHHGFHF68CC
中和區,建物,新北市中和區景安路７８號九樓,0.0,住,,,1110412,土地0建物1車位0,九層,12,住宅大樓(11層含以上有電梯),住家用,鋼筋混凝土造,0970109,67.61,2,2,1,有,有,有,25000,370,,0.0,0,租金含管理費。兩位承租方，輸入其中一位資料申報。,RPTOMLLLMHHGFHF58CC
中和區,房地(土地+建物),新北市中和區連成路３８１之１號３樓,11.6,住,,,1110419,土地1建物1車位0,三層,5,公寓(5樓含以下無電梯),住家用,鋼筋混凝土造,0720602,75.75,2,2,1,有,無,有,17000,224,,0.0,0,,RPPPMLLLMHHGFHF28CC
中和區,房地(土地+建物),新北市中和區中正路２１號１６樓之６,0.0,住,,,1110329,土地0建物1車位0,十六層,22,住宅大樓(11層含以上有電梯),住家用,鋼筋混凝土造,0851116,27.78,1,1,1,有,有,有,10700,385,,0.0,0,,RPPQMLLLMHHGFHF38CC
永和區,建物,新北市永和區環河西路二段１９９號９樓,0.0,住,,,1110415,土地0建物1車位0,九層,22,住宅大樓(11層含以上有電梯),住家用,ＳＲＣ造,0880827,124.98,4,2,2,有,有,有,31000,248,,0.0,0,,RPRQMLLLMHHGFHF58CC
中和區,房地(土地+建物),新北市中和區捷運路５８之８號６樓,0.0,其他,,,1110325,土地0建物1車位0,六層,19,住宅大樓(11層含以上有電梯),集合住宅,鋼骨鋼筋混凝土構造,1000415,64.23,1,1,1,有,有,有,23000,358,,0.0,0,,RPSQMLLLMHHGFHF68CC
中和區,建物,新北市中和區福美路２５６巷１６弄６號３樓,0.0,住,,,1110407,土地0建物1車位0,三層,5,公寓(5樓含以下無電梯),住家用,鋼筋混凝土造,0741205,97.46,3,2,2,有,無,有,20000,205,,0.0,0,此為新北市社會住宅包租代管計劃之物件，評定市價租金為36162，因新北市計劃租金上限為22500，選擇代租方案須打九折且簽約租金無條件捨去至百分位，房東願以較低的金額出租，故實際租賃契約金額為20000。,RPVQMLLLMHHGFHF98CC
中和區,建物,新北市中和區連城路４５６巷１５號６樓,0.0,住,,,1110415,土地0建物1車位0,六層,6,華廈(10層含以下有電梯),住家用,鋼筋混凝土造,0900926,88.59,2,2,1,有,有,有,20200,228,,0.0,0,此為新北市社會住宅包租代管計劃之物件，評定市價租金為24147，因新北市計劃租金上限為22500，選擇代租方案須打九折且簽約租金無條件捨去至百分位，實際租賃契約金額20200。管理費每月1880元另計機車車位一位，租賃期間無償使用租賃期間111.4.15-112.1.14，共9個月,RPPRMLLLMHHGFHF48CC
板橋區,建物,新北市板橋區中山路二段５０之５號１３樓,0.0,住,,,1110413,土地0建物1車位0,十三層,13,住宅大樓(11層含以上有電梯),住家用,鋼筋混凝土造,0980116,85.00999999999999,2,2,1,有,無,有,36000,423,,0.0,0,,RPXNMLLLMHHGFAF18CC
板橋區,建物,新北市板橋區中正路２５３巷５７號三樓,0.0,住,,,1110307,土地0建物1車位0,見其他登記事項,5,公寓(5樓含以下無電梯),住家用,鋼筋混凝土造,0691002,106.78,3,2,1,有,無,有,20000,187,,0.0,0,,RPQPMLLLMHHGFAF67CC
