松山區,建物,臺北市松山區復興北路１９１號十五樓之１,0.0,商,,,1110623,土地0建物1車位0,十五層,16,辦公商業大樓,住家用,鋼筋混凝土造,0731214,163.85,2,0,0,有,有,無,92000,561,,0.0,0,,RPQPMLSLOHHGFDA38CC
松山區,建物,臺北市松山區光復南路３３巷５號３樓,0.0,住,,,1110616,土地0建物1車位0,三層,7,華廈(10層含以下有電梯),集合住宅,鋼筋混凝土造,0761223,116.79,3,2,2,有,無,有,43000,368,,0.0,0,,RPRPMLSLOHHGFDA48CC
松山區,建物,臺北市松山區南京東路三段２５６巷５０號１樓,0.0,住,,,1110621,土地0建物1車位0,一層,6,華廈(10層含以下有電梯),住家用,鋼筋混凝土造,0731226,188.01999999999998,0,0,0,有,無,有,86000,457,,0.0,0,,RPTPMLSLOHHGFDA68CC
松山區,建物,臺北市松山區光復南路１３巷３２之３號,0.0,住,,,1110521,土地0建物1車位0,四層,4,公寓(5樓含以下無電梯),,加強磚造,,77.3,3,1,1,有,有,有,21000,272,,0.0,0,,RPVPMLSLOHHGFDA88CC
松山區,建物,臺北市松山區慶城街２６之１號七樓,0.0,住,,,1110519,土地0建物1車位0,七層,7,華廈(10層含以下有電梯),住家用,鋼筋混凝土造,0680104,167.23000000000002,3,2,1,有,有,無,68000,407,,0.0,0,房屋用途做營業使用。原申報序號C1AD11106060012。,RPQQMLSLOHHGFDA48CC
松山區,建物,臺北市松山區復興北路３３號六樓,0.0,商,,,1110518,土地0建物1車位0,六層,12,辦公商業大樓,商業用,鋼筋混凝土造,0710630,173.97,0,1,3,有,有,無,100000,575,,0.0,0,租金調漲：民國114年6月18日起，租金調整為新台幣壹拾壹萬元整。租賃期間含免租金裝潢期。原申報序號C1AD11106060008。,RPSQMLSLOHHGFDA68CC
松山區,建物,臺北市松山區吉祥路４３號１樓,0.0,住,,,1110519,土地0建物1車位0,一層,7,店面(店鋪),商業用,鋼筋混凝土造,0811222,127.28999999999999,0,0,1,有,無,有,62000,487,,0.0,0,,RPTQMLSLOHHGFDA78CC
南港區,建物,臺北市南港區舊莊街一段２６９號４樓,0.0,住,,,1110625,土地0建物1車位0,四層,7,華廈(10層含以下有電梯),集合住宅,鋼筋混凝土造,1070814,79.45,2,2,1,有,有,有,23500,296,,0.0,0,,RPUQMLSLOHHGFDA88CC
信義區,建物,臺北市信義區基隆路一段４３２號６樓之２,0.0,商,,,1110617,土地0建物1車位0,六層,15,辦公商業大樓,商業用,鋼筋混凝土造,0710527,147.04999999999998,0,0,0,無,有,無,60000,408,,0.0,0,,RPVQMLSLOHHGFDA98CC
松山區,建物,臺北市松山區復興北路３３３號８樓之３,0.0,商,,,1110615,土地0建物1車位0,八層,12,住宅大樓(11層含以上有電梯),住家用,鋼筋混凝土造,0720808,89.26,2,1,1,有,有,無,31500,353,,0.0,0,分割27坪B室,RPWQMLSLOHHGFDA09CC
松山區,建物,臺北市松山區復興南路一段１號,0.0,商,,,1110628,土地0建物1車位0,五層,14,住宅大樓(11層含以上有電梯),商業用,鋼筋混凝土造,0680209,158.67,0,0,0,無,有,無,72000,454,,0.0,0,分割48坪504室,RPXQMLSLOHHGFDA56CC
大安區,建物,臺北市大安區仁愛路四段６８號４樓之８,0.0,其他,,,1110601,土地0建物1車位0,四層,14,住宅大樓(11層含以上有電梯),商業用,鋼筋混凝土造,0661212,41.75,1,2,1,有,有,有,35000,838,,0.0,0,,RPPNMLSLOHHGFFA28CC
大安區,建物,臺北市大安區光復南路２４０巷４８號９樓之２,0.0,商,,,1110603,土地0建物1車位0,九層,11,住宅大樓(11層含以上有電梯),住家用,鋼筋混凝土造,0941213,67.14,2,2,1,有,有,有,53000,789,,0.0,0,,RPQNMLSLOHHGFFA38CC
大安區,建物,臺北市大安區臥龍街３１８號４樓之１,0.0,住,,,1110610,土地0建物1車位0,四層,13,住宅大樓(11層含以上有電梯),住家用,鋼筋混凝土造,0990513,93.38,3,2,1,有,無,有,47000,503,,0.0,0,,RPSNMLSLOHHGFFA58CC
大安區,建物,臺北市大安區瑞安街２０８巷３９號２樓,0.0,住,,,1110621,土地0建物1車位0,二層,7,華廈(10層含以下有電梯),住家用,鋼筋混凝土造,1040511,66.54,1,1,1,有,無,有,44000,661,,0.0,0,,RPWNMLSLOHHGFFA98CC
大安區,建物,臺北市大安區信義路二段１２號１０樓之５,0.0,商,,,1110615,土地0建物1車位0,十層,13,住宅大樓(11層含以上有電梯),住家用,鋼筋混凝土造,0970908,53.34,0,1,1,有,無,有,25000,469,,0.0,0,,RPOOMLSLOHHGFFA28CC
大安區,建物,臺北市大安區瑞安街２０８巷３９號５樓之２,0.0,住,,,1110615,土地0建物1車位0,五層,7,華廈(10層含以下有電梯),住家用,鋼筋混凝土造,1040511,44.22,0,1,1,有,無,有,28000,633,,0.0,0,,RPPOMLSLOHHGFFA38CC
大安區,建物,臺北市大安區敦化南路二段１５２號１２樓,0.0,其他,,,1110620,土地0建物1車位0,十二層,19,住宅大樓(11層含以上有電梯),住家用,鋼筋混凝土造,0740417,135.06,3,2,2,有,無,有,55000,407,,0.0,0,,RPROMLSLOHHGFFA58CC
大安區,建物,臺北市大安區通化街２０９號１樓,0.0,住,,,1110617,土地0建物1車位0,一層,4,店面(店鋪),,加強磚造,,90.98,0,1,1,有,無,有,55000,605,,0.0,0,,RPSOMLSLOHHGFFA68CC
大安區,建物,臺北市大安區瑞安街２０８巷３９號４樓之２,0.0,住,,,1110615,土地0建物1車位0,四層,7,華廈(10層含以下有電梯),住家用,鋼筋混凝土造,1040511,44.22,1,1,1,有,無,有,26315,595,,0.0,0,,RPUOMLSLOHHGFFA88CC
大安區,建物,臺北市大安區信義路三段４３號１３樓,0.0,商,,,1110615,土地0建物1車位1,十三層,18,住宅大樓(11層含以上有電梯),住家用,鋼筋混凝土造,0770121,213.41,3,2,2,有,無,有,105000,492,坡道平面,0.0,0,,RPVOMLSLOHHGFFA98CC
大安區,建物,臺北市大安區光復南路２８０巷４３號,0.0,住,,,1110627,土地0建物1車位0,一層,6,店面(店鋪),商業用,鋼筋混凝土造,0750917,137.66,0,0,1,有,有,無,110000,799,,0.0,0,,RPWOMLSLOHHGFFA09CC
文山區,建物,臺北市文山區和興路５２巷７弄６號３樓,0.0,其他,,,1110602,土地0建物1車位0,三層,13,住宅大樓(11層含以上有電梯),住家用,鋼筋混凝土造,0851227,38.0,1,0,1,有,有,有,14000,368,,0.0,0,,RPRNMLSLOHHGFAA97CC
文山區,建物,臺北市文山區景興路２６２號十五樓,0.0,商,,,1110615,土地0建物1車位0,十五層,15,套房(1房1廳1衛),住家用,鋼筋混凝土造,0981028,43.52,1,1,1,有,有,有,18000,414,,0.0,0,租金含管理費。租賃期間含免租金裝潢期。,RPSNMLSLOHHGFAA08CC
中正區,建物,臺北市中正區和平西路二段１６巷１號二樓,0.0,住,,,1110624,土地0建物1車位0,二層,7,套房(1房1廳1衛),住家用,鋼筋混凝土造,0691230,116.67,1,1,1,有,無,有,23000,197,,0.0,0,國家住宅及都市更新中心辦理社會住宅包租代管計畫；電費由承租人負擔。,RPTNMLSLOHHGFAA18CC
中正區,建物,臺北市中正區大埔街２５巷２５號二樓,0.0,住,,,1110624,土地0建物1車位0,二層,5,華廈(10層含以下有電梯),住家用,鋼筋混凝土造,0820625,146.93,3,2,2,有,無,有,22500,153,,0.0,0,國家住宅及都市更新中心辦理社會住宅包租代管計畫；水電瓦斯費由承租人負擔。,RPUNMLSLOHHGFAA28CC
中正區,建物,臺北市中正區南昌路二段８９號１３樓之２,0.0,商,,,1110617,土地0建物1車位0,十三層,14,住宅大樓(11層含以上有電梯),集合住宅,鋼骨造,1080124,55.010000000000005,2,1,1,有,無,有,40000,727,,0.0,0,,RPXNMLSLOHHGFAA58CC
文山區,建物,臺北市文山區木柵路一段６６之６號,0.0,住,,,1110619,土地0建物1車位1,一層,7,店面(店鋪),商業用,鋼筋混凝土造,0880204,103.94999999999999,0,0,0,無,無,無,42000,404,升降機械,0.0,0,,RPOOMLSLOHHGFAA77CC
文山區,建物,臺北市文山區景文街４３號四樓,0.0,商,,,1110530,土地0建物0車位0,四層,7,華廈(10層含以下有電梯),見使用執照,鋼筋混凝土造,0711230,77.17,2,1,1,有,無,無,20000,259,,0.0,0,,RPROMLSLOHHGFAA08CC
文山區,建物,臺北市文山區景文街４３號四樓,0.0,商,,,1110530,土地0建物0車位0,四層,7,華廈(10層含以下有電梯),見使用執照,鋼筋混凝土造,0711230,77.17,2,1,1,有,無,無,20000,259,,0.0,0,,RPSOMLSLOHHGFAA18CC
中正區,建物,臺北市中正區南昌路一段４８號三樓,0.0,商,,,1110610,土地0建物1車位0,三層,5,套房(1房1廳1衛),住家用,鋼筋混凝土造,,46.4,1,1,1,有,無,有,20000,431,,0.0,0,,RPXOMLSLOHHGFAA68CC
中山區,建物,臺北市中山區民生西路２號,0.0,商,,,1110627,土地0建物1車位0,一層,12,店面(店鋪),商業用,鋼筋混凝土造,0770409,124.75,0,0,0,無,有,無,150000,1202,,0.0,0,租金前3年15萬，後2年15.45萬 以上含租賃所得稅及二代健保補充保費,RPTNMLSLOHHGFCA38CC
中山區,建物,臺北市中山區林森北路３６３號１７樓,0.0,商,,,1110601,土地0建物1車位0,十七層,18,住宅大樓(11層含以上有電梯),商業用,鋼筋混凝土造,0980916,62.290000000000006,1,2,1,有,有,有,43000,690,,0.0,0,,RPXNMLSLOHHGFCA78CC
中山區,建物,臺北市中山區林森北路３０８號９樓之６,0.0,商,,,1110531,土地0建物1車位0,九層,15,套房(1房1廳1衛),住家用,鋼骨造,0990409,76.7,1,1,1,有,有,有,51000,665,,0.0,0,,RPOOMLSLOHHGFCA97CC
內湖區,建物,臺北市內湖區金湖路３５８巷２號四樓,0.0,住,,,1110607,土地0建物1車位1,四層,8,華廈(10層含以下有電梯),住家用,鋼筋混凝土造,0990323,211.25,4,2,2,有,有,有,70000,331,坡道平面,16.55,0,租金含管理費。,RPPOMLSLOHHGFCA08CC
內湖區,建物,臺北市內湖區東湖路１３４號２樓,0.0,住,,,1110618,土地0建物1車位0,二層,5,公寓(5樓含以下無電梯),住家用,鋼筋混凝土造,0701228,92.22,0,1,1,有,無,無,25000,271,,0.0,0,,RPQOMLSLOHHGFCA18CC
中山區,建物,臺北市中山區五常街１１巷７號３樓之１,0.0,住,,,1110622,土地0建物1車位0,三層,17,住宅大樓(11層含以上有電梯),住家用,鋼筋混凝土造,1080918,155.6,2,2,2,有,有,有,68000,437,,0.0,0,,RPROMLSLOHHGFCA28CC
中山區,建物,臺北市中山區農安街６號１４樓之６,0.0,商,,,1110606,土地0建物1車位0,十四層,14,住宅大樓(11層含以上有電梯),住家用,鋼筋混凝土造,0980622,51.71,1,1,1,有,有,有,25000,483,,0.0,0,,RPTOMLSLOHHGFCA48CC
中山區,車位,臺北市中山區農安街６號,0.0,商,,,1110606,土地0建物0車位1,,0,其他,商業用,鋼筋混凝土造,0980622,48.519999999999996,0,0,0,有,有,無,6500,,坡道平面,48.52,6500,地下3樓，編號27號,RPXOMLSLOHHGFCA88CC
中山區,建物,臺北市中山區中山北路二段９３巷８號５樓之６,0.0,商,,,1110607,土地0建物1車位0,五層,12,住宅大樓(11層含以上有電梯),商業用,鋼筋混凝土造,0940803,78.78,2,2,2,有,有,有,63000,800,,0.0,0,租金含稅價,RPOPMLSLOHHGFCA08CC
中山區,建物,臺北市中山區新生北路二段６２巷３８之３號６樓之１,0.0,商,,,1110620,土地0建物1車位0,六層,9,華廈(10層含以下有電梯),商業用,鋼筋混凝土造,0800225,53.379999999999995,1,1,1,有,有,有,22800,427,,0.0,0,租金含稅含管價,RPPPMLSLOHHGFCA18CC
內湖區,建物,臺北市內湖區康樂街２０１巷４５號三樓,0.0,住,,,1110624,土地0建物1車位0,三層,8,華廈(10層含以下有電梯),住家用,鋼筋混凝土造,0821224,117.28,3,2,2,有,有,有,25000,213,,0.0,0,國家住宅及都市更新中心辦理社會住宅包租代管計畫；水電瓦斯費及每月管理費3500元由承租人負擔。,RPQPMLSLOHHGFCA28CC
中山區,建物,臺北市中山區建國北路二段９６號１１樓,0.0,住,,,1110517,土地0建物1車位0,十一層,12,辦公商業大樓,商業用,鋼筋混凝土造,0731221,173.67,4,0,0,有,有,有,66000,380,,0.0,0,,RPWPMLSLOHHGFCA88CC
中山區,建物,臺北市中山區敬業三路１７１號３樓,0.0,住,,,1110615,土地0建物1車位2,三層,7,華廈(10層含以下有電梯),住家用,鋼筋混凝土造,0980910,161.46,2,1,2,有,無,有,85000,526,坡道機械,0.0,0,,RPXPMLSLOHHGFCA98CC
中山區,建物,臺北市中山區南京東路二段１５７號五樓,0.0,商,,,1110622,土地0建物1車位0,五層,8,辦公商業大樓,商業用,鋼筋混凝土造,0620619,180.5,1,0,2,有,無,無,94000,521,,0.0,0,,RPPQMLSLOHHGFCA28CC
中山區,建物,臺北市中山區新生北路二段４０號６樓之６,0.0,商,,,1110511,土地0建物1車位0,六層,17,住宅大樓(11層含以上有電梯),商業用,鋼筋混凝土造,0850718,66.17,2,2,1,有,有,有,35000,529,,0.0,0,,RPQQMLSLOHHGFCA38CC
中山區,建物,臺北市中山區松江路１００巷１４號３樓,0.0,住,,,1110516,土地0建物1車位0,三層,6,華廈(10層含以下有電梯),住家用,鋼筋混凝土造,0711209,33.06,0,0,0,無,有,有,27000,817,,0.0,0,分租套房實際租賃坪數33.06,RPRQMLSLOHHGFCA48CC
中山區,建物,臺北市中山區長安東路二段１１８號３樓,0.0,商,,,1110615,土地0建物1車位1,三層,13,住宅大樓(11層含以上有電梯),集合住宅,鋼筋混凝土造,1071219,172.8,3,2,2,有,無,有,60000,347,塔式車位,0.0,0,,RPUQMLSLOHHGFCA78CC
中山區,房地(土地+建物),臺北市中山區中山北路二段６６號一樓及６８號二樓,0.0,商,,,1110516,土地0建物1車位0,二層,11,辦公商業大樓,商業用,見使用執照,0910827,957.21,0,0,0,無,有,有,588000,614,,0.0,0,,RPXQMLSLOHHGFCA09CC
中山區,建物,臺北市中山區中山北路二段４２巷１８號四樓,0.0,住,,,1110601,土地0建物1車位0,四層,8,華廈(10層含以下有電梯),住家用,鋼筋混凝土造,1081224,42.75,1,1,1,有,有,有,32000,749,,0.0,0,,RPSRMLSLOHHGFCA68CC
中山區,建物,臺北市中山區建國北路二段１４７號１２樓之６之７之８,0.0,住,,,1110617,土地0建物3車位0,十二層,14,辦公商業大樓,住家用,鋼筋混凝土造,0710702,225.70999999999998,0,0,0,無,有,無,80514,357,,0.0,0,12樓之6之7之8打通出租,RPTRMLSLOHHGFCA78CC
中山區,建物,臺北市中山區合江街２０巷１４號三樓,0.0,商,,,1110625,土地0建物0車位0,三層,4,套房(1房1廳1衛),住家用,鋼筋混凝土造,0640626,26.21,1,0,1,有,無,有,14000,534,,0.0,0,此為分租套房，第三層共分成2間，一間平均面積約為26.21平方公尺。每月垃圾收取費600元、水雜費200元皆為承租人負擔。,RPXRMLSLOHHGFCA56CC
北投區,建物,臺北市北投區稻香路１８６號二樓,0.0,住,,,1110611,土地0建物1車位1,二層,5,華廈(10層含以下有電梯),集合住宅,鋼筋混凝土造,1101217,157.84,3,2,2,有,無,有,36000,228,坡道機械,34.9,0,,RPPNMLSLOHHGFEA18CC
士林區,建物,臺北市士林區天母東路４３巷４弄３號７樓,0.0,商,,,1110601,土地0建物1車位0,七層,7,華廈(10層含以下有電梯),住家用,鋼筋混凝土造,0690325,119.6,3,2,2,有,有,有,70000,585,,0.0,0,,RPRNMLSLOHHGFEA38CC
北投區,建物,臺北市北投區懷德街１０５巷１４號,0.0,住,,,1110611,土地0建物1車位0,四層,4,公寓(5樓含以下無電梯),住家用,鋼筋混凝土造,0621114,88.77,3,2,1,有,無,有,26000,293,,0.0,0,,RPSNMLSLOHHGFEA48CC
士林區,建物,臺北市士林區仰德大道二段７０巷１８號１樓,0.0,其他,,,1110615,土地0建物1車位0,全,2,透天厝,住家用,鋼筋混凝土造,0681130,201.46,4,3,3,有,無,有,128000,635,,0.0,0,,RPUNMLSLOHHGFEA68CC
士林區,建物,臺北市士林區中山北路六段１０之１號４樓,0.0,住,,,1110610,土地0建物1車位0,四層,8,住宅大樓(11層含以上有電梯),住家用,鋼筋混凝土造,0870721,95.08,3,3,1,有,無,有,45000,473,,0.0,0,,RPWNMLSLOHHGFEA88CC
士林區,建物,臺北市士林區天母東路１０５巷２號三樓,0.0,住,,,1110623,土地0建物1車位0,三層,5,公寓(5樓含以下無電梯),住家用,鋼筋混凝土造,0710917,123.4,3,2,2,有,無,有,22000,178,,0.0,0,國家住宅及都市更新中心辦理社會住宅包租代管計畫；水電瓦斯費由承租人負擔。,RPOOMLSLOHHGFEA18CC
士林區,建物,臺北市士林區新安路２８６號,0.0,住,,,1110530,土地0建物1車位0,全,1,透天厝,住家用,鋼筋混凝土造,0680418,122.43,5,2,5,有,無,有,125000,1021,,0.0,0,,RPVOMLSLOHHGFEA88CC
中正區,建物,臺北市中正區中華路一段７號１１樓之８,0.0,商,,,1110604,土地0建物1車位0,十一層,15,住宅大樓(11層含以上有電梯),住家用,鋼筋混凝土造,1041214,129.82,3,2,2,有,有,有,54895,423,,0.0,0,,RPRNMLSLOHHGFBA08CC
大同區,建物,臺北市大同區長安西路３１８號,155.0,商,,,1110316,土地0建物1車位0,全,4,透天厝,,加強磚造,,524.64,6,2,5,有,無,無,125000,238,,0.0,0,,RPSNMLSLOHHGFBA18CC
中正區,建物,臺北市中正區重慶南路一段４３號９樓之５,0.0,商,,,1110610,土地0建物1車位0,九層,12,住宅大樓(11層含以上有電梯),住家用,鋼筋混凝土造,0750805,52.42,0,0,0,無,有,無,19000,362,,0.0,0,,RPTNMLSLOHHGFBA28CC
大同區,建物,臺北市大同區長安西路３２０號,161.0,商,,,1110316,土地0建物1車位0,全,4,透天厝,,加強磚造,,448.22,6,2,5,有,無,有,125000,279,,0.0,0,,RPUNMLSLOHHGFBA38CC
大同區,建物,臺北市大同區承德路三段１５２號１樓,0.0,商,,,1110504,土地0建物1車位0,一層,13,住宅大樓(11層含以上有電梯),一般零售業,鋼筋混凝土造,0951016,37.15,1,0,1,有,有,有,26000,700,,0.0,0,,RPWNMLSLOHHGFBA58CC
中正區,建物,臺北市中正區武昌街一段１８號４樓,0.0,商,,,1110616,土地0建物1車位0,見其他登記事項,12,辦公商業大樓,一般服務業（補習班）,鋼筋混凝土造,0860125,561.15,2,1,2,有,有,無,262000,467,,0.0,0,,RPPOMLSLOHHGFBA97CC
萬華區,建物,臺北市萬華區中華路一段１１０號五樓,0.0,其他,,,1110623,土地0建物1車位0,五層,8,套房(1房1廳1衛),住家用,鋼筋混凝土造,0700703,20.56,1,0,1,有,無,有,13000,632,,0.0,0,國家住宅及都市更新中心辦理社會住宅包租代管計畫；水電瓦斯費由承租人負擔。,RPSOMLSLOHHGFBA28CC
萬華區,建物,臺北市萬華區德昌街１８５巷５７弄３號二樓,0.0,住,,,1110609,土地0建物1車位0,二層,4,公寓(5樓含以下無電梯),住家用,加強磚造,,60.95,2,1,1,有,無,有,9000,148,,0.0,0,,RPWOMLSLOHHGFBA68CC
大同區,建物,臺北市大同區延平北路三段１８巷１７號３樓,0.0,住,,,1110619,土地0建物1車位0,三層,4,公寓(5樓含以下無電梯),,鋼筋混凝土造,0630218,72.68,3,1,1,有,有,有,25000,344,,0.0,0,,RPUPMLSLOHHGFBA58CC
大同區,建物,臺北市大同區五原路１９號１４樓之２,0.0,商,,,1110616,土地0建物1車位0,十四層,14,住宅大樓(11層含以上有電梯),住家用,鋼筋混凝土造,0981216,37.91,1,1,1,有,有,有,25000,659,,0.0,0,,RPQQMLSLOHHGFBA28CC
萬華區,建物,臺北市萬華區萬大路１４５號二樓,0.0,商,,,1110604,土地0建物1車位0,二層,5,公寓(5樓含以下無電梯),住家用,鋼筋混凝土造,0640508,30.95,1,1,1,有,無,有,13000,420,,0.0,0,,RPVQMLSLOHHGFBA78CC
大同區,建物,臺北市大同區延平北路一段４７號十五樓,0.0,商,,,1110624,土地0建物1車位0,十五層,15,辦公商業大樓,一般事務所,鋼筋混凝土造,1010606,326.17,3,0,1,有,有,無,105000,322,,0.0,0,,RPTNMLTLOHHGFBA38CC
中正區,建物,臺北市中正區中華路一段７號五樓之８,0.0,商,,,1110601,土地0建物1車位0,五層,15,住宅大樓(11層含以上有電梯),住家用,鋼筋混凝土造,1041214,139.51,2,2,2,有,有,有,65000,466,,0.0,0,,RPUNMLTLOHHGFBA48CC
大同區,建物,臺北市大同區雙連街７７號十二樓之２,0.0,住,,,1110616,土地0建物1車位0,十二層,15,住宅大樓(11層含以上有電梯),住家用,鋼筋混凝土造,1060726,90.34,2,1,1,有,無,有,60000,664,,0.0,0,,RPWNMLTLOHHGFBA68CC
大同區,建物,臺北市大同區延平北路三段１８巷３１號二樓,0.0,住,,,1110625,土地0建物1車位0,二層,4,公寓(5樓含以下無電梯),住家用,鋼筋混凝土造,0660119,61.78,2,2,1,有,無,有,18000,291,,0.0,0,國家住宅及都市更新中心辦理社會住宅包租代管計畫；水電瓦斯費由承租人負擔。,RPPOMLTLOHHGFBA08CC
大同區,建物,臺北市大同區歸綏街１８１號七樓之１０,0.0,商,,,1110625,土地0建物1車位0,七層,10,套房(1房1廳1衛),商業用,鋼筋混凝土造,0680925,14.85,1,0,1,有,有,有,8500,572,,0.0,0,國家住宅及都市更新中心辦理社會住宅包租代管計畫；水電瓦斯費及每月管理費550元由承租人負擔。,RPQOMLTLOHHGFBA18CC
大同區,建物,臺北市大同區延平北路二段１３５巷１６號２樓,0.0,商,,,1110610,土地0建物1車位0,二層,2,公寓(5樓含以下無電梯),,磚造,,70.57,3,1,1,有,無,有,26000,368,,0.0,0,,RPTOMLTLOHHGFBA48CC
萬華區,建物,臺北市萬華區艋舺大道３８８巷６號,0.0,住,,,1110616,土地0建物1車位0,一層,4,公寓(5樓含以下無電梯),住家用,鋼筋混凝土造,0600821,66.71,2,2,1,有,無,有,19000,285,,0.0,0,台北市都發局社會住宅包租代管第計畫；水電瓦斯費由承租人負擔。,RPUOMLTLOHHGFBA58CC
大同區,房地(土地+建物)+車位,臺北市大同區華陰街７９號１０樓,93.59,商,,,1110610,土地1建物1車位1,十層,13,住宅大樓(11層含以上有電梯),住家用,鋼筋混凝土造,1020118,159.48000000000002,3,2,2,有,有,有,97000,608,塔式車位,0.0,0,,RPVOMLTLOHHGFBA68CC
大同區,建物,臺北市大同區太原路８０號６樓,0.0,商,,,1110629,土地0建物1車位0,六層,14,套房(1房1廳1衛),住家用,鋼筋混凝土造,0971211,55.81,1,1,1,有,有,有,22500,403,,0.0,0,,RPWOMLTLOHHGFBA78CC
萬華區,建物,臺北市萬華區萬大路３４４巷１６號２樓,0.0,住,,,1110624,土地0建物1車位0,二層,4,公寓(5樓含以下無電梯),住家用,鋼筋混凝土造,,98.95,2,1,1,有,無,有,22000,222,,0.0,0,,RPXOMLTLOHHGFBA88CC
北投區,建物,臺北市北投區吉利街２５７巷２弄１號,0.0,住,,,1110610,土地0建物0車位0,一層,4,套房(1房1廳1衛),住家用,鋼筋混凝土造,0640318,21.89,1,0,1,有,無,有,12000,548,,0.0,0,部分承租。,RPRNMLTLOHHGFEA48CC
士林區,建物,臺北市士林區忠誠路二段１４０巷１６號,0.0,其他,,,1110613,土地0建物1車位0,一層,5,公寓(5樓含以下無電梯),見使用執照,鋼筋混凝土造,0700403,133.2,2,1,2,有,無,有,47000,353,,0.0,0,,RPQOMLTLOHHGFEA48CC
北投區,建物,臺北市北投區溫泉路３４巷１１弄４號二樓,0.0,住,,,1110609,土地0建物1車位0,二層,5,公寓(5樓含以下無電梯),住家用,鋼筋混凝土造,0690213,82.49,2,1,2,有,無,有,22000,267,,0.0,0,,RPVOMLTLOHHGFEA98CC
北投區,建物,臺北市北投區泉源路３４號７樓之３,0.0,住,,,1110610,土地0建物1車位0,七層,10,華廈(10層含以下有電梯),住家用,鋼筋混凝土造,0870105,41.42,1,1,1,有,有,有,15000,362,,0.0,0,,RPWOMLTLOHHGFEA09CC
北投區,建物,臺北市北投區致遠二路１１３巷１６號５樓,0.0,住,,,1110621,土地0建物1車位0,五層,5,公寓(5樓含以下無電梯),住家用,鋼筋混凝土造,0710121,89.47,3,2,2,有,無,有,25000,279,,0.0,0,國家住宅及都市更新中心社會住宅包租代管計畫。每月水電瓦斯費由承租人負擔。,RPTPMLTLOHHGFEA88CC
士林區,建物,臺北市士林區仰德大道一段６巷８５號,0.0,住,,,1110625,土地0建物0車位0,全,1,透天厝,住家用,磚造,0520201,6.82,1,0,0,有,無,有,3300,484,,0.0,0,此為雅房，一間面積約為6.82平方公尺，每月水雜費200元由承租人負擔。,RPUPMLTLOHHGFEA98CC
中山區,建物,臺北市中山區林森北路３５１號十樓之１,0.0,商,,,1110621,土地0建物1車位0,十層,24,住宅大樓(11層含以上有電梯),住家用,鋼骨造,1021101,204.06,3,2,2,有,有,有,96500,473,,0.0,0,,RPQNMLTLOHHGFCA18CC
中山區,建物,臺北市中山區德惠街６５號八樓,0.0,住,,,1110620,土地0建物1車位0,八層,10,華廈(10層含以下有電梯),住家用,鋼筋混凝土造,0900926,174.21,2,2,2,有,有,有,51000,293,,0.0,0,,RPSNMLTLOHHGFCA38CC
中山區,建物,臺北市中山區林森北路５８７號九樓之７,0.0,商,,,1110617,土地0建物1車位0,九層,13,住宅大樓(11層含以上有電梯),住家用,鋼筋混凝土造,1000726,89.76,2,1,1,有,有,有,49000,546,,0.0,0,本次承租方辦理變更名義及續租,RPUNMLTLOHHGFCA58CC
中山區,建物,臺北市中山區新生北路二段６２巷１２號十七樓之２,0.0,商,,,1110608,土地0建物1車位0,十七層,19,住宅大樓(11層含以上有電梯),住家用,鋼骨鋼筋混凝土造,1050322,158.56,3,2,2,有,有,有,90000,568,,0.0,0,,RPVNMLTLOHHGFCA68CC
中山區,建物,臺北市中山區新生北路二段１３７巷１７號五樓之１,0.0,住,,,1110625,土地0建物1車位0,五層,5,公寓(5樓含以下無電梯),住家用,鋼筋混凝土造,0740615,86.31,2,2,1,有,無,有,22000,255,,0.0,0,國家住宅及都市更新中心辦理社會住宅包租代管計畫；水電瓦斯費由承租人負擔。,RPXNMLTLOHHGFCA88CC
內湖區,建物,臺北市內湖區環山路二段５３巷５弄１２號B室,0.0,住,,,1110626,土地0建物1車位0,一層,4,公寓(5樓含以下無電梯),住商用,鋼筋混凝土造,0681102,23.14,1,0,1,有,無,有,12000,519,,0.0,0,,RPOOMLTLOHHGFCA08CC
中山區,建物,臺北市中山區林森北路１０７巷３０號八樓之３,0.0,商,,,1110624,土地0建物1車位0,八層,8,套房(1房1廳1衛),住家用,鋼筋混凝土造,0711115,27.220000000000002,1,0,1,有,有,有,15000,551,,0.0,0,國家住宅及都市更新中心辦理社會住宅包租代管計畫；水電瓦斯費及每月管理費800元由承租人負擔。,RPROMLTLOHHGFCA38CC
內湖區,建物,臺北市內湖區文德路６６巷１１弄８號５樓,40.91,住,,,1110627,土地0建物0車位0,五層,5,住宅大樓(11層含以上有電梯),住家用,鋼筋混凝土造,0730127,39.17,1,0,1,有,無,有,12000,306,,0.0,0,,RPTOMLTLOHHGFCA58CC
中山區,建物,臺北市中山區長春路２５８巷３２號３樓之一,0.0,住,,,1110603,土地0建物1車位0,三層,6,華廈(10層含以下有電梯),住家用,鋼筋混凝土造,0860925,48.86,1,1,1,有,有,有,23000,471,,0.0,0,,RPPPMLTLOHHGFCA28CC
