萬華區,建物,臺北市萬華區大理街５４之１號１樓,0.0,商,,,1110606,土地0建物1車位0,一層,4,店面(店鋪),商業用,加強磚造,0641015,103.45,0,0,0,無,無,無,76000,735,,0.0,0,租金含稅。原本申報書序號：C1AB11106100015,RPQPMLSKPHHGFBA18CC
大同區,建物,臺北市大同區重慶北路三段１６４號,0.0,商,,,1110715,土地0建物1車位0,二層,4,公寓(5樓含以下無電梯),,加強磚造,,55.53,2,1,1,有,無,有,25000,450,,0.0,0,,RPXPMLSKPHHGFBA88CC
士林區,建物,臺北市士林區承德路四段３０４號６樓,0.0,住,,,1110713,土地0建物1車位0,六層,12,住宅大樓(11層含以上有電梯),住家用,鋼筋混凝土造,0770715,134.97,3,2,2,有,有,有,48000,356,,0.0,0,,RPTNMLSKPHHGFEA58CC
北投區,建物,臺北市北投區公館路３７６巷２弄９號,0.0,住,,,1110712,土地0建物1車位0,全,2,透天厝,住家用,加強磚造,0611107,51.48,2,2,1,有,無,有,27500,534,,0.0,0,,RPUOMLSKPHHGFEA78CC
士林區,建物,臺北市士林區中山北路六段１５７巷１１號三樓之５,0.0,工,,,1110620,土地0建物1車位0,三層,15,住宅大樓(11層含以上有電梯),策略性產業（資訊服務業）,鋼筋混凝土造,0971002,116.8,2,2,1,有,有,有,73000,625,,0.0,0,,RPPNMLTKPHHGFEA28CC
士林區,建物,臺北市士林區中山北路七段２６號六樓,0.0,商,,,1110625,土地0建物1車位0,六層,7,華廈(10層含以下有電梯),住家用,鋼筋混凝土造,0750103,143.7,3,2,2,有,有,有,60000,418,,0.0,0,,RPXNMLTKPHHGFEA09CC
北投區,建物,臺北市北投區溫泉路７１號二樓之３,0.0,其他,,,1110712,土地0建物1車位0,二層,7,套房(1房1廳1衛),商業用,鋼筋混凝土造,0700218,26.5,1,0,1,有,有,有,10000,377,,0.0,0,國家住宅及都市更新中心辦理社會住宅包租代管計畫；水電瓦斯費及每月管理費500元由承租人負擔。,RPUOMLTKPHHGFEA88CC
北投區,建物,臺北市北投區光明路２００號７樓之２５,0.0,其他,,,1110628,土地0建物1車位0,七層,14,住宅大樓(11層含以上有電梯),自由職業事務所,鋼筋混凝土造,0940322,37.400000000000006,1,0,0,有,有,有,13000,348,,0.0,0,租金含稅價,RPWOMLTKPHHGFEA09CC
北投區,建物,臺北市北投區大度路三段３０１巷１２８弄７之２號四樓,0.0,住,,,1110715,土地0建物1車位0,四層,4,公寓(5樓含以下無電梯),住家用,鋼筋混凝土造,0770827,69.42999999999999,2,1,1,有,無,有,15000,216,,0.0,0,台北市都發局社會住宅包租代管計畫；水電瓦斯費由承租人負擔。,RPVPMLTKPHHGFEA09CC
北投區,建物,臺北市北投區文林北路７５巷６７號二樓,0.0,住,,,1110718,土地0建物1車位1,二層,13,住宅大樓(11層含以上有電梯),Ｈ２多戶住宅,鋼筋混凝土造,1061117,191.64,3,2,2,有,有,無,35000,183,坡道平面,43.1,0,,RPWPMLTKPHHGFEA56CC
北投區,建物,臺北市北投區中和街４９３巷１弄３號五樓,0.0,住,,,1110714,土地0建物0車位0,五層,5,套房(1房1廳1衛),住家用,鋼筋混凝土造,0711227,25.27,1,0,1,有,無,有,8000,317,,0.0,0,此為分租套房，第五層共分成4間，一間平均面積約為25.27平方公尺。每月垃圾收取費600元、水費200元皆為承租人負擔。,RPOQMLTKPHHGFEA48CC
士林區,建物,臺北市士林區承德路四段３３６號二樓,0.0,住,,,1110714,土地0建物0車位0,二層,5,公寓(5樓含以下無電梯),住家用,鋼筋混凝土造,0700820,38.89,2,1,1,有,無,有,19800,509,,0.0,0,此為2房，第二層共分成2間，一間平均面積約為38.89平方公尺。每月垃圾收取費900元、水費200元皆為承租人負擔。,RPRQMLTKPHHGFEA78CC
大同區,建物,臺北市大同區南京西路５７號十一樓之１１,0.0,其他,,,1110621,土地0建物1車位0,十一層,19,住宅大樓(11層含以上有電梯),住家用,鋼筋混凝土造,1080304,67.47,1,1,1,有,有,有,49950,740,,0.0,0,,RPQNMLTKPHHGFBA08CC
中正區,建物,臺北市中正區衡陽路７６號,0.0,商,,,1110714,土地0建物0車位0,二層,7,套房(1房1廳1衛),,加強磚造,,32.87,1,0,1,有,無,有,14200,432,,0.0,0,此為分租套房，第二層共分成4間，一間平均面積約為32.87平方公尺，垃圾收取費600元、水費200元由承租人負擔。,RPRNMLTKPHHGFBA18CC
大同區,建物,臺北市大同區大龍街６０號二樓,0.0,住,,,1110708,土地0建物1車位0,四層,4,套房(1房1廳1衛),住家用,鋼筋混凝土造,0730802,44.04,1,0,1,有,無,有,13000,295,,0.0,0,台北市都發局社會住宅包租代管計畫；水電瓦斯費由承租人負擔；【本案僅出租四樓33.91+陽台10.13 =  44.04平方公尺】。,RPUNMLTKPHHGFBA48CC
萬華區,建物,臺北市萬華區環河南路一段７１號六樓之４,0.0,商,,,1110715,土地0建物1車位0,六層,12,套房(1房1廳1衛),住家用,鋼筋混凝土造,0660829,21.92,1,0,1,有,有,有,9000,411,,0.0,0,國家住宅及都市更新中心辦理社會住宅包租代管計畫；水電瓦斯費及每月管理費608元由承租人負擔。,RPVNMLTKPHHGFBA58CC
萬華區,建物,臺北市萬華區西寧南路１０５號６樓,0.0,商,,,1110712,土地0建物1車位0,六層,14,住宅大樓(11層含以上有電梯),一般事務所,鋼筋混凝土造,0931130,113.16999999999999,3,2,2,有,有,有,42000,371,,0.0,0,,RPWNMLTKPHHGFBA68CC
萬華區,建物,臺北市萬華區環河南路一段７１號六樓之５,0.0,商,,,1110715,土地0建物1車位0,六層,12,套房(1房1廳1衛),住家用,鋼筋混凝土造,0660829,21.92,1,0,1,有,有,有,9000,411,,0.0,0,國家住宅及都市更新中心辦理社會住宅包租代管計畫；水電瓦斯費及每月管理費608元由承租人負擔。,RPOOMLTKPHHGFBA97CC
大同區,建物,臺北市大同區延平北路四段５１號４樓,0.0,住,,,1110628,土地0建物1車位0,四層,4,公寓(5樓含以下無電梯),住家用,加強磚造,0590110,44.88,2,1,1,有,無,有,21000,468,,0.0,0,租金含稅價,RPPOMLTKPHHGFBA08CC
萬華區,建物,臺北市萬華區萬大路１３７巷３２號五樓,0.0,商,,,1110718,土地0建物1車位0,五層,5,公寓(5樓含以下無電梯),住家用,鋼筋混凝土造,0640508,45.88,2,1,1,有,無,有,18800,410,,0.0,0,國家住宅及都市更新中心辦理社會住宅包租代管計畫；水電瓦斯費由承租人負擔。,RPROMLTKPHHGFBA28CC
大同區,建物,臺北市大同區環河北路二段２０５巷２號２樓之１,0.0,住,,,1110626,土地0建物1車位0,二層,8,華廈(10層含以下有電梯),住家用,鋼筋混凝土造,0991028,108.59,0,0,0,無,有,有,32000,295,,0.0,0,,RPVOMLTKPHHGFBA68CC
中正區,建物,臺北市中正區開封街一段１０６巷８號,0.0,商,,,1110709,土地0建物0車位0,三層,3,套房(1房1廳1衛),,磚造,,12.78,1,0,1,有,無,有,10000,782,,0.0,0,此為分租套房，第三層共分成4間，一間平均面積約為12.78平方公尺，每月垃圾收取費600元、水費200元皆為承租人負擔。,RPVPMLTKPHHGFBA78CC
大同區,建物,臺北市大同區萬全街１號３樓之３,0.0,商,,,1110630,土地0建物1車位0,三層,15,住宅大樓(11層含以上有電梯),住家用,鋼筋混凝土造,1041016,84.47,2,1,1,有,有,有,53000,627,,0.0,0,,RPQQMLTKPHHGFBA38CC
中山區,建物,臺北市中山區五常街３１號二樓,0.0,住,,,1110624,土地0建物1車位0,二層,12,住宅大樓(11層含以上有電梯),住家用,鋼筋混凝土造,1050115,60.55,1,1,1,有,有,有,38000,628,,0.0,0,,RPPNMLTKPHHGFCA08CC
中山區,建物,臺北市中山區新生北路三段５６巷１９號七樓之１,0.0,商,,,1110624,土地0建物1車位0,七層,13,住宅大樓(11層含以上有電梯),住家用,鋼筋混凝土造,0981021,76.03,2,1,1,有,有,有,49800,655,,0.0,0,,RPRNMLTKPHHGFCA28CC
中山區,建物,臺北市中山區新生北路二段７３號二樓之１８,0.0,住,,,1110620,土地0建物1車位0,二層,7,套房(1房1廳1衛),住家用,鋼筋混凝土造,0680301,23.47,1,1,1,有,有,有,10000,426,,0.0,0,,RPPOMLTKPHHGFCA18CC
內湖區,建物,臺北市內湖區民權東路六段１８０巷６號９樓之２９,0.0,商,,,1110718,土地0建物1車位0,九層,12,辦公商業大樓,商業用,鋼筋混凝土造,0881102,40.05,0,1,1,有,有,有,18000,449,,0.0,0,,RPWOMLTKPHHGFCA88CC
中山區,建物,臺北市中山區民生東路一段２５號７樓之８,0.0,商,,,1110718,土地0建物1車位0,七層,12,住宅大樓(11層含以上有電梯),住家用,鋼筋混凝土造,0690815,40.75,1,1,1,有,有,有,16000,393,,0.0,0,,RPUPMLTKPHHGFCA78CC
內湖區,房地(土地+建物),臺北市內湖區江南街７１巷１８之４號五樓,15.43,住,,,1110702,土地1建物1車位0,五層,5,華廈(10層含以下有電梯),住家用,鋼筋混凝土造,0820213,51.980000000000004,1,1,1,有,無,無,19000,366,,0.0,0,,RPVPMLTKPHHGFCA88CC
中山區,建物,臺北市中山區吉林路１３５號二樓,0.0,商,,,1110716,土地0建物0車位0,二層,3,套房(1房1廳1衛),住家用,加強磚造,,19.53,1,0,1,有,無,有,9800,502,,0.0,0,此為分租套房，第二層共分成5間，一間平均面積約為19.53平方公尺。每月垃圾收取費600元、水費200元皆為承租人負擔。,RPOQMLTKPHHGFCA28CC
中山區,建物,臺北市中山區南京東路二段１４４號,0.0,商,,,1110715,土地0建物0車位0,三層,4,套房(1房1廳1衛),,鋼筋混凝土造,0560720,20.05,1,0,1,有,無,有,15000,748,,0.0,0,此為分租套房，第三層共分成8間，一間平均面積約為20.05平方公尺。每月垃圾收取費600元、水費200元皆為承租人負擔。,RPPQMLTKPHHGFCA38CC
中山區,建物,臺北市中山區民生東路二段１號７樓之１,0.0,商,,,1110629,土地0建物1車位0,七層,14,住宅大樓(11層含以上有電梯),集合住宅,鋼筋混凝土造,1021112,199.45999999999998,4,2,2,有,無,有,92780,465,,0.0,0,,RPRQMLTKPHHGFCA58CC
大安區,建物,臺北市大安區新生南路二段８２號二樓之３,0.0,住,,,1110714,土地0建物1車位0,二層,7,華廈(10層含以下有電梯),住家用,鋼筋混凝土造,0690526,78.31,2,1,1,有,有,有,30000,383,,0.0,0,國家住宅及都市更新中心辦理社會住宅包租代管計畫；水電瓦斯費及每月管理費1120元由承租人負擔。,RPSNMLTKPHHGFFA68CC
大安區,建物,臺北市大安區和平東路三段４６４巷２號７樓,0.0,住,,,1110709,土地0建物1車位0,七層,14,住宅大樓(11層含以上有電梯),住家用,鋼骨鋼筋混凝土造,0910704,90.21000000000001,2,1,1,有,無,有,30000,333,,0.0,0,,RPTNMLTKPHHGFFA78CC
大安區,建物,臺北市大安區羅斯福路四段１１９巷３８號,0.0,住,,,1110630,土地0建物1車位0,一層,7,華廈(10層含以下有電梯),住家用,鋼筋混凝土造,0760318,92.4,1,0,0,有,有,有,23000,249,,0.0,0,租金含稅價,RPUNMLTKPHHGFFA88CC
大安區,建物,臺北市大安區和平東路三段２６號三樓,0.0,商,,,1110715,土地0建物1車位0,三層,12,住宅大樓(11層含以上有電梯),商業用,鋼筋混凝土造,0770212,73.8,3,2,2,有,有,有,31800,431,,0.0,0,國家住宅及都市更新中心辦理社會住宅包租代管計畫；水電瓦斯費及每月管理費1800元由承租人負擔。,RPPOMLTKPHHGFFA48CC
大安區,建物,臺北市大安區樂業街１５９巷５３號三樓,0.0,住,,,1110626,土地0建物1車位0,三層,4,公寓(5樓含以下無電梯),住家用,鋼筋混凝土造,,91.11,3,2,1,有,無,有,28000,307,,0.0,0,租金含水電費。,RPROMLTKPHHGFFA68CC
松山區,建物,臺北市松山區八德路四段７６５號１４樓之４,0.0,商,,,1110701,土地0建物1車位0,十四層,14,住宅大樓(11層含以上有電梯),住家用,鋼筋混凝土造,0860613,28.81,1,1,1,有,有,有,16100,559,,0.0,0,,RPQNMLTKPHHGFDA28CC
信義區,建物,臺北市信義區忠孝東路四段５５３巷２２弄４之１號４樓,0.0,住,,,1110708,土地0建物1車位0,四層,7,華廈(10層含以下有電梯),住家用,鋼筋混凝土造,0670203,83.28,2,2,2,有,無,有,58000,696,,0.0,0,,RPTNMLTKPHHGFDA58CC
信義區,建物,臺北市信義區忠孝東路五段７１巷３０號１樓,0.0,住,,,1110712,土地0建物1車位0,一層,4,店面(店鋪),住家用,鋼筋混凝土造,0651230,102.81,0,0,1,有,無,有,102401,996,,0.0,0,,RPUNMLTKPHHGFDA68CC
松山區,建物,臺北市松山區南京東路五段６６巷２０號３樓,0.0,住,,,1110712,土地0建物1車位0,三層,7,華廈(10層含以下有電梯),住家用,鋼筋混凝土造,0730525,125.67,3,2,2,有,無,有,43500,346,,0.0,0,,RPVNMLTKPHHGFDA78CC
信義區,建物,臺北市信義區忠孝東路五段５３號１２樓,0.0,住,,,1110708,土地0建物1車位0,十二層,12,住宅大樓(11層含以上有電梯),集合住宅,鋼筋混凝土造,0720406,116.19,3,2,1,有,無,有,48000,413,,0.0,0,,RPWNMLTKPHHGFDA88CC
信義區,建物,臺北市信義區光復南路５４７號１１樓之２,0.0,商,,,1110713,土地0建物1車位0,十一層,15,住宅大樓(11層含以上有電梯),住家用,鋼筋混凝土造,0790109,131.07,3,2,2,有,有,有,45000,343,,0.0,0,,RPQOMLTKPHHGFDA38CC
信義區,建物,臺北市信義區基隆路一段３５巷７弄１之２號,0.0,住,,,1110708,土地0建物0車位0,全,4,透天厝,防空避難室、會客室、宿舍,鋼筋混凝土造,0641016,15.71,1,0,0,有,無,有,7040,448,,0.0,0,此為雅房，一間平均面積約為15.71平方公尺，每月垃圾收取費600元、水雜費200元、公區使用費200元皆為承租人負擔。,RPTOMLTKPHHGFDA68CC
中正區,建物,臺北市中正區同安街２０號２樓之１,0.0,住,,,1110708,土地0建物1車位0,二層,7,華廈(10層含以下有電梯),住家用,鋼筋混凝土造,1001110,97.44,2,2,2,有,無,有,39000,400,,0.0,0,,RPSNMLTKPHHGFAA18CC
文山區,建物,臺北市文山區景華街１１２號五樓,0.0,住,,,1110715,土地0建物1車位0,五層,5,公寓(5樓含以下無電梯),住家用,鋼筋混凝土造,0690212,96.91,3,2,1,有,無,有,29800,308,,0.0,0,國家住宅及都市更新中心辦理社會住宅包租代管計畫；水電瓦斯費由承租人負擔。,RPTNMLTKPHHGFAA28CC
中正區,建物,臺北市中正區南昌路二段８９號６樓之３,0.0,商,,,1110713,土地0建物1車位0,六層,14,住宅大樓(11層含以上有電梯),集合住宅,鋼骨造,1080124,52.11,2,1,1,有,有,有,43000,825,,0.0,0,,RPUNMLTKPHHGFAA38CC
中正區,建物,臺北市中正區中華路二段７５巷６號５樓,0.0,住,,,1110708,土地0建物0車位0,五層,5,公寓(5樓含以下無電梯),住家用,鋼筋混凝土造,0731205,39.31,2,1,1,有,無,有,20500,521,,0.0,0,此為2房，第五層共分成3間，一間平均面積約為39.31平方公尺，每月垃圾收取費900元、水費200元皆為承租人負擔。,RPPOMLTKPHHGFAA97CC
文山區,建物,臺北市文山區木新路二段２５０號二樓,0.0,住,,,1110718,土地0建物1車位0,二層,5,公寓(5樓含以下無電梯),住家用,鋼筋混凝土造,,99.19,3,2,1,有,無,有,20000,202,,0.0,0,國家住宅及都市更新中心辦理社會住宅包租代管計畫；水電瓦斯費由承租人負擔。,RPRNMLKLPHHGFAA27CC
中正區,建物,臺北市中正區羅斯福路２段６６巷２號１０樓,0.0,商,,,1110714,土地0建物1車位0,十層,12,住宅大樓(11層含以上有電梯),住家用,鋼筋混凝土造,0710122,85.01,2,2,1,有,無,有,30000,353,,0.0,0,,RPWNMLKLPHHGFAA77CC
中正區,建物,臺北市中正區和平西路一段１１號九樓,0.0,商,,,1110715,土地0建物0車位0,九層,11,套房(1房1廳1衛),商業用,鋼筋混凝土造,,42.6,1,0,1,有,無,有,13400,315,,0.0,0,此為分租套房，第九層共分成21間，一間平均面積約為42.60平方公尺。每月垃圾收取費600元、水費200元、鍋爐費300元皆為承租人負擔。,RPQOMLKLPHHGFAA27CC
文山區,建物,臺北市文山區萬美街一段１９巷１號２樓之１,0.0,其他,,,1110716,土地0建物0車位0,二層,13,住宅大樓(11層含以上有電梯),商業用,鋼筋混凝土造,0860419,65.31,2,1,1,有,無,有,21000,322,,0.0,0,此為2房，第二層共分成5間，一間平均面積約為65.31平方公尺，每月垃圾收取費900元、水費200元皆為承租人負擔。,RPTOMLKLPHHGFAA57CC
中正區,建物,臺北市中正區廈門街７５之２號,0.0,商,,,1110701,土地0建物1車位0,一層,12,店面(店鋪),一般零售業甲組（不含日用百貨）,鋼筋混凝土造,1071023,91.44,0,0,0,無,有,無,55000,601,,0.0,0,,RPVOMLKLPHHGFAA77CC
文山區,建物,臺北市文山區福興路６３巷４弄１１之１１號六樓,0.0,住,,,1110710,土地0建物1車位0,六層,8,華廈(10層含以下有電梯),住家用,鋼筋混凝土造,0860613,72.29,2,2,1,有,有,有,26250,363,,0.0,0,,RPWOMLKLPHHGFAA87CC
松山區,房地(土地+建物)+車位,臺北市松山區南京東路五段１６５號,0.0,其他,,,1110629,土地0建物1車位3,見其他登記事項,18,店面(店鋪),一般零售業（甲組）,鋼骨造,0991112,510.55,0,0,0,無,有,有,300000,588,坡道平面,106.68,0,第三年起月租金30.9萬,RPRNMLKLPHHGFDA57CC
信義區,建物,臺北市信義區松山路２０４巷８號三樓,0.0,住,,,1110628,土地0建物1車位0,三層,16,住宅大樓(11層含以上有電梯),商業用,鋼筋混凝土造,0760713,155.28,4,2,2,有,有,有,40000,258,,0.0,0,,RPPPMLKLPHHGFDA57CC
松山區,建物,臺北市松山區敦化北路３０３號七樓之１,0.0,其他,,,1110629,土地0建物1車位1,七層,12,辦公商業大樓,住家用,鋼筋混凝土造,0651022,146.2,3,2,2,有,有,無,85000,581,坡道平面,13.83,0,,RPRPMLKLPHHGFDA77CC
大安區,建物,臺北市大安區復興南路一段２１３號７樓之２,0.0,商,,,1110718,土地0建物1車位0,七層,12,套房(1房1廳1衛),商業用,鋼筋混凝土造,0771229,40.53,1,0,1,有,有,有,20000,493,,0.0,0,,RPXNMLKLPHHGFFA38CC
大安區,建物,臺北市大安區忠孝東路三段２１７巷４弄６之６號７樓,0.0,住,,,1110630,土地0建物1車位0,七層,7,華廈(10層含以下有電梯),住家用,鋼筋混凝土造,,152.58,4,2,2,有,有,有,58000,380,,0.0,0,,RPUOMLKLPHHGFFA18CC
大安區,建物,臺北市大安區忠孝東路三段２５１巷８弄３之３號,0.0,住,,,1110715,土地0建物1車位0,四層,4,公寓(5樓含以下無電梯),住家用,加強磚造,0530220,98.34,2,1,1,有,無,有,30000,305,,0.0,0,水電費、瓦斯費皆為承租人負擔。,RPVOMLKLPHHGFFA28CC
內湖區,建物,臺北市內湖區成功路三段７６巷９號３樓,0.0,商,,,1110703,土地0建物1車位0,三層,5,公寓(5樓含以下無電梯),住家用,鋼筋混凝土造,0700417,91.61999999999999,0,0,0,無,無,有,21000,229,,0.0,0,,RPUNMLKLPHHGFCA77CC
中山區,建物,臺北市中山區新生北路三段１號八號之２０,0.0,商,,,1110714,土地0建物1車位0,八層,14,套房(1房1廳1衛),住家用,鋼筋混凝土造,0700122,37.81,1,0,1,有,有,有,19000,503,,0.0,0,國家住宅及都市更新中心辦理社會住宅包租代管計畫；水電瓦斯費及每月管理費由承租人負擔。,RPWNMLKLPHHGFCA97CC
中山區,建物,臺北市中山區林森北路２５９巷９號７樓之１１,0.0,商,,,1110628,土地0建物1車位0,七層,7,華廈(10層含以下有電梯),住家用,鋼筋混凝土造,0730922,35.21,0,0,0,無,無,有,20000,568,,0.0,0,,RPXNMLKLPHHGFCA08CC
中山區,建物,臺北市中山區雙城街１９巷８號１２樓,0.0,商,,,1110714,土地0建物1車位0,十二層,14,住宅大樓(11層含以上有電梯),住家用,鋼筋混凝土造,0970312,36.58,0,0,0,無,無,有,25000,683,,0.0,0,,RPPOMLKLPHHGFCA37CC
中山區,建物,臺北市中山區中山北路一段１０５巷１２號３樓之６,0.0,商,,,1110630,土地0建物1車位0,三層,10,華廈(10層含以下有電梯),一般事務所,鋼筋混凝土造,1060110,82.00999999999999,1,2,1,有,有,有,54000,658,,0.0,0,,RPSOMLKLPHHGFCA67CC
中山區,建物,臺北市中山區林森北路２５９巷９號３樓之１１,0.0,商,,,1110714,土地0建物0車位0,三層,7,套房(1房1廳1衛),商業用,鋼筋混凝土造,0730922,37.57,0,0,0,無,無,有,18800,500,,0.0,0,,RPWOMLKLPHHGFCA08CC
內湖區,建物,臺北市內湖區堤頂大道二段２９７號８樓,0.0,商,,,1110715,土地0建物1車位0,八層,10,辦公商業大樓,工業用,鋼筋混凝土造,0980116,464.42999999999995,0,0,0,無,有,無,185000,398,,0.0,0,,RPQPMLKLPHHGFCA57CC
中山區,建物,臺北市中山區吉林路４２８號,0.0,住,,,1110716,土地0建物0車位0,二層,4,套房(1房1廳1衛),住家用,加強磚造,0580410,24.95,1,0,1,有,無,有,13800,553,,0.0,0,此為分租套房，第二層共分成3間，一間平均面積約為24.95平方公尺。每月垃圾收取費600元、水費200元皆為承租人負擔。,RPSPMLKLPHHGFCA77CC
中山區,車位,臺北市中山區新生北路二段４７號等共有部分,0.0,住,,,1110711,土地0建物0車位1,,,其他,,,,21.61,0,0,0,有,有,無,3200,,升降機械,21.61,3200,租金含管理費,RPTPMLKLPHHGFCA87CC
內湖區,建物,臺北市內湖區行愛路１１１號,0.0,工,,,1110711,土地0建物1車位0,一層,7,店面(店鋪),第十七組日常用品零售業、店舖診所,鋼筋混凝土造,1080612,301.51,2,1,1,有,有,無,126000,418,,0.0,0,,RPVPMLKLPHHGFCA08CC
中山區,建物,臺北市中山區五常街１１巷３號９樓之２,0.0,住,,,1110701,土地0建物1車位0,九層,17,住宅大樓(11層含以上有電梯),住家用,鋼筋混凝土造,1080918,64.56,1,1,1,有,有,有,43000,666,,0.0,0,,RPRQMLKLPHHGFCA77CC
中山區,建物,臺北市中山區民權東路一段７４號,0.0,商,,,1110701,土地0建物1車位0,一層,4,店面(店鋪),,鋼筋混凝土造,0560527,95.28,0,0,0,無,無,無,85000,892,,0.0,0,,RPSQMLKLPHHGFCA87CC
中山區,建物,臺北市中山區合江街１００之１號,0.0,住,,,1110701,土地0建物1車位0,一層,7,店面(店鋪),商業用,鋼筋混凝土造,0740718,114.66999999999999,0,0,0,無,無,無,75000,654,,0.0,0,,RPUQMLKLPHHGFCA08CC
中山區,建物,臺北市中山區復興北路２１４號十四樓,0.0,住,,,1110701,土地0建物1車位0,十四層,14,住宅大樓(11層含以上有電梯),集合住宅,鋼筋混凝土造,0750314,105.03999999999999,3,2,1,有,有,有,28000,267,,0.0,0,,RPWQMLKLPHHGFCA28CC
萬華區,建物,臺北市萬華區成都路１１０號五樓之１４,0.0,商,,,1110714,土地0建物1車位0,五層,12,套房(1房1廳1衛),見使用執照,鋼筋混凝土造,0660907,35.12,1,0,1,有,有,有,12000,342,,0.0,0,國家住宅及都市更新中心辦理社會住宅包租代管計畫；水電瓦斯費及每月管理費731元由承租人負擔。,RPPNMLKLPHHGFBA17CC
大同區,房地(土地+建物),臺北市大同區承德路三段４０號六樓,0.0,商,,,1110719,土地3建物1車位0,六層,7,華廈(10層含以下有電梯),住家用,鋼筋混凝土造,0711123,248.07,0,0,0,無,無,無,75000,302,,0.0,0,,RPQNMLKLPHHGFBA27CC
大同區,建物,臺北市大同區民權西路１０４號１０樓之６,0.0,商,,,1110718,土地0建物1車位0,十層,13,住宅大樓(11層含以上有電梯),商業用,鋼筋混凝土造,0710713,127.13000000000001,1,1,0,有,無,無,40000,315,,0.0,0,,RPOOMLKLPHHGFBA17CC
中正區,建物,臺北市中正區延平南路１６０號,0.0,商,,,1110716,土地0建物0車位0,二層,4,套房(1房1廳1衛),,鋼筋混凝土造,0560407,19.07,1,0,1,有,無,有,12700,666,,0.0,0,此為分租套房，第二層共分成4間，一間平均面積約為19.07平方公尺。每月垃圾收取費600元、水費200元皆為承租人負擔。,RPROMLKLPHHGFBA47CC
大同區,建物,臺北市大同區萬全街１號５樓之５,0.0,商,,,1110624,土地0建物1車位0,五層,15,住宅大樓(11層含以上有電梯),住家用,鋼筋混凝土造,1041016,148.23,3,1,2,有,有,有,85900,580,,0.0,0,,RPVOMLKLPHHGFBA87CC
北投區,建物,臺北市北投區大興街２３巷３５號四樓,0.0,住,,,1110715,土地0建物1車位0,四層,5,公寓(5樓含以下無電梯),住家用,鋼筋混凝土造,0770706,135.04,3,2,2,有,無,有,35000,259,,0.0,0,國家住宅及都市更新中心辦理社會住宅包租代管計畫；水電瓦斯費由承租人負擔。,RPRNMLKLPHHGFEA67CC
北投區,建物,臺北市北投區東華街２段２２號９樓,0.0,住,,,1110715,土地0建物1車位0,九層,12,住宅大樓(11層含以上有電梯),住家用,鋼筋混凝土造,1020923,150.74,2,2,2,有,有,有,56000,372,,0.0,0,,RPSNMLKLPHHGFEA77CC
士林區,建物,臺北市士林區忠誠路一段１７１巷１２弄７號十二樓,0.0,住,,,1110630,土地0建物1車位1,十二層,12,住宅大樓(11層含以上有電梯),住家用,鋼筋混凝土造,0981231,206.37,4,2,2,有,有,有,70000,339,坡道平面,0.0,0,租金含管理費。車位面積無法分算。,RPTOMLKLPHHGFEA97CC
士林區,建物,臺北市士林區延平北路五段２８５巷４６號３樓,0.0,住,,,1110712,土地0建物1車位0,三層,5,公寓(5樓含以下無電梯),住家用,鋼筋混凝土造,0780828,128.15,3,1,2,有,無,有,30000,234,,0.0,0,國家住宅及都市更新中心社會住宅包租代管計畫。每月水電瓦斯費由承租人負擔。,RPPPMLKLPHHGFEA67CC
北投區,建物,臺北市北投區溫泉路１４３之１８號二樓,0.0,其他,,,1110715,土地0建物1車位0,二層,5,公寓(5樓含以下無電梯),住家用,鋼筋混凝土造,0780214,69.85,2,1,1,有,無,有,13000,186,,0.0,0,加入臺北市社會住宅包租代管第2期計畫,RPQNMLLLPHHGFEA67CC
北投區,建物,臺北市北投區中山路１之６號七樓之３,0.0,其他,,,1110628,土地0建物0車位0,七層,8,套房(1房1廳1衛),住家用,鋼筋混凝土造,0670404,22.75,1,0,1,有,有,有,14000,615,,0.0,0,部分承租。租金含管理費。租金含水費。,RPRNMLLLPHHGFEA77CC
北投區,建物,臺北市北投區吉利街１５５號二樓,0.0,住,,,1110705,土地0建物1車位0,二層,3,公寓(5樓含以下無電梯),住商用,加強磚造,0590525,84.27,3,2,1,有,無,有,23000,273,,0.0,0,,RPTNMLLLPHHGFEA97CC
士林區,建物,臺北市士林區士東路２００巷４３號三樓,0.0,住,,,1110703,土地0建物1車位0,三層,5,公寓(5樓含以下無電梯),住家用,鋼筋混凝土造,0800921,128.0,3,2,2,有,無,有,34000,266,,0.0,0,,RPUNMLLLPHHGFEA08CC
