中山區,建物,臺北市中山區南京東路一段１６號４樓之８,0.0,商,,,1110520,土地0建物1車位0,四層,10,華廈(10層含以下有電梯),,鋼筋混凝土造,0561031,89.31,1,1,1,有,有,有,38000,425,,0.0,0,,RPPNMLOJOHHGFCA37CC
中山區,建物,臺北市中山區新生北路三段８２巷２號５樓之２,0.0,商,,,1110527,土地0建物1車位0,五層,10,華廈(10層含以下有電梯),商業用,鋼筋混凝土造,0821015,35.7,0,0,0,無,有,有,20000,560,,0.0,0,,RPQNMLOJOHHGFCA47CC
中山區,建物,臺北市中山區新生北路３段２６號１１樓之２０,0.0,商,,,1110601,土地0建物1車位0,十一層,12,住宅大樓(11層含以上有電梯),住家用,鋼筋混凝土造,0700703,31.76,0,0,0,無,有,有,16000,504,,0.0,0,,RPPNMLPJOHHGFCA57DC
內湖區,建物,臺北市內湖區康樂街１３６巷３０弄３號七樓,0.0,住,,,1110523,土地0建物1車位0,七層,7,華廈(10層含以下有電梯),（Ｈ２）集合住宅,鋼筋混凝土造,1090424,100.72,3,2,1,有,有,有,39000,387,,0.0,0,租賃範圍不含車位，已扣除車位面積。租金含管理費。,RPUNMLQJOHHGFCA08CC
中山區,建物,臺北市中山區明水路３９７巷１９弄１０號四樓之１,0.0,住,,,1110521,土地0建物1車位2,四層,12,住宅大樓(11層含以上有電梯),住家用,鋼筋混凝土造,0880125,252.38,4,3,2,有,有,有,76000,301,坡道平面,0.0,0,租金含管理費。車位面積無法分算。,RPXNMLQJOHHGFCA38CC
內湖區,建物,臺北市內湖區康寧路一段１３５號,0.0,住,,,1110601,土地0建物1車位0,見其他登記事項,15,店面(店鋪),第一層：一般零售業甲組（便利商店除外）；第一層夾層：一般零售業甲組（便利商店除外）；第二層：一般事務所。,鋼筋混凝土造,1060905,171.93,0,0,0,無,有,有,100000,582,,0.0,0,免租金裝潢期:111/06/15-111/08/14,RPQOMLQJOHHGFCA77CC
中山區,建物,臺北市中山區吉林路６５號９樓,0.0,商,,,1110520,土地0建物1車位0,九層,14,住宅大樓(11層含以上有電梯),住家用,鋼筋混凝土造,0940811,215.92000000000002,3,2,2,有,無,有,100000,463,,0.0,0,,RPUOMLQJOHHGFCA18CC
中山區,建物,臺北市中山區松江路２５９巷３８號５樓,0.0,住,,,1110511,土地0建物1車位0,五層,7,華廈(10層含以下有電梯),住家用,鋼筋混凝土造,0740115,120.09,3,2,1,有,有,有,41000,341,,0.0,0,,RPXOMLQJOHHGFCA48CC
內湖區,建物,臺北市內湖區內湖路三段１１５巷４弄４號３樓,0.0,住,,,1110516,土地0建物1車位0,三層,4,公寓(5樓含以下無電梯),住家用,鋼筋混凝土造,0650901,83.89,3,2,1,有,無,無,26000,310,,0.0,0,,RPRPMLQJOHHGFCA97CC
中山區,建物,臺北市中山區新生北路三段５６巷１４號地下室,0.0,商,,,1110530,土地0建物1車位0,地下層,6,華廈(10層含以下有電梯),見使用執照,鋼筋混凝土造,0670127,315.86,0,0,0,無,無,有,65000,206,,0.0,0,,RPTPMLQJOHHGFCA18CC
中山區,建物,臺北市中山區中山北路二段２６巷９號,0.0,住,,,1110513,土地0建物1車位0,一層,4,公寓(5樓含以下無電梯),住家用,加強磚造,0570201,112.88,0,0,1,有,無,無,60000,532,,0.0,0,,RPVPMLQJOHHGFCA38CC
中山區,建物,臺北市中山區新生北路二段３８號九樓之５,0.0,商,,,1110522,土地0建物1車位0,九層,17,住宅大樓(11層含以上有電梯),住家用,鋼筋混凝土造,0850718,79.62,3,2,1,有,有,有,32000,402,,0.0,0,租金含管理費。,RPPQMLQJOHHGFCA87CC
內湖區,建物,臺北市內湖區內湖路二段１０３巷４２之５號三樓,0.0,住,,,1110521,土地0建物1車位1,三層,7,華廈(10層含以下有電梯),（Ｈ２）集合住宅,鋼筋混凝土造,1100223,156.64,3,2,2,有,有,有,60000,383,坡道平面,30.9,0,租金含管理費。,RPQQMLQJOHHGFCA97CC
文山區,建物,臺北市文山區仙岩路１６巷４６號六樓之９,0.0,住,,,1110516,土地0建物1車位0,六層,8,華廈(10層含以下有電梯),見使用執照,鋼筋混凝土造,0821221,29.650000000000002,1,0,0,無,無,有,9000,304,,0.0,0,加入臺北市社會住宅包租代管第3期計畫,RPUNMLQJOHHGFAA87CC
中正區,建物,臺北市中正區南昌路二段８９號３樓之２,0.0,商,,,1110514,土地0建物1車位0,三層,14,住宅大樓(11層含以上有電梯),集合住宅,鋼骨造,1080124,54.83,2,1,1,有,無,有,38000,693,,0.0,0,,RPWNMLQJOHHGFAA08CC
文山區,建物,臺北市文山區福興路４６巷２弄６號,0.0,住,,,1110429,土地0建物1車位0,一層,4,公寓(5樓含以下無電梯),住家用,鋼筋混凝土造,,52.25,2,1,1,有,無,有,19000,364,,0.0,0,,RPXNMLQJOHHGFAA18CC
文山區,建物,臺北市文山區興隆路二段１５４巷１２號三樓,0.0,住,,,1110601,土地0建物0車位0,三層,4,套房(1房1廳1衛),集合住宅,鋼筋混凝土造,0630705,20.35,1,0,1,有,無,有,9800,482,,0.0,0,此為分租套房，第三層共分成5間，一間平均面積約為20.35平方公尺。每月管理維護費200元、垃圾費600元皆由承租人負擔。租期第13個月為房租年繳優惠贈送。,RPOOMLQJOHHGFAA37CC
文山區,建物,臺北市文山區萬美街二段２巷３號三樓之２,0.0,住,,,1110517,土地0建物1車位0,三層,12,套房(1房1廳1衛),集合住宅,鋼筋混凝土造,0720916,46.76,1,1,1,有,有,有,13200,282,,0.0,0,加入臺北市社會住宅包租代管第3期計畫,RPPOMLQJOHHGFAA47CC
文山區,建物,臺北市文山區木柵路４段１５９巷２之１６號２樓,0.0,住,,,1110601,土地0建物1車位0,二層,5,公寓(5樓含以下無電梯),住家用,鋼筋混凝土造,0700130,118.86,3,1,2,有,無,有,24000,202,,0.0,0,,RPROMLQJOHHGFAA67CC
中正區,建物,臺北市中正區中華路二段５５號,0.0,商,,,1110601,土地0建物0車位0,全,5,透天厝,住商用,鋼筋混凝土造,0620727,29.62,2,1,1,有,無,有,20500,692,,0.0,0,此為2房，第三層共分成3間，一間平均面積約為29.62平方公尺。每月管理維護費200元、垃圾費900元皆由承租人負擔。,RPSOMLQJOHHGFAA77CC
大安區,建物,臺北市大安區臥龍街２２２號３樓,0.0,住,,,1110511,土地0建物1車位1,二層,12,住宅大樓(11層含以上有電梯),住家用,鋼筋混凝土造,1030529,257.15,2,2,2,有,無,有,120000,467,坡道平面,29.05,0,,RPQOMLQJOHHGFFA08CC
大安區,建物,臺北市大安區瑞安街２０８巷３９號３樓之１,0.0,住,,,1110514,土地0建物1車位0,三層,7,華廈(10層含以下有電梯),住家用,鋼筋混凝土造,1040511,43.480000000000004,1,1,1,有,無,無,32000,736,,0.0,0,,RPROMLQJOHHGFFA18CC
大安區,車位,臺北市大安區和平東路三段４４８號等共有部分,0.0,住,,,1110520,土地0建物0車位1,,,其他,,,,36.99,0,0,0,有,有,無,5000,,坡道平面,36.99,5000,依車位所登記公設門牌申報。租金含管理費。,RPUOMLQJOHHGFFA48CC
南港區,建物,臺北市南港區忠孝東路六段２１號１４樓之１,0.0,商,,,1110509,土地0建物1車位3,十四層,17,辦公商業大樓,一般事務所,鋼骨鋼筋混凝土造；鋼骨造,0931216,386.22,0,0,0,無,有,無,210294,544,坡道平面,0.0,0,,RPSNMLQJOHHGFDA97CC
信義區,建物,臺北市信義區信義路四段４５８號３樓,0.0,商,,,1110513,土地0建物1車位0,三層,27,辦公商業大樓,商業用,見使用執照,0861230,410.89,0,0,0,無,有,無,270000,657,,0.0,0,,RPTNMLQJOHHGFDA08CC
信義區,建物,臺北市信義區吳興街１８４巷２３號四樓,0.0,住,,,1110521,土地0建物1車位0,四層,4,公寓(5樓含以下無電梯),住家用,加強磚造,,107.67,4,2,2,有,無,有,34000,316,,0.0,0,,RPPOMLQJOHHGFDA77CC
南港區,建物,臺北市南港區研究院路二段１２巷５７弄１２號四樓,0.0,住,,,1110524,土地0建物1車位0,四層,5,公寓(5樓含以下無電梯),住家用,鋼筋混凝土造,0740802,110.92,3,2,2,有,無,有,26000,234,,0.0,0,,RPROMLQJOHHGFDA97CC
松山區,建物,臺北市松山區敦化南路一段５７號２樓之１０,0.0,其他,,,1110523,土地0建物1車位0,二層,12,住宅大樓(11層含以上有電梯),住家用,鋼筋混凝土造,0660110,61.739999999999995,2,1,1,有,無,有,35000,567,,0.0,0,,RPVOMLQJOHHGFDA38CC
信義區,建物,臺北市信義區基隆路二段１７７號５樓之３,0.0,住,,,1110519,土地0建物1車位0,五層,15,住宅大樓(11層含以上有電梯),住家用,鋼筋混凝土造,0990901,74.45,1,1,1,有,無,有,55500,745,,0.0,0,,RPXOMLQJOHHGFDA58CC
信義區,建物,臺北市信義區松勤街８６號９樓、９樓之１、９樓之２、９樓之３,0.0,住,,,1110516,土地0建物4車位2,九層,10,華廈(10層含以下有電梯),集合住宅,鋼骨造,1081107,313.57,3,0,0,有,有,有,315000,1005,升降機械,0.0,0,,RPOPMLQJOHHGFDA77CC
信義區,建物,臺北市信義區信義路五段１１５號９樓之３,0.0,其他,,,1110519,土地0建物1車位0,九層,19,住宅大樓(11層含以上有電梯),住家用,鋼筋混凝土造,0980702,71.83,1,0,1,有,無,有,31000,432,,0.0,0,,RPPPMLQJOHHGFDA87CC
信義區,建物,臺北市信義區市民大道六段３１６號９樓,0.0,商,,,1110517,土地0建物1車位1,九層,16,住宅大樓(11層含以上有電梯),住家用,鋼筋混凝土造,1031227,315.82,4,2,3,有,無,有,135000,427,坡道平面,38.0,0,,RPUPMLQJOHHGFDA38CC
松山區,建物,臺北市松山區八德路四段１１７號８樓,0.0,住,,,1110525,土地0建物1車位0,八層,11,住宅大樓(11層含以上有電梯),住家用,鋼筋混凝土造,0790206,124.26,3,2,2,有,無,有,49000,394,,0.0,0,,RPVPMLQJOHHGFDA48CC
信義區,建物,臺北市信義區仁愛路四段５０２號６樓,0.0,住,,,1110509,土地0建物1車位0,六層,11,住宅大樓(11層含以上有電梯),住家用,鋼筋混凝土造,0750116,208.05,4,2,2,有,無,有,78000,375,,0.0,0,,RPWPMLQJOHHGFDA58CC
信義區,建物,臺北市信義區永吉路３６９號９樓,0.0,商,,,1110516,土地0建物1車位1,九層,14,住宅大樓(11層含以上有電梯),集合住宅,鋼筋混凝土造,1060905,196.23000000000002,3,2,2,有,無,有,83000,423,坡道平面,33.73,0,,RPXPMLQJOHHGFDA68CC
信義區,建物,臺北市信義區紫雲街１９號３樓,0.0,住,,,1110601,土地0建物1車位0,三層,6,華廈(10層含以下有電梯),住家用,鋼筋混凝土造,0690520,150.95000000000002,3,2,2,有,無,有,41840,277,,0.0,0,,RPRQMLQJOHHGFDA18CC
信義區,建物,臺北市信義區忠孝東路５段４３９號５樓,0.0,商,,,1110527,土地0建物1車位0,五層,7,華廈(10層含以下有電梯),住家用,鋼筋混凝土造,0710507,131.09,3,1,2,有,有,有,35000,267,,0.0,0,,RPUQMLQJOHHGFDA48CC
信義區,建物,臺北市信義區松信路３９號四樓,0.0,住,,,1110601,土地0建物1車位0,四層,4,公寓(5樓含以下無電梯),住家用,鋼筋混凝土造,0641021,85.51,3,2,1,有,無,有,28900,338,,0.0,0,國家住宅及都市更新中心辦理社會住宅包租代管第三期計畫；水電瓦斯費由承租人負擔。,RPPRMLQJOHHGFDA08CC
萬華區,建物,臺北市萬華區萬大路３２７之１號,0.0,住,,,1110523,土地0建物1車位0,一層,5,店面(店鋪),商業用,鋼筋混凝土造,0650817,81.02,0,0,0,無,無,無,40000,494,,0.0,0,,RPQNMLQJOHHGFBA57CC
大同區,建物,臺北市大同區南京西路１６５號七樓之１５,0.0,商,,,1110601,土地0建物1車位0,七層,11,套房(1房1廳1衛),住商用,鋼筋混凝土造,0660822,16.1,1,0,1,有,有,有,7500,466,,0.0,0,國家住宅及都市更新中心辦理社會住宅包租代管第三期計畫。水電費、瓦斯費及每月管理費292元皆由承租人負擔。,RPWNMLQJOHHGFBA18CC
萬華區,建物,臺北市萬華區富民路１５５巷３１號五樓之２,0.0,住,,,1110602,土地0建物1車位0,五層,12,住宅大樓(11層含以上有電梯),住家用,鋼筋混凝土造,0720929,92.69999999999999,3,1,2,有,有,有,19000,205,,0.0,0,國家住宅及都市更新中心辦理社會住宅包租代管第三期計畫。水電費、瓦斯費及每月管理費1500元皆由承租人負擔。,RPXNMLQJOHHGFBA28CC
大同區,建物,臺北市大同區南京西路２８８號５樓之１８,0.0,商,,,1110525,土地0建物1車位1,五層,19,住宅大樓(11層含以上有電梯),一般事務所,鋼筋混凝土造,1011214,153.19,2,2,1,有,無,有,58000,379,坡道平面,13.9,0,,RPOOMLQJOHHGFBA47CC
中正區,建物,臺北市中正區漢口街一段３，５，９，１１號４樓,0.0,商,,,1110518,土地0建物1車位0,四層,9,辦公商業大樓,商業用,鋼筋混凝土造,0601210,355.03,6,1,1,有,無,有,170000,479,,0.0,0,,RPQOMLQJOHHGFBA67CC
中正區,建物,臺北市中正區中華路一段７７號８樓之２,0.0,商,,,1110509,土地0建物1車位0,八層,14,住宅大樓(11層含以上有電梯),見使用執照,鋼骨鋼筋混凝土造,0920430,131.89000000000001,3,2,2,有,無,有,51351,389,,0.0,0,,RPTOMLQJOHHGFBA97CC
北投區,建物,臺北市北投區中央北路一段１８０巷１號二樓之４,0.0,商,,,1110523,土地0建物1車位0,二層,8,華廈(10層含以下有電梯),見使用執照,鋼筋混凝土造,0700831,82.21000000000001,3,2,1,有,有,有,30000,365,,0.0,0,租金含管理費。,RPPRMLQJOHHGFEA18CC
北投區,建物,臺北市北投區民族街８０號二樓,0.0,住,,,1110516,土地0建物1車位0,二層,4,公寓(5樓含以下無電梯),住家用,鋼筋混凝土造,0611006,108.36,3,2,1,有,無,有,20000,185,,0.0,0,加入臺北市社會住宅包租代管第3期計畫,RPSRMLQJOHHGFEA48CC
北投區,建物,臺北市北投區三合街一段８２巷１１２號七樓,0.0,住,,,1110521,土地0建物1車位0,七層,9,華廈(10層含以下有電梯),住家用,鋼筋混凝土造,1070423,86.44,2,1,1,有,有,有,38000,440,,0.0,0,租金含管理費。,RPURMLQJOHHGFEA68CC
士林區,建物,臺北市士林區天母西路６５號５樓,0.0,商,,,1110523,土地0建物1車位0,五層,7,華廈(10層含以下有電梯),住家用,鋼筋混凝土造,0660609,142.22,3,2,2,有,無,無,57150,402,,0.0,0,,RPWRMLQJOHHGFEA88CC
北投區,建物,臺北市北投區中央南路二段１２之１２號１８樓,0.0,工,,,1110519,土地0建物1車位1,十八層,19,其他,策略性產業（資訊服務業）,鋼筋混凝土造,1040828,142.95,2,2,1,有,無,有,46500,325,坡道平面,36.91,0,,RPOSMLQJOHHGFEA18CC
士林區,建物,臺北市士林區士東路８９巷２２弄５號四樓,0.0,住,,,1110517,土地0建物1車位0,四層,5,公寓(5樓含以下無電梯),住家用,鋼筋混凝土造,0670804,78.86,3,2,2,有,無,有,20000,254,,0.0,0,加入臺北市社會住宅包租代管第3期計畫,RPWSMLQJOHHGFEA98CC
北投區,建物,臺北市北投區光明路２１７號八樓之３,0.0,其他,,,1110601,土地0建物1車位0,八層,12,套房(1房1廳1衛),商業用,鋼筋混凝土造,0851218,39.93,1,0,1,有,有,有,17000,426,,0.0,0,水電費依帳單及每月管理費1080元皆由承租人負擔。,RPSTMLQJOHHGFEA68CC
北投區,建物,臺北市北投區明德路３３１巷３５號,0.0,住,,,1110520,土地0建物1車位0,一層,5,公寓(5樓含以下無電梯),住家用,鋼筋混凝土造,0690408,145.85,4,2,1,有,無,有,33000,226,,0.0,0,,RPTTMLQJOHHGFEA78CC
北投區,建物,臺北市北投區珠海路１６號四樓之１,0.0,商,,,1110508,土地0建物1車位0,四層,14,套房(1房1廳1衛),商業用,鋼筋混凝土造,0880812,41.69,1,1,1,有,有,有,15000,360,,0.0,0,,RPVTMLQJOHHGFEA98CC
士林區,建物,臺北市士林區通河街３２５巷１８之４號,0.0,住,,,1110519,土地0建物1車位0,四層,5,套房(1房1廳1衛),住家用,鋼筋混凝土造,0591210,29.48,1,1,1,有,無,有,10000,339,,0.0,0,,RPTOMLRJOHHGFEA38CC
士林區,建物,臺北市士林區天母北路２４號,0.0,住,,,1110604,土地0建物1車位0,一層,7,店面(店鋪),商業用,鋼筋混凝土造,0670322,145.22,0,1,1,有,無,無,40000,275,,0.0,0,,RPWPMLRJOHHGFEA78CC
士林區,建物,臺北市士林區德行西路３６號六樓之１１,0.0,住,,,1110524,土地0建物1車位0,六層,13,其他,策略性產業（資訊服務業）,鋼筋混凝土造,0970502,47.99,1,1,1,有,有,有,26049,543,,0.0,0,,RPOQMLRJOHHGFEA08CC
大同區,建物,臺北市大同區市民大道一段２０７號五樓之６,0.0,其他,,,1110512,土地0建物1車位0,五層,18,住宅大樓(11層含以上有電梯),住家用,鋼骨造,0980724,92.48,2,1,1,有,有,有,62000,670,,0.0,0,,RPSNMLRJOHHGFBA87CC
萬華區,建物,臺北市萬華區萬大路４２３巷３０弄１號,0.0,住,,,1110601,土地0建物1車位0,一層,13,住宅大樓(11層含以上有電梯),住家用,鋼筋混凝土造,0870824,194.07,3,1,2,有,無,有,24000,124,,0.0,0,,RPUNMLRJOHHGFBA08CC
萬華區,建物,臺北市萬華區武昌街二段５０巷２０號四樓之７,0.0,商,,,1110530,土地0建物1車位0,四層,6,華廈(10層含以下有電梯),住家用,鋼筋混凝土造,0700903,58.21,2,1,1,有,有,有,20000,344,,0.0,0,,RPUOMLRJOHHGFBA18CC
中正區,建物,臺北市中正區博愛路１５６號,0.0,商,,,1110602,土地0建物0車位0,二層,5,套房(1房1廳1衛),,加強磚造,,25.37,1,0,1,有,無,有,11000,434,,0.0,0,此為分租套房，第二層共分成4間，一間平均面積約為25.37平方公尺。每月垃圾收取費600元、水雜費200元皆為承租人負擔。,RPWOMLRJOHHGFBA38CC
中正區,建物,臺北市中正區延平南路１６０之６號,0.0,商,,,1110601,土地0建物0車位0,三層,4,套房(1房1廳1衛),,鋼筋混凝土造,0560407,26.24,1,0,1,有,無,有,14200,541,,0.0,0,此為分租套房，第三層共分成3間，一間平均面積約為26.24平方公尺。每月垃圾收取費600元、水雜費200元皆為承租人負擔。,RPXOMLRJOHHGFBA48CC
中正區,建物,臺北市中正區開封街一段１０６巷６號,0.0,商,,,1110603,土地0建物0車位0,一層,3,套房(1房1廳1衛),,加強磚造,,30.47,1,0,1,有,無,有,9600,315,,0.0,0,此為分租套房，第一層共分成2間，一間平均面積約為30.47平方公尺。每月垃圾收取費600元、水雜費200元皆為承租人負擔。,RPOPMLRJOHHGFBA67CC
中正區,建物,臺北市中正區開封街一段１０６巷８號,0.0,商,,,1110604,土地0建物0車位0,三層,3,套房(1房1廳1衛),,磚造,,12.78,1,0,1,有,無,有,7800,610,,0.0,0,此為分租套房，第三層共分成4間，一間平均面積約為12.78平方公尺。每月垃圾收取費600元、水雜費200元皆為承租人負擔。,RPPPMLRJOHHGFBA77CC
信義區,建物,臺北市信義區虎林街１２１巷７號三樓,0.0,商,,,1110520,土地0建物0車位0,三層,4,套房(1房1廳1衛),住家用,鋼筋混凝土造,,19.83,1,0,1,有,無,有,11000,555,,0.0,0,部分承租。,RPRNMLRJOHHGFDA97CC
信義區,建物,臺北市信義區忠孝東路五段７４３巷３１弄２５號６樓,0.0,住,,,1110526,土地0建物1車位1,六層,16,住宅大樓(11層含以上有電梯),集合住宅,鋼筋混凝土造,1070824,154.13,2,2,2,有,無,有,75000,487,坡道平面,33.86,0,,RPPOMLRJOHHGFDA87CC
南港區,建物,臺北市南港區園區街２２號２樓之３,0.0,住,,,1110522,土地0建物1車位1,二層,15,住宅大樓(11層含以上有電梯),住家用,鋼筋混凝土造,1000412,208.31,3,2,2,有,無,有,60000,288,坡道平面,42.93,0,,RPQOMLRJOHHGFDA97CC
信義區,建物,臺北市信義區光復南路４２１巷１５號３樓,0.0,商,,,1110515,土地0建物1車位0,二層,7,華廈(10層含以下有電梯),住家用,鋼筋混凝土造,0670831,101.96,3,2,1,有,無,有,43000,422,,0.0,0,,RPROMLRJOHHGFDA08CC
松山區,建物,臺北市松山區南京東路五段２３９號８樓之２,0.0,其他,,,1110530,土地0建物1車位0,八層,18,套房(1房1廳1衛),住家用,鋼筋混凝土造,0980331,55.44,1,0,1,有,無,有,30000,541,,0.0,0,,RPUOMLRJOHHGFDA38CC
松山區,建物,臺北市松山區民生東路３段１３３號３樓,0.0,其他,,,1110526,土地0建物1車位0,三層,14,辦公商業大樓,商業用,鋼筋混凝土造,0751008,751.13,0,0,0,無,無,無,410400,546,,0.0,0,,RPWPMLRJOHHGFDA68CC
大安區,建物,臺北市大安區信義路三段１５２巷７號１１樓,0.0,商,,,1110520,土地0建物1車位0,十一層,12,住宅大樓(11層含以上有電梯),住家用,鋼筋混凝土造,1020116,126.96000000000001,2,2,2,有,無,有,94674,746,,0.0,0,,RPWNMLRJOHHGFFA68CC
大安區,建物,臺北市大安區延吉街１３１巷３３號４樓,0.0,住,,,1110531,土地0建物1車位0,四層,7,華廈(10層含以下有電梯),住家用,鋼筋混凝土造,0700129,138.52,3,2,2,有,無,有,45000,325,,0.0,0,,RPXNMLRJOHHGFFA78CC
大安區,建物,臺北市大安區大安路一段２０２號五樓之１,0.0,住,,,1110528,土地0建物1車位0,五層,12,住宅大樓(11層含以上有電梯),住家用,鋼筋混凝土造,0971028,34.95,0,1,1,有,有,有,26000,744,,0.0,0,,RPQOMLRJOHHGFFA18CC
大安區,建物,臺北市大安區四維路１２４巷２２號,0.0,住,,,1110601,土地0建物0車位0,二層,2,套房(1房1廳1衛),,加強磚造,,19.24,1,0,1,有,無,有,11000,572,,0.0,0,此為分租套房，第二層共分成3間，一間平均面積約為19.24平方公尺。每月垃圾收取費600元、水雜費200元皆為承租人負擔。,RPROMLRJOHHGFFA28CC
大安區,建物,臺北市大安區敦化南路一段２３３巷１５號四樓,0.0,住,,,1110526,土地0建物1車位0,四層,7,華廈(10層含以下有電梯),住家用,鋼筋混凝土造,0671220,153.81,3,2,2,有,無,有,68000,442,,0.0,0,,RPUOMLRJOHHGFFA58CC
大安區,建物,臺北市大安區和平東路二段２６５巷２５弄１號十四樓,0.0,住,,,1110515,土地0建物1車位0,十四層,17,住宅大樓(11層含以上有電梯),住家用,鋼筋混凝土造,0740522,106.17,3,2,2,有,有,有,35000,330,,0.0,0,租金含管理費。,RPVOMLRJOHHGFFA68CC
文山區,建物,臺北市文山區興隆路二段２２８號２樓,0.0,商,,,1110602,土地0建物1車位0,二層,9,華廈(10層含以下有電梯),住家用,鋼筋混凝土造,0751024,77.86,2,1,1,有,有,有,20000,257,,0.0,0,,RPSOMLRJOHHGFAA87CC
文山區,建物,臺北市文山區下崙路１１巷１３號２樓,0.0,住,,,1110527,土地0建物1車位1,二層,7,華廈(10層含以下有電梯),集合住宅,鋼筋混凝土造,1060104,186.38,3,2,2,有,有,有,35100,229,坡道平面,36.0,600,1.縣市版社會住宅案件 2.合約面積規定不含車位故合約面積 150.38,RPVOMLRJOHHGFAA18CC
中正區,建物,臺北市中正區和平西路二段１３３號三樓,0.0,住,,,1110601,土地0建物0車位0,三層,4,套房(1房1廳1衛),住家用,加強磚造,0571017,19.23,1,0,1,有,無,有,8700,452,,0.0,0,此為分租套房，第三層共分成6間，一間平均面積約為19.23平方公尺。每月垃圾收取費600元、水雜費200元皆為承租人負擔。,RPXOMLRJOHHGFAA38CC
中正區,建物,臺北市中正區和平西路一段１１號七樓,0.0,商,,,1110601,土地0建物0車位0,七層,11,住宅大樓(11層含以上有電梯),商業用,鋼筋混凝土造,,15.580000000000002,1,0,0,有,無,有,6900,443,,0.0,0,此為雅房，一間平均面積約為15.58平方公尺。每月垃圾收取費600元、水雜費200元、鍋爐費300元皆由承租人負擔。,RPRPMLRJOHHGFAA87CC
中正區,建物,臺北市中正區中華路二段４５號,0.0,商,,,1110601,土地0建物0車位0,四層,5,套房(1房1廳1衛),住商用,鋼筋混凝土造,,29.62,1,0,1,有,無,有,12700,429,,0.0,0,此為分租套房，第四層共分成3間，一間平均面積約為29.62平方公尺。每月垃圾收取費600元、水雜費200元皆為承租人負擔。,RPVPMLRJOHHGFAA28CC
中正區,建物,臺北市中正區中華路二段４５號,0.0,商,,,1110603,土地0建物0車位0,五層,5,套房(1房1廳1衛),住商用,鋼筋混凝土造,,29.62,1,0,1,有,無,有,12500,422,,0.0,0,此為分租套房，第五層共分成3間，一間平均面積約為29.62平方公尺。每月垃圾收取費600元、水雜費200元皆為承租人負擔。,RPWPMLRJOHHGFAA38CC
中山區,建物,臺北市中山區中山北路三段５５巷６號七樓之１,0.0,商,,,1110605,土地0建物1車位0,七層,8,套房(1房1廳1衛),商業用,鋼筋混凝土造,0681227,37.34,1,0,1,有,有,有,23000,616,,0.0,0,國家住宅及都市更新中心辦理社會住宅包租代管第三期計畫；水電瓦斯費由承租人負擔。,RPOOMLRJOHHGFCA67CC
中山區,建物,臺北市中山區吉林路２２巷２１號四樓,0.0,住,,,1110604,土地0建物1車位0,見其他登記事項,4,公寓(5樓含以下無電梯),住家用,鋼筋混凝土造,0640226,74.95,3,0,1,有,無,有,21000,280,,0.0,0,國家住宅及都市更新中心辦理社會住宅包租代管第三期計畫；水電瓦斯費由承租人負擔。,RPQOMLRJOHHGFCA87CC
中山區,建物,臺北市中山區南京東路二段１０８號７樓之２５,0.0,商,,,1110530,土地0建物1車位0,七層,18,套房(1房1廳1衛),住家用,鋼骨造,0990917,66.32,1,0,1,有,無,無,31000,467,,0.0,0,,RPSOMLRJOHHGFCA08CC
中山區,建物,臺北市中山區雙城街２５巷３號３樓,0.0,商,,,1110513,土地0建物1車位0,三層,13,住宅大樓(11層含以上有電梯),住家用,鋼筋混凝土造,1041221,198.6,3,2,2,有,無,有,100000,504,,0.0,0,,RPUOMLRJOHHGFCA28CC
內湖區,建物,臺北市內湖區內湖路二段１７９巷４６弄４１號五樓,0.0,住,,,1110525,土地0建物1車位0,五層,5,公寓(5樓含以下無電梯),住家用,鋼筋混凝土造,0720314,105.48,3,2,1,有,無,有,17000,161,,0.0,0,,RPWOMLRJOHHGFCA48CC
中山區,建物,臺北市中山區朱崙街３４號３樓之８,0.0,住,,,1110517,土地0建物1車位1,三層,5,華廈(10層含以下有電梯),住家用,鋼筋混凝土造,0850411,46.980000000000004,1,0,1,有,無,有,17500,372,坡道平面,16.77,0,,RPXOMLRJOHHGFCA58CC
中山區,建物,臺北市中山區林森北路３４９號４樓,0.0,商,,,1110527,土地0建物1車位1,四層,24,住宅大樓(11層含以上有電梯),住家用,鋼骨造,1021101,287.89,3,2,3,有,無,有,109227,379,坡道平面,26.66,0,從111年12月1日至113年5月31日止，租金調漲為119277承租方改為公司法人,RPOPMLRJOHHGFCA77CC
