汐止區,建物,新北市汐止區樟樹二路９１號,0.0,住,,,1110522,土地0建物1車位0,一層,15,店面(店鋪),店鋪,鋼筋混凝土構造,1050810,98.5,0,0,0,無,有,無,30000,305,,0.0,0,,RPQNMLQJOHHGFDF28CC
汐止區,建物,新北市汐止區福德二路２８號５樓,0.0,住,,,1110529,土地0建物1車位0,五層,7,套房(1房1廳1衛),住家用,鋼筋混凝土造,0821215,59.72,1,1,1,有,有,有,15000,251,,0.0,0,此為新北市社會住宅包租代管計畫之物件，評定市價租金為16667元，選擇代管方案須打9折，實際租賃契約金額為15000元。每月水電費由承租人負擔。,RPWOMLQJOHHGFDF98CC
汐止區,建物,新北市汐止區樟樹一路１２３巷３號２樓,0.0,住,,,1110521,土地0建物1車位0,見其他登記事項,5,公寓(5樓含以下無電梯),住家用,鋼筋混凝土造,0781115,152.03,3,2,2,有,有,有,30000,197,,0.0,0,,RPXOMLQJOHHGFDF09CC
中和區,房地(土地+建物),新北市中和區新北市中和區明禮街１１巷８號６樓,13.0,住,,,1110527,土地1建物1車位0,六層,21,住宅大樓(11層含以上有電梯),集合住宅,鋼筋混凝土構造,1100830,104.26,2,2,1,有,無,有,28000,269,,0.0,0,社宅3期-包租,RPUPMLQJOHHGFHF66CC
中和區,房地(土地+建物),新北市中和區景平路９８９巷２號１７樓之２,4.84,商,,,1110527,土地1建物1車位0,十七層,22,住宅大樓(11層含以上有電梯),住家用,鋼筋混凝土造,0840612,116.69,2,2,2,有,無,有,30000,257,,0.0,0,社宅3期,RPWRMLQJOHHGFHF07CC
永和區,建物,新北市永和區中正路２８３巷３４號１樓,0.0,住,,,1110517,土地0建物1車位0,一層,4,公寓(5樓含以下無電梯),住家用,加強磚造,0640615,59.0,3,2,1,有,無,有,30000,508,,0.0,0,,RPVSMLQJOHHGFHF07CC
永和區,建物,新北市永和區成功路二段１１號五樓,0.0,住,,,1110522,土地0建物0車位0,五層,5,套房(1房1廳1衛),住家用,鋼筋混凝土造,0660420,19.83,1,0,1,有,無,有,8000,403,,0.0,0,部分承租。,RPRUMLQJOHHGFHF86CC
中和區,建物,新北市中和區立德街１０１號５樓,0.0,工,,,1110510,土地0建物3車位0,五層,7,廠辦,廠房,鋼筋混凝土造,0891128,821.77,0,0,0,無,有,無,189224,230,,0.0,0,立德街97、99、101號5樓共三筆建物,RPSUMLQJOHHGFHF96CC
永和區,建物,新北市永和區成功路二段１１號五樓,0.0,住,,,1110522,土地0建物0車位0,五層,5,套房(1房1廳1衛),住家用,鋼筋混凝土造,0660420,26.44,1,0,1,有,無,有,8000,303,,0.0,0,部分承租。,RPTUMLQJOHHGFHF07CC
永和區,建物,新北市永和區成功路二段１１號五樓,0.0,住,,,1110522,土地0建物0車位0,五層,5,套房(1房1廳1衛),住家用,鋼筋混凝土造,0660420,19.83,1,0,1,有,無,有,7500,378,,0.0,0,部分承租。,RPUUMLQJOHHGFHF17CC
淡水區,房地(土地+建物)+車位,新北市淡水區濱海路二段２０２巷７５號１９樓,16.15,住,,,1110420,土地1建物1車位1,十九層,23,住宅大樓(11層含以上有電梯),集合住宅,鋼筋混凝土造,1100119,99.43,2,2,1,有,有,有,20000,201,坡道平面,33.26,0,冷氣*3窗簾*3組.熱水器*1.流理台*1.瓦斯爐*1.天然瓦斯,RPOPMLQJOHHGFEF38CC
淡水區,房地(土地+建物),新北市淡水區淡金路３８巷９０號,25.24,住,,,1110605,土地1建物1車位0,一層,11,店面(店鋪),店舖、住宅,鋼筋混凝土造,0980821,93.25999999999999,0,0,0,無,有,有,22000,236,,0.0,0,含管理費,RPSPMLQJOHHGFEF78CC
淡水區,房地(土地+建物)+車位,新北市淡水區坪頂路５２巷２０號８樓,6.25,住,,,1110605,土地1建物1車位1,八層,11,住宅大樓(11層含以上有電梯),住家用,鋼筋混凝土造,1001103,71.46,2,2,1,有,有,有,23000,322,坡道平面,0.0,0,,RPOQMLQJOHHGFEF48CC
淡水區,建物,新北市淡水區新市五路三段３８８號二十四樓,0.0,商,,,1110523,土地0建物1車位0,二十四層,29,住宅大樓(11層含以上有電梯),集合住宅,鋼筋混凝土造,1080822,74.89,1,1,1,有,有,有,15000,200,,0.0,0,本案僅建物部份屬國家住宅及都市更新中心辦理社會住宅包租代管第3期計畫,RPVQMLQJOHHGFEF56CC
淡水區,建物,新北市淡水區北新路１４１巷１７號三樓之２,0.0,住,,,1110524,土地0建物1車位0,三層,6,套房(1房1廳1衛),住家用,鋼筋混凝土造,0821118,71.57,1,1,1,有,有,有,9000,126,,0.0,0,本案僅建物部份屬國家住宅及都市更新中心辦理社會住宅包租代管第3期計畫,RPXQMLQJOHHGFEF76CC
淡水區,建物,新北市淡水區淡金路３８巷３３號三樓之２２,0.0,住,,,1110526,土地0建物1車位0,三層,22,住宅大樓(11層含以上有電梯),住家用,鋼筋混凝土造,0980218,58.47,1,1,1,有,有,有,18585,318,,0.0,0,本案僅建物部份屬國家住宅及都市更新中心辦理社會住宅包租代管第3期計畫,RPORMLQJOHHGFEF58CC
淡水區,建物,新北市淡水區新市五路三段２２２號二十六樓,0.0,商,,,1110601,土地0建物1車位0,二十六層,27,住宅大樓(11層含以上有電梯),住家用,鋼筋混凝土造,1061229,117.87,3,2,2,有,有,有,16900,143,,0.0,0,本案僅建物部份屬國家住宅及都市更新中心辦理社會住宅包租代管第3期計畫,RPPRMLQJOHHGFEF68CC
淡水區,建物,新北市淡水區鄧公路３０之６號十一樓,0.0,住,,,1110601,土地0建物1車位0,十一層,18,住宅大樓(11層含以上有電梯),住家用,鋼筋混凝土造,0860604,163.07,3,2,2,有,有,有,19000,117,,0.0,0,本案僅建物部份屬國家住宅及都市更新中心辦理社會住宅包租代管第3期計畫,RPQRMLQJOHHGFEF78CC
淡水區,房地(土地+建物)+車位,新北市淡水區中山北路一段３７４號９樓,28.1,住,,,1110601,土地1建物1車位0,九層,13,住宅大樓(11層含以上有電梯),住家用,鋼筋混凝土造,0960302,162.23,3,2,2,有,無,有,22000,136,坡道平面,28.69,0,,RPSRMLQJOHHGFEF98CC
三重區,建物,新北市三重區重新路二段８號,0.0,商,,,1110515,土地0建物2車位0,見其他登記事項,4,店面(店鋪),住家用,鋼筋混凝土造,0660715,171.0,0,2,1,有,無,無,135000,789,,0.0,0,2個門牌。租金調整:116年7月1日起調漲租金至壹拾陸萬伍仟元至121年6月30日。,RPSOMLQJOHHGFGF88CC
蘆洲區,建物,新北市蘆洲區信義路３０３號二樓,0.0,商,,,1110511,土地0建物1車位0,二層,4,公寓(5樓含以下無電梯),住家用,加強磚造,0661126,80.0,3,1,1,有,無,有,20000,250,,0.0,0,本案僅建物部份屬國家住宅及都市更新中心辦理社會住宅包租代管第3期計畫,RPTPMLQJOHHGFGF09CC
三重區,建物,新北市三重區中華路７５巷３號,0.0,住,,,1110601,土地0建物0車位0,二層,4,套房(1房1廳1衛),住家用,加強磚造,0640116,24.11,1,0,1,有,無,有,11200,465,,0.0,0,此為分租套房，第二層共分成4間，一間平均面積約為24.11平方公尺。每月垃圾收取費600元、水雜費200元皆為承租人負擔。,RPQRMLQJOHHGFGF98CC
三峽區,建物,新北市三峽區大觀路１３８號五樓,0.0,住,,,1110522,土地0建物1車位0,五層,14,住宅大樓(11層含以上有電梯),住家用,鋼筋混凝土造,0960202,120.84,3,2,2,有,有,有,25000,207,,0.0,0,,RPVNMLQJOHHGFIF66CC
新莊區,建物,新北市新莊區中平路２９２巷１弄３６號十一樓,0.0,住,,,1110513,土地0建物1車位0,十一層,18,住宅大樓(11層含以上有電梯),集合住宅,鋼筋混凝土造,1101019,84.43,2,2,1,有,有,有,21000,249,,0.0,0,,RPRNMLQJOHHGFBF18CC
林口區,建物,新北市林口區中山路９７巷１６號四樓,0.0,其他,,,1110515,土地0建物1車位0,四層,4,公寓(5樓含以下無電梯),住家用,鋼筋混凝土造,0771124,110.37,3,2,2,有,無,有,16000,145,,0.0,0,,RPVNMLQJOHHGFBF58CC
五股區,房地(土地+建物),新北市五股區成泰路一段６８號,4.27,其他,,,1110420,土地1建物1車位0,全,3,透天厝,住商用,鋼筋混凝土造,0760114,16.25,1,0,1,有,無,有,6300,388,,0.0,0,原申報書序號:C1FB11104290019建物型態為透天厝/分租套房,RPRQMLQJOHHGFBF48CC
五股區,房地(土地+建物),新北市五股區成泰路一段６８號,5.12,其他,,,1110501,土地1建物1車位0,全,3,透天厝,住商用,鋼筋混凝土造,0760114,19.49,1,0,1,有,無,有,7500,385,,0.0,0,原申報書序號:C1FB11105230049建物型態為透天厝/分租套房,RPSQMLQJOHHGFBF58CC
新莊區,建物,新北市新莊區榮華路二段８７號１２樓,0.0,住,,,1110526,土地0建物1車位0,十二層,21,住宅大樓(11層含以上有電梯),集合住宅,鋼筋混凝土造,1040601,81.18,2,1,1,有,有,有,23000,283,,0.0,0,此為新北市社會住宅包租代管計畫之物件，評定市價租金為25556元，選擇代管方案須打9折，實際租賃契約金額為23000元。水電、瓦斯費及每月管理費3000元由承租人負擔。,RPVQMLQJOHHGFBF88CC
新店區,建物,新北市新店區復興路１００號７樓,0.0,住,,,1110407,土地0建物1車位1,七層,23,住宅大樓(11層含以上有電梯),集合住宅,鋼筋混凝土構造,1050826,362.90999999999997,3,2,3,有,有,有,77000,212,坡道平面,45.7,0,,RPPNMLQJOHHGFCF08CC
新店區,房地(土地+建物),新北市新店區永安街９９號８樓之１,4.59,住,,,1110527,土地1建物1車位0,八層,13,住宅大樓(11層含以上有電梯),住家用,鋼筋混凝土造,0840908,26.3,1,1,1,有,無,有,7500,285,,0.0,0,社宅3期,RPPOMLQJOHHGFCF18CC
新店區,建物,新北市新店區中央路１５３號２９樓之２５等共１０戶,0.0,其他,,,1110602,土地0建物10車位0,二十九層,29,住宅大樓(11層含以上有電梯),住家用,鋼骨構造、鋼筋混凝土構造,1011114,884.3700000000001,20,9,10,有,有,有,238000,269,,0.0,0,本交易標的153號總樓層數為29樓、161號總樓層數為22樓。本交易標的共計10戶，153號29樓之25、161號4樓之2、161號11樓之1、161號13樓之1、161號17樓之1、161號17樓之5、161號18樓之2、161號19樓之3、161號20樓之2、161號18樓。,RPTOMLQJOHHGFCF58CC
新店區,建物,新北市新店區北新路二段１９６巷８號４樓,0.0,住,,,1110513,土地0建物1車位0,四層,4,公寓(5樓含以下無電梯),住家用,鋼筋混凝土造,,80.93,3,2,1,有,無,有,18000,222,,0.0,0,,RPVOMLQJOHHGFCF78CC
新店區,建物,新北市新店區北新路二段１０號２樓,0.0,其他,,,1110528,土地0建物1車位0,二層,4,公寓(5樓含以下無電梯),住宅,加強磚造,0641229,76.7,3,1,1,有,無,有,21000,274,,0.0,0,,RPXOMLQJOHHGFCF98CC
新店區,建物,新北市新店區花園一路三段５２巷１６號地下一樓,0.0,住,,,1110601,土地0建物1車位0,地下一層,2,公寓(5樓含以下無電梯),住家用,鋼筋混凝土造,0870609,105.84,3,2,2,有,有,有,34000,321,,0.0,0,水電瓦斯費及每月管理費330元由承租人負擔。,RPTPMLQJOHHGFCF68CC
新店區,建物,新北市新店區永安街９２-２號５樓之１,0.0,住,,,1110511,土地0建物1車位0,五層,6,套房(1房1廳1衛),住家用,鋼筋混凝土造,0861107,42.11,1,0,1,有,有,有,12000,285,,0.0,0,此為新北市社會住宅包租代管計劃之物件，評定市價租金為16700，因新北市計劃租金上限為35000，選擇代租方案須打九折且簽約租金無條件捨去至百分位，房東願以較低的金額出租，故實際租賃契約金額為12000。管理費每月0元,RPVPMLQJOHHGFCF88CC
新店區,建物,新北市新店區達觀路１４巷３號八樓之五,0.0,,山坡地保育區,丙種建築用地,1110531,土地0建物1車位0,八層,17,住宅大樓(11層含以上有電梯),住家用,鋼筋混凝土造,0850710,59.0,2,1,1,有,有,有,13500,229,,0.0,0,此為新北市社會住宅包租代管計畫之物件，評定市價租金15000元，選擇代租方案須打九折，實際租賃契約金額為13500元；水電瓦斯費由承租人負擔。,RPOQMLQJOHHGFCF28CC
板橋區,建物,新北市板橋區中山路一段５０巷３６號十二樓,0.0,其他,,,1110517,土地0建物1車位1,十二層,18,住宅大樓(11層含以上有電梯),住家用,鋼筋混凝土造,0860314,150.26999999999998,1,2,1,有,有,有,26500,176,坡道平面,0.0,0,車位面積無法分算。,RPSNMLQJOHHGFAF18CC
土城區,房地(土地+建物),新北市土城區順風路１６號３樓,50.23,住,,,1110602,土地1建物1車位0,三層,5,公寓(5樓含以下無電梯),住家用,鋼筋混凝土造,0810228,124.24,3,2,2,有,無,有,16000,129,,0.0,0,社宅3期,RPPPMLQJOHHGFAF08CC
板橋區,建物,新北市板橋區龍泉街１１０號１２樓,0.0,住,,,1110513,土地0建物1車位0,十二層,16,住宅大樓(11層含以上有電梯),住家用,鋼筋混凝土造,0840617,66.81,2,1,1,有,有,有,18000,269,,0.0,0,,RPPQMLQJOHHGFAF18CC
板橋區,建物,新北市板橋區文化路一段２８５巷２弄８號二樓,0.0,住,,,1110518,土地0建物1車位0,二層,4,公寓(5樓含以下無電梯),住家用,加強磚造,,69.08,3,1,1,有,無,有,18000,261,,0.0,0,,RPQQMLQJOHHGFAF28CC
土城區,建物,新北市土城區中央路一段９６巷１１號九樓,0.0,住,,,1110515,土地0建物1車位0,九層,9,套房(1房1廳1衛),住家用,鋼筋混凝土造,0850613,42.91,1,0,1,有,有,有,10000,233,,0.0,0,租金含管理費。,RPWNMLRJOHHGFAF68CC
板橋區,建物,新北市板橋區新生街８７巷３０號,0.0,住,,,1110607,土地0建物1車位0,一層,5,公寓(5樓含以下無電梯),住家用,鋼筋混凝土造,0730625,136.2,5,2,2,有,無,有,40000,294,,0.0,0,,RPPQMLRJOHHGFAF28CC
板橋區,建物,新北市板橋區大仁街５３巷２弄３號５樓,0.0,住,,,1110526,土地0建物1車位0,五層,5,公寓(5樓含以下無電梯),住家用,鋼筋混凝土造,0721015,103.37,3,2,1,有,無,有,21000,203,,0.0,0,此為新北市社會住宅包租代管計畫之物件，評定市價租金為23334元，選擇代管方案須打9折，實際租賃契約金額為21000元。每月水電、瓦斯費由承租人負擔。,RPVQMLRJOHHGFAF88CC
鶯歌區,房地(土地+建物),新北市鶯歌區福德四街１５號四樓,19.03,住,,,1110521,土地2建物1車位0,四層,5,公寓(5樓含以下無電梯),住家用,鋼筋混凝土造,,82.0,3,2,1,有,無,有,10000,122,,0.0,0,,RPUOMLRJOHHGFIF86DC
汐止區,建物,新北市汐止區汐萬路二段１２２巷１４號,0.0,,山坡地保育區,丁種建築用地,1110601,土地0建物1車位0,五層,5,廠辦,工商用,鋼筋混凝土造,0770528,843.52,0,0,1,有,無,有,200000,237,,0.0,0,,RPXNMLRJOHHGFDF56DC
永和區,建物,新北市永和區國中路２號一樓,0.0,其他,,,1110602,土地0建物1車位0,一層,12,店面(店鋪),店舖及室內停車位,鋼筋混凝土造,0780817,298.74,0,0,0,無,有,有,30000,100,,0.0,0,,RPXPMLRJOHHGFHF17DC
新店區,建物,新北市新店區安和路３段９巷９號２樓,0.0,住,,,1110604,土地0建物1車位0,二層,7,華廈(10層含以下有電梯),住家用,鋼筋混凝土造,0840812,149.41,3,2,2,有,有,有,20000,134,,0.0,0,此為新北市社會住宅包租代管計劃之物件，評定市價租金為30194，因新北市計劃租金上限為22500，選擇代租方案須打九折且簽約租金無條件捨去至百分位，房東願以較低的金額出租，故實際租賃契約金額為20000。管理費每月1940元,RPSNMLRJOHHGFCF48CC
新店區,建物,新北市新店區安興路１２５之９號１０樓,0.0,其他,,,1110525,土地0建物1車位0,十層,14,廠辦,工商服務業（工商服務及展覽業）,鋼筋混凝土構造,1050406,100.76,0,0,0,無,有,無,30000,298,,0.0,0,,RPTPMLRJOHHGFCF78CC
新店區,房地(土地+建物)+車位,新北市新店區中正路５２７號９樓,0.0,工,,,1110526,土地0建物1車位2,九層,10,廠辦,工業用,鋼筋混凝土造,0800314,283.93,0,0,0,無,有,無,73300,258,坡道平面,0.0,0,分租含公設持份1/2,RPVPMLRJOHHGFCF98CC
新店區,建物,新北市新店區中正路５２７號９樓,0.0,工,,,1110526,土地0建物1車位0,九層,10,廠辦,工業用,鋼筋混凝土造,0800314,283.93,0,0,0,無,有,無,80000,282,,0.0,0,短租分租含公設持份1/2,RPWPMLRJOHHGFCF09CC
新店區,建物,新北市新店區安祥路１１０巷６５號１２樓,0.0,,山坡地保育區,丙種建築用地,1110527,土地0建物1車位0,十二層,17,住宅大樓(11層含以上有電梯),住家用,鋼筋混凝土造,0850120,113.9,2,1,1,有,有,有,15000,132,,0.0,0,此為新北市社會住宅包租代管計畫之物件，評定市價租金為16667元，選擇代管方案須打9折，實際租賃契約金額為15000元。水電費及每月管理費1300元由承租人負擔。,RPXPMLRJOHHGFCF56CC
新莊區,建物,新北市新莊區中正路３４７巷２１號,0.0,住,,,1110520,土地0建物1車位0,一層,14,店面(店鋪),商業用,鋼筋混凝土造,0840218,59.06,1,1,1,有,有,無,21000,356,,0.0,0,,RPQNMLRJOHHGFBF18CC
林口區,建物,新北市林口區中山路５６９號二樓,0.0,住,,,1110531,土地0建物1車位0,二層,12,住宅大樓(11層含以上有電梯),住家用,鋼筋混凝土造,0950705,115.39999999999999,3,2,2,有,有,有,22800,198,,0.0,0,此為新北市社會住宅包租代管計畫之物件，評定市價租金25334元，選擇代租方案須打九折，實際租賃契約金額為22800元；水電瓦斯費及每月管理費2200元由承租人負擔。,RPOOMLRJOHHGFBF08CC
林口區,房地(土地+建物),新北市林口區忠孝路２８２號,16.87,商,,,1110514,土地1建物1車位0,見其他登記事項,15,店面(店鋪),一般零售業或服務業,鋼筋混凝土造,1090312,161.76,0,0,0,無,有,無,90000,556,,0.0,0,,RPWOMLRJOHHGFBF88CC
新莊區,建物,新北市新莊區新北大道四段１９１號７樓,0.0,商,,,1110526,土地0建物1車位1,七層,28,住宅大樓(11層含以上有電梯),一般事務所,鋼筋混凝土造,1050920,224.37,3,2,2,有,有,有,54582,243,坡道平面,40.48,0,,RPPQMLRJOHHGFBF38CC
新莊區,建物,新北市新莊區公園路１１０號七樓,0.0,住,,,1110522,土地0建物1車位0,七層,8,華廈(10層含以下有電梯),住家用,鋼筋混凝土造,0780626,134.7,3,2,2,有,有,有,23000,171,,0.0,0,租金含管理費。,RPQRMLRJOHHGFBF58CC
林口區,房地(土地+建物),新北市林口區中山路６７９號１３樓,8.62,其他,,,1110606,土地1建物1車位0,十三層,19,住宅大樓(11層含以上有電梯),集合住宅,鋼筋混凝土造,1051018,76.54,1,1,1,有,有,有,22000,287,,0.0,0,含管理費,RPWRMLRJOHHGFBF56CC
三峽區,建物,新北市三峽區民生街１巷１之７３號五樓,0.0,住,,,1110402,土地0建物1車位1,五層,12,住宅大樓(11層含以上有電梯),集合住宅,鋼筋混凝土造,1100603,152.68,3,2,2,有,有,有,30720,201,坡道平面,30.79,0,租金含管理費。房屋用途做辦公室使用。,RPRQMLRJOHHGFIF66CC
三重區,房地(土地+建物),新北市三重區三民街９９號１樓,33.7,住,,,1110510,土地3建物1車位0,一層,5,店面(店鋪),商業用,鋼筋混凝土造,0671124,97.0,0,0,0,無,無,無,64000,660,,0.0,0,,RPUOMLRJOHHGFGF56CC
三重區,建物,新北市三重區忠孝路三段９９巷１３號五樓,0.0,住,,,1110602,土地0建物1車位0,五層,5,公寓(5樓含以下無電梯),住家用,鋼筋混凝土造,0810326,117.34,4,2,1,有,無,有,20000,170,,0.0,0,此為新北市社會住宅包租代管計畫之物件，評定市價租金22223元，選擇代租方案須打九折，實際租賃契約金額為20000元；水電瓦斯費由承租人負擔。,RPVOMLRJOHHGFGF66CC
三重區,建物,新北市三重區光復路一段６１巷２７號３樓之２,0.0,工,,,1110324,土地0建物1車位3,三層,13,廠辦,工業用,鋼筋混凝土造,0841019,826.05,2,1,0,有,有,有,157500,191,坡道平面,148.66,0,三戶打通，沿用申報序號:C1FG11104220034,RPQPMLRJOHHGFGF88CC
三重區,建物,新北市三重區光復路１段８５號６樓,0.0,工,,,1110411,土地0建物1車位1,六層,10,廠辦,工業用,鋼筋混凝土造,0801220,463.59000000000003,8,1,1,有,有,有,99750,215,坡道平面,66.89,0,,RPSPMLRJOHHGFGF09CC
三重區,建物,新北市三重區仁忠街１１號,0.0,住,,,1110525,土地0建物1車位0,一層,5,公寓(5樓含以下無電梯),住商用,鋼筋混凝土造,0701230,75.0,3,1,1,有,無,有,16000,213,,0.0,0,此為新北市社會住宅包租代管計畫之物件，評定市價租金為17778元，選擇代管方案須打9折，實際租賃契約金額為16000元。每月水電費由承租人負擔。,RPXQMLRJOHHGFGF07CC
淡水區,房地(土地+建物),新北市淡水區新民街１９巷６０號１２樓,5.58,住,,,1110606,土地1建物1車位0,十二層,14,住宅大樓(11層含以上有電梯),住家用,鋼筋混凝土造,0891027,30.84,1,0,0,無,有,有,9000,292,,0.0,0,,RPXOMLRJOHHGFEF66CC
淡水區,房地(土地+建物),新北市淡水區中正東路一段１３７號１０樓之６,4.52,商,,,1110529,土地1建物1車位0,十層,21,住宅大樓(11層含以上有電梯),住家用,鋼筋混凝土造,0940714,55.769999999999996,1,1,1,有,有,有,16000,287,,0.0,0,,RPTPMLRJOHHGFEF98CC
淡水區,建物,新北市淡水區學府路１３６巷４０弄２４號五樓之２,0.0,住,,,1110519,土地0建物1車位0,五層,5,公寓(5樓含以下無電梯),住家用,鋼筋混凝土造,0790315,32.56,1,1,1,有,無,有,6000,184,,0.0,0,,RPQRMLRJOHHGFEF88CC
中和區,建物,新北市中和區中正路８２９號１６樓之１,0.0,住,,,1110525,土地0建物1車位0,十六層,22,住宅大樓(11層含以上有電梯),住家用,鋼筋混凝土造,0880915,87.13999999999999,2,1,1,有,有,有,25000,287,,0.0,0,此為新北市社會住宅包租代管計劃之物件，評定市價租金為27800，因新北市計劃租金上限為35000，選擇代租方案須打九折且簽約租金無條件捨去至百分位，實際租賃契約金額25000。管理費每月950元另計,RPWOMLRJOHHGFHF86CC
中和區,建物,新北市中和區連城路４６９巷２１弄９號五樓,0.0,住,,,1110524,土地0建物1車位0,五層,5,公寓(5樓含以下無電梯),住家用,鋼筋混凝土造,0730706,98.89,3,2,1,有,無,有,15000,152,,0.0,0,,RPPPMLRJOHHGFHF88CC
中和區,建物,新北市中和區景安路２０８巷２２號,0.0,住,,,1110520,土地0建物0車位0,一層,4,套房(1房1廳1衛),住家用,加強磚造,0600317,16.0,1,0,1,有,無,有,10000,625,,0.0,0,部分承租。租金含水費。,RPQQMLRJOHHGFHF09CC
永和區,建物,新北市永和區永和路二段１６６號七樓之八,0.0,住,,,1110515,土地0建物1車位0,七層,19,套房(1房1廳1衛),一般事務所,鋼骨鋼筋混凝土構造,1000422,38.42,1,1,1,有,有,有,20000,521,,0.0,0,,RPXQMLRJOHHGFHF17CC
中和區,建物,新北市中和區景安路２４７巷１２號三樓,0.0,住,,,1110517,土地0建物1車位0,三層,14,住宅大樓(11層含以上有電梯),住家用,鋼筋混凝土造,0970710,65.81,2,2,1,有,有,有,24500,372,,0.0,0,租金含管理費。,RPPRMLRJOHHGFHF09CC
中和區,建物,新北市中和區橋和路１１５號１樓,0.0,工,,,1110521,土地0建物1車位0,一層,10,廠辦,廠房、辦公室,鋼筋混凝土造,0911018,238.82,0,0,0,無,有,無,78750,330,,0.0,0,,RPVRMLRJOHHGFHF07CC
汐止區,建物,新北市汐止區樟樹二路３６０號十六樓之５,0.0,其他,,,1110524,土地0建物1車位1,十六層,28,住宅大樓(11層含以上有電梯),集合住宅,鋼筋混凝土構造,1100419,123.77,2,2,1,有,有,有,25000,202,坡道平面,39.19,0,,RPTNMLRJOHHGFDF68CC
汐止區,建物,新北市汐止區民族六街４巷１４號５樓,0.0,住,,,1110601,土地0建物1車位0,五層,5,公寓(5樓含以下無電梯),住家用,鋼筋混凝土造,0701219,89.59,3,2,1,有,無,有,16000,179,,0.0,0,,RPSNMLSJOHHGFDF68CC
汐止區,建物,新北市汐止區南陽街１０５.１０７號,0.0,工,,,1110603,土地0建物1車位0,全,6,透天厝,工商用,鋼筋混凝土造,0700819,551.22,0,0,0,無,無,無,280000,508,,0.0,0,含臨時門牌103號 約1302.48平方公尺,RPSQMLSJOHHGFDF98CC
汐止區,建物,新北市汐止區弘道街５３巷１４弄２號４樓,0.0,住,,,1110531,土地0建物1車位0,四層,5,公寓(5樓含以下無電梯),住家用,鋼筋混凝土造,0700721,112.67,3,2,2,有,無,有,28000,249,,0.0,0,,RPXQMLSJOHHGFDF86CC
板橋區,房地(土地+建物)+車位,新北市板橋區漢生東路２３２號２５樓,7.66,住,,,1110511,土地1建物1車位1,二十五層,29,住宅大樓(11層含以上有電梯),住家用,鋼骨鋼筋混凝土造,0980724,107.88,2,2,1,有,有,有,38000,352,坡道機械,12.69,0,,RPSPMLSJOHHGFAF68DC
永和區,建物,新北市永和區民樂街２５巷７號４樓,0.0,住,,,1110526,土地0建物1車位0,四層,5,公寓(5樓含以下無電梯),住家用,鋼筋混凝土造,0690602,89.85,3,2,2,有,無,有,22000,245,,0.0,0,,RPRPMLSJOHHGFHF56CC
永和區,建物,新北市永和區自強街２６號四樓之一,0.0,住,,,1110520,土地0建物1車位0,四層,7,套房(1房1廳1衛),住家用,鋼筋混凝土造,0941130,35.129999999999995,1,1,1,有,有,有,15000,427,,0.0,0,,RPWPMLSJOHHGFHF07CC
中和區,建物,新北市中和區華福街９號３樓,0.0,住,,,1110527,土地0建物1車位0,三層,4,公寓(5樓含以下無電梯),住家用,加強磚造,0651007,104.25,3,1,1,有,無,有,17000,163,,0.0,0,,RPOQMLSJOHHGFHF98CC
中和區,建物,新北市中和區景安路１４５號２樓,0.0,住,,,1110527,土地0建物1車位0,二層,4,公寓(5樓含以下無電梯),住家用,鋼筋混凝土造,0660620,71.06,2,1,1,有,無,有,17500,246,,0.0,0,,RPPQMLSJOHHGFHF09CC
中和區,建物,新北市中和區景平路７０３巷２弄１號３樓,0.0,住,,,1110527,土地0建物1車位0,三層,5,公寓(5樓含以下無電梯),住家用,鋼筋混凝土造,0670622,96.58,3,2,1,有,無,有,20000,207,,0.0,0,,RPQQMLSJOHHGFHF56CC
中和區,建物,新北市中和區安平路１１７號１５樓,0.0,其他,,,1110527,土地0建物1車位0,十五層,15,住宅大樓(11層含以上有電梯),住家用,鋼筋混凝土造,0820205,75.61,2,1,1,有,有,有,20000,265,,0.0,0,,RPRQMLSJOHHGFHF66CC
中和區,建物,新北市中和區華新街１０９巷２６號１０樓,0.0,住,,,1110530,土地0建物1車位0,十層,14,住宅大樓(11層含以上有電梯),集合住宅,鋼筋混凝土造,0850307,90.44,3,2,2,有,有,有,21000,232,,0.0,0,,RPSQMLSJOHHGFHF76CC
