五股區,建物,新北市五股區工商路１７２號八樓,0.0,其他,,,1110507,土地0建物1車位1,八層,9,華廈(10層含以下有電梯),住家用,鋼筋混凝土造,0861212,90.86,2,1,1,有,有,有,19500,239,坡道機械,19.83,2500,本案僅建物部份屬國家住宅及都市更新中心辦理社會住宅包租代管第3期計劃原編號C1FB11105250022,RPOSMLTLOHHGFBF88CC
林口區,建物,新北市林口區忠福路１２７號３樓,0.0,住,,,1110624,土地0建物1車位0,三層,7,華廈(10層含以下有電梯),集合住宅,鋼筋混凝土造,1100628,94.74,2,1,1,有,有,有,25000,264,,0.0,0,此為新北市社會住宅包租代管計畫之物件，評定市價租金為27778元，選擇代管方案須打9折，實際租賃契約金額為25000元。每月水電瓦斯費由承租人負擔。,RPPSMLTLOHHGFBF98CC
中和區,建物,新北市中和區景平路４９０號１３樓之５,0.0,其他,,,1110628,土地0建物1車位0,十三層,19,套房(1房1廳1衛),住家用,鋼骨鋼筋混凝土造,0970501,42.69,1,0,1,有,有,有,16600,389,,0.0,0,此為新北市社會住宅包租代管計劃之物件，評定市價租金為18474，因新北市計劃租金上限為22500，選擇代租方案須打九折且簽約租金無條件捨去至百分位，實際租賃契約金額16600。管理費每月1291元租賃期間111.7.1-112.4.14，未滿10期機車車位一位，租賃期間無償使用,RPRQMLTLOHHGFHF96CC
中和區,建物,新北市中和區華新街１０９巷４０號１０樓之３,0.0,住,,,1110629,土地0建物1車位0,十層,14,套房(1房1廳1衛),住家用,鋼筋混凝土造,0850719,49.59,1,1,1,有,有,有,13000,262,,0.0,0,此為新北市社會住宅包租代管計劃之物件，評定市價租金為20227，因新北市計劃租金上限為22500，選擇代租方案須打九折且簽約租金無條件捨去至百分位，房東願以較低的金額出租，故實際租賃契約金額為13000。管理費0元,RPTQMLTLOHHGFHF17CC
永和區,建物,新北市永和區成功路一段２８巷１０號三樓,0.0,住,,,1110612,土地0建物0車位0,三層,5,套房(1房1廳1衛),住家用,加強磚造,0660323,18.0,1,0,1,有,無,有,8000,444,,0.0,0,部分承租。,RPVQMLTLOHHGFHF37CC
永和區,建物,新北市永和區中正路９３號十五樓之一,0.0,住,,,1110617,土地0建物1車位0,十五層,19,住宅大樓(11層含以上有電梯),住家用,鋼筋混凝土造,0900411,94.87,3,2,2,有,有,有,27000,285,,0.0,0,,RPURMLTLOHHGFHF37CC
中和區,建物,新北市中和區連城路６０１號４樓之１,0.0,住,,,1110617,土地0建物1車位0,四層,13,住宅大樓(11層含以上有電梯),住家用,鋼筋混凝土造,0960212,102.55,2,1,1,有,有,有,23000,224,,0.0,0,此為新北市社會住宅包租代管計畫之物件，評定市價租金為25556元，選擇代管方案須打9折，實際租賃契約金額為23000元。水電費及每月管理費1861元由承租人負擔。,RPWRMLTLOHHGFHF57CC
永和區,建物,新北市永和區永利路７２巷２４號十二樓,0.0,住,,,1110612,土地0建物1車位0,十二層,14,住宅大樓(11層含以上有電梯),住家用,鋼筋混凝土造,0960207,89.99,2,2,1,有,有,有,28000,311,,0.0,0,租金含管理費。,RPXRMLTLOHHGFHF67CC
中和區,建物,新北市中和區員山路４２３巷１４弄５號,0.0,住,,,1110617,土地0建物1車位0,一層,5,公寓(5樓含以下無電梯),住家用,鋼筋混凝土造,0720226,92.35,3,2,2,有,無,有,21000,227,,0.0,0,此為新北市社會住宅包租代管計畫之物件，評定市價租金為23334元，選擇代管方案須打9折，實際租賃契約金額為21000元。每月水電瓦斯、網路費由承租人負擔。,RPOSMLTLOHHGFHF86CC
永和區,建物,新北市永和區秀朗路二段１４３號八樓,0.0,住,,,1110612,土地0建物1車位0,八層,24,住宅大樓(11層含以上有電梯),集合住宅,鋼骨鋼筋混凝土構造,1080805,109.36,2,2,1,有,有,有,30000,274,,0.0,0,租金含管理費。,RPPSMLTLOHHGFHF96CC
汐止區,建物,新北市汐止區建成路１４２巷４３號十二樓,0.0,住,,,1110615,土地0建物1車位0,十二層,14,住宅大樓(11層含以上有電梯),住家用,鋼筋混凝土造,0851116,71.32000000000001,2,2,1,有,有,有,24000,337,,0.0,0,租金含管理費。,RPQNMLTLOHHGFDF78CC
汐止區,建物,新北市汐止區工建路１２４號８樓,0.0,住,,,1110617,土地0建物1車位0,八層,20,住宅大樓(11層含以上有電梯),住家用,鋼筋混凝土造,0860502,90.2,2,2,2,有,有,有,23000,255,,0.0,0,,RPPOMLTLOHHGFDF78CC
淡水區,建物,新北市淡水區沙崙路一段１２６巷９６號十四樓,0.0,住,,,1110615,土地0建物1車位1,十四層,23,住宅大樓(11層含以上有電梯),住家用,鋼筋混凝土造,1050816,154.81,2,2,2,有,有,有,25000,161,坡道平面,36.52,0,租金含管理費。兩位承租方，輸入其中一位資料申報。,RPPNMLTLOHHGFEF78CC
淡水區,房地(土地+建物)+車位,新北市淡水區新市五路三段２１０號６樓,8.34,其他,,,1110626,土地1建物1車位1,六層,27,住宅大樓(11層含以上有電梯),住家用,鋼筋混凝土造,1061229,93.85,2,2,1,有,有,有,17000,181,坡道機械,15.42,0,含管理費及清潔費,RPRNMLTLOHHGFEF98CC
淡水區,建物,新北市淡水區北新路１１９巷１１號六樓,0.0,住,,,1110624,土地0建物1車位0,六層,14,住宅大樓(11層含以上有電梯),住家用,鋼筋混凝土造,0840612,124.05,3,2,2,有,有,有,17000,137,,0.0,0,此為新北市社會住宅包租代管計畫之物件，評定市價租金18889元，選擇代租方案須打九折，實際租賃契約金額為17000元；水電費及每月管理費1700元由承租人負擔。,RPTNMLTLOHHGFEF56CC
淡水區,房地(土地+建物),新北市淡水區新市五路三段２５６號２４樓,7.59,其他,,,1110628,土地1建物1車位0,二十四層,26,住宅大樓(11層含以上有電梯),住家用,鋼筋混凝土造,1061229,87.1,2,2,1,有,有,有,17000,195,,0.0,0,含管理費及清潔費,RPUNMLTLOHHGFEF66CC
淡水區,建物,新北市淡水區中正路一段６２巷２６號三樓,0.0,住,,,1110625,土地0建物1車位0,三層,4,公寓(5樓含以下無電梯),住家用,加強磚造,0640207,96.46,3,2,1,有,無,有,8000,83,,0.0,0,水電瓦斯費及網路費由承租人負擔。,RPXNMLTLOHHGFEF96CC
淡水區,建物,新北市淡水區新春街１４６之１３號十一樓,0.0,住,,,1110610,土地0建物1車位0,十一層,18,住宅大樓(11層含以上有電梯),住家用,鋼筋混凝土造,1030423,131.06,3,2,2,有,有,有,22000,168,,0.0,0,租金含管理費。,RPOOMLTLOHHGFEF78CC
淡水區,房地(土地+建物)+車位,新北市淡水區新市五路三段１６８號２１樓,8.44,住,,,1110627,土地1建物1車位1,二十一層,27,住宅大樓(11層含以上有電梯),住家用,鋼筋混凝土造,1061229,124.24000000000001,2,1,1,有,有,無,14000,113,坡道平面,30.84,0,,RPOPMLTLOHHGFEF88CC
淡水區,房地(土地+建物)+車位,新北市淡水區濱海路三段１４８巷２９號８樓,38.87,住,,,1110620,土地1建物1車位1,八層,11,住宅大樓(11層含以上有電梯),住家用,鋼筋混凝土造,1030613,175.82999999999998,3,2,2,有,有,有,21000,119,坡道平面,29.24,0,,RPPPMLTLOHHGFEF98CC
淡水區,房地(土地+建物),新北市淡水區重建街２１０號２樓,24.45,住,,,1110621,土地1建物1車位0,二層,5,公寓(5樓含以下無電梯),住家用,鋼筋混凝土造,0710105,52.12,2,1,2,有,無,有,13000,249,,0.0,0,,RPRPMLTLOHHGFEF56CC
淡水區,房地(土地+建物)+車位,新北市淡水區新市三路一段１３６號１５樓,12.03,住,,,1110623,土地1建物1車位1,十五層,23,住宅大樓(11層含以上有電梯),住家用,鋼筋混凝土造,1080222,86.8,1,1,1,有,有,有,17800,205,坡道平面,25.02,0,,RPWPMLTLOHHGFEF07CC
三芝區,建物,新北市三芝區淡金路二段７９號十一樓,0.0,住,,,1110623,土地0建物1車位0,十一層,12,住宅大樓(11層含以上有電梯),住家用,鋼筋混凝土造,0850430,87.15,3,2,2,有,有,有,9000,103,,0.0,0,本案僅建物部份屬國家住宅及都市更新中心辦理社會住宅包租代管第3期計畫,RPPQMLTLOHHGFEF09CC
淡水區,房地(土地+建物)+車位,新北市淡水區新市三路二段２５７號１９樓,8.72,商,,,1110626,土地1建物1車位1,十九層,29,住宅大樓(11層含以上有電梯),住家用,鋼筋混凝土造,1070525,129.15,2,1,1,有,有,有,19500,151,坡道平面,30.47,0,,RPQQMLTLOHHGFEF56CC
淡水區,建物,新北市淡水區北新路１４１巷３４號二樓,0.0,住,,,1110625,土地0建物1車位0,二層,13,套房(1房1廳1衛),住家用,鋼筋混凝土造,0841005,27.720000000000002,1,0,1,有,有,有,8000,289,,0.0,0,本案僅建物部份屬國家住宅及都市更新中心辦理社會住宅包租代管第3期計畫,RPSQMLTLOHHGFEF76CC
板橋區,建物,新北市板橋區中山路二段４０７之２號,0.0,工,,,1110610,土地0建物1車位0,一層,14,辦公商業大樓,一般辦公室,鋼筋混凝土造,0960907,77.77,1,1,1,有,有,有,30000,386,,0.0,0,租金含管理費。,RPPNMLTLOHHGFAF38CC
土城區,建物,新北市土城區學府路一段２４巷９號１０樓,0.0,住,,,1110623,土地0建物1車位0,十層,12,住宅大樓(11層含以上有電梯),住家用,鋼筋混凝土造,0850313,95.14,3,2,2,有,有,有,20000,210,,0.0,0,此為新北市社會住宅包租代管計劃之物件，評定市價租金為22500，因新北市計劃租金上限為35000，選擇代租方案須打九折且簽約租金無條件捨去至百分位，房東願以較低的金額出租，故實際租賃契約金額為20000。管理費每月1397元,RPPOMLTLOHHGFAF48CC
板橋區,建物,新北市板橋區漢生東路１９３巷８３弄２號５樓,0.0,住,,,1110625,土地0建物1車位0,五層,5,公寓(5樓含以下無電梯),住家用,鋼筋混凝土造,0690915,95.3,3,1,1,有,無,有,19000,199,,0.0,0,此為新北市社會住宅包租代管計劃之物件，評定市價租金為30100，因新北市計劃租金上限為35000，選擇代租方案須打九折且簽約租金無條件捨去至百分位，房東願以較低的金額出租，故實際租賃契約金額為19000。,RPTOMLTLOHHGFAF88CC
板橋區,建物,新北市板橋區文化路一段１８８巷９弄５號３樓,0.0,住,,,1110624,土地0建物1車位0,三層,4,公寓(5樓含以下無電梯),住家用,加強磚造,,65.64,2,1,1,有,無,有,18500,282,,0.0,0,,RPPPMLTLOHHGFAF58CC
板橋區,建物,新北市板橋區縣民大道一段１８５之８號５樓,0.0,商,,,1110622,土地0建物1車位0,五層,15,住宅大樓(11層含以上有電梯),住家用,鋼筋混凝土造,0970808,81.69,2,2,1,有,有,有,25000,306,,0.0,0,每月新台幣貳萬伍仟元整含稅，含管理費。,RPSQMLTLOHHGFAF98CC
新店區,建物,新北市新店區福園街１５號,0.0,住,,,1110617,土地0建物1車位0,見其他登記事項,5,公寓(5樓含以下無電梯),見使用執照,鋼筋混凝土造,0680704,103.26,3,1,1,有,無,有,34000,329,,0.0,0,租賃期間含免租金裝潢期。,RPQNMLTLOHHGFCF68CC
新店區,建物,新北市新店區安和路二段２０７號３樓,0.0,住,,,1110623,土地0建物1車位0,三層,16,住宅大樓(11層含以上有電梯),住家用,鋼筋混凝土造,0800629,175.37,3,1,2,有,有,有,27000,154,,0.0,0,,RPWNMLTLOHHGFCF66CC
新店區,建物,新北市新店區安祥路７３巷３號,0.0,,山坡地保育區,丙種建築用地,1110624,土地0建物1車位0,一層,8,其他,一般事務所,鋼筋混凝土造,0970319,90.51,2,2,1,有,有,有,23000,254,,0.0,0,,RPXNMLTLOHHGFCF76CC
深坑區,建物,新北市深坑區北深路三段１２４號２樓,0.0,住,,,1110620,土地0建物1車位0,二層,4,公寓(5樓含以下無電梯),住家用,鋼筋混凝土造,,71.53,3,1,1,有,無,有,11000,154,,0.0,0,此為新北市社會住宅包租代管計畫之物件，評定市價租金為12223元，選擇代管方案須打9折，實際租賃契約金額為11000元。每月水電費由承租人負擔。,RPSOMLTLOHHGFCF98CC
新店區,建物,新北市新店區光華街８巷２６號７樓,0.0,住,,,1110601,土地0建物1車位0,七層,7,華廈(10層含以下有電梯),住家用,鋼筋混凝土造,0860111,99.1,3,2,1,有,有,有,16200,163,,0.0,0,,RPUOMLTLOHHGFCF56CC
新店區,建物,新北市新店區溪園路３６５之１４號５樓,0.0,住,,,1110601,土地0建物1車位0,五層,14,住宅大樓(11層含以上有電梯),住家用,鋼筋混凝土造,0921201,100.94000000000001,2,2,2,有,有,有,29400,291,,0.0,0,,RPXOMLTLOHHGFCF86CC
新店區,建物,新北市新店區寶宏路３０號四樓,0.0,工,,,1110627,土地0建物0車位0,四層,4,套房(1房1廳1衛),住家用,鋼筋混凝土造,0640820,23.49,1,0,1,有,無,有,7000,298,,0.0,0,此為分租套房，第四層共分成4間，一間平均面積約為23.49平方公尺。每月管理維護費200元由承租人負擔。,RPWNMLKMOHHGFCF48CC
新店區,建物,新北市新店區中興路三段２２１號十六樓,0.0,住,,,1110605,土地0建物1車位0,十六層,25,住宅大樓(11層含以上有電梯),住家用,鋼筋混凝土造,0851007,75.56,1,1,1,有,有,有,20000,265,,0.0,0,,RPWOMLKMOHHGFCF58CC
新店區,建物,新北市新店區永安街８３巷５號４樓,0.0,住,,,1110625,土地0建物1車位0,四層,14,住宅大樓(11層含以上有電梯),住家用,鋼筋混凝土造,0820310,147.84,4,2,2,有,有,有,26000,176,,0.0,0,此為新北市社會住宅包租代管計畫之物件，評定市價租金為28889元，選擇代管方案須打9折，實際租賃契約金額為26000元。水電瓦斯費及每月管理費2009元由承租人負擔。,RPWPMLKMOHHGFCF68CC
新店區,建物,新北市新店區中央三街１２１巷８號二十六樓,0.0,住,,,1110617,土地0建物1車位0,二十六層,27,住宅大樓(11層含以上有電梯),住家用,鋼筋混凝土造,0890105,76.4,1,2,1,有,有,有,22000,288,,0.0,0,租賃範圍不含車位，已扣除車位面積。租金含管理費。,RPXPMLKMOHHGFCF78CC
板橋區,建物,新北市板橋區藝文街１７１號十六樓,0.0,住,,,1110617,土地0建物1車位1,十六層,19,住宅大樓(11層含以上有電梯),集合住宅,鋼筋混凝土造,1100127,149.32,3,2,2,有,有,有,33000,221,坡道平面,36.69,0,租金含管理費。,RPPNMLKMOHHGFAF57CC
土城區,建物,新北市土城區南天母路１８之１號五樓,0.0,其他,,,1110613,土地0建物1車位0,五層,7,華廈(10層含以下有電梯),住家用,鋼筋混凝土造,0850823,104.94,2,1,1,有,有,有,18000,172,,0.0,0,租金含管理費。至111/12/31,RPRNMLKMOHHGFAF77CC
土城區,房地(土地+建物),新北市土城區明德路二段５８號６樓之１,5.45,住,,,1110623,土地3建物1車位0,六層,21,住宅大樓(11層含以上有電梯),住家用,鋼骨造,0870221,64.13,3,2,1,有,有,有,26000,405,,0.0,0,,RPPQMLKMOHHGFAF87CC
板橋區,建物,新北市板橋區大觀路二段 １９ 巷 ８７ 號四樓,0.0,住,,,1110510,土地0建物1車位0,四層,4,公寓(5樓含以下無電梯),住家用,加強磚造,,80.54,3,2,1,有,無,有,10000,124,,0.0,0,,RPVRMLKMOHHGFAF58CC
土城區,建物,新北市土城區延和路１８巷１５弄７號三樓,0.0,住,,,1110628,土地0建物1車位0,三層,5,公寓(5樓含以下無電梯),住家用,鋼筋混凝土造,0770803,116.12,3,2,2,有,無,有,18000,155,,0.0,0,此為新北市社會住宅包租代管計畫之物件，評定市價租金20000元，選擇代租方案須打九折，實際租賃契約金額為18000元；水電費由承租人負擔。,RPPSMLKMOHHGFAF08CC
板橋區,建物,新北市板橋區沙崙街２９之１１號２樓,0.0,住,,,1110614,土地0建物1車位0,二層,9,華廈(10層含以下有電梯),住家用,鋼筋混凝土造,0910509,112.04,3,2,2,有,有,有,21000,187,,0.0,0,此為新北市社會住宅包租代管計畫之物件，評定市價租金為23334元，選擇代管方案須打9折，實際租賃契約金額為21000元。水電瓦斯費及每月管理費1745元由承租人負擔。,RPQSMLKMOHHGFAF18CC
板橋區,建物,新北市板橋區貴興路１０６巷２５號,0.0,住,,,1110617,土地0建物1車位0,一層,6,華廈(10層含以下有電梯),住家用,鋼筋混凝土造,0900103,124.6,3,2,2,有,有,有,25000,201,,0.0,0,租賃範圍不含車位，已扣除車位面積。,RPSSMLKMOHHGFAF38CC
土城區,建物,新北市土城區龍山一街２７號１３樓,0.0,住,,,1110625,土地0建物1車位0,十三層,14,住宅大樓(11層含以上有電梯),集合住宅,鋼筋混凝土造,1090715,69.19,2,1,1,有,有,有,12000,173,,0.0,0,此為新北市社會住宅包租代管計畫之物件，評定市價租金為13334元，選擇代管方案須打9折，實際租賃契約金額為12000元。每月水電費由承租人負擔。,RPTSMLKMOHHGFAF48CC
淡水區,建物,新北市淡水區沙崙路一段１０７號八樓,0.0,住,,,1110617,土地0建物1車位1,八層,23,住宅大樓(11層含以上有電梯),住家用,鋼筋混凝土造,1080306,125.59,2,2,2,有,有,有,17000,135,坡道平面,30.1,0,租金含管理費。,RPROMLKMOHHGFEF28CC
淡水區,房地(土地+建物),新北市淡水區大忠街８５號二樓之８,5.37,住,,,1110626,土地1建物1車位0,二層,14,套房(1房1廳1衛),商業用,鋼筋混凝土造,0790828,31.080000000000002,1,1,1,有,有,有,5650,182,,0.0,0,租金5650元含管理費。,RPUOMLKMOHHGFEF58CC
淡水區,建物,新北市淡水區北新路１６９巷５８號十五樓,0.0,住,,,1110619,土地0建物1車位0,十五層,18,套房(1房1廳1衛),住家用,鋼筋混凝土造,0851228,48.15,1,1,1,有,有,有,10000,208,,0.0,0,,RPVOMLKMOHHGFEF68CC
三芝區,建物,新北市三芝區樂全街１３６號十一樓,0.0,,山坡地保育區,丙種建築用地,1110624,土地0建物1車位0,十一層,16,套房(1房1廳1衛),住家用,鋼筋混凝土造,0850529,42.58,1,0,1,有,有,有,6000,141,,0.0,0,此為新北市社會住宅包租代管計畫之物件，評定市價租金6667元，選擇代租方案須打九折，實際租賃契約金額為6000元；水電費及每月管理費500元由承租人負擔。,RPPRMLKMOHHGFEF38CC
淡水區,房地(土地+建物),新北市淡水區博愛街２３之１號２樓,24.08,住,,,1110605,土地1建物1車位0,二層,4,公寓(5樓含以下無電梯),住家用,加強磚造,0620802,61.66,3,2,2,有,無,有,14000,227,,0.0,0,,RPQRMLKMOHHGFEF48CC
淡水區,建物,新北市淡水區新市五路三段３３６號二十四樓,0.0,商,,,1110628,土地0建物1車位0,二十四層,27,住宅大樓(11層含以上有電梯),住家用,鋼筋混凝土造,1061229,86.6,2,1,1,有,有,有,15000,173,,0.0,0,此為新北市社會住宅包租代管計畫之物件，評定市價租金16667元，選擇代租方案須打九折，實際租賃契約金額為15000元；水電費及每月管理費3000元由承租人負擔。,RPSRMLKMOHHGFEF68CC
淡水區,建物,新北市淡水區淡金路３８巷３３號十一樓之１,0.0,住,,,1110625,土地0建物1車位0,十一層,22,套房(1房1廳1衛),住家用,鋼筋混凝土造,0980218,48.1,1,0,1,有,有,有,15000,312,,0.0,0,此為新北市社會住宅包租代管計畫之物件，評定市價租金16667元，選擇代租方案須打九折，實際租賃契約金額為15000元；水電費由承租人負擔。,RPVRMLKMOHHGFEF98CC
淡水區,建物,新北市淡水區新春街１１４之２號十樓,0.0,住,,,1110623,土地0建物1車位0,十層,15,住宅大樓(11層含以上有電梯),集合住宅,鋼筋混凝土造,1100708,86.03999999999999,2,2,1,有,有,有,20000,232,,0.0,0,此為新北市社會住宅包租代管計畫之物件，評定市價租金22223元，選擇代租方案須打九折，實際租賃契約金額為20000元；水電瓦斯費及每月管理費2062元由承租人負擔。,RPPSMLKMOHHGFEF48CC
淡水區,建物,新北市淡水區興福寮８８巷２２２號八樓,0.0,,山坡地保育區,丙種建築用地,1110628,土地0建物1車位0,八層,14,住宅大樓(11層含以上有電梯),鄉村住宅,鋼筋混凝土造,0900411,56.93,2,1,1,有,有,有,13000,228,,0.0,0,本案僅建物部份屬國家住宅及都市更新中心辦理社會住宅包租代管第3期計畫,RPQSMLKMOHHGFEF58CC
淡水區,房地(土地+建物)+車位,新北市淡水區中正路二段６號２０樓,11.54,商,,,1110628,土地1建物1車位1,二十層,20,住宅大樓(11層含以上有電梯),住家用,鋼筋混凝土造,0840505,123.52,2,2,2,有,有,有,22000,178,升降平面,32.01,0,,RPRSMLKMOHHGFEF68CC
淡水區,建物,新北市淡水區民權路７１號二十二樓之３,0.0,住,,,1110619,土地0建物1車位0,二十二層,22,住宅大樓(11層含以上有電梯),住家用,鋼筋混凝土造,0850203,94.85,3,2,1,有,有,有,23500,248,,0.0,0,租金含管理費。,RPSSMLKMOHHGFEF78CC
汐止區,房地(土地+建物),新北市汐止區新臺五路一段９３號１７樓之５,24.8,工,,,1110601,土地2建物1車位0,見其他登記事項,35,辦公商業大樓,廠房,鋼骨構造,1080123,319.46,0,0,0,無,有,無,79248,248,,0.0,0,,RPRNMLKMOHHGFDF08CC
汐止區,建物,新北市汐止區新臺五路一段７５號等底一層,0.5,工,,,1110429,土地0建物1車位0,地下一層,21,廠辦,見使用執照,鋼造,0830330,42.98,0,0,0,無,有,無,10500,244,,0.0,0,原申報C1FD11105120016C1FD11105260003，此戶為分租,RPSNMLKMOHHGFDF18CC
汐止區,房地(土地+建物)+車位,新北市汐止區新臺五路一段９７號２８樓,34.82,工,,,1110325,土地2建物1車位3,二十八層,37,辦公商業大樓,一般事務所,鋼骨構造,1031013,555.44,0,0,0,無,有,有,120644,217,坡道平面,92.7,0,,RPTNMLKMOHHGFDF28CC
汐止區,建物,新北市汐止區茄安路２４８號４樓,0.0,其他,,,1110608,土地0建物1車位0,四層,5,公寓(5樓含以下無電梯),工業用,鋼筋混凝土造,0710227,135.05,3,2,2,有,無,有,15000,111,,0.0,0,,RPOQMLKMOHHGFDF08CC
汐止區,建物,新北市汐止區伯爵街１４巷１２號,0.0,,鄉村區,乙種建築用地,1110626,土地0建物1車位0,一層,12,住宅大樓(11層含以上有電梯),住家用,鋼筋混凝土造,0810521,193.85,3,2,2,有,有,有,12000,62,,0.0,0,此為新北市社會住宅包租代管計畫之物件，評定市價租金13334元，選擇代租方案須打九折，實際租賃契約金額為12000元；水電費由承租人負擔。,RPRQMLKMOHHGFDF38CC
汐止區,建物,新北市汐止區環山路１６號７樓,0.0,住,,,1110621,土地0建物1車位0,七層,7,華廈(10層含以下有電梯),住家用,鋼筋混凝土造,0880125,99.38000000000001,3,2,2,有,有,有,20000,201,,0.0,0,此為新北市社會住宅包租代管計畫之物件，評定市價租金為22223元，選擇代管方案須打9折，實際租賃契約金額為20000元。水電瓦斯費及每月管理費1655元由承租人負擔。,RPSQMLKMOHHGFDF48CC
永和區,建物,新北市永和區竹林路２２５巷３２號,0.0,住,,,1110611,土地0建物1車位0,一層,3,店面(店鋪),住家用,加強磚造,0600301,100.04,2,1,1,有,無,有,32000,320,,0.0,0,租金調漲：第二年起租金調整為33000元/月。,RPWOMLKMOHHGFHF09CC
永和區,建物,新北市永和區成功路二段１巷７號五樓,0.0,住,,,1110624,土地0建物0車位0,五層,5,套房(1房1廳1衛),住家用,鋼筋混凝土造,0671129,22.12,1,0,1,有,無,有,7888,357,,0.0,0,此為分租套房，第五層共分成5間，一間平均面積約為22.12平方公尺。每月管理維護費200元由承租人負擔。,RPQPMLKMOHHGFHF58CC
永和區,建物,新北市永和區成功路一段２９巷２號２樓,0.0,住,,,1110623,土地0建物1車位0,二層,4,公寓(5樓含以下無電梯),住家用,加強磚造,0650921,80.64,2,2,1,有,無,有,15000,186,,0.0,0,此為新北市社會住宅包租代管計畫之物件，評定市價租金為16667元，選擇代管方案須打9折，實際租賃契約金額為15000元。每月水電瓦斯費由承租人負擔。,RPPQMLKMOHHGFHF58CC
中和區,建物,新北市中和區景安路２０８巷２２號,0.0,住,,,1110614,土地0建物0車位0,一層,4,套房(1房1廳1衛),住家用,加強磚造,0600317,16.53,1,0,1,有,無,有,10000,605,,0.0,0,部分承租。租金含水費。,RPQQMLKMOHHGFHF68CC
新莊區,建物,新北市新莊區中平路２９２巷１弄４６號十五樓,0.0,住,,,1110619,土地0建物1車位0,十五層,18,住宅大樓(11層含以上有電梯),集合住宅,鋼筋混凝土造,1101019,94.94,2,2,1,有,有,有,22000,232,,0.0,0,,RPSOMLKMOHHGFBF08CC
新莊區,建物,新北市新莊區中平路２９２巷１弄４０號十樓,0.0,住,,,1110619,土地0建物1車位1,十層,18,住宅大樓(11層含以上有電梯),集合住宅,鋼筋混凝土造,1101019,161.37,3,2,2,有,有,有,31400,195,坡道平面,33.86,0,承租車位為同社區他戶產權之車位，面積依謄本持分比例196/100000面積登錄。,RPUOMLKMOHHGFBF28CC
五股區,建物,新北市五股區登林路４６巷４號二樓,0.0,住,,,1110624,土地0建物1車位0,二層,4,公寓(5樓含以下無電梯),住家用,鋼筋混凝土造,0691115,71.42,3,2,1,有,無,有,9000,126,,0.0,0,此為新北市社會住宅包租代管計畫之物件，評定市價租金10000元，選擇代租方案須打九折，實際租賃契約金額為9000元；水電瓦斯費由承租人負擔。,RPVOMLKMOHHGFBF38CC
新莊區,建物,新北市新莊區中信街７２號十一樓之七,0.0,其他,,,1110604,土地0建物1車位0,十一層,14,套房(1房1廳1衛),住家用,鋼筋混凝土造,0870808,35.86,1,1,1,有,有,有,14000,390,,0.0,0,,RPWPMLKMOHHGFBF58CC
林口區,房地(土地+建物)+車位,新北市林口區文化北路一段５４２巷６０號６樓,32.25,住,,,1110608,土地1建物1車位1,六層,9,華廈(10層含以下有電梯),集合住宅,鋼筋混凝土造,1050520,143.88,2,2,1,有,有,有,31961,222,坡道平面,0.0,0,,RPXQMLKMOHHGFBF78CC
