中壢區,房地(土地+建物),桃園市中壢區成功路１３３巷１６弄７號,5.2,住,,,1100314,土地1建物0車位0,全,5,透天厝,住家用,加強磚造,0590410,16.2,1,0,1,有,無,有,7000,432,,0.0,0,隔間套房,RPOONLSJMHGGFBH18CC
中壢區,房地(土地+建物),桃園市中壢區成功路１３３巷１６弄７號,5.2,住,,,1100309,土地1建物0車位0,全,5,透天厝,住家用,加強磚造,0590410,23.4,1,0,1,有,無,有,8500,363,,0.0,0,隔間套房,RPPONLSJMHGGFBH28CC
中壢區,房地(土地+建物),桃園市中壢區成功路９４巷３５-３號,4.78,住,,,1100316,土地1建物0車位0,全,5,透天厝,住家用,鋼筋混凝土造,0800213,23.04,1,0,1,有,無,有,8000,347,,0.0,0,隔間套房,RPQONLSJMHGGFBH38CC
中壢區,房地(土地+建物),桃園市中壢區領航南路二段１９５.１９７號一樓,50.05,住,,,1100401,土地1建物1車位0,一層,9,店面(店鋪),見其他登記事項,鋼筋混凝土造,0990812,172.91,3,0,0,無,有,無,45000,260,,0.0,0,,RPQPMLSJMHGGFBH48DC
中壢區,房地(土地+建物)+車位,桃園市中壢區民權路四段７４０號,11.36,住,,,1100401,土地1建物1車位2,一層,10,華廈(10層含以下有電梯),見其他登記事項,鋼筋混凝土造,1020220,69.47,4,0,0,無,有,有,31000,446,坡道平面,21.46,0,,RPVPMLSJMHGGFBH98DC
中壢區,房地(土地+建物)+車位,桃園市中壢區高鐵南路二段２２３號２樓,43.55,住,,,1100305,土地1建物1車位2,二層,12,住宅大樓(11層含以上有電梯),見其他登記事項,鋼筋混凝土造,1040706,98.31,0,1,1,有,有,有,85000,865,坡道平面,24.06,0,,RPTQMLSJMHGGFBH88DC
中壢區,房地(土地+建物),桃園市中壢區元化路８９巷３１弄１３號,24.81,住,,,1100324,土地1建物1車位0,全,2,透天厝,住家用,加強磚造,0620724,19.57,4,3,2,有,無,有,15000,766,,0.0,0,,RPQRMLSJMHGGFBH68DC
龜山區,土地,山頂段121-5地號,139.0,,鄉村區,乙種建築用地,1100324,土地1建物0車位0,,,其他,,,,0.0,0,0,0,有,無,有,22000,158,,0.0,0,土地上有建物，建物無保存登記。,RPQTMLSJMHGGFHH86DC
桃園區,房地(土地+建物),桃園市桃園區國豐六街４１.４３.４５號,59.0,商,,,1100329,土地1建物3車位0,一層,13,店面(店鋪),住商用,鋼筋混凝土造,0961023,245.61,0,0,0,無,有,無,60000,244,,0.0,0,,RPSRMLTJMHGGFAH88DC
蘆竹區,房地(土地+建物),桃園市蘆竹區錦福路２４號,398.64,工,,,1100329,土地5建物1車位0,見其他登記事項,2,工廠,見其他登記事項,鋼筋混凝土造,0780828,335.29,0,0,0,無,無,無,35000,,,0.0,0,,RPWOMLTJMHGGFEH76DC
龜山區,建物,桃園市龜山區新興街４８號,0.0,住,,,1100226,土地0建物1車位0,全,3,透天厝,住家用,鋼筋混凝土造,0781105,84.24,1,3,1,有,無,有,25000,297,,0.0,0,社會住宅,RPTPMLTJMHGGFHH76CC
龜山區,建物,桃園市龜山區文化三路９５號１０樓,0.0,商,,,1100312,土地0建物1車位1,十層,12,住宅大樓(11層含以上有電梯),住家用,鋼筋混凝土造,0950117,145.34,3,2,2,有,有,有,32000,220,坡道平面,36.5,0,,RPVSMLTJMHGGFHH27CC
中壢區,建物,桃園市中壢區龍岡路三段３７巷２２號十一樓,0.0,商,,,1100308,土地0建物1車位0,十一層,15,住宅大樓(11層含以上有電梯),見其他登記事項,鋼筋混凝土造,1060605,93.65,2,1,1,有,有,有,15300,163,,0.0,0,社會住宅管理費另計1700元,RPUNMLTJMHGGFBH68CC
中壢區,建物,桃園市中壢區華美三路３７１號四樓之５,0.0,住,,,1100305,土地0建物1車位0,四層,14,住宅大樓(11層含以上有電梯),見其他登記事項,鋼筋混凝土造,1060509,123.28,3,1,2,有,有,有,18000,146,,0.0,0,社會住宅管理費另計2000元租賃車位1個租金另計2000元、機車位1個,RPVNMLTJMHGGFBH78CC
中壢區,建物,桃園市中壢區高鐵南路二段３６２號二十五樓,0.0,商,,,1100226,土地0建物1車位0,二十五層,25,套房(1房1廳1衛),見其他登記事項,鋼筋混凝土造,1080329,61.78,1,1,1,有,有,有,14500,235,,0.0,0,社會住宅管理費另計1500元,RPWNMLTJMHGGFBH88CC
中壢區,建物,桃園市中壢區松信路２６號二樓之３,0.0,商,,,1100310,土地0建物1車位0,二層,15,住宅大樓(11層含以上有電梯),見其他登記事項,鋼筋混凝土造,1090817,93.3,2,1,1,有,有,有,18000,193,,0.0,0,社會住宅管理費另計2000元租賃車位1個租金另計0元、機車位1個,RPXNMLTJMHGGFBH98CC
中壢區,建物,桃園市中壢區環中東路二段３１２巷３號六樓之２,0.0,住,,,1100222,土地0建物1車位0,六層,14,住宅大樓(11層含以上有電梯),住家用,鋼筋混凝土造,0880528,111.25,3,2,2,有,有,有,10000,90,,0.0,0,社會住宅管理費另計1340元,RPOOMLTJMHGGFBH18CC
中壢區,建物,桃園市中壢區仁美二街１００巷８號五樓,0.0,住,,,1100311,土地0建物1車位0,五層,7,華廈(10層含以下有電梯),住家用,鋼筋混凝土造,0820308,120.38,3,2,2,有,有,有,15700,130,,0.0,0,社會住宅管理費另計1300元租賃車位1個租金另計0元,RPPOMLTJMHGGFBH28CC
觀音區,建物,桃園市觀音區欣華路一段２３９巷８弄５５號二樓,0.0,,特定農業區,甲種建築用地,1100225,土地0建物1車位0,二層,5,公寓(5樓含以下無電梯),住家用,鋼筋混凝土造,0830921,98.60000000000001,3,1,1,有,無,有,9000,91,,0.0,0,社會住宅,RPQOMLTJMHGGFBH38CC
中壢區,建物,桃園市中壢區興仁路二段９９號五樓之６,0.0,住,,,1100121,土地0建物1車位0,五層,10,套房(1房1廳1衛),住家用,鋼筋混凝土造,0950520,31.65,0,0,0,無,有,有,5700,180,,0.0,0,社會住宅管理費另計300元,RPSOMLTJMHGGFBH58CC
中壢區,建物,桃園市中壢區九和一街６號二十樓之９,0.0,商,,,1100305,土地0建物1車位0,二十層,22,套房(1房1廳1衛),住家用,鋼筋混凝土造,0900830,45.769999999999996,0,0,0,無,有,有,12000,262,,0.0,0,社會住宅管理費另計1000元,RPTOMLTJMHGGFBH68CC
觀音區,建物,桃園市觀音區福興街２９１號四樓,0.0,住,,,1100219,土地0建物1車位0,四層,5,華廈(10層含以下有電梯),見其他登記事項,鋼筋混凝土造,1071222,62.46,2,1,2,有,有,有,10500,168,,0.0,0,社會住宅管理費另計500元租賃機車位1個,RPUOMLTJMHGGFBH78CC
中壢區,建物,桃園市中壢區忠孝路３５６號六樓,0.0,住,,,1100320,土地0建物1車位0,六層,9,華廈(10層含以下有電梯),住家用,鋼筋混凝土造,0920729,96.64,3,1,1,有,有,有,15000,155,,0.0,0,社會住宅管理費另計2000元租賃車位1個租金另計0元、機車位1個,RPVOMLTJMHGGFBH88CC
觀音區,建物,桃園市觀音區吉祥街６５巷２號二樓之１,0.0,,工業區,丁種建築用地,1100317,土地0建物1車位0,二層,5,華廈(10層含以下有電梯),見其他登記事項,鋼筋混凝土造,1090311,77.68,2,1,2,有,有,有,12000,154,,0.0,0,社會住宅管理費另計500元租賃機車位1個租金另計0元,RPWOMLTJMHGGFBH98CC
觀音區,建物,桃園市觀音區福壽街１１６號三樓,0.0,,工業區,丁種建築用地,1100308,土地0建物1車位0,三層,5,華廈(10層含以下有電梯),見其他登記事項,鋼筋混凝土造,1081105,83.61,2,1,1,有,有,有,13600,163,,0.0,0,社會住宅管理費另計1000元租賃機車位1個租金另計0元,RPXOMLTJMHGGFBH09CC
中壢區,建物,桃園市中壢區永康三街１６之２號三樓,0.0,住,,,1100318,土地0建物1車位0,三層,5,公寓(5樓含以下無電梯),住家用,鋼筋混凝土造,0780602,90.28999999999999,3,1,1,有,無,有,12000,133,,0.0,0,社會住宅,RPPPMLTJMHGGFBH38CC
中壢區,建物,桃園市中壢區龍岡路二段７３巷３６號,0.0,住,,,1100309,土地0建物1車位0,一層,7,套房(1房1廳1衛),住家用,見其他登記事項,0961212,26.560000000000002,1,1,1,有,有,有,6500,245,,0.0,0,社會住宅管理費另計500元,RPUPMLTJMHGGFBH88CC
中壢區,房地(土地+建物),桃園市中壢區中山東路一段２２３巷８９弄２４號４樓,3.79,住,,,1100325,土地1建物0車位0,四層,7,華廈(10層含以下有電梯),住家用,鋼筋混凝土造,0830804,18.98,1,0,1,有,無,有,7000,369,,0.0,0,隔間套房,RPWPMLTJMHGGFBH09CC
中壢區,房地(土地+建物),桃園市中壢區吉林路９９巷２１號,5.51,,工業區,丁種建築用地,1100319,土地1建物0車位0,全,4,透天厝,住家用,鋼筋混凝土造,0880125,17.28,1,0,1,有,無,有,8200,475,,0.0,0,,RPOQMLTJMHGGFBH38CC
中壢區,建物,桃園市中壢區長春五路２６號八樓,0.0,住,,,1100305,土地0建物1車位0,八層,11,套房(1房1廳1衛),住家用,鋼筋混凝土造,0961001,65.33,0,0,0,無,有,有,14500,222,,0.0,0,社會住宅,RPRQMLTJMHGGFBH68CC
中壢區,建物,桃園市中壢區溪州二街２３巷４號二層,0.0,住,,,1100305,土地0建物1車位0,二層,5,公寓(5樓含以下無電梯),住家用,鋼筋混凝土造,0690602,77.14,3,2,2,有,無,有,14000,181,,0.0,0,社會住宅,RPWRMLTJMHGGFBH66CC
觀音區,建物,桃園市觀音區仁德街２１號四樓之１,0.0,,工業區,丁種建築用地,1100310,土地0建物1車位0,四層,5,公寓(5樓含以下無電梯),見其他登記事項,鋼筋混凝土造,1041222,84.78999999999999,2,2,2,有,無,有,14000,165,,0.0,0,社會住宅租賃機車位1個租金另計0元,RPXRMLTJMHGGFBH76CC
中壢區,建物,桃園市中壢區仁德街６３巷１弄２３號,0.0,住,,,1100301,土地0建物1車位0,全,2,透天厝,住家用,加強磚造,0680424,77.34,3,2,3,有,無,有,16000,207,,0.0,0,社會住宅,RPOSMLTJMHGGFBH58CC
中壢區,建物,桃園市中壢區華勛街１６３巷２４號,0.0,住,,,1100303,土地0建物1車位0,見其他登記事項,5,公寓(5樓含以下無電梯),住商用,鋼筋混凝土造,0810711,59.08,2,2,2,有,無,有,10000,169,,0.0,0,社會住宅租賃機車位1個租金另計0元,RPPSMLTJMHGGFBH68CC
中壢區,建物,桃園市中壢區仁慈路１７６十二樓之１,0.0,住,,,1100312,土地0建物1車位0,十二層,12,套房(1房1廳1衛),住家用,鋼筋混凝土造,0840805,35.43,0,0,0,無,有,有,6000,169,,0.0,0,社會住宅,RPSSMLTJMHGGFBH98CC
中壢區,建物,桃園市中壢區龍岡路一段６３巷１８之１號,0.0,住,,,1100311,土地0建物1車位0,二層,4,公寓(5樓含以下無電梯),住家用,加強磚造,0660129,63.78,2,2,1,有,無,有,9000,141,,0.0,0,社會住宅,RPUSMLTJMHGGFBH56CC
中壢區,房地(土地+建物)+車位,桃園市中壢區永泰路１２３號４樓,13.49,住,,,1100408,土地1建物1車位1,四層,17,住宅大樓(11層含以上有電梯),見其他登記事項,鋼筋混凝土造,1090413,79.72,2,1,1,有,有,有,17000,303,坡道平面,28.15,1400,,RPXUMLTJMHGGFBH07CC
中壢區,建物,桃園市中壢區莊敬路８６９號三樓之９,0.0,其他,,,1100325,土地0建物1車位0,三層,8,套房(1房1廳1衛),見其他登記事項,鋼筋混凝土造,0880909,39.38,1,1,1,有,有,有,8500,216,,0.0,0,租金含管理費。,RPTVMLTJMHGGFBH76CC
中壢區,房地(土地+建物),桃園市中壢區同慶路３８號３樓,16.11,住,,,1100319,土地1建物1車位0,三層,10,華廈(10層含以下有電梯),住家用,鋼筋混凝土造,0830126,112.52,3,2,2,有,有,有,11900,106,,0.0,0,,RPWVMLTJMHGGFBH07CC
桃園區,建物,桃園市桃園區民生路７２號五樓之３,0.0,商,,,1100311,土地0建物1車位0,五層,9,套房(1房1廳1衛),住家用,鋼筋混凝土造,0830318,30.369999999999997,0,0,0,無,有,有,7000,230,,0.0,0,社會住宅管理費另計470元,RPQPMLTJMHGGFAH38CC
桃園區,建物,桃園市桃園區中山路１３０８巷２９１號七樓,0.0,住,,,1100315,土地0建物1車位0,七層,8,華廈(10層含以下有電梯),住家用,鋼筋混凝土造,0921030,85.0,3,1,2,有,有,有,15200,179,,0.0,0,社會住宅管理費另計1800元租賃車位1個租金另計0元、機車位1個,RPRPMLTJMHGGFAH48CC
桃園區,建物,桃園市桃園區大業路一段７１號１８樓,0.0,住,,,1100311,土地0建物1車位0,十八層,21,住宅大樓(11層含以上有電梯),住家用,鋼筋混凝土造,0850412,104.86999999999999,2,2,2,有,有,有,15000,143,,0.0,0,社會住宅管理費另計2000元,RPSQMLTJMHGGFAH68CC
桃園區,建物,桃園市桃園區國強七街９１號四樓,0.0,住,,,1100311,土地0建物1車位0,四層,7,華廈(10層含以下有電梯),住家用,鋼筋混凝土造,0821122,125.8,3,2,2,有,有,有,12000,95,,0.0,0,社會住宅管理費另計500元租賃車位1個租金另計0元,RPXTMLTJMHGGFAH86CC
桃園區,房地(土地+建物),桃園市桃園區力行路８６之１號,49.0,住,,,1100408,土地1建物1車位0,二層,4,公寓(5樓含以下無電梯),住家用,鋼筋混凝土造,0690131,79.03,0,0,0,無,無,無,15000,190,,0.0,0,,RPXNNLTJMHGGFAH98CC
桃園區,房地(土地+建物)+車位,桃園市桃園區新埔七街１１８巷３５號４樓,34.28,住,,,1100322,土地1建物1車位1,四層,5,華廈(10層含以下有電梯),住家用,鋼筋混凝土造,0800801,149.88,3,2,2,有,有,有,18400,123,坡道平面,0.0,2000,,RPXONLTJMHGGFAH09CC
桃園區,房地(土地+建物)+車位,桃園市桃園區大業路一段３２４號１２樓,15.65,商,,,1100326,土地1建物1車位1,十二層,14,住宅大樓(11層含以上有電梯),住家用,鋼筋混凝土造,0950910,119.96,3,2,2,有,無,有,18100,151,坡道機械,0.0,2100,,RPOPNLTJMHGGFAH28CC
平鎮區,建物,桃園市平鎮區中正三路８７號九樓,0.0,商,,,1100320,土地0建物1車位0,九層,19,住宅大樓(11層含以上有電梯),住家用,鋼筋混凝土造,1040930,147.63,2,1,2,有,有,有,17000,115,,0.0,0,社會住宅管理費另計2500元租賃車位1個租金另計500元,RPSNMLTJMHGGFGH98CC
平鎮區,建物,桃園市平鎮區上海路２１６號十三樓,0.0,商,,,1100224,土地0建物1車位0,十三層,15,住宅大樓(11層含以上有電梯),住家用,鋼筋混凝土造,1030728,96.02,2,1,1,有,無,有,12000,125,,0.0,0,社會住宅管理費另計1800元,RPTNMLTJMHGGFGH09CC
平鎮區,建物,桃園市平鎮區德育路二段１６０之１號四樓,0.0,住,,,1100311,土地0建物1車位0,四層,13,住宅大樓(11層含以上有電梯),住家用,鋼筋混凝土造,0971001,144.87,4,2,2,有,有,有,15000,104,,0.0,0,社會住宅管理費另計2000元租賃車位1個租金另計1000元,RPUNMLTJMHGGFGH56CC
平鎮區,建物,桃園市平鎮區金陵路七段１８７巷６０弄７號九樓,0.0,,一般農業區,甲種建築用地,1100305,土地0建物1車位0,九層,11,住宅大樓(11層含以上有電梯),見其他登記事項,鋼筋混凝土造,1091019,106.28999999999999,3,1,3,有,有,有,16400,154,,0.0,0,社會住宅 管理費另計600元,RPWNMLTJMHGGFGH76CC
平鎮區,建物,桃園市平鎮區環南路二段２８６號六樓之４,0.0,住,,,1100319,土地0建物1車位0,六層,18,住宅大樓(11層含以上有電梯),住家用,鋼筋混凝土造,0831111,141.84,4,1,2,有,有,有,16000,113,,0.0,0,社會住宅管理費另計2000元,RPXNMLTJMHGGFGH86CC
平鎮區,建物,桃園市平鎮區文心路１３０號五樓,0.0,商,,,1100305,土地0建物1車位0,五層,15,住宅大樓(11層含以上有電梯),住家用,鋼筋混凝土造,1060817,94.47999999999999,2,1,1,有,有,有,12800,135,,0.0,0,社會住宅管理費另計1700元租賃機車位1個租金另計0元,RPROMLTJMHGGFGH98CC
平鎮區,建物,桃園市平鎮區東豐路３６巷６弄１９號,0.0,住,,,1091228,土地0建物1車位0,全,2,透天厝,住家用,加強磚造,0680716,84.66,3,2,2,有,無,有,15000,177,,0.0,0,社會住宅,RPSOMLTJMHGGFGH09CC
大溪區,建物,桃園市大溪區慈光街４７巷１６號,0.0,住,,,1100305,土地0建物1車位0,全,2,透天厝,住家用,加強磚造,0670401,96.0,4,2,3,有,無,有,17500,182,,0.0,0,社會住宅,RPQNMLTJMHGGFCH38CC
大溪區,建物,桃園市大溪區中華路４２巷２３號,0.0,住,,,1100315,土地0建物1車位0,一層,1,其他,住家用,加強磚造,,65.96,5,2,2,有,無,有,18000,273,,0.0,0,社會住宅,RPSNMLTJMHGGFCH58CC
八德區,建物,桃園市八德區建國路１３３巷６弄７號三樓,0.0,住,,,1100223,土地0建物1車位0,三層,7,華廈(10層含以下有電梯),住家用,鋼筋混凝土造,0871102,126.25,3,2,2,有,有,有,12000,95,,0.0,0,社會住宅管理費另計1500元,RPQNMLTJMHGGFFH68CC
八德區,建物,桃園市八德區建德路６０號十三樓,0.0,住,,,1100309,土地0建物1車位0,十三層,13,住宅大樓(11層含以上有電梯),見其他登記事項,鋼筋混凝土造,1080715,103.08000000000001,3,2,1,有,有,有,17500,170,,0.0,0,社會住宅管理費另計2500元租賃車位1個租金另計2000元、機車位1個,RPRNMLTJMHGGFFH78CC
八德區,建物,桃園市八德區陸光街５２之１號五樓,0.0,住,,,1100310,土地0建物1車位0,五層,13,住宅大樓(11層含以上有電梯),住家用,鋼筋混凝土造,0881125,143.75,3,1,2,有,有,有,15400,107,,0.0,0,社會住宅管理費另計500元,RPSNMLTJMHGGFFH88CC
八德區,建物,桃園市八德區中正路１２２號十四樓,0.0,商,,,1100219,土地0建物1車位0,十四層,15,住宅大樓(11層含以上有電梯),住家用,鋼筋混凝土造,1030623,89.55,2,2,1,有,有,有,15000,168,,0.0,0,社會住宅管理費另計1800元租賃車位1個租金另計0元、機車位1個,RPTNMLTJMHGGFFH98CC
八德區,建物,桃園市八德區中華路３７號五樓,0.0,住,,,1100318,土地0建物1車位0,五層,15,套房(1房1廳1衛),住家用,鋼筋混凝土造,0970425,70.78,1,1,1,有,有,有,10000,141,,0.0,0,社會住宅管理費另計1500元租賃車位1個租金另計1500元、機車位1個,RPUNMLTJMHGGFFH09CC
八德區,建物,桃園市八德區建德路２７１號十五樓,0.0,住,,,1100303,土地0建物1車位0,十五層,15,住宅大樓(11層含以上有電梯),住家用,鋼筋混凝土造,1040420,79.54,2,1,1,有,有,有,13000,163,,0.0,0,社會住宅管理費另計2000元租賃車位1個租金另計2000元、機車位1個,RPVNMLTJMHGGFFH56CC
八德區,建物,桃園市八德區介壽路二段６８５巷５０弄３號二樓,0.0,,鄉村區,乙種建築用地,1100317,土地0建物1車位0,二層,4,公寓(5樓含以下無電梯),住家用,加強磚造,0701005,84.0,3,2,2,有,無,有,13000,155,,0.0,0,社會住宅,RPXNMLTJMHGGFFH76CC
八德區,建物,桃園市八德區金和路１０５號五樓,0.0,住,,,1100220,土地0建物1車位0,五層,15,住宅大樓(11層含以上有電梯),住家用,鋼筋混凝土造,0981016,100.47,2,2,2,有,有,有,13400,133,,0.0,0,社會住宅管理費另計1300元，車位管理費另計300元租賃車位1個租金另計1000元、機車位一個,RPOOMLTJMHGGFFH58CC
八德區,建物,桃園市八德區銀和街２７巷２弄６號十四樓之８,64.27,住,,,1100311,土地0建物1車位0,十四層,18,住宅大樓(11層含以上有電梯),住家用,鋼骨鋼筋混凝土造,0870729,90.22999999999999,2,2,1,有,有,有,12800,142,,0.0,0,社會住宅管理費另計700元,RPPOMLTJMHGGFFH68CC
八德區,建物,桃園市八德區銀和街２７巷２弄１號五樓之１,0.0,住,,,1100310,土地0建物1車位0,五層,18,住宅大樓(11層含以上有電梯),住家用,鋼骨鋼筋混凝土造,0870729,119.98,3,2,2,有,有,有,13800,115,,0.0,0,社會住宅管理費另計1200元,RPQOMLTJMHGGFFH78CC
八德區,建物,桃園市八德區銀和街２７巷２弄１７號十樓之３,0.0,住,,,1100302,土地0建物1車位0,十層,19,住宅大樓(11層含以上有電梯),住家用,鋼骨鋼筋混凝土造,0870729,98.5,2,2,1,有,有,有,13800,140,,0.0,0,社會住宅管理費另計700元,RPROMLTJMHGGFFH88CC
楊梅區,建物,桃園市楊梅區永美路４４５巷３６弄１號,0.0,住,,,1100310,土地0建物1車位0,全,2,透天厝,住家用,加強磚造,0670721,62.9,3,2,2,有,無,有,12000,191,,0.0,0,社會住宅,RPQNMLTJMHGGFDH48CC
楊梅區,建物,桃園市楊梅區中山北路一段３９０巷４５弄４６號１０樓之２,0.0,住,,,1100315,土地0建物1車位0,十層,13,住宅大樓(11層含以上有電梯),住家用,鋼筋混凝土造,0830625,99.93,3,1,2,有,有,有,10000,100,,0.0,0,社會住宅管理費另計900元,RPRNMLTJMHGGFDH58CC
楊梅區,建物,桃園市楊梅區環南路２２３巷４３號六樓,0.0,住,,,1100319,土地0建物1車位0,六層,6,華廈(10層含以下有電梯),住家用,鋼筋混凝土造,0850430,112.25999999999999,3,1,2,有,有,有,9000,80,,0.0,0,社會住宅,RPSNMLTJMHGGFDH68CC
楊梅區,建物,桃園市楊梅區金山街３２０號十四樓,0.0,住,,,1100310,土地0建物1車位0,四層,15,住宅大樓(11層含以上有電梯),住家用,鋼筋混凝土造,1040525,93.37,2,1,1,有,有,有,13300,142,,0.0,0,社會住宅管理費另計1700元租賃車位1個租金另計0元、機車位1個,RPTNMLTJMHGGFDH78CC
楊梅區,建物,桃園市楊梅區金山街２７５巷７０號四樓,0.0,住,,,1100315,土地0建物1車位0,四層,15,住宅大樓(11層含以上有電梯),見其他登記事項,鋼筋混凝土造,1091218,90.95,2,2,1,有,有,有,13000,143,,0.0,0,社會住宅管理費另計1500元，停車位管理費1000元租賃車位1個租金另計0元，機車位1個,RPXNMLTJMHGGFDH56CC
楊梅區,建物,桃園市楊梅區中山北路一段４９４巷７２號二樓,0.0,住,,,1100316,土地0建物1車位0,二層,15,住宅大樓(11層含以上有電梯),見其他登記事項,鋼筋混凝土造,1091218,87.31,2,1,1,有,有,有,12500,143,,0.0,0,社會住宅管理費另計2500元租賃車位1個租金另計0元，機車位1個,RPOOMLTJMHGGFDH38CC
楊梅區,建物,桃園市楊梅區金山街１０９號四樓之３,0.0,住,,,1100305,土地0建物1車位0,四層,11,住宅大樓(11層含以上有電梯),住家用,鋼筋混凝土造,0841227,79.41,3,2,2,有,有,有,10000,126,,0.0,0,社會住宅管理費另計1200元，停車位管理費另計800元租賃車位1個租金另計0元、機車位1個,RPPOMLTJMHGGFDH48CC
楊梅區,建物,桃園市楊梅區青山三街３６巷８號七樓,0.0,住,,,1100217,土地0建物1車位0,七層,9,華廈(10層含以下有電梯),住家用,鋼筋混凝土造,0950305,90.32000000000001,2,2,1,有,有,有,10500,116,,0.0,0,社會住宅管理費另計1500元租賃車位1個租金另計1500元,RPQOMLTJMHGGFDH58CC
楊梅區,建物,桃園市楊梅區中山南路６１８之１號九樓,0.0,住,,,1100219,土地0建物1車位0,九層,14,住宅大樓(11層含以上有電梯),見其他登記事項,鋼筋混凝土造,1071105,93.96,2,1,1,有,有,有,12300,131,,0.0,0,社會住宅管理費另計1700元,RPROMLTJMHGGFDH68CC
楊梅區,建物,桃園市楊梅區新農街二段１１８號四樓,0.0,住,,,1100322,土地0建物1車位0,四層,9,華廈(10層含以下有電梯),住家用,鋼筋混凝土造,1020502,124.79,3,2,2,有,有,有,17000,136,,0.0,0,社會住宅管理費另計2500元、停車位管理費500元租賃車位1個租金另計0元、機車位,RPSOMLTJMHGGFDH78CC
楊梅區,建物,桃園市楊梅區環南路２１９巷３５弄１７號,0.0,住,,,1100309,土地0建物1車位0,全,4,透天厝,見其他登記事項,鋼筋混凝土造,1091008,208.74,4,2,2,有,有,有,13000,62,,0.0,0,社會住宅管理費另計2000元,RPTOMLTJMHGGFDH88CC
楊梅區,建物,桃園市楊梅區新農街二段１１０巷１６號,0.0,住,,,1100219,土地0建物1車位0,一層,9,華廈(10層含以下有電梯),住家用,鋼筋混凝土造,1020502,89.22,2,2,1,有,有,有,13500,151,,0.0,0,社會住宅管理費另計1500元租賃車位1個租金另計0元、機車位1個,RPUOMLTJMHGGFDH98CC
楊梅區,建物,桃園市楊梅區中山北路一段３９０巷３３之２號,0.0,住,,,1100202,土地0建物1車位0,一層,8,華廈(10層含以下有電梯),住商用,鋼筋混凝土造,0820817,88.58,3,2,2,有,有,有,11000,124,,0.0,0,社會住宅管理費另計1000元,RPVOMLTJMHGGFDH09CC
楊梅區,建物,桃園市楊梅區東森路５９巷２２號三樓,0.0,,山坡地保育區,丙種建築用地,1100319,土地0建物1車位0,全,4,透天厝,見其他登記事項,鋼筋混凝土造,0960315,170.2,3,2,2,有,有,有,14000,82,,0.0,0,社會住宅管理費另計2574元,RPWOMLTJMHGGFDH56CC
楊梅區,建物,桃園市楊梅區新農街６６０號二樓,0.0,住,,,1100315,土地0建物1車位0,二層,14,住宅大樓(11層含以上有電梯),住家用,鋼筋混凝土造,1030107,110.5,3,1,1,有,有,有,14000,127,,0.0,0,社會住宅管理費另計2000元租賃車位1個租金另計0元、機車位1個,RPXOMLTJMHGGFDH66CC
楊梅區,建物,桃園市楊梅區中山北路一段３９０巷３３之３號五樓,0.0,住,,,1100311,土地0建物1車位0,五層,8,華廈(10層含以下有電梯),住家用,鋼筋混凝土造,0820817,100.44,3,2,2,有,有,有,10200,102,,0.0,0,社會住宅管理費另計800元,RPOPMLTJMHGGFDH48CC
楊梅區,建物,桃園市楊梅區新梅八街５５號二樓,0.0,住,,,1100318,土地0建物1車位0,二層,12,住宅大樓(11層含以上有電梯),見其他登記事項,鋼筋混凝土造,1091007,117.6,3,2,2,有,有,有,15500,132,,0.0,0,社會住宅管理費另計2700元、停車位管理費800元租賃車位1個租金另計0元、機車位1個,RPPPMLTJMHGGFDH58CC
楊梅區,建物,桃園市楊梅區青山二街３８２號七樓之１２,0.0,住,,,1100225,土地0建物1車位0,七層,15,套房(1房1廳1衛),住家用,鋼筋混凝土造,0840324,41.79,0,0,0,無,有,有,6500,156,,0.0,0,社會住宅管理費另計700元,RPQPMLTJMHGGFDH68CC
楊梅區,建物,桃園市楊梅區新農街３６２號二樓,0.0,住,,,1100218,土地0建物1車位0,二層,9,華廈(10層含以下有電梯),住家用,鋼筋混凝土造,0860911,114.27,3,2,2,有,無,有,13500,118,,0.0,0,社會住宅租賃車位1個租金另計0元停車位管理費另計500元,RPRPMLTJMHGGFDH78CC
楊梅區,建物,桃園市楊梅區青山一街１１７之１號三樓,0.0,住,,,1100315,土地0建物1車位0,三層,15,住宅大樓(11層含以上有電梯),見其他登記事項,鋼筋混凝土造,1080418,91.75,2,2,1,有,有,有,11500,125,,0.0,0,社會住宅管理費另計2000元,RPSPMLTJMHGGFDH88CC
楊梅區,建物,桃園市楊梅區三民北路１６２巷３號六樓,0.0,住,,,1100318,土地0建物1車位0,六層,9,華廈(10層含以下有電梯),住家用,鋼筋混凝土造,0841230,139.88,4,2,2,有,有,有,15400,110,,0.0,0,社會住宅管理費另計1500元、停車位管理費100元租賃車位1個租金另計0元,RPTPMLTJMHGGFDH98CC
