中正區,建物,臺北市中正區臨沂街７５巷１５號地下之６,0.0,住,,,1111220,土地0建物1車位0,地下一層,9,套房(1房1廳1衛),商業用,鋼筋混凝土造,0850824,23.380000000000003,1,0,1,有,有,有,10000,428,,0.0,0,國家住宅及都市更新中心辦理社會住宅包租代管計畫。水電費、瓦斯費及每月管理費1000元皆由承租人負擔。,RPXOMLRLKIHGFBA38CC
萬華區,建物,臺北市萬華區康定路４６之３號,0.0,商,,,1111220,土地0建物2車位0,全,4,透天厝,,加強磚造,,628.96,0,0,0,無,無,有,294000,467,,0.0,0,與台北市萬華區康定路46號之4號 共同承租,RPPPMLRLKIHGFBA67CC
大同區,建物,臺北市大同區民族西路１７２號１樓,0.0,商,,,1111221,土地0建物1車位0,見其他登記事項,5,公寓(5樓含以下無電梯),見使用執照,鋼筋混凝土造,0681109,133.44,0,0,0,無,無,有,55000,412,,0.0,0,,RPTPMLRLKIHGFBA08CC
中正區,建物,臺北市中正區中山北路一段８巷１號四樓之２,0.0,其他,,,1111222,土地0建物1車位0,四層,5,套房(1房1廳1衛),住家用,鋼筋混凝土造,0710226,24.48,1,0,1,有,無,無,16700,682,,0.0,0,,RPVPMLRLKIHGFBA28CC
中正區,房地(土地+建物)+車位,臺北市中正區中華路一段９３號八樓,20.38,商,,,1111122,土地1建物1車位2,八層,14,辦公商業大樓,一般事務所,鋼骨鋼筋混凝土造,1010709,287.1,3,2,3,有,有,有,130000,453,其他,0.0,0,,RPWPMLRLKIHGFBA38CC
大同區,建物,臺北市大同區市民大道一段２１１號１０樓之３,0.0,其他,,,1111211,土地0建物1車位0,十層,18,套房(1房1廳1衛),一般事務所,鋼骨造,0980724,55.65,1,1,1,有,有,有,25000,449,,0.0,0,,RPOQMLRLKIHGFBA67CC
信義區,建物,臺北市信義區信義路五段１２７號１４樓之１１,0.0,其他,,,1111216,土地0建物1車位0,十四層,19,住宅大樓(11層含以上有電梯),住家用,鋼骨造,0951229,86.97,1,1,1,有,無,有,40790,469,,0.0,0,,RPPNMLRLKIHGFDA67CC
信義區,建物,臺北市信義區崇德街１６１之５號２樓,0.0,住,,,1111219,土地0建物1車位0,二層,5,華廈(10層含以下有電梯),集合住宅,鋼筋混凝土造,1070731,105.58000000000001,2,2,1,有,有,有,53000,502,,0.0,0,,RPRNMLRLKIHGFDA87CC
南港區,建物,臺北市南港區八德路四段７６８巷１弄１８號七樓,0.0,其他,,,1111223,土地0建物1車位1,七層,13,辦公商業大樓,工業用,鋼筋混凝土造,0790705,282.83,3,0,0,有,有,無,110000,389,坡道平面,0.0,0,,RPSNMLRLKIHGFDA97CC
信義區,建物,臺北市信義區忠孝東路四段５５３巷１６弄９號四樓,0.0,住,,,1111221,土地0建物0車位0,四層,7,套房(1房1廳1衛),住家用,鋼筋混凝土造,0650504,29.62,1,0,1,有,無,有,21000,709,,0.0,0,此為分租套房，第四層隔為3間，一間面積約為29.62平方公尺，每月電費由承租人負擔。,RPOOMLRLKIHGFDA67CC
松山區,建物,臺北市松山區南京東路五段２３９號１８樓之２,0.0,其他,,,1111215,土地0建物1車位0,十八層,18,住宅大樓(11層含以上有電梯),住家用,鋼筋混凝土造,0980331,55.28,1,1,1,有,有,有,28000,507,,0.0,0,,RPQOMLRLKIHGFDA87CC
松山區,建物,臺北市松山區三民路１８號５樓之１,0.0,住,,,1111220,土地0建物1車位0,五層,11,套房(1房1廳1衛),住家用,鋼筋混凝土造,1030530,54.989999999999995,1,1,1,有,有,有,38000,691,,0.0,0,,RPROMLRLKIHGFDA97CC
信義區,建物,臺北市信義區松德路１６１號２７樓之２,0.0,住,,,1111130,土地0建物1車位0,二十七層,30,辦公商業大樓,商業用,鋼骨混凝土造,0820524,137.8,2,2,1,有,有,無,53000,385,,0.0,0,,RPSOMLRLKIHGFDA08CC
南港區,建物,臺北市南港區八德路四段８７９號二樓,0.0,商,,,1111215,土地0建物1車位0,二層,16,辦公商業大樓,商業用,鋼筋混凝土造,0841219,48.230000000000004,0,0,0,無,有,無,9000,187,,0.0,0,租期一年：自民國111年12月20日起至民國112年12月19日止。,RPXOMLRLKIHGFDA58CC
南港區,建物,臺北市南港區松河街７７０號三樓之２,0.0,住,,,1111211,土地0建物1車位0,三層,7,套房(1房1廳1衛),住家用,鋼筋混凝土造,0981207,38.660000000000004,1,0,1,有,有,有,20000,517,,0.0,0,租金含管理費。,RPOPMLRLKIHGFDA77CC
信義區,建物,臺北市信義區信義路六段３５號４樓,0.0,住,,,1111227,土地0建物1車位0,四層,5,公寓(5樓含以下無電梯),住家用,鋼筋混凝土造,0670110,88.93,3,2,2,有,無,有,30000,337,,0.0,0,租金含稅價,RPQPMLRLKIHGFDA97CC
信義區,建物,臺北市信義區永吉路８號５樓,0.0,商,,,1111212,土地0建物1車位0,五層,12,住宅大樓(11層含以上有電梯),住家用,鋼筋混凝土造,0961106,94.61999999999999,1,2,1,有,有,有,53000,560,,0.0,0,,RPRPMLRLKIHGFDA08CC
信義區,建物,臺北市信義區光復南路５６７號１７樓之８,0.0,商,,,1111220,土地0建物1車位1,十七層,18,住宅大樓(11層含以上有電梯),住家用,鋼骨造,0970822,95.96000000000001,1,1,1,有,有,有,45000,469,坡道平面,0.0,0,,RPSPMLRLKIHGFDA18CC
松山區,房地(土地+建物),臺北市松山區南京東路四段５６號７樓之２,5.26,商,,,1111202,土地1建物1車位0,七層,12,辦公商業大樓,商業用,鋼筋混凝土造,0670317,46.61,0,1,2,有,有,無,31000,665,,0.0,0,,RPTPMLRLKIHGFDA28CC
信義區,房地(土地+建物),臺北市信義區松德路１２４號１樓,28.75,住,,,1111207,土地1建物1車位0,一層,4,公寓(5樓含以下無電梯),住家用,鋼筋混凝土造,0600710,78.11,1,1,1,有,無,無,64000,819,,0.0,0,,RPUPMLRLKIHGFDA38CC
士林區,建物,臺北市士林區中山北路六段２巷２７號５樓,0.0,住,,,1111215,土地0建物1車位1,五層,5,華廈(10層含以下有電梯),住家用,鋼筋混凝土造,0730524,134.09,3,2,2,有,無,有,68000,507,坡道平面,0.0,0,,RPVNMLRLKIHGFEA38CC
士林區,建物,臺北市士林區華齡街１８５巷１號９樓,0.0,商,,,1111215,土地0建物1車位1,九層,15,住宅大樓(11層含以上有電梯),住家用,鋼筋混凝土造,0970826,128.5,2,2,2,有,有,有,46000,358,坡道平面,0.0,0,,RPWNMLRLKIHGFEA48CC
北投區,建物,臺北市北投區中和街３２號１樓,0.0,住,,,1111114,土地0建物1車位0,一層,17,店面(店鋪),商業用,鋼筋混凝土造,0890329,119.75,0,0,0,無,有,無,58000,484,,0.0,0,,RPOOMLRLKIHGFEA77CC
北投區,建物,臺北市北投區永興路二段４７號五樓之１,0.0,住,,,1111214,土地0建物1車位0,五層,8,華廈(10層含以下有電梯),住家用,鋼筋混凝土造,0990901,66.09,2,1,1,有,有,有,18000,272,,0.0,0,租金含管理費。,RPPOMLRLKIHGFEA87CC
北投區,建物,臺北市北投區文林北路１３８號１７樓,0.0,住,,,1111114,土地0建物1車位1,十七層,25,住宅大樓(11層含以上有電梯),住家用,鋼骨造,1060220,370.95000000000005,2,2,3,有,無,有,187000,504,坡道平面,28.37,0,,RPXOMLRLKIHGFEA68CC
士林區,建物,臺北市士林區延平北路六段１９９巷７之２號四樓,0.0,住,,,1111221,土地0建物1車位0,四層,4,套房(1房1廳1衛),住家用,鋼筋混凝土造,0711116,38.72,1,1,1,有,無,有,9000,232,,0.0,0,國家住宅及都市更新中心辦理社會住宅包租代管計畫。水電費、瓦斯費由承租人負擔。,RPOPMLRLKIHGFEA87CC
北投區,建物,臺北市北投區石牌路二段３１５巷８號,0.0,住,,,1111221,土地0建物1車位1,一層,5,華廈(10層含以下有電梯),住家用,鋼筋混凝土造,0840619,110.66999999999999,3,2,2,有,無,有,48000,434,坡道平面,0.0,0,,RPPPMLRLKIHGFEA97CC
北投區,建物,臺北市北投區崇仰一路５之６號,0.0,住,,,1111209,土地0建物1車位1,一層,11,住宅大樓(11層含以上有電梯),住家用,鋼筋混凝土造,0860819,208.79,4,2,2,有,有,有,50000,239,坡道平面,40.35,0,租金含管理費。,RPQPMLRLKIHGFEA08CC
士林區,建物,臺北市士林區德行西路３６號十二樓之１,0.0,住,,,1111220,土地0建物1車位0,十二層,13,其他,策略性產業（資訊服務業）,鋼筋混凝土造,0970502,36.3,1,1,1,有,有,有,22000,606,,0.0,0,租金含管理費。,RPOQMLRLKIHGFEA97CC
士林區,建物,臺北市士林區天母東路１０５巷６３號三樓,0.0,住,,,1111216,土地0建物1車位0,三層,4,公寓(5樓含以下無電梯),住家用,鋼筋混凝土造,0671118,87.89,2,2,1,有,有,有,35000,398,,0.0,0,租金含管理費。,RPPQMLRLKIHGFEA08CC
北投區,建物,臺北市北投區西安街二段２６１號７樓,0.0,住,,,1111110,土地0建物1車位1,七層,12,住宅大樓(11層含以上有電梯),集合住宅,鋼筋混凝土造,1110126,173.85000000000002,3,2,2,有,有,有,53500,308,坡道平面,0.0,0,租金附一B1平面車位原申報書編號為C1AE11111170021,RPQQMLRLKIHGFEA18CC
北投區,建物,臺北市北投區中和街３６８號八樓之２,0.0,其他,,,1111213,土地0建物1車位1,八層,19,套房(1房1廳1衛),住家用,鋼筋混凝土造,0870624,76.35,1,1,1,有,有,有,17000,223,坡道平面,0.0,0,,RPSQMLRLKIHGFEA38CC
北投區,建物,臺北市北投區明德路３８巷１６號３樓,0.0,住,,,1111216,土地0建物1車位0,三層,9,華廈(10層含以下有電梯),住家用,鋼筋混凝土造,1040203,181.61,3,2,2,有,有,有,68000,374,,0.0,0,,RPTQMLRLKIHGFEA48CC
中正區,建物,臺北市中正區廈門街１３７號１０樓,0.0,商,,,1111213,土地0建物1車位1,十層,12,住宅大樓(11層含以上有電梯),集合住宅,鋼筋混凝土造,1070816,113.23,2,2,1,有,有,有,36000,318,升降機械,6.87,0,,RPVNMLRLKIHGFAA97CC
文山區,建物,臺北市文山區興隆路四段２２３號二樓,0.0,住,,,1111218,土地0建物1車位0,二層,4,公寓(5樓含以下無電梯),,鋼筋混凝土造,,72.1,2,2,1,有,無,有,20000,277,,0.0,0,,RPXNMLRLKIHGFAA18CC
中正區,建物,臺北市中正區詔安街５０巷７號１樓前面套房,0.0,住,,,1111226,土地0建物0車位0,全,2,透天厝,,加強磚造,,15.0,1,0,1,有,無,有,12000,800,,0.0,0,分租套房,RPTOMLRLKIHGFAA87CC
中正區,建物,臺北市中正區中華路二段３１１巷７號三樓,0.0,住,,,1111220,土地0建物1車位0,三層,5,公寓(5樓含以下無電梯),住家用,加強磚造,,35.11,2,2,1,有,無,有,16000,456,,0.0,0,,RPWOMLRLKIHGFAA18CC
內湖區,建物,臺北市內湖區星雲街１６８巷２３號二樓之１,0.0,住,,,1111214,土地0建物1車位1,二層,13,住宅大樓(11層含以上有電梯),住家用,鋼筋混凝土造,0841116,125.05,2,2,1,有,有,有,30000,240,坡道平面,0.0,0,車位面積無法分算。,RPPNMLRLKIHGFCA57CC
內湖區,建物,臺北市內湖區新湖二路２５７號４樓之２,0.0,工,,,1111221,土地0建物1車位2,四層,7,廠辦,公害較輕微之工業〈第５２組〉,鋼筋混凝土造,0970313,534.5,2,0,0,有,有,無,136534,255,坡道平面,57.12,0,短租5個月,RPSNMLRLKIHGFCA87CC
中山區,建物,臺北市中山區中山北路三段５３號８樓,0.0,商,,,1111219,土地0建物1車位1,八層,11,住宅大樓(11層含以上有電梯),集合住宅,鋼筋混凝土造,1101013,217.82,2,2,2,有,有,有,112700,517,坡道平面,43.35,0,,RPWNMLRLKIHGFCA28CC
中山區,建物,臺北市中山區吉林路３６９號二樓之２,0.0,住,,,1111219,土地0建物0車位0,二層,7,套房(1房1廳1衛),住家用,鋼筋混凝土造,0681219,32.92,1,0,1,有,無,有,12500,380,,0.0,0,此為分租套房，第二層共分成3間，一間平均面積約為32.92平方公尺。電費及每月垃圾收取費600元、水費200元皆為承租人負擔。,RPQOMLRLKIHGFCA77CC
內湖區,建物,臺北市內湖區內湖路一段７３７巷５０弄９號三樓,0.0,住,,,1111201,土地0建物1車位0,三層,5,公寓(5樓含以下無電梯),住家用,鋼筋混凝土造,0760831,105.81,3,2,2,有,無,有,32500,307,,0.0,0,加入臺北市社會住宅包租代管第3期計畫,RPTOMLRLKIHGFCA08CC
中山區,建物,臺北市中山區中山北路二段２７巷４號五樓,0.0,商,,,1111129,土地0建物0車位0,五層,7,華廈(10層含以下有電梯),商業用,鋼筋混凝土造,0660516,108.5,2,0,0,有,有,無,47500,438,,0.0,0,租賃期間含免租金裝潢期。部分承租。,RPPPMLRLKIHGFCA77CC
內湖區,建物,臺北市內湖區民權東路六段１２３巷２０弄９號,0.0,商,,,1111211,土地0建物1車位0,一層,14,辦公商業大樓,商業用,鋼筋混凝土造,0890106,115.41,0,1,1,有,有,有,51500,446,,0.0,0,租金含管理費。,RPTPMLRLKIHGFCA18CC
內湖區,建物,臺北市內湖區瑞光路２５８巷２號７樓-２、之３,0.0,工,,,1111212,土地0建物2車位3,七層,10,辦公商業大樓,工業用,見使用執照,0920530,811.03,7,0,0,有,有,有,300000,370,坡道平面,106.68,0,,RPWPMLRLKIHGFCA48CC
中山區,建物,臺北市中山區新生北路二段３６號１５樓之３,0.0,商,,,1111210,土地0建物1車位0,十五層,17,住宅大樓(11層含以上有電梯),住家用,鋼筋混凝土造,0850718,66.28,2,2,1,有,有,有,50000,754,,0.0,0,,RPSQMLRLKIHGFCA18CC
中山區,建物,臺北市中山區雙城街１３巷９號９樓之２,0.0,商,,,1111211,土地0建物1車位0,九層,15,住宅大樓(11層含以上有電梯),住家用,鋼筋混凝土造,1010327,133.53,3,2,2,有,有,有,82000,614,,0.0,0,,RPTQMLRLKIHGFCA28CC
中山區,建物,臺北市中山區南京東路二段１８８號６樓,0.0,商,,,1111214,土地0建物1車位0,六層,15,住宅大樓(11層含以上有電梯),住家用,鋼筋混凝土造,0990528,136.03,3,2,2,有,有,有,70000,515,,0.0,0,,RPVQMLRLKIHGFCA48CC
中山區,建物,臺北市中山區新生北路二段４９號１０樓,0.0,住,,,1111215,土地0建物1車位0,十層,19,住宅大樓(11層含以上有電梯),住家用,鋼骨鋼筋混凝土造,0980916,208.43,3,2,2,有,有,有,70000,336,,0.0,0,,RPWQMLRLKIHGFCA58CC
中山區,建物,臺北市中山區林森北路４７２號五樓之６,0.0,商,,,1111221,土地0建物1車位0,五層,10,華廈(10層含以下有電梯),商業用,鋼筋混凝土造,0850730,29.99,1,0,1,有,無,有,20000,667,,0.0,0,,RPORMLRLKIHGFCA87CC
內湖區,建物,臺北市內湖區洲子街８８號６樓-１,0.0,工,,,1111121,土地0建物1車位1,六層,10,辦公商業大樓,工業用,鋼骨造,0950418,362.46000000000004,0,0,0,無,有,有,118000,326,坡道平面,35.83,0,,RPWNMLSLKIHGFCA38CC
內湖區,建物,臺北市內湖區文德路６６巷６９弄２８號１樓,0.0,住,,,1111102,土地0建物1車位0,一層,5,公寓(5樓含以下無電梯),住家用,鋼筋混凝土造,0721230,182.01,4,2,2,有,無,無,42000,231,,0.0,0,租金未含稅  未含二代健保/原申報序號：C1AC11111150008/公寓做倉庫使用,RPOOMLSLKIHGFCA67CC
中山區,建物,臺北市中山區松江路１８５號６樓之７,0.0,商,,,1111110,土地0建物1車位0,六層,14,辦公商業大樓,商業用,鋼筋混凝土造,0671219,28.85,0,0,0,無,無,無,12500,433,,0.0,0,,RPPOMLSLKIHGFCA77CC
內湖區,建物,臺北市內湖區金湖路９７號１樓,0.0,住,,,1111107,土地0建物1車位0,一層,14,店面(店鋪),一般零售業〈甲組〉〈日用百貨除外〉,鋼筋混凝土造,0990518,111.65,0,0,0,無,有,無,72000,645,,0.0,0,,RPQOMLSLKIHGFCA87CC
中山區,建物,臺北市中山區新生北路二段６２巷１２號９樓之２,0.0,商,,,1111115,土地0建物1車位0,九層,19,住宅大樓(11層含以上有電梯),住家用,鋼骨鋼筋混凝土造,1050322,162.4,3,2,2,有,有,有,96000,591,,0.0,0,,RPVOMLSLKIHGFCA38CC
中山區,房地(土地+建物)+車位,臺北市中山區敬業一路１２８巷５號,0.0,商,,,1111228,土地0建物1車位1,一層,11,店面(店鋪),一般零售業〈甲組〉,鋼筋混凝土造,0961127,169.53,0,0,0,無,有,無,98000,681,坡道平面,31.45,4000,,RPPPMLSLKIHGFCA87CC
中山區,房地(土地+建物),臺北市中山區敬業一路１２８巷３號,0.0,商,,,1111228,土地0建物1車位0,一層,11,店面(店鋪),一般零售業〈甲組〉,鋼筋混凝土造,0961127,143.71,0,0,0,無,有,無,102000,710,,0.0,0,,RPQPMLSLKIHGFCA97CC
內湖區,建物,臺北市內湖區安泰街１２５巷３號二樓,0.0,住,,,1111214,土地0建物1車位0,二層,8,華廈(10層含以下有電梯),住家用,鋼筋混凝土造,0860116,93.85,2,1,1,有,無,有,20000,213,,0.0,0,加入臺北市社會住宅包租代管第3期計畫,RPTPMLSLKIHGFCA28CC
中山區,房地(土地+建物),臺北市中山區南京東路二段２０號８樓之４,7.42,商,,,1111216,土地3建物1車位0,八層,12,住宅大樓(11層含以上有電梯),商業用,鋼筋混凝土造,0680330,103.46,3,1,0,有,無,有,56661,548,,0.0,0,,RPWPMLSLKIHGFCA58CC
內湖區,建物,臺北市內湖區內湖路一段９１巷３５弄３８號二樓,0.0,商,,,1111215,土地0建物1車位0,二層,5,公寓(5樓含以下無電梯),住家用,鋼筋混凝土造,0720815,106.75999999999999,3,2,2,有,無,有,28000,262,,0.0,0,,RPPQMLSLKIHGFCA97CC
中山區,建物,臺北市中山區民權東路二段９２巷８弄２２號,0.0,住,,,1111215,土地0建物1車位0,一層,4,公寓(5樓含以下無電梯),住家用,加強磚造,0580913,62.97,0,1,1,有,無,有,29000,461,,0.0,0,房屋用途做倉庫使用。,RPUQMLSLKIHGFCA48CC
內湖區,房地(土地+建物)+車位,臺北市內湖區安康路４２６號,612.23,住,,,1111223,土地1建物1車位1,一層,9,店面(店鋪),日常用品零售業（Ｇ３）（日用百貨）,鋼筋混凝土造,1090929,44.96,0,0,0,無,無,有,36000,801,升降機械,0.0,0,,RPVQMLSLKIHGFCA58CC
內湖區,建物,臺北市內湖區環山路二段１０９巷１弄６號４樓,0.0,住,,,1111211,土地0建物1車位0,四層,5,公寓(5樓含以下無電梯),住家用,鋼筋混凝土造,0740108,94.75,3,2,2,有,有,無,30000,317,,0.0,0,,RPPRMLSLKIHGFCA08CC
內湖區,建物,臺北市內湖區康寧路三段１６５巷２３弄１５號二樓,0.0,住,,,1111223,土地0建物1車位0,二層,5,公寓(5樓含以下無電梯),住家用,鋼筋混凝土造,0731218,109.37,3,2,2,有,無,有,29000,265,,0.0,0,國家住宅及都市更新中心社會住宅包租代管計畫。水電瓦斯費及每月管理費350元由承租人負擔。,RPQRMLSLKIHGFCA18CC
中山區,建物,臺北市中山區南京東路一段１３２巷２９號四樓之３,0.0,商,,,1111221,土地0建物1車位0,四層,6,套房(1房1廳1衛),住家用,鋼筋混凝土造,0660525,39.22,1,0,1,有,有,有,13000,331,,0.0,0,國家住宅及都市更新中心社會住宅包租代管計畫。水電瓦斯費及每月管理費600元由承租人負擔。,RPRRMLSLKIHGFCA28CC
內湖區,建物,臺北市內湖區康樂街６１巷１２弄３號四樓,0.0,住,,,1111223,土地0建物1車位0,四層,5,公寓(5樓含以下無電梯),住家用,鋼筋混凝土造,0741230,87.64,3,2,1,有,無,有,23000,262,,0.0,0,國家住宅及都市更新中心社會住宅包租代管計畫。每月水電瓦斯、網路及第四台費由承租人負擔。,RPTRMLSLKIHGFCA48CC
士林區,建物,臺北市士林區忠誠路二段１４０巷１５弄１３號,0.0,住,,,1111120,土地0建物1車位0,一層,5,公寓(5樓含以下無電梯),住家用,鋼筋混凝土造,0700424,109.25999999999999,3,2,2,有,無,有,38000,348,,0.0,0,,RPTNMLSLKIHGFEA28CC
士林區,建物,臺北市士林區中山北路七段５５號２樓,0.0,住,,,1111121,土地0建物1車位0,二層,7,華廈(10層含以下有電梯),住家用,鋼筋混凝土造,0720111,153.89999999999998,0,0,0,無,有,有,48000,312,,0.0,0,,RPVNMLSLKIHGFEA48CC
北投區,建物,臺北市北投區裕民六路１００號十二樓之１,0.0,商,,,1111111,土地0建物1車位0,十二層,17,住宅大樓(11層含以上有電梯),見使用執照,鋼筋混凝土造,0920221,190.25,3,2,1,有,有,有,50000,263,,0.0,0,,RPXNMLSLKIHGFEA68CC
士林區,建物,臺北市士林區中山北路六段１５７巷１１號７樓之７,0.0,工,,,1111116,土地0建物1車位0,七層,15,住宅大樓(11層含以上有電梯),策略性產業（資訊服務業）,鋼筋混凝土造,0971002,160.86,2,2,1,有,有,有,60000,373,,0.0,0,,RPPOMLSLKIHGFEA97CC
北投區,建物,臺北市北投區文林北路１３８號６樓,0.0,住,,,1111130,土地0建物1車位0,六層,25,住宅大樓(11層含以上有電梯),住家用,鋼骨造,1060220,171.61,3,2,2,有,有,有,92000,536,,0.0,0,,RPSPMLSLKIHGFEA38CC
北投區,建物,臺北市北投區明德路２８號８樓,0.0,住,,,1111130,土地0建物1車位0,八層,15,住宅大樓(11層含以上有電梯),住家用,鋼筋混凝土造,1050425,218.39,4,2,3,有,有,有,90000,412,,0.0,0,,RPTPMLSLKIHGFEA48CC
士林區,建物,臺北市士林區中山北路六段２９０巷２３弄１０號五樓,0.0,住,,,1111226,土地0建物1車位0,五層,5,公寓(5樓含以下無電梯),住家用,鋼筋混凝土造,0690812,121.25,3,2,2,有,無,有,32000,264,,0.0,0,國家住宅及都市更新中心辦理社會住宅包租代管計畫。水電費、瓦斯費由承租人負擔。,RPUPMLSLKIHGFEA58CC
北投區,建物,臺北市北投區崇仁路一段１７６號二樓之２,0.0,住,,,1111222,土地0建物1車位0,二層,14,套房(1房1廳1衛),住家用,鋼筋混凝土造,0870729,46.45,1,1,1,有,有,有,19000,409,,0.0,0,國家住宅及都市更新中心社會住宅包租代管計畫。水電瓦斯費及每月管理費1265元由承租人負擔。,RPVPMLSLKIHGFEA68CC
士林區,建物,臺北市士林區通河東街一段９１號二樓,0.0,住,,,1111221,土地0建物1車位0,二層,5,公寓(5樓含以下無電梯),住家用,鋼筋混凝土造,0680828,98.74,3,2,1,有,無,有,22500,228,,0.0,0,國家住宅及都市更新中心社會住宅包租代管計畫。每月水電瓦斯費由承租人負擔。,RPWPMLSLKIHGFEA78CC
北投區,建物,臺北市北投區溫泉路７１號四樓之１５,0.0,其他,,,1111221,土地0建物1車位0,四層,7,套房(1房1廳1衛),商業用,鋼筋混凝土造,0700218,27.220000000000002,1,0,1,有,有,有,8000,294,,0.0,0,國家住宅及都市更新中心社會住宅包租代管計畫。每月水電瓦斯費由承租人負擔。,RPXPMLSLKIHGFEA88CC
士林區,建物,臺北市士林區文林路５４６號九樓,0.0,商,,,1111214,土地0建物1車位0,九層,9,辦公商業大樓,商業用,鋼筋混凝土造,0910502,245.13,0,3,0,有,有,有,70000,286,,0.0,0,租賃範圍不含車位，已扣除車位面積。租賃期間含免租金裝潢期。租金調漲：第二年起租金調整為75000元/月。,RPOQMLSLKIHGFEA08CC
南港區,建物,臺北市南港區三重路１９之５號１０樓,0.0,其他,,,1111121,土地0建物1車位5,十層,16,辦公商業大樓,一般事務所（工業區）,鋼骨造,0880705,1422.42,0,0,0,無,有,無,600000,422,坡道平面,299.0,0,,RPUNMLSLKIHGFDA28CC
信義區,建物,臺北市信義區基隆路二段５６號９樓之２,0.0,商,,,1111202,土地0建物1車位0,九層,10,辦公商業大樓,商業用,鋼筋混凝土造,0840214,112.64,0,0,0,無,有,無,60900,541,,0.0,0,,RPWNMLSLKIHGFDA48CC
信義區,建物,臺北市信義區忠孝東路五段７４３巷２１弄２５號三樓,0.0,住,,,1111209,土地0建物1車位0,三層,11,住宅大樓(11層含以上有電梯),集合住宅,鋼筋混凝土造,1040821,66.27,2,1,1,有,有,有,42000,634,,0.0,0,租金含管理費。租賃範圍不含車位，已扣除車位面積。,RPQOMLSLKIHGFDA97CC
松山區,建物,臺北市松山區八德路二段３８６號八樓之６,0.0,商,,,1111216,土地0建物1車位0,八層,12,住宅大樓(11層含以上有電梯),住家用,鋼筋混凝土造,0691108,45.370000000000005,1,0,1,有,無,有,14000,309,,0.0,0,加入臺北市社會住宅包租代管第3期計畫,RPUOMLSLKIHGFDA38CC
松山區,建物,臺北市松山區南京東路五段４０號六樓之２,0.0,其他,,,1111221,土地0建物1車位0,六層,19,住宅大樓(11層含以上有電梯),商業用,鋼筋混凝土造,0790216,70.47,2,1,1,有,有,有,30600,434,,0.0,0,加入臺北市社會住宅包租代管第3.1期計畫,RPWOMLSLKIHGFDA58CC
南港區,房地(土地+建物),臺北市南港區研究院路二段３７巷１弄６號,71.0,住,,,1111130,土地1建物1車位0,一層,3,公寓(5樓含以下無電梯),住家用,鋼筋混凝土造,0610606,62.08,4,0,1,有,無,無,25600,412,,0.0,0,,RPTPMLSLKIHGFDA38CC
南港區,房地(土地+建物),臺北市南港區研究院路二段３９之５號,71.0,住,,,1111130,土地1建物1車位0,二層,3,公寓(5樓含以下無電梯),住家用,鋼筋混凝土造,0610606,66.93,0,0,0,無,無,無,25600,382,,0.0,0,,RPWPMLSLKIHGFDA68CC
松山區,建物,臺北市松山區復興北路１７９號十樓之６,0.0,商,,,1111220,土地0建物1車位0,十層,12,住宅大樓(11層含以上有電梯),住家用,鋼筋混凝土造,,70.15,2,1,1,有,有,有,30000,428,,0.0,0,,RPSQMLSLKIHGFDA38CC
松山區,建物,臺北市松山區復興北路１７９號１２樓之３,0.0,商,,,1111220,土地0建物1車位0,十二層,12,住宅大樓(11層含以上有電梯),住家用,鋼筋混凝土造,,41.23,1,1,1,有,有,無,20000,485,,0.0,0,,RPTQMLSLKIHGFDA48CC
中正區,建物,臺北市中正區仁愛路２段９９號６樓,0.0,住,,,1111206,土地0建物1車位6,六層,16,辦公商業大樓,商業用,鋼筋混凝土造,0771018,709.64,0,0,0,無,無,無,537705,758,坡道平面,0.0,50400,租金含5%加值營業稅。,RPROMLSLKIHGFBA87CC
萬華區,建物,臺北市萬華區西寧南路５０巷７號,0.0,商,,,1111215,土地0建物1車位0,一層,4,店面(店鋪),,加強磚造,,40.0,0,0,0,無,無,無,100000,2500,,0.0,0,部分承租。租賃期間含免租金裝潢期。,RPSOMLSLKIHGFBA97CC
萬華區,建物,臺北市萬華區廣州街７９號三樓之１,0.0,商,,,1111223,土地0建物1車位0,三層,13,住宅大樓(11層含以上有電梯),商業用,鋼筋混凝土造,0890425,139.6,3,2,2,有,有,有,31500,226,,0.0,0,國家住宅及都市更新中心社會住宅包租代管計畫。水電瓦斯費及每月管理費2289元由承租人負擔。,RPTOMLSLKIHGFBA08CC
大安區,建物,臺北市大安區復興南路二段３４４之１號１樓,38.5,住,,,1111116,土地0建物0車位0,一層,4,店面(店鋪),住家用,鋼筋混凝土造,0640725,107.3,0,0,0,無,無,無,95000,885,,0.0,0,,RPUNMLSLKIHGFFA48CC
