信義區,建物,臺北市信義區忠孝東路５段５１０號７樓之１,0.0,住,,,1111108,土地0建物1車位0,七層,27,辦公商業大樓,商業用,鋼骨混凝土造,0820813,193.37,0,0,0,無,有,無,95000,491,,0.0,0,車位為坡道平面.車位坪數22.5平方公尺.車位租金已含房屋內,RPWNMLPJKIHGFDA97CC
信義區,房地(土地+建物),臺北市信義區永吉路１８０巷５２號１樓,0.0,住,,,1111114,土地0建物1車位0,全,3,透天厝,住家用,鋼筋混凝土造,0860701,26.39,0,1,1,有,無,無,19000,720,,0.0,0,,RPQOMLPJKIHGFDA47CC
松山區,車位,臺北市松山區八德路四段８６號,0.0,住,,,1111202,土地0建物0車位1,,0,其他,住家用,鋼筋混凝土造,0910619,44.949999999999996,0,0,0,有,無,無,5500,,坡道平面,44.95,5500,,RPSOMLPJKIHGFDA67CC
南港區,建物,臺北市南港區昆陽街１４０巷２４號四樓,0.0,住,,,1111107,土地0建物1車位0,四層,4,公寓(5樓含以下無電梯),住家用,鋼筋混凝土造,0660503,77.23,3,1,2,有,無,有,15000,194,,0.0,0,,RPUOMLPJKIHGFDA87CC
松山區,建物,臺北市松山區八德路三段１８５號三樓,0.0,商,,,1111107,土地0建物1車位0,三層,4,公寓(5樓含以下無電梯),住家用,鋼筋混凝土造,,79.97,3,2,1,有,無,有,18000,225,,0.0,0,,RPVOMLPJKIHGFDA97CC
信義區,建物,臺北市信義區吳興街３７５巷６１弄９之２號,0.0,住,,,1111115,土地0建物1車位0,三層,4,公寓(5樓含以下無電梯),住家用,鋼筋混凝土造,0610417,95.54,3,2,1,有,無,有,30000,314,,0.0,0,,RPOPMLPJKIHGFDA37CC
松山區,建物,臺北市松山區民權東路三段１０６巷３弄６５號６樓,0.0,住,,,1111112,土地0建物1車位0,六層,7,華廈(10層含以下有電梯),住家用,鋼筋混凝土造,0740301,124.06,3,2,2,有,有,有,62000,500,,0.0,0,,RPUPMLPJKIHGFDA97CC
南港區,建物,臺北市南港區南港路三段９９號４樓,0.0,工,,,1111117,土地0建物1車位0,四層,9,辦公商業大樓,工業用,鋼筋混凝土造,0810317,393.35999999999996,2,1,2,有,有,有,100000,254,,0.0,0,,RPVPMLPJKIHGFDA08CC
信義區,建物,臺北市信義區忠孝東路五段６６９號４樓之１,0.0,住,,,1111201,土地0建物1車位0,四層,10,辦公商業大樓,商業用,鋼筋混凝土造,0811006,123.27000000000001,0,0,0,無,有,無,50000,406,,0.0,0,,RPWPMLPJKIHGFDA18CC
大安區,建物,臺北市大安區復興南路一段３５８號及３５８號地下室,0.0,商,,,1111118,土地0建物2車位0,見其他登記事項,12,店面(店鋪),住商用,鋼筋混凝土造,0660718,377.46999999999997,0,2,1,有,有,無,285000,755,,0.0,0,租賃期間含免租金裝潢期。,RPQNMLPJKIHGFFA57CC
大安區,建物,臺北市大安區和平東路一段１８３巷１１弄６號４樓,0.0,住,,,1111117,土地0建物1車位1,四層,10,住宅大樓(11層含以上有電梯),住家用,鋼筋混凝土造,0950908,278.2,3,2,2,有,有,無,85000,306,坡道平面,0.0,0,,RPRNMLPJKIHGFFA67CC
北投區,建物,臺北市北投區溫泉路３７巷３０號三樓之９,0.0,商,,,1111110,土地0建物1車位0,三層,13,住宅大樓(11層含以上有電梯),住家用,鋼筋混凝土造,0941111,33.42,1,1,1,有,有,有,14000,419,,0.0,0,管理費:1000,RPROMLPJKIHGFEA67CC
士林區,建物,臺北市士林區士東路８９巷１４號三樓,0.0,住,,,1111201,土地0建物1車位0,三層,7,華廈(10層含以下有電梯),住家用,鋼筋混凝土造,1021007,167.38,3,2,2,有,有,有,87000,520,,0.0,0,,RPSPMLPJKIHGFEA87CC
士林區,建物,臺北市士林區中山北路六段１５７巷１１號十四樓之１,0.0,工,,,1111205,土地0建物1車位0,十四層,15,住宅大樓(11層含以上有電梯),策略性產業（資訊服務業）,鋼筋混凝土造,0971002,101.18,2,2,1,有,有,有,64500,637,,0.0,0,,RPTPMLPJKIHGFEA97CC
士林區,建物,臺北市士林區芝玉路二段６１巷８號三樓,0.0,住,,,1111205,土地0建物1車位0,三層,14,住宅大樓(11層含以上有電梯),住家用,鋼筋混凝土造,0910102,171.34,4,2,2,有,有,有,59000,344,,0.0,0,,RPUPMLPJKIHGFEA08CC
士林區,建物,臺北市士林區福港街２５９巷１３弄１０之１號二樓,0.0,住,,,1111111,土地0建物1車位0,二層,5,公寓(5樓含以下無電梯),住家用,鋼筋混凝土造,0711030,92.00999999999999,3,2,2,有,無,有,29000,315,,0.0,0,,RPWPMLPJKIHGFEA28CC
中山區,建物,臺北市中山區錦州街５０號八樓之１２,0.0,商,,,1111107,土地0建物1車位0,八層,13,套房(1房1廳1衛),住家用,鋼筋混凝土造,0730927,37.86,1,1,1,有,有,有,11000,291,,0.0,0,管理費:1080,RPQOMLPJKIHGFCA37CC
中山區,建物,臺北市中山區林森北路６５７號２樓之２,0.0,商,,,1111024,土地0建物1車位0,二層,10,華廈(10層含以下有電梯),住家用,鋼筋混凝土造,0930423,34.379999999999995,1,0,0,無,有,無,17000,494,,0.0,0,,RPPPMLPJKIHGFCA37CC
中山區,建物,臺北市中山區南京東路二段１０８號１１樓之７,0.0,其他,,,1111025,土地0建物1車位0,十一層,18,套房(1房1廳1衛),住家用,鋼骨造,0990917,48.6,1,1,1,有,有,有,27000,556,,0.0,0,,RPQPMLPJKIHGFCA47CC
中山區,建物,臺北市中山區新生北路二段９６號８樓之７,0.0,商,,,1111021,土地0建物1車位0,八層,12,住宅大樓(11層含以上有電梯),住家用,鋼筋混凝土造,0711224,34.71,1,0,0,無,有,有,11000,317,,0.0,0,國家住宅及都市中心辦理社會住宅包租代管計畫原申請編號：C1AC11110280034,RPSPMLPJKIHGFCA67CC
內湖區,建物,臺北市內湖區港墘路２０８號６樓,0.0,工,,,1111125,土地0建物1車位0,六層,7,辦公商業大樓,公害較輕微之工業,鋼筋混凝土造,0990826,232.11,0,0,0,無,無,有,156000,672,,0.0,0,,RPUPMLPJKIHGFCA87CC
中山區,建物,臺北市中山區復興北路１７８號１４樓之１ １４樓之２,0.0,商,,,1111201,土地0建物1車位0,十四層,16,辦公商業大樓,商業用,鋼筋混凝土造,0851205,205.41000000000003,2,1,1,有,有,有,59000,287,,0.0,0,此租賃物為復興北路178號14樓之1 14樓之2合併出租,RPXPMLPJKIHGFCA18CC
中山區,建物,臺北市中山區長安東路一段２１號３樓,0.0,商,,,1111123,土地0建物1車位0,三層,11,辦公商業大樓,辦公室、停車場,鋼筋混凝土造,0650419,264.46,0,0,0,無,有,無,110000,416,,0.0,0,分割A室80坪,RPOQMLPJKIHGFCA37CC
中山區,建物,臺北市中山區松江路１２６號４樓之３,0.0,商,,,1111129,土地0建物1車位0,四層,17,辦公商業大樓,一般事務所,鋼骨造,1011116,268.59000000000003,0,0,0,無,有,無,205006,763,,0.0,0,,RPQQMLPJKIHGFCA67DC
文山區,建物,臺北市文山區辛亥路五段９５號五樓,0.0,住,,,1111201,土地0建物1車位0,五層,7,華廈(10層含以下有電梯),住家用,鋼筋混凝土造,0720818,108.68,3,2,2,有,有,有,29400,271,,0.0,0,國家住宅及都市更新中心辦理社會住宅包租代管計畫。水電費、瓦斯費及每月管理費1200元皆由承租人負擔。,RPWNMLPJKIHGFAA67CC
文山區,建物,臺北市文山區三福街３２號四樓,0.0,住,,,1111108,土地0建物1車位0,四層,4,公寓(5樓含以下無電梯),住家用,鋼筋混凝土造,0650915,68.15,3,1,1,有,無,有,22000,323,,0.0,0,,RPXNMLPJKIHGFAA77CC
中正區,建物,臺北市中正區中華路二段３１１巷１６號二樓,0.0,住,,,1111115,土地0建物1車位0,二層,5,公寓(5樓含以下無電梯),,加強磚造,0560519,35.11,2,1,1,有,無,有,13000,370,,0.0,0,,RPQNMLQJKIHGFAA17CC
文山區,建物,臺北市文山區政大一街３２０巷９８號五樓,0.0,商,,,1111120,土地0建物1車位1,五層,11,住宅大樓(11層含以上有電梯),住家用,鋼筋混凝土造,1000429,234.64,3,2,2,有,有,有,52000,222,坡道平面,43.71,0,租金含管理費。謄本登記層次為六層，現況為五層，故以現況層次申報。,RPRNMLQJKIHGFAA27CC
文山區,建物,臺北市文山區忠順街二段４６號三樓,0.0,住,,,1111110,土地0建物1車位0,三層,7,華廈(10層含以下有電梯),住家用,鋼筋混凝土造,0730712,105.24,3,2,2,有,有,有,25000,238,,0.0,0,管理費400不記入租金內,RPSNMLQJKIHGFAA37CC
文山區,建物,臺北市文山區育英街５９之２號２樓,0.0,住,,,1111117,土地0建物1車位0,二層,4,公寓(5樓含以下無電梯),住家用,鋼筋混凝土造,0651127,90.02,2,1,1,有,無,有,25000,278,,0.0,0,,RPSOMLQJKIHGFAA47CC
中山區,建物,臺北市中山區吉林路３７９巷１９號１樓,0.0,住,,,1111117,土地0建物1車位0,一層,7,華廈(10層含以下有電梯),住商用,鋼筋混凝土造,0710408,198.74,0,1,1,有,無,有,60000,302,,0.0,0,,RPTNMLQJKIHGFCA67CC
內湖區,建物,臺北市內湖區港墘路２６巷１１號十二樓之１,0.0,住,,,1111111,土地0建物1車位1,十二層,14,住宅大樓(11層含以上有電梯),住家用,鋼筋混凝土造,0840401,181.25,4,2,2,有,有,有,58000,320,坡道平面,0.0,0,車位面積無法分算。,RPVNMLQJKIHGFCA87CC
中山區,建物,臺北市中山區新生北路二段１５巷６號７樓,0.0,住,,,1111123,土地0建物1車位0,七層,7,華廈(10層含以下有電梯),住家用,鋼筋混凝土造,1001014,136.38,2,2,2,有,無,有,75000,550,,0.0,0,,RPROMLQJKIHGFCA57CC
中山區,建物,臺北市中山區復興北路６２號２樓之２,0.0,商,,,1111019,土地0建物1車位0,二層,12,住宅大樓(11層含以上有電梯),商業用,鋼筋混凝土造,0700217,132.79,0,1,2,有,有,有,55000,414,,0.0,0,,RPVOMLQJKIHGFCA97CC
內湖區,建物,臺北市內湖區民權東路六段１１７號十三樓之６,0.0,商,,,1111120,土地0建物1車位1,十三層,15,住宅大樓(11層含以上有電梯),住家用,鋼筋混凝土造,0970130,156.57999999999998,3,2,2,有,有,有,40000,255,坡道機械,4.63,0,,RPXOMLQJKIHGFCA18CC
內湖區,建物,臺北市內湖區民權東路六段２８０巷２５弄６０號３樓,0.0,住,,,1111122,土地0建物1車位2,三層,14,住宅大樓(11層含以上有電梯),住家用,鋼筋混凝土造,0961224,249.8,4,2,2,有,無,有,92000,368,坡道平面,43.01,0,,RPOPMLQJKIHGFCA37CC
中山區,建物,臺北市中山區中山北路二段５２號３樓,0.0,商,,,1111130,土地0建物1車位0,三層,12,辦公商業大樓,商業用,鋼筋混凝土造,0750410,178.9,0,0,0,無,有,無,90000,503,,0.0,0,,RPSPMLQJKIHGFCA77CC
中山區,建物,臺北市中山區新生北路二段１４９巷７之４號１樓,0.0,商,,,1111025,土地0建物1車位0,一層,4,公寓(5樓含以下無電梯),住家用,加強磚造,0580331,27.54,2,0,1,有,無,無,7000,254,,0.0,0,租賃期限:111年11月15日至112年11月14日分隔為兩室出租此為B室承租範圍:權利範圍1/3更正申報書序號:C1AC11112060022,RPTPMLQJKIHGFCA87CC
中山區,建物,臺北市中山區新生北路二段１４９巷７之４號１樓,0.0,商,,,1111025,土地0建物1車位0,一層,4,公寓(5樓含以下無電梯),住家用,加強磚造,0580331,50.07,2,0,1,有,無,無,18000,359,,0.0,0,租賃期限:111年11月15日至112年11月14日分隔為兩室出租此為A室承租範圍:權利範圍2/3更正申報書序號:C1AC11112060023,RPUPMLQJKIHGFCA97CC
中山區,房地(土地+建物)+車位,臺北市中山區中山北路一段２７號８樓,0.0,商,,,1111025,土地1建物1車位3,見其他登記事項,16,辦公商業大樓,商業用,鋼骨混凝土造,0851017,378.67,6,0,0,有,有,無,223918,591,坡道機械,0.0,0,原申報序號：C1AC11111100004；車位部分：1面積無法拆算 2有承租另一主建物車位,RPVPMLQJKIHGFCA08CC
內湖區,建物,臺北市內湖區瑞光路１１２巷１號３樓,0.0,工,,,1111130,土地0建物1車位0,三層,6,辦公商業大樓,工業用,鋼筋混凝土造,0880630,225.19,8,0,0,有,有,無,70000,311,,0.0,0,,RPXPMLQJKIHGFCA28CC
內湖區,建物,臺北市內湖區星雲街１２７號１２樓,0.0,住,,,1111125,土地0建物1車位0,十二層,14,住宅大樓(11層含以上有電梯),住家用,鋼筋混凝土造,0931222,126.02,2,2,2,有,有,有,62105,493,,0.0,0,每月租金含稅及管理費,RPSQMLQJKIHGFCA87CC
中山區,建物,臺北市中山區民生東路一段２５號７樓之２０,0.0,商,,,1111202,土地0建物1車位0,七層,12,套房(1房1廳1衛),住家用,鋼筋混凝土造,0690815,26.71,1,0,1,有,有,有,12800,479,,0.0,0,國家住宅及都市更新中心社會住宅包租代管計畫。每月水電費及管理費485元由承租人負擔。,RPTQMLQJKIHGFCA97CC
中山區,建物,臺北市中山區林森北路３０６號５樓之２,0.0,商,,,1111130,土地0建物1車位0,五層,14,住宅大樓(11層含以上有電梯),商業用,鋼筋混凝土造,0920213,41.129999999999995,1,1,1,有,無,有,25000,608,,0.0,0,,RPPRMLQJKIHGFCA67CC
北投區,房地(土地+建物),臺北市北投區致遠一路一段１２５巷２號３樓,37.0,住,,,1111205,土地1建物1車位0,三層,4,公寓(5樓含以下無電梯),住家用,鋼筋混凝土造,0650922,90.3,3,2,1,有,無,有,22000,244,,0.0,0,,RPRNMLQJKIHGFEA67CC
士林區,建物,臺北市士林區後港街１０２號三樓,0.0,工,,,1111107,土地0建物1車位0,三層,8,辦公商業大樓,工業用,鋼筋混凝土造,0840321,171.41,3,1,1,有,無,有,60000,350,,0.0,0,,RPUNMLQJKIHGFEA97CC
士林區,建物,臺北市士林區承德路四段４０巷１０５號五樓之６,0.0,住,,,1111125,土地0建物1車位0,四層,5,公寓(5樓含以下無電梯),住家用,鋼筋混凝土造,0591008,42.8,2,1,1,有,無,有,12000,280,,0.0,0,,RPWNMLQJKIHGFEA18CC
北投區,建物,臺北市北投區中和街５０７巷３弄６號七樓,59.7,住,,,1111112,土地0建物1車位0,七層,7,華廈(10層含以下有電梯),住家用,鋼筋混凝土造,1050224,69.72,1,1,1,有,有,有,20000,287,,0.0,0,月租金20000元含管理費,RPOPMLQJKIHGFEA57CC
士林區,建物,臺北市士林區通河街１６５之１號五樓,0.0,住,,,1111108,土地0建物1車位0,五層,7,華廈(10層含以下有電梯),住家用,鋼筋混凝土造,0730119,92.28999999999999,3,2,2,有,有,有,27100,294,,0.0,0,本案僅建物部份屬國家住宅及都市更新中心辦理社會住宅包租代管增辦第3期計畫，另有管理費由承租人負擔,RPSPMLQJKIHGFEA97CC
北投區,建物,臺北市北投區溫泉路７１號五樓,0.0,其他,,,1111203,土地0建物1車位0,五層,7,套房(1房1廳1衛),住家用,鋼筋混凝土造,0700218,44.56,1,1,1,有,有,有,11000,247,,0.0,0,台北市社會住宅包租代管計畫。水電費、瓦斯費及每月管理費670元皆由承租人負擔。,RPVPMLQJKIHGFEA28CC
北投區,建物,臺北市北投區光明路１３３之８號,0.0,其他,,,1111204,土地0建物1車位0,見其他登記事項,2,店面(店鋪),住家用,磚造,0440607,101.78,0,0,2,有,無,無,120000,1179,,0.0,0,112年1月5日至113年12月4日每月新台幣12萬元整含營業稅，113年12月5日至116年12月4日新台幣12.5萬元整含營業稅,RPPQMLQJKIHGFEA77CC
北投區,建物,臺北市北投區義理街７２號２樓,0.0,其他,,,1111121,土地0建物1車位0,二層,4,公寓(5樓含以下無電梯),住家用,鋼筋混凝土造,0650703,118.83,3,2,1,有,無,有,23000,194,,0.0,0,,RPRQMLQJKIHGFEA97CC
大安區,建物,臺北市大安區光復南路８８號５樓,0.0,住,,,1111118,土地0建物1車位2,五層,13,住宅大樓(11層含以上有電梯),住家用,鋼筋混凝土造,0940126,235.75,4,2,2,有,無,有,135000,573,坡道平面,0.0,0,,RPQNMLQJKIHGFFA67CC
大安區,建物,臺北市大安區信義路三段６５號４樓,0.0,商,,,1111124,土地0建物1車位0,四層,14,住宅大樓(11層含以上有電梯),商業用,鋼筋混凝土造,0871103,255.51,3,2,2,有,無,有,100000,391,,0.0,0,,RPTNMLQJKIHGFFA97CC
大安區,建物,臺北市大安區師大路８０巷９號４樓,0.0,住,,,1111116,土地0建物1車位1,四層,5,華廈(10層含以下有電梯),住家用,鋼筋混凝土造,0820914,195.32999999999998,5,2,2,有,無,有,40000,205,坡道平面,0.0,0,,RPUNMLQJKIHGFFA08CC
大安區,建物,臺北市大安區和平東路二段２２９號,0.0,商,,,1111130,土地0建物2車位0,全,3,透天厝,住家用,加強磚造,,234.34,4,1,5,有,無,無,170000,725,,0.0,0,,RPOOMLQJKIHGFFA57CC
大安區,建物,臺北市大安區杭州南路二段６１巷２號２樓,0.0,住,,,1111123,土地0建物1車位0,二層,6,華廈(10層含以下有電梯),住家用,鋼筋混凝土造,1040427,125.09,2,2,2,有,無,有,70919,567,,0.0,0,,RPPOMLQJKIHGFFA67CC
大安區,房地(土地+建物),臺北市大安區信義路四段１１６號１樓,24.02,其他,,,1111206,土地1建物1車位0,一層,12,住宅大樓(11層含以上有電梯),商業用,鋼筋混凝土造,0740205,79.18,1,2,1,有,有,無,80000,1010,,0.0,0,,RPTOMLQJKIHGFFA08CC
大安區,建物,臺北市大安區潮州街８４號３樓之１,0.0,住,,,1111119,土地0建物1車位0,三層,9,華廈(10層含以下有電梯),住家用,鋼筋混凝土造,0980120,16.79,1,0,1,有,有,有,10500,625,,0.0,0,,RPUOMLQJKIHGFFA18CC
信義區,建物,臺北市信義區福德街５１巷１１之１號３樓,0.0,住,,,1111202,土地0建物1車位0,三層,4,公寓(5樓含以下無電梯),住家用,鋼筋混凝土造,0610509,69.61,2,1,1,有,無,有,23000,330,,0.0,0,,RPQNMLQJKIHGFDA47CC
信義區,建物,臺北市信義區瑞雲街４４號,0.0,其他,,,1111118,土地0建物1車位0,一層,4,公寓(5樓含以下無電梯),住家用,鋼筋混凝土造,0670505,117.50999999999999,3,2,2,有,無,有,50000,425,,0.0,0,,RPRNMLQJKIHGFDA57CC
松山區,建物,臺北市松山區敦化南路一段３號１３樓之２,0.0,其他,,,1111117,土地0建物1車位1,十三層,23,住宅大樓(11層含以上有電梯),集合住宅,鋼骨造,1100203,235.77,3,2,2,有,無,有,183000,776,坡道平面,33.28,0,,RPSNMLQJKIHGFDA67CC
松山區,建物,臺北市松山區敦化北路１６５巷４號,0.0,住,,,1111121,土地0建物1車位0,一層,9,店面(店鋪),商業用,鋼筋混凝土造,0790524,120.21000000000001,0,0,2,有,無,有,80000,666,,0.0,0,,RPVNMLQJKIHGFDA97CC
信義區,建物,臺北市信義區松山路３４２巷７號１樓,0.0,商,,,1111114,土地0建物1車位0,一層,15,辦公商業大樓,日常用品零售業,鋼骨造,1100119,79.71,0,0,0,無,有,有,45000,565,,0.0,0,,RPQOMLQJKIHGFDA57CC
松山區,建物,臺北市松山區南京東路四段１１２之１,0.0,商,,,1111128,土地0建物1車位0,一層,15,店面(店鋪),一般零售業甲組,鋼骨鋼筋混凝土造,0990831,103.32,0,0,0,無,有,無,80000,774,,0.0,0,,RPROMLQJKIHGFDA67CC
萬華區,建物,臺北市萬華區隆昌街５４號二樓之１,0.0,商,,,1111115,土地0建物1車位0,二層,5,公寓(5樓含以下無電梯),見使用執照,鋼筋混凝土造,0710316,56.129999999999995,1,1,1,有,無,有,16000,285,,0.0,0,,RPRNMLQJKIHGFBA37CC
中正區,建物,臺北市中正區忠孝東路一段１６２號８樓之１,0.0,商,,,1111111,土地0建物1車位0,八層,13,辦公商業大樓,一般事務所,鋼筋混凝土造,1080807,55.86,1,1,1,有,無,有,47000,841,,0.0,0,,RPVNMLQJKIHGFBA77CC
大同區,建物,臺北市大同區承德路三段１２２巷１２號５樓之１,0.0,住,,,1111119,土地0建物1車位0,五層,7,華廈(10層含以下有電梯),住家用,鋼筋混凝土造,1090824,67.15,1,1,1,有,無,有,35000,521,,0.0,0,,RPWNMLQJKIHGFBA87CC
萬華區,建物,臺北市萬華區長泰街７１號三樓,0.0,住,,,1111125,土地0建物1車位0,三層,5,公寓(5樓含以下無電梯),住家用,鋼筋混凝土造,0750522,73.28,3,2,1,有,無,有,20000,273,,0.0,0,,RPXNMLQJKIHGFBA97CC
中正區,建物,臺北市中正區開封街一段１０６巷８號,0.0,商,,,1111129,土地0建物0車位0,三層,3,套房(1房1廳1衛),,磚造,,12.78,1,0,1,有,無,有,7800,610,,0.0,0,此為分租套房，第三層共分成4間，一間平均面積約為12.78平方公尺。電費及每月垃圾收取費600元、水費200元皆為承租人負擔。,RPROMLQJKIHGFBA47CC
萬華區,建物,臺北市萬華區漢中街１６０號３樓之５,0.0,商,,,1111124,土地0建物1車位0,三層,15,住宅大樓(11層含以上有電梯),住家用,鋼筋混凝土造,1110322,55.01,2,1,1,有,無,有,33000,600,,0.0,0,,RPVOMLQJKIHGFBA87CC
中正區,建物,臺北市中正區新生南路一段６號４樓,0.0,其他,,,1111108,土地0建物1車位0,四層,12,住宅大樓(11層含以上有電梯),住家用,鋼筋混凝土造,0750723,115.43,3,2,2,有,有,無,46648,404,,0.0,0,,RPQPMLQJKIHGFBA47CC
萬華區,建物,臺北市萬華區西園路二段１４７號３樓,0.0,商,,,1111028,土地0建物1車位1,三層,11,住宅大樓(11層含以上有電梯),住家用,鋼筋混凝土造,1000826,200.19,4,2,2,有,無,有,57000,285,升降機械,19.52,0,,RPRPMLQJKIHGFBA57CC
中正區,建物,臺北市中正區忠孝東路一段３９號１０樓之３,0.0,商,,,1111024,土地0建物1車位0,十層,13,住宅大樓(11層含以上有電梯),住家用,鋼筋混凝土造,0950926,82.93,2,2,1,有,無,有,45000,543,,0.0,0,,RPTPMLQJKIHGFBA77CC
萬華區,車位,臺北市萬華區東園街１３６號六樓,0.0,商,,,1111202,土地0建物0車位1,,,其他,,,,11.19,0,0,0,有,有,無,3500,,塔式車位,11.19,3500,租金含管理費。,RPOSMLQJKIHGFBA57CC
大同區,建物,臺北市大同區民權西路８７號,0.0,商,,,1111201,土地0建物1車位0,一層,4,店面(店鋪),住商用,加強磚造,0581128,68.25,0,0,0,無,無,有,50000,733,,0.0,0,,RPVTMLQJKIHGFBA38CC
大同區,建物,臺北市大同區承德路三段１５９巷６號三樓,0.0,商,,,1111201,土地0建物0車位0,三層,3,套房(1房1廳1衛),,加強磚造,,22.5,1,0,1,有,無,有,8600,382,,0.0,0,此為分租套房，第三層共分成3間，一間平均面積約為22.50平方公尺。電費及每月垃圾費600元、水費200元皆為承租人負擔。租期第13個月免租金。,RPTNMLRJKIHGFBA67CC
大同區,建物,臺北市大同區保安街７８巷４號,0.0,其他,,,1111124,土地0建物0車位0,全,2,透天厝,,土磚石混合造,,62.27,2,1,1,有,無,有,18000,289,,0.0,0,此為2房，第一層共分成2間，面積約為62.27平方公尺。電費及每月垃圾費900元、水費200元皆為承租人負擔。,RPVNMLRJKIHGFBA87CC
萬華區,建物,臺北市萬華區環河南路一段７１號８樓之２１,0.0,商,,,1111129,土地0建物1車位0,八層,12,套房(1房1廳1衛),住家用,鋼筋混凝土造,0660829,18.46,1,0,1,有,有,有,8000,433,,0.0,0,國家住宅及都市更新中心社會住宅包租代管計畫。每月水電瓦斯費由承租人負擔。,RPUOMLRJKIHGFBA87CC
大同區,建物,臺北市大同區重慶北路三段２７４號,0.0,住,,,1111126,土地0建物0車位0,全,4,透天厝,,加強磚造,,35.03,2,1,1,有,無,有,18000,514,,0.0,0,此為2房，第二層共分成2間，面積約為35.03平方公尺。電費及每月垃圾費900元、水費200元皆為承租人負擔。租期第13個月免租金。,RPVOMLRJKIHGFBA97CC
萬華區,建物,臺北市萬華區西藏路１７６號三樓,0.0,住,,,1111202,土地0建物0車位0,三層,5,套房(1房1廳1衛),住家用,鋼筋混凝土造,0741105,23.2,1,0,1,有,無,有,8800,379,,0.0,0,此為分租套房，第三層共分成5間，一間平均面積約為23.20平方公尺。電費及每月垃圾費600元、水費200元皆為承租人負擔。租期第13個月免租金。,RPWOMLRJKIHGFBA08CC
萬華區,建物,臺北市萬華區西藏路１２５巷１１號五樓之３,0.0,商,,,1111121,土地0建物1車位0,五層,12,住宅大樓(11層含以上有電梯),住家用,鋼筋混凝土造,0690205,58.14,2,1,1,有,有,有,15000,258,,0.0,0,加入臺北市社會住宅包租代管第3期計畫,RPXOMLRJKIHGFBA18CC
大同區,建物,臺北市大同區南京西路２６２巷２３號,0.0,商,,,1111202,土地0建物0車位0,四層,4,套房(1房1廳1衛),,加強磚造,0570429,22.26,1,0,1,有,無,有,10600,476,,0.0,0,此為分租套房，第四層共分成2間，一間平均面積約為22.26平方公尺。電費及每月垃圾費600元、水費200元皆為承租人負擔。,RPPPMLRJKIHGFBA47CC
萬華區,建物,臺北市萬華區西園路１段１２５巷５號４樓,0.0,商,,,1111124,土地0建物1車位0,四層,4,公寓(5樓含以下無電梯),住家用,鋼筋混凝土造,0621022,88.04,2,1,1,有,無,有,26000,295,,0.0,0,,RPRPMLRJKIHGFBA67CC
萬華區,建物,臺北市萬華區貴陽街二段３９號三樓之２,0.0,商,,,1111118,土地0建物1車位1,三層,19,辦公商業大樓,一般事務所（Ｇ２）,鋼筋混凝土造,1061127,206.92,3,2,2,有,有,無,65000,314,坡道平面,27.87,0,租賃期間含免租金裝潢期。,RPTPMLRJKIHGFBA87CC
信義區,房地(土地+建物),臺北市信義區吳興街２８４巷１１之５號,14.56,住,,,1111201,土地1建物1車位0,一層,5,店面(店鋪),商業用,鋼筋混凝土造,0781023,51.25,0,0,0,無,無,無,24000,468,,0.0,0,,RPRNMLRJKIHGFDA67CC
南港區,建物,臺北市南港區忠孝東路七段６１６號３樓,0.0,商,,,1111116,土地0建物1車位0,三層,5,公寓(5樓含以下無電梯),住家用,鋼筋混凝土造,0710630,101.92,3,1,2,有,無,有,30500,299,,0.0,0,國家住宅及都市中心辦理社會住宅包租代管計畫,RPTNMLRJKIHGFDA87CC
信義區,建物,臺北市信義區忠孝東路五段３７２巷２７弄２１號５樓,0.0,住,,,1111130,土地0建物1車位0,五層,7,華廈(10層含以下有電梯),住家用,鋼筋混凝土造,0731228,83.63,2,2,1,有,有,有,27500,329,,0.0,0,國家住宅及都市中心辦理社會住宅包租代管計畫,RPUNMLRJKIHGFDA97CC
松山區,建物,臺北市松山區八德路４段６３８號３樓,0.0,商,,,1111112,土地0建物1車位0,三層,13,住宅大樓(11層含以上有電梯),住家用,鋼筋混凝土造,0990525,91.75999999999999,2,1,1,有,有,有,34776,379,,0.0,0,,RPOOMLRJKIHGFDA47CC
南港區,車位,臺北市南港區忠孝東路六段８２號等共有部分,0.0,住,,,1111115,土地0建物0車位1,,,其他,,,,33.76,0,0,0,有,有,無,4500,,坡道平面,33.76,4500,,RPPOMLRJKIHGFDA57CC
信義區,建物,臺北市信義區福德街９９號２樓,0.0,其他,,,1111128,土地0建物1車位0,二層,4,公寓(5樓含以下無電梯),住家用,鋼筋混凝土造,0630624,75.4,3,1,1,有,無,有,23000,305,,0.0,0,,RPRPMLRJKIHGFDA87CC
