大同區,建物,臺北市大同區重慶北路三段５３號,0.0,商,,,1120110,土地0建物1車位0,全,4,透天厝,,加強磚造,,93.72,2,1,1,有,無,有,21000,224,,0.0,0,本案為透天，此次只出租第三層。台北市社會住宅包租代管計畫。水電費、瓦斯費由承租人負擔。,RPUOMLQKJHIGFBA77CC
大安區,建物,臺北市大安區瑞安街２０８巷３９號５樓之３,0.0,住,,,1120107,土地0建物1車位0,五層,7,華廈(10層含以下有電梯),住家用,鋼筋混凝土造,1040511,41.74,1,1,1,有,無,有,28000,671,,0.0,0,,RPVNMLQKJHIGFFA18CC
大安區,建物,臺北市大安區永康街７５巷１０號３樓,0.0,其他,,,1120107,土地0建物1車位0,三層,5,公寓(5樓含以下無電梯),住家用,鋼筋混凝土造,0721029,83.36,2,2,2,有,無,有,40000,480,,0.0,0,,RPXNMLQKJHIGFFA38CC
大安區,建物,臺北市大安區新生南路一段１４１之８號８樓,0.0,住,,,1120105,土地0建物1車位0,八層,11,住宅大樓(11層含以上有電梯),見使用執照,鋼筋混凝土造,0861224,133.12,2,2,2,有,有,有,60000,451,,0.0,0,,RPQOMLQKJHIGFFA77CC
大安區,建物,臺北市大安區樂業街７２巷２０號８樓,0.0,住,,,1120110,土地0建物1車位0,八層,10,華廈(10層含以下有電梯),住家用,鋼筋混凝土造,1100906,80.93,2,1,1,有,無,有,52000,643,,0.0,0,,RPTOMLQKJHIGFFA08CC
大安區,建物,臺北市大安區新生南路一段１５７巷４０之１號,0.0,住,,,1120112,土地0建物1車位0,一層,4,公寓(5樓含以下無電梯),住家用,鋼筋混凝土造,,83.51,1,2,1,有,無,有,65000,778,,0.0,0,,RPVOMLQKJHIGFFA28CC
大安區,建物,臺北市大安區大安路一段３１巷１７號６樓,0.0,住,,,1111205,土地0建物1車位0,六層,7,華廈(10層含以下有電梯),住家用,鋼筋混凝土造,0801209,72.06,0,0,0,無,無,有,33000,458,,0.0,0,修正C1AF11112200027此為分租雅房，租賃面積為72.066平方公尺,RPQPMLQKJHIGFFA87CC
大安區,建物,臺北市大安區忠孝東路三段２３６號,0.0,住,,,1111223,土地0建物1車位0,一層,14,店面(店鋪),見使用執照,鋼筋混凝土造,0760423,73.21,0,0,0,無,有,有,49000,669,,0.0,0,,RPTNMLRKJHIGFFA08CC
大安區,建物,臺北市大安區和平東路１段１９９巷７號４樓之１,0.0,住,,,1120110,土地0建物1車位0,四層,7,華廈(10層含以下有電梯),住家用,鋼筋混凝土造,0951228,88.03999999999999,2,2,1,有,有,有,41668,473,,0.0,0,,RPOOMLRKJHIGFFA67CC
大安區,建物,臺北市大安區新生南路１段１２３號９樓,0.0,住,,,1111228,土地0建物1車位1,九層,12,辦公商業大樓,住家用,鋼筋混凝土造,0750613,235.10999999999999,5,1,2,有,無,有,97850,416,坡道平面,0.0,0,車位面積含於公設內,RPROMLRKJHIGFFA97CC
大安區,建物,臺北市大安區信義路四段６０之４２號,0.0,商,,,1120117,土地0建物1車位0,一層,6,店面(店鋪),,鋼筋混凝土造,0600301,19.19,0,0,0,無,有,無,36000,1876,,0.0,0,,RPWOMLRKJHIGFFA48CC
中正區,建物,臺北市中正區紹興北街３１巷１５弄５號,0.0,商,,,1120112,土地0建物1車位0,一層,8,華廈(10層含以下有電梯),商業用,鋼筋混凝土造,0760114,135.82999999999998,4,2,2,有,無,有,43236,318,,0.0,0,,RPPNMLRKJHIGFBA27CC
中正區,建物,臺北市中正區臨沂街５９巷３７號,0.0,住,,,1120109,土地0建物1車位1,一層,4,公寓(5樓含以下無電梯),住家用,加強磚造,0580505,122.45,3,2,2,有,無,有,60000,490,其他,0.0,0,車位面積無法分算。,RPQNMLRKJHIGFBA37CC
大同區,建物,臺北市大同區太原路８０號９樓,0.0,商,,,1120117,土地0建物1車位0,九層,14,住宅大樓(11層含以上有電梯),住家用,鋼筋混凝土造,0971211,55.81,1,1,1,有,有,有,24500,439,,0.0,0,,RPOOMLRKJHIGFBA27CC
萬華區,建物,臺北市萬華區雅江街２３巷４號四樓,0.0,商,,,1120105,土地0建物1車位0,四層,4,公寓(5樓含以下無電梯),住家用,鋼筋混凝土造,0610405,45.58,1,1,1,有,有,有,15000,329,,0.0,0,,RPPOMLRKJHIGFBA37CC
大同區,房地(土地+建物),臺北市大同區民族西路３０９號５樓,31.99,住,,,1111212,土地1建物1車位0,五層,7,華廈(10層含以下有電梯),住家用,鋼筋混凝土造,0701222,137.39,3,2,2,有,有,有,33000,240,,0.0,0,建物共有部分權利範圍空白。原申報書序號:C1AB11112130004。,RPQOMLRKJHIGFBA47CC
萬華區,建物,臺北市萬華區內江街６３號八樓之３,0.0,商,,,1120105,土地0建物1車位0,八層,14,住宅大樓(11層含以上有電梯),住家用,鋼筋混凝土造,0921204,50.51,2,1,1,有,有,有,19500,386,,0.0,0,,RPROMLRKJHIGFBA57CC
北投區,建物,臺北市北投區石牌路二段３１５巷１０弄７之１號四樓之２,0.0,住,,,1120105,土地0建物1車位0,四層,10,華廈(10層含以下有電梯),住家用,鋼筋混凝土造,0960625,84.3,2,1,1,有,有,有,38000,451,,0.0,0,租金含管理費。租賃範圍不含車位，已扣除車位面積。,RPRNMLRKJHIGFEA77CC
北投區,建物,臺北市北投區大度路三段１９１號五樓之２,0.0,住,,,1120103,土地0建物1車位1,五層,14,住宅大樓(11層含以上有電梯),住家用,鋼筋混凝土造,0910322,145.3,3,2,2,有,有,有,40000,275,坡道平面,0.0,0,車位面積無法分算。,RPXNMLRKJHIGFEA38CC
士林區,建物,臺北市士林區菁山路４９之２號３樓,0.0,住,,,1120104,土地0建物1車位1,三層,5,華廈(10層含以下有電梯),住家用,鋼筋混凝土造,0980605,244.94,4,2,2,有,有,有,60000,245,坡道平面,0.0,0,租金為未稅金額。,RPPOMLRKJHIGFEA67CC
士林區,建物,臺北市士林區承德路四段２１８號四樓,0.0,工,,,1120105,土地0建物1車位1,四層,7,華廈(10層含以下有電梯),工業用,鋼筋混凝土造,0810601,243.0,3,2,2,有,有,有,60000,247,升降平面,44.67,0,房屋用途做辦公室使用。,RPROMLRKJHIGFEA87CC
北投區,建物,臺北市北投區明德路３２號７樓,0.0,住,,,1111212,土地0建物1車位0,七層,15,住宅大樓(11層含以上有電梯),住家用,鋼筋混凝土造,1050425,138.41,3,2,2,有,有,有,80000,578,,0.0,0,,RPSOMLRKJHIGFEA97CC
北投區,房地(土地+建物)+車位,臺北市北投區行義路１３０巷８號,69.6,住,,,1111125,土地1建物1車位1,一層,5,華廈(10層含以下有電梯),住家用,鋼筋混凝土造,0970609,165.41,3,2,2,有,無,無,38000,230,坡道平面,29.97,0,,RPWOMLRKJHIGFEA38CC
士林區,建物,臺北市士林區士東路２００巷５３號５樓,0.0,住,,,1111225,土地0建物1車位1,五層,7,華廈(10層含以下有電梯),住家用,鋼筋混凝土造,0991025,175.5,4,2,2,有,有,有,50000,285,坡道平面,34.25,0,,RPXOMLRKJHIGFEA48CC
士林區,建物,臺北市士林區天玉街７５巷８號四樓,0.0,住,,,1111211,土地0建物1車位0,四層,5,公寓(5樓含以下無電梯),住家用,鋼筋混凝土造,0671229,98.66,2,2,2,有,無,有,25000,253,,0.0,0,,RPSPMLRKJHIGFEA08CC
松山區,建物,臺北市松山區敦化北路１００號,0.0,其他,,,1120111,土地0建物0車位0,十三層,15,套房(1房1廳1衛),商業用,鋼骨鋼筋混凝土造,0721005,30.73,1,0,1,有,無,有,18000,586,,0.0,0,此為分租套房，租賃面積約為30.73平方公尺，每月電費1500元、管理費910元、水費300元、瓦斯費300元皆為承租人負擔。本租賃標的未計入共有部分之分算面積。,RPRNMLRKJHIGFDA67CC
信義區,建物,臺北市信義區松仁路８９號７樓之５,0.0,商,,,1111230,土地0建物1車位0,七層,18,辦公商業大樓,一般事務所,見使用執照,0880119,247.48000000000002,0,0,0,無,有,有,224580,907,,0.0,0,,RPUOMLRKJHIGFDA08CC
信義區,建物,臺北市信義區吳興街３３６巷１４號４樓,0.0,住,,,1120113,土地0建物1車位0,四層,4,公寓(5樓含以下無電梯),住家用,鋼筋混凝土造,0630212,81.1,2,1,1,有,無,有,31000,382,,0.0,0,,RPOPMLRKJHIGFDA57CC
松山區,建物,臺北市松山區南京東路５段２９１巷６弄１１號,0.0,其他,,,1120116,土地0建物1車位0,一層,2,店面(店鋪),,加強磚造,,86.81,0,1,1,有,無,有,49000,564,,0.0,0,每月租金新台幣49000元內含租賃所得稅及二代健保,RPSPMLRKJHIGFDA97CC
松山區,建物,臺北市松山區南京東路四段７５號７樓,0.0,商,,,1120103,土地0建物1車位0,七層,12,辦公商業大樓,商業用,鋼筋混凝土造,0680517,231.4,0,0,0,無,無,無,116894,505,,0.0,0,,RPUPMLRKJHIGFDA18CC
信義區,建物,臺北市信義區福德街２６８巷５弄１６號三樓,0.0,住,,,1120101,土地0建物1車位0,三層,4,公寓(5樓含以下無電梯),住家用,鋼筋混凝土造,0670605,48.61,1,1,1,有,有,有,15000,309,,0.0,0,,RPWPMLRKJHIGFDA38CC
信義區,建物,臺北市信義區嘉興街１８１巷５號,0.0,住,,,1120109,土地0建物1車位0,一層,4,店面(店鋪),住家用,鋼筋混凝土造,0580324,106.01,1,1,1,有,無,無,75000,707,,0.0,0,,RPXPMLRKJHIGFDA48CC
松山區,建物,臺北市松山區敦化北路４巷３１號五樓之１８,0.0,住,,,1120109,土地0建物1車位0,五層,7,華廈(10層含以下有電梯),住家用,鋼筋混凝土造,0590728,33.0,1,1,1,有,有,有,18500,561,,0.0,0,,RPQQMLRKJHIGFDA87CC
松山區,建物,臺北市松山區敦化北路１００號,0.0,其他,,,1120113,土地0建物0車位0,十三層,15,套房(1房1廳1衛),商業用,鋼骨鋼筋混凝土造,0721005,30.73,1,0,1,有,無,有,16500,537,,0.0,0,此為分租套房，租賃面積約為30.73平方公尺。每月電費1500元、管理費990元、水費300元、瓦斯費300元皆為承租人負擔。本租賃標的未計入共有部分之分算面積。,RPTQMLRKJHIGFDA18CC
松山區,建物,臺北市松山區敦化北路１００號,0.0,其他,,,1120113,土地0建物0車位0,十三層,15,套房(1房1廳1衛),商業用,鋼骨鋼筋混凝土造,0721005,30.73,1,0,1,有,無,有,18000,586,,0.0,0,此為分租套房，租賃面積約為30.73平方公尺，每月電費1500元、管理費910元、水費300元、瓦斯費300元皆為承租人負擔。本租賃標的未計入共有部分之分算面積。,RPUQMLRKJHIGFDA28CC
文山區,建物,臺北市文山區景興路１９５號五樓之８,0.0,商,,,1111226,土地0建物1車位0,五層,18,住宅大樓(11層含以上有電梯),商業用,鋼骨鋼筋混凝土造,0831210,82.74,1,2,1,有,有,有,22500,272,,0.0,0,租金含管理費。,RPPNMLRKJHIGFAA17CC
內湖區,建物,臺北市內湖區大湖山莊街２１９巷３４弄３號４樓-２,0.0,住,,,1120112,土地0建物1車位0,四層,6,華廈(10層含以下有電梯),住家用,鋼筋混凝土造,0810717,42.29,1,1,1,有,有,有,16500,390,,0.0,0,,RPVOMLRKJHIGFCA08CC
中山區,建物,臺北市中山區林森北路８５巷３９號二樓之１６,0.0,商,,,1120113,土地0建物1車位0,二層,7,套房(1房1廳1衛),商業用,鋼筋混凝土造,0661020,27.61,1,0,1,有,有,有,14000,507,,0.0,0,國家住宅及都市更新中心辦理社會住宅包租代管計畫。水電費、瓦斯費及每月管理費740元皆由承租人負擔。,RPXOMLRKJHIGFCA28CC
內湖區,建物,臺北市內湖區行愛路５７號１樓,0.0,工,,,1120113,土地0建物1車位0,一層,8,辦公商業大樓,一般服務業（汽車保養所及洗車）,鋼筋混凝土造,1020110,355.45000000000005,1,0,0,有,有,有,170668,480,,0.0,0,,RPPPMLRKJHIGFCA57CC
內湖區,建物,臺北市內湖區東湖路１１３巷７０弄８之１號１樓,33.45,住,,,1120107,土地0建物1車位0,一層,5,公寓(5樓含以下無電梯),商業用,鋼筋混凝土造,0760807,76.03,2,1,2,有,無,無,27000,355,,0.0,0,,RPRPMLRKJHIGFCA77CC
內湖區,房地(土地+建物),臺北市內湖區內湖路一段２８５巷４號４樓,17.84,商,,,1120111,土地1建物1車位0,四層,5,公寓(5樓含以下無電梯),住家用,鋼筋混凝土造,0680907,104.89,3,2,1,有,無,無,23000,219,,0.0,0,,RPSPMLRKJHIGFCA87CC
內湖區,建物,臺北市內湖區成功路四段１７８號１２樓之３,0.0,其他,,,1111212,土地0建物1車位2,十二層,29,住宅大樓(11層含以上有電梯),住家用,鋼骨造,1070223,309.15,3,2,2,有,無,有,176000,569,坡道平面,0.0,0,車位為社區其他所有權人代租的非本建物上共有部分的車位原序號:C1AC11112200006,RPUPMLRKJHIGFCA08CC
內湖區,建物,臺北市內湖區洲子街１０２號５樓之１,0.0,工,,,1111212,土地0建物1車位1,五層,10,廠辦,工業用,鋼筋混凝土造,0870917,258.74,2,0,0,有,有,無,98000,379,坡道平面,37.74,0,,RPXPMLRKJHIGFCA38CC
內湖區,建物,臺北市內湖區新湖二路３６７號４樓４０３室,0.0,工,,,1111208,土地0建物0車位0,四層,5,辦公商業大樓,一般服務業〈職業介紹所〉,鋼筋混凝土造,0990304,99.0,0,1,1,有,有,有,40000,404,,0.0,0,切割物件，約30坪，本租賃標的未紀錄共有部之分面積。原申報書序號：C1AC11112120010,RPVQMLRKJHIGFCA28CC
內湖區,建物,臺北市內湖區堤頂大道二段５０１號３樓之２,0.0,工,,,1111212,土地0建物0車位0,三層,10,辦公商業大樓,工業用,鋼筋混凝土造,0941201,136.0,1,0,0,有,有,無,73000,537,,0.0,0,切割物件，本租賃標的未記錄共有部之分算面積。原申報書序號：C1AC11112120010,RPXQMLRKJHIGFCA48CC
中山區,建物,臺北市中山區長安東路二段８１號,0.0,商,,,1111222,土地0建物1車位0,一層,12,店面(店鋪),商業用,鋼筋混凝土造,0720719,445.68,0,0,0,無,有,無,280000,628,,0.0,0,租金調整:第1-3年每月28萬，第4-6年每月32萬，第7-10年每月33萬,RPTRMLRKJHIGFCA18CC
中山區,建物,臺北市中山區民權東路二段３６號１０樓,0.0,商,,,1111226,土地0建物1車位0,十層,12,住宅大樓(11層含以上有電梯),住家用,鋼筋混凝土造,1020206,160.60000000000002,4,2,2,有,有,有,90000,560,,0.0,0,,RPURMLRKJHIGFCA28CC
中山區,建物,臺北市中山區新生北路二段６２巷１６號７樓之５,0.0,商,,,1111227,土地0建物1車位0,七層,19,住宅大樓(11層含以上有電梯),住家用,鋼骨鋼筋混凝土造,1050322,122.52,2,2,2,有,有,有,67044,547,,0.0,0,,RPVRMLRKJHIGFCA38CC
中山區,建物,臺北市中山區長安東路一段５３巷１６號５樓之５,0.0,商,,,1111228,土地0建物1車位0,五層,7,華廈(10層含以下有電梯),住家用,鋼筋混凝土造,0761223,40.06,1,1,1,有,無,有,21000,524,,0.0,0,此物件為臺北市社會住宅包租代管計畫之物件，評定市價租金為23400元，臺北市社會住宅包租代管計畫租金上限為39000元，因出租人選擇代租方案須打九折且簽約租金無條件捨去百分位，實際租賃契約金額為21000元。原申堡書序號：C1AC11201170009。）（管理費500元/月。）,RPWRMLRKJHIGFCA48CC
內湖區,車位,臺北市內湖區東湖路１１３巷９５弄１００號等共同使用,0.0,住,,,1120108,土地0建物0車位1,,,其他,,,,93.9,0,0,0,有,有,無,3200,,坡道平面,0.0,3200,車位面積無法分算。,RPVNMLSKJHIGFCA08CC
中山區,建物,臺北市中山區樂群二路２６７號４樓之２,0.0,商,,,1120113,土地0建物1車位0,四層,10,辦公商業大樓,金融保險業,鋼骨造,1041027,223.87,0,0,0,無,有,無,145000,648,,0.0,0,,RPSOMLSKJHIGFCA87CC
中山區,建物,臺北市中山區中山北路二段５２號３樓之２,0.0,商,,,1111130,土地0建物2車位0,三層,12,辦公商業大樓,商業用,鋼筋混凝土造,0750410,297.53,3,0,0,有,有,無,160000,538,,0.0,0,本案3樓之1與3樓之2一同出租,RPWOMLSKJHIGFCA28CC
中山區,建物,臺北市中山區林森北路３４９號１６樓之１,0.0,商,,,1120101,土地0建物1車位0,十六層,24,住宅大樓(11層含以上有電梯),住家用,鋼骨造,1021101,210.12,3,2,2,有,有,有,95000,452,,0.0,0,,RPQPMLSKJHIGFCA77CC
中山區,建物,臺北市中山區民權東路一段５７號７樓,0.0,商,,,1120101,土地0建物1車位0,七層,12,住宅大樓(11層含以上有電梯),一般事務所（Ｇ－２）,鋼骨鋼筋混凝土造,1090120,78.8,1,2,1,有,有,有,62000,787,,0.0,0,,RPRPMLSKJHIGFCA87CC
中山區,建物,臺北市中山區中山北路２段１７８號１樓,0.0,商,,,1120110,土地0建物1車位0,一層,4,店面(店鋪),,加強磚造,,87.51,0,0,0,無,無,有,75000,857,,0.0,0,本租案只承租1樓+騎樓,RPVPMLSKJHIGFCA28CC
中山區,建物,臺北市中山區雙城街１３巷９號３樓之５,0.0,商,,,1120101,土地0建物1車位0,三層,15,住宅大樓(11層含以上有電梯),住家用,鋼筋混凝土造,1010327,141.09,2,2,2,有,有,有,60000,425,,0.0,0,,RPWPMLSKJHIGFCA38CC
中山區,建物,臺北市中山區中山北路二段１１８號１４樓之２,0.0,商,,,1120103,土地0建物1車位0,十四層,14,住宅大樓(11層含以上有電梯),住家用,鋼筋混凝土造,1080227,69.9,2,2,1,有,有,有,58000,830,,0.0,0,,RPXPMLSKJHIGFCA48CC
中山區,建物,臺北市中山區松江路３１８號１３樓之２,0.0,其他,,,1120105,土地0建物1車位0,十三層,14,辦公商業大樓,一般事務所,鋼骨鋼筋混凝土造,0980521,239.64,1,0,0,有,有,無,120000,501,,0.0,0,,RPOQMLSKJHIGFCA67CC
中山區,建物,臺北市中山區林森北路５８５號３樓之３,0.0,商,,,1120107,土地0建物1車位0,三層,13,華廈(10層含以下有電梯),住家用,鋼筋混凝土造,1000726,120.75999999999999,3,2,1,有,有,有,58000,480,,0.0,0,,RPPQMLSKJHIGFCA77CC
中山區,建物,臺北市中山區松江路６３巷１號６樓之２,0.0,商,,,1120107,土地0建物1車位0,六層,9,華廈(10層含以下有電梯),住家用,鋼筋混凝土造,1070831,110.14,2,2,1,有,有,有,50000,454,,0.0,0,,RPQQMLSKJHIGFCA87CC
中正區,建物,臺北市中正區和平西路一段１１號十樓,0.0,商,,,1120112,土地0建物0車位0,十層,11,套房(1房1廳1衛),商業用,鋼筋混凝土造,,42.6,1,0,1,有,無,有,12500,293,,0.0,0,此為分租套房，第十層共分成21間，一間平均面積約為42.60平方公尺。電費及每月垃圾費650元、水費250元、鍋爐費300元皆為承租人負擔。,RPOOMLSKJHIGFAA27CC
信義區,建物,臺北市信義區基隆路一段３８０號二樓,0.0,商,,,1120112,土地0建物1車位0,二層,10,辦公商業大樓,商業用,鋼筋混凝土造,0800508,199.77999999999997,1,1,1,有,有,無,80000,400,,0.0,0,,RPRNMLSKJHIGFDA77CC
松山區,建物,臺北市松山區敦化北路１００號,0.0,其他,,,1120117,土地0建物0車位0,十三層,15,套房(1房1廳1衛),商業用,鋼骨鋼筋混凝土造,0721005,30.73,1,0,1,有,無,有,16000,521,,0.0,0,此為分租套房，租賃面積約為30.73平方公尺，每月電費1500元、管理費930元、水費300元、瓦斯費300元皆為承租人負擔。本租賃標的未計入共有部分之分算面積。,RPPOMLSKJHIGFDA67CC
松山區,建物,臺北市松山區敦化北路１００號,0.0,其他,,,1120117,土地0建物0車位0,十三層,15,套房(1房1廳1衛),商業用,鋼骨鋼筋混凝土造,0721005,30.73,1,0,1,有,無,有,17000,553,,0.0,0,此為分租套房，租賃面積約為30.73平方公尺，每月電費1500元、管理費930元、水費300元、瓦斯費300元皆為承租人負擔。本租賃標的未計入共有部分之分算面積。,RPQOMLSKJHIGFDA77CC
松山區,建物,臺北市松山區敦化北路１００號,0.0,其他,,,1120116,土地0建物0車位0,十三層,15,套房(1房1廳1衛),商業用,鋼骨鋼筋混凝土造,0721005,30.73,1,0,1,有,無,有,16000,521,,0.0,0,此為分租套房，租賃面積約為30.73平方公尺，每月電費1500元、管理費930元、水費300元、瓦斯費300元皆為承租人負擔。本租賃標的未計入共有部分之分算面積。,RPROMLSKJHIGFDA87CC
南港區,建物,臺北市南港區重陽路１９號６樓,0.0,住,,,1120109,土地0建物1車位1,六層,14,住宅大樓(11層含以上有電梯),集合住宅,鋼筋混凝土造,1110124,76.78999999999999,1,1,1,有,有,有,37000,482,坡道平面,0.0,0,,RPSOMLSKJHIGFDA97CC
南港區,建物,臺北市南港區園區街３２號７樓之３,0.0,住,,,1111210,土地0建物1車位0,七層,11,住宅大樓(11層含以上有電梯),住家用,鋼筋混凝土造,1020521,41.77,1,1,1,有,無,有,18000,431,,0.0,0,,RPXOMLSKJHIGFDA48CC
松山區,建物,臺北市松山區光復南路４５巷１６號２樓,0.0,住,,,1120118,土地0建物1車位0,二層,6,華廈(10層含以下有電梯),住家用,鋼筋混凝土造,0760425,150.84,4,2,2,有,有,有,50000,331,,0.0,0,,RPPPMLSKJHIGFDA77CC
松山區,建物,臺北市松山區敦化北路１００號,0.0,其他,,,1120113,土地0建物0車位0,十三層,15,套房(1房1廳1衛),商業用,鋼骨鋼筋混凝土造,0721005,30.73,1,0,1,有,無,有,16630,541,,0.0,0,此為分租套房，租賃面積約為30.73平方公尺，每月電費1500元、管理費870元、水費300元、瓦斯費300元皆為承租人負擔。本租賃標的未計入共有部分之分算面積。,RPWPMLSKJHIGFDA48CC
士林區,建物,臺北市士林區中山北路六段１９５巷８號七樓,0.0,住,,,1111221,土地0建物1車位0,七層,14,住宅大樓(11層含以上有電梯),住家用,鋼筋混凝土造,0970506,162.59,3,2,2,有,有,有,91200,561,,0.0,0,,RPPOMLSKJHIGFEA77CC
士林區,建物,臺北市士林區天母西路１６之４號六樓,0.0,住,,,1120105,土地0建物1車位0,六層,7,華廈(10層含以下有電梯),住家用,鋼筋混凝土造,0651106,193.52,4,2,2,有,有,有,75000,388,,0.0,0,,RPQOMLSKJHIGFEA87CC
士林區,建物,臺北市士林區中山北路六段７２８巷３號２樓,0.0,住,,,1120101,土地0建物1車位0,二層,5,華廈(10層含以下有電梯),住家用,鋼筋混凝土造,0910503,214.64,4,2,2,有,有,有,75000,349,,0.0,0,,RPROMLSKJHIGFEA97CC
士林區,建物,臺北市士林區中山北路七段１４巷１９號６樓,0.0,住,,,1120101,土地0建物1車位0,六層,7,華廈(10層含以下有電梯),住家用,鋼筋混凝土造,0770119,146.85,3,2,2,有,有,有,70000,477,,0.0,0,,RPTOMLSKJHIGFEA18CC
士林區,建物,臺北市士林區中山北路六段４２７巷６弄２號４樓,34.4,住,,,1120117,土地0建物1車位0,四層,5,公寓(5樓含以下無電梯),住家用,鋼筋混凝土造,0660215,112.05,3,2,2,有,無,有,28500,254,,0.0,0,,RPUOMLSKJHIGFEA28CC
士林區,建物,臺北市士林區基河路２２號１４樓之１,0.0,商,,,1120101,土地0建物1車位0,十層,18,住宅大樓(11層含以上有電梯),住家用,鋼筋混凝土造,0971126,80.89,1,2,1,有,有,有,34000,420,,0.0,0,,RPVOMLSKJHIGFEA38CC
士林區,建物,臺北市士林區天母東路１０號６樓,0.0,商,,,1120106,土地0建物1車位1,六層,7,華廈(10層含以下有電梯),住家用,鋼筋混凝土造,0780107,140.84,3,2,2,有,有,有,70000,497,坡道平面,0.0,5000,,RPXOMLSKJHIGFEA58CC
士林區,建物,臺北市士林區天母東路４３巷４弄１２號５樓,0.0,商,,,1120110,土地0建物1車位0,五層,6,華廈(10層含以下有電梯),住家用,鋼筋混凝土造,0850605,180.31,3,2,2,有,有,有,59000,327,,0.0,0,,RPOPMLSKJHIGFEA77CC
萬華區,建物,臺北市萬華區長泰街３１６巷１６之１號,0.0,住,,,1120106,土地0建物1車位0,一層,4,公寓(5樓含以下無電梯),住家用,加強磚造,0580811,78.84,0,1,1,有,無,無,25000,317,,0.0,0,租賃期間含免租金裝潢期。房屋用途做辦公室使用。,RPTNMLSKJHIGFBA77CC
中正區,建物,臺北市中正區博愛路１５４號,0.0,商,,,1120116,土地0建物1車位0,三層,7,辦公商業大樓,商業用,鋼筋混凝土造,0600510,398.09,4,0,1,有,有,無,194250,488,,0.0,0,,RPUNMLSKJHIGFBA87CC
大同區,建物,臺北市大同區承德路一段１０５號８樓之６,0.0,商,,,1120101,土地0建物1車位0,八層,12,辦公商業大樓,商業用,鋼筋混凝土造,0781227,76.43,1,1,1,有,有,有,31000,406,,0.0,0,,RPWNMLSKJHIGFBA08CC
萬華區,建物,臺北市萬華區環河南路一段２３號八樓之５,0.0,商,,,1120116,土地0建物1車位0,八層,12,套房(1房1廳1衛),商業用,鋼筋混凝土造,0720624,27.860000000000003,1,0,1,有,有,有,9000,323,,0.0,0,國家住宅及都市更新中心辦理社會住宅包租代管計畫。水電費、瓦斯費及每月管理費490元皆由承租人負擔。,RPROMLSKJHIGFBA67CC
大同區,建物,臺北市大同區南京西路５７號七樓之２,0.0,其他,,,1120106,土地0建物1車位0,七層,19,住宅大樓(11層含以上有電梯),住家用,鋼筋混凝土造,1080304,101.0,2,1,1,有,有,有,70000,693,,0.0,0,,RPSOMLSKJHIGFBA77CC
萬華區,建物,臺北市萬華區華西街３０巷６號,0.0,商,,,1120113,土地0建物1車位0,全,1,透天厝,,土木造,,43.12,2,1,1,有,無,有,16800,390,,0.0,0,國家住宅及都市更新中心辦理社會住宅包租代管計畫。水電費、瓦斯費由承租人負擔。,RPTOMLSKJHIGFBA87CC
大同區,建物,臺北市大同區市民大道一段２０３號７樓之３,0.0,其他,,,1120101,土地0建物1車位0,七層,18,住宅大樓(11層含以上有電梯),住家用,鋼骨造,0980724,80.4,2,2,1,有,有,有,43000,535,,0.0,0,,RPUOMLSKJHIGFBA97CC
大同區,建物,臺北市大同區市民大道一段２０５號７樓之２,0.0,其他,,,1120101,土地0建物1車位0,七層,18,住宅大樓(11層含以上有電梯),住家用,鋼骨造,0980724,92.43,1,2,1,有,有,有,52000,563,,0.0,0,,RPVOMLSKJHIGFBA08CC
大同區,建物,臺北市大同區市民大道一段２０３號７樓-１６,0.0,其他,,,1120104,土地0建物1車位0,七層,18,住宅大樓(11層含以上有電梯),住家用,鋼骨造,0980724,91.13,2,1,1,有,有,有,68000,746,,0.0,0,,RPOPMLSKJHIGFBA47CC
大同區,房地(土地+建物),臺北市大同區民權西路１４４巷１５之１號,14.63,住,,,1120118,土地1建物1車位0,見其他登記事項,7,華廈(10層含以下有電梯),商業用,鋼筋混凝土造,0750403,168.96,2,2,1,有,有,有,43000,254,,0.0,0,租金含稅不含管理費/水電費,RPQPMLSKJHIGFBA67CC
大同區,建物,臺北市大同區承德路三段９號１１樓之１,0.0,商,,,1120108,土地0建物1車位0,十一層,15,住宅大樓(11層含以上有電梯),住家用,鋼筋混凝土造,0990903,233.9,3,2,2,有,有,有,68300,292,,0.0,0,,RPRPMLSKJHIGFBA77CC
